1,(单选题)世界上第一只ETF在（）推出的。,<p>A美国</p><p>B加拿大</p><p>C英国</p><p>D澳大利亚</p>,4,B,无,0,0
1,(单选题)当基金二级市场交易价格高于其份额净值时。称为（）。,<p>A溢价交易</p><p>B折价交易</p><p>C平价交易</p><p>D不确定</p>,4,A,溢价交易的定义。,0,0
1,(单选题)基金管理人可设总经理（），副总经理（）。,<p>A一人;若干人</p><p>B若干人;一人</p><p>C两人；若干人.</p><p>D若干人；两人</p>,4,A,基金管理人可设总经理一人，（本题本题出自金考必过，网址：www.jinkaobiguo.com，最好的刷题网站。）副经理若干人。,0,0
1,(单选题)货币市场基金可以投资于以下金融工具（）。,<p>A现金</p><p>B股票</p><p>C可转涣债券</p><p>D信用等级在AAA级以下的企业债券</p>,4,A,货币市场基金投资于以下会融工具:(i)殷票;(2〕可转换债券:(3)熟余期限超过397天的债券;(4)信用等级在AAA级以下的企业债券;(5)国闪信用评级机构评定的A-1级或相当于A-1级的短期信用级别及该标准以下的短期融资券〔6)流通受限的证券,0,0
1,(单选题)（）是资产管理的主要方式之一，它是一种组合投资、专业管理利益共享、风险公担的集合投资方式。,<p>A投资基金</p><p>B信托管理</p><p>C证券债券</p><p>D证券理财</p>,4,A,投资基金是资产管理的主要方式之一，它是一种组台投资、专业管理、利益共享、风险共担的集合投资方式。,0,0
1,(单选题)以下关于职业道德的作用，说法不正确的是(〕。,<p>A调整职业关系</p><p>B提升职业素质</p><p>C促进行业发展</p><p>D促进人才进步</p>,4,D,本题考察职业道德的作用.职业道德的作用有:调整职业关系、提升职业素质和促进行业发展。,0,0
1,(单选题)销售相关业务人员为了提高业绩和争抢客户，违反法规，为管理人带来处罚和声誉损失的风险是（）。,<p>A投资合规性风险</p><p>B销售合规性风险</p><p>C信息披露合规性风险</p><p>D反洗钱合规性风险</p>,4,B,暂无，请查看考友笔记,0,0
1,(单选题)根据投资目标的不同，可以将基金分为（）.,<p>A收入型基金、增长型基金和平衡型基金</p><p>B主动型基金和被动型基金</p><p>C公司型基金和契约型基金</p><p>D在岸基金和离岸基金</p>,4,A,根据投资目标的不同，可以将基金分为收入型基金、增长型基金知平衡型基金3种模型。,0,0
1,(单选题)招募说明书包含的重要信息包括（）。,<p>A涉及基金管理人、基金托管业务的诉讼</p><p>B转换基金运作方式</p><p>C涉及基金财产的诉讼</p><p>D基金运作方式</p>,4,D,涉及基金管理人，基金财产、基金托管业务的诉讼不属于招募说明书包含的重要信息：基金运作方式属于招募说明书包含的重要信息，转换基金运作方式不属于。,0,0
1,(单选题)封闭式基金的募集一般要经过申请、（）、发售、基金合同生效四个步骤.,<p>A认购</p><p>B核准</p><p>C发行</p><p>D申购</p>,4,B,考察基金的募集程序。基金的幕集一般要经过申请、核准、发售、基金合同生效四个步骤。,0,0
1,(单选题)QDII基金份额净值应当至少（）计算并披露一次，如基金投资衍生品应当在（）计算并披露.,<p>A每月，每周</p><p>B每周，每个工作日</p><p>C每月，每日</p><p>D每日，每日</p>,4,B,QDII基金份额净值应当至少每周计算并披露一次，如基金投资衍生品，应当在每个工作日计算并披露。,0,0
1,(单选题)基金份额在基金合同期限内固定不变，基金份额可以在依法设立的证券交易所交易，但基金份额待有人不得申请赎回的一种基金类型是（）。,<p>A开放式基金</p><p>B封闭式基金</p><p>C对冲基金</p><p>D契约型基金</p>,4,B,封闭式基金的定义。,0,0
1,(单选题)以下哪些内容是基金宣传推介材料中禁止的（）。,<p>A经相关机构认定的公司描述性词语</p><p>B登记过去10年的投资业绩</p><p>C“安心享受财富增长”</p><p>D基金分红公告</p>,4,C,不得登载单位或个人的推荐性文字。“安心享受财富增长”违规使用了可能使投资人认为没有风险的词语。,0,0
1,(单选题)基金管理人设监事会，监事会向股东会负责。监事会依法行使的职权不包括（）。,<p>A检查公司的财务</p><p>B对公司董事、总经理和其他高级管理人员执行公司职务时违反法律、行政法规或者公司章程的行为进行监督</p><p>C当公司董事、总经理和其他高级管理人员的行为损害公司的利益时，要求前述人员予以纠正</p><p>D决定公司合规管理部门的设置及其职能</p>,4,D,决定公司合规管理部门的i设置乃其职能属于董事会的合规责任,0,0
1,(单选题)证券投资基金的特点不包括（）.,<p>A集合理财、专业管理</p><p>B组合筹资、分散风险</p><p>C利益共享、风险共担</p><p>D严格监管、信息透明</p>,4,B,"证券投资基金的特点:（1）集台理财,专业管理；(2)组台投资分散风险；（3）利益共享、风险共但；（4）严格监管、信息透明；（5）独立托管、保障安全。",0,0
1,(单选题)（）即基金份额的持有人、基金产品的没资人，是基金资产的所有者和基金投资回报的受益人，是开展基金一切活动的中心。,<p>A基金托管人</p><p>B基金管理人</p><p>C基金客户</p><p>D基金当事人</p>,4,C,考查基金客户的定义.（本题本题出自金考必过，网址：www.jinkaobiguo.com，最好的刷题网站。）,0,0
1,(单选题)下列情形中，督察长不用及时向公司董事会，中国证监会及相关派出机构报告的是（）.,<p>A基金及公司发生违法违规行为</p><p>B基金及公司存在重大经营风险或者隐患</p><p>C基金公司销售人员小李离职</p><p>D督察长依法认为需要报告的其他情形</p>,4,C,发现下列情形之一的督察长应当及时向公司董事会、中国证监会及相关派出机构报告：(1)基金及公司发生违法违规行为。.(2)基金及公司存在重大经营风险或隐患。(3督察长依法认为需要报告的其他情形.(4)中国证监会规定的其他情形.,0,0
1,(单选题)基金的后台管理服务不包括（）。,<p>A基金份额的注册登记</p><p>B基金资产的托管</p><p>C会计核算</p><p>D信息披露</p>,4,B,基金的后台管理服务的四个内容。,0,0
1,(单选题)公司内部控制的核心是风险控制，制定内部控制制度应当以审慎经营、防范和化解风险为出发点指的是（）。,<p>A合法性原则</p><p>B完整性原则</p><p>C及时性原则</p><p>D审慎性原则</p>,4,D,公司内部控制的核心是风险控制，制定内部控制制度应当以审慎经营、防范和化解风险为出发点。,0,0
1,(单选题)根据投资对象的不同，证券役资基金的划分类别不包括（）。,<p>A股票基金</p><p>B债券基金</p><p>C混台基金</p><p>D平衡型基金</p>,4,D,根据投资对象的不同，基金分为股票基金、债券基金、货币市场基金、混合基金等。,0,0
1,(单选题)公司型基金依据(〕设立并营运。,<p>A公司法</p><p>B公司章程</p><p>C基金法</p><p>D基金合同</p>,4,B,公司型基金依据基金公司章程设立，基金投资者是基金公司的股东，享有股东权，按所持有的股份承担有限责任。,0,0
1,(单选题)相对于实质性审查制度，强制性信息披露的基本推论是投资者在公开信息的基础上（）。,<p>A风险共担</p><p>B收益共享</p><p>C买者自慎</p><p>D买者自负</p>,4,C,相对于实质性审查制度，强制性信息披露的基本推论是投资者在公开信息的基础上‘买者自慎’。,0,0
1,(单选题)是社会认可和人们普遍接受的行为规范，既可以是成文的，也可以是不成文的，没有特定的表现形式。,<p>A道德</p><p>B法律</p><p>C行政法规</p><p>D思想观念</p>,4,A,道德是社会认可和人们普遍接受的行为规范，既可以是成文的，也可以是不成文的，没有特定的表现形式.,0,0
1,(单选题)基金合同是规范基金当事人权利义务关系的基本法律文件，这些当事人不包括（）。,<p>A基金托管人</p><p>B基金管理人</p><p>C基金份额持有人</p><p>D基金代销机构</p>,4,D,暂无，请查看考友笔记,0,0
1,"(单选题)对冲基金,基于投资理论和极其复杂的金融市场操作技巧，充分利用各种金融衍生产品的杠杆效用,（）的投资模式",<p>A承担低风险、追求低收益</p><p>B承担低风险、追求高收益</p><p>C承担高风险、追求低收益</p><p>D承担高风险、追求高收益</p>,4,D,对冲基金基于投资理论和极其复杂的金融市场操作技巧，（本题本题出自金考必过，网址：www.jinkaobiguo.com，最好的刷题网站。）充分利用各种金融衍生产品的杠杆效用，承担高风险，追求高收益的投资模式。,0,0
1,(单选题)基金代销机构的代销资格应当是由（）来负责审核和批准.,<p>A不用任何机构审批</p><p>B人民银行</p><p>C银监会</p><p>D证监会</p>,4,D,基金代销机构的代销资格应当是由证监会来负责审核扣批准。,0,0
1,(单选题)基金管理人合规管理的相关规则不包括（）。,<p>A立法机关发布的基本法律规则</p><p>B证监会发布的基本法律规则</p><p>C基金业协会和证券业协会等自律性组织制定的适用于全行业的规范、标准、惯例等</p><p>D银行业协会等自律性组织制定的适用于全行业的规范、标准、惯例等</p>,4,D,暂无，请查看考友笔记,0,0
1,(单选题)依照《证券投资基金法》的规定，不属于基金托管人的职责的是（）。,<p>A办理与基金托管相关的信息披露事项</p><p>B计算并公告基金资产份额净值</p><p>C按规定召集基金份额持有人大会</p><p>D按照规定开设基金财产的资全账户和证券账户</p>,4,B,计算并公告基金资产份额净值为基金管理人的职责。,0,0
1,(单选题)货币市场基金的赎回资金划付较快一些.一般（）日即可从基金的银行存款账户划出，最快可在划出当日到达投资者资金账户。,<p>AT</p><p>BT+1</p><p>CT+2</p><p>DT+3</p>,4,B,货币市场基金的赎回资金划付较快一些。一股T十1日即可从基金的银行存款划出，最快可在划出当日到达投资者资金账户。,0,0
1,(单选题)基金资产（）以上投资于债券的为债券型基金.,<p>A0.6</p><p>B0.7</p><p>C0.8</p><p>D0.9</p>,4,C,基金资产80%以上投资与债券的为债券型基金。,0,0
1,(单选题)我国开放式基金首次募集的募集期限为自该基金份额发售之日起（）内。,<p>A3个月</p><p>B6个月</p><p>C9个月</p><p>D1个月</p>,4,A,我国开放式基金首次募集的募集期限为自该基金份额发售之日起3个月。（本题本题出自金考必过，网址：www.jinkaobiguo.com，最好的刷题网站。）,0,0
1,(单选题)基金管理人应当自收到投资者的申购(认购)、赎回申请之日起（）个工作日内，对该申购(认购)、赎回申请的有效性进行确认。,<p>A2</p><p>B3</p><p>C5</p><p>D7</p>,4,B,由于基金申购和赎回的资金清算依据注册登记机构的确认数据进行，为保护基金投资人的利益，有关法规明确规定，基金管理人应当自收到投资者的申购(认购〕.赎回申请之日起3个工作日内，对该申购(认购)、赎回申请的有效性进行确认.,0,0
1,(单选题)封闭式证券投资基金与开放式证券投资基金的主要区别之一是（）。,<p>A是否被监管部门严格监管</p><p>B基金规模是否固定</p><p>C是否有股权性</p><p>D基金成立是否规定了最低规模</p>,4,B,暂无，请查看考友笔记,0,0
1,(单选题)当基金管理人认为兑付投资者的赎回申请有因难，或认为兑付投资者的赎回申请进行的资产变现可能使基金份额净值发生较大波动时，基金管理人在当日接受赎回比例不低于上一日基金总份额（）的前提下.对其余赎回申请延期办理。,<p>A0.11</p><p>B0.1</p><p>C0.09</p><p>D0.08</p>,4,B,当基金管理人认为兑付投资者的赎回申请有困难，或认为兑付投资者的赎回申请进行的资产变现可能使基金份额净值发生波动较大时，基金管理人在当日接受赎回比例不低于上一日基金总份额10％的前提下，对其余赎回申请延期办理.,0,0
1,(单选题)在半年度和年度报告的重大事件揭示中，应披露报告期内偏离度绝对值达到或超过（）的信息.,<p>A0.005</p><p>B0.008</p><p>C0.003</p><p>D0.001</p>,4,A,在半年度和年度报告的重大事件揭示中，应披露报告期内偏离度绝对值达到或超过0.5%的信息.,0,0
1,(单选题)在我国基金信息披露法规体系中属于部门规章的是（）。,<p>A《证券投资基金法》</p><p>B《深圳证券交易所证券没资基金上市规则》</p><p>C《证券投资基金信息披露管理办法》</p><p>D《上市开放式基金业务指引》</p>,4,C,其他几项是国家法律、规范性文件和自律性规则（本题本题出自金考必过，网址：www.jinkaobiguo.com，最好的刷题网站。）,0,0
1,(单选题)如果封闭式基金募集期限届满后不能成立，基金管理人要在（）日内返还投资者已缴纳的款项，并加计银行同期存款利息。,<p>A7</p><p>B10</p><p>C15</p><p>D30</p>,4,D,如果封闭式基金募集期限届满后不能成立，基金管理人要在30日内返还投资者已缴纳的款项，并加计银行同期存款利息.,0,0
1,(单选题)封闭式基金份额上市交易，基金份额持有人不少于（）人。,<p>A100</p><p>B200</p><p>C500</p><p>D1000</p>,4,D,此题考察封闭式基金的上市交易条件,0,0
