1,(单选题)基金管理人、代销机构应当建立健全档案管理制度，保管基金份额持有人的开户资料和与销售业务有关 的资料的保存期不得少于()年。 ,<p>A20</p><p>B10</p><p>C15</p><p>D5</p>,4,C,基金管理人、代销机构应当建立健全档案管理制度，保管基金份额持有人的开户资料和与销售业务有 关的资料的保存期不得少于15年。,0,0
1,(单选题)个人理财业务管理部门内部调查监督，应重点检查()的情况。 ,<p>A理财产品销售人员的资格 </p><p>B业务记录是都齐全 </p><p>C销售业绩是否达标 </p><p>D是否存在错误销售和不当销售</p>,4,D,根据《商业银行个人理财业务风险管理指引》第14条规定可知，个人理财业务管理部门的内部调查监 督，应在审查个人理财顾问服务的相关记录、合同和其他材料等基础上，重点检查是否存在错误销售 和不当销售情况。,0,0
1,(单选题)下列各项中不能成为商业银行个人理财业务客户的是()。 ,<p>A限制民事行为能力人的法定代理人 </p><p>B无民事行为能力的自然人 </p><p>C完全民事行为能力的自然人 </p><p>D无民事行为能力人的法定代理人</p>,4,B,无民事行为能力的自然人的任何民事行为都无效。,0,0
1,(单选题)为了制定合理的现金预算，银行理财从业人员需预测客户的收入，若客户是一位市场销售人员，在这一过程中，主要应该评估()。 ,<p>A客户收入最低时的状况和过去平均状况 </p><p>B客户收入过去的平均状况和最高时的状况 </p><p>C客户收入最低时的状况和最高时的状况 </p><p>D以客户过去的平均收入为基准，做最好与最坏状况下的分析</p>,4,D,收入淡旺季差异大的市场销售人员，年收入不稳定，应该以过去的平均收入为基准，做最好与最坏状 况下的分析。,0,0
1,(单选题)中国银行业从业人员资格认证的日常工作机构是()。 ,<p>A中国银行业监督管理委员会 </p><p>B中国银行业从业人员资格认证办公室 </p><p>C中国证券监督管理委员会 </p><p>D中国保险监督管理委员会</p>,4,B,《中国银行业从业人员资格认证制度暂行规定(2006年修订)》第4条规定，专家委员会是实施认证制度 的专业咨询机构；认证办公室是实施认证制度的日常工作机构。,0,0
1,(单选题)下列理财目标中属于长期目标的是()。 ,<p>A偿还个人债务 </p><p>B投资股票市场 </p><p>C税收负担最小化 </p><p>D建立退休基金</p>,4,D,客户在与银行从业人员接触的过程中会提出他们的需求和期望目标，这些目标按时间长短可以划分 为：①短期目标。比如休假、旅游等；②中期目标。比如子女教育基金、按揭购房等；③长期目标。 比如退休金、遗产等。故本题答案选D。,0,0
1,(单选题)《证券法》的基本原则不包括()。 ,<p>A自愿、有偿、诚实信用原则 </p><p>B混业经营混业监管原则 </p><p>C合法原则 </p><p>D公开、公平、公正原则</p>,4,B,我国《证券法》的基本原则可以归纳为以下六项：①公开、公平、公正原则，称“三公”原则；②自 愿有偿、诚实信用的原则；③合法原则；④分业经营、分业管理的原则；⑤保护投资者合法权益的原 则；⑥国家集中统一监管与行业自律相结合的原则。,0,0
1,(单选题)下列关于商业银行理财产品（计划）监管要求的表述，错误的是()。 ,<p>A商业银行不得承诺或变相承诺除保证收益以外的任何可获得收益 </p><p>B商业银行使用保证收益理财计划附加条件所产生的投资风险应由银行承担 </p><p>C商业银行不得将理财计划与本行储蓄存款进行强制性搭配销售 </p><p>D商业银行不得将一般储蓄存款产品单独当做理财计划销售</p>,4,B,《商业银行个人理财业务管理暂行办法》第25条规定；商业银行使用保证收益理财计划附加条件所产 生的投资风险应由客户承担。,0,0
1,(单选题)()不是最高净值客户。(1)小王单笔认购理财产品150万元人民币(2)小李购买理财产品时，出示120万元个 人储蓄存款证明(3)小张提供了最近3年的收入证明，每年不低于20万元(4)小赵提供了最近3年每年28万元 的家庭收入证明 ,<p>A小王 </p><p>B小李 </p><p>C小张 </p><p>D小赵</p>,4,D,高净值客户是指满足下列条件之一的商业银行客户：①单笔认购理财产品不少于100万元人民币的自然 人；②认购理财产品时，个人或家庭金融净资产总计超过100万元人民币的自然人；③个人收入在最近 三年每年超过20万元人民币或者家庭合计收入在最近3年内每年超过30万元人民币的自然人。,0,0
1,(单选题)下列关于评估客户投资风险承受度的表述，错误的是()。 ,<p>A已退休客户，应该建议其投资低风险型产品 </p><p>B家庭负担越重，所能承受的风险越大 </p><p>C投资经验越丰富，风险承受能力越高 </p><p>D资金需动用的时间离现在越近，越不能承担风险</p>,4,B,家庭负担越重，所能承受的风险越小。,0,0
1,(单选题)下列关于代理的说法，不正确的是()。 ,<p>A代理人和第三人串通损害被代理人利益的，由代理人和第三人承担连带责任 </p><p>B代理人不履行职责而给被代理人造成损害的，应当承担民事责任 </p><p>C第三人知道行为人没有代理权的情况下还与行为人实施民事行为给他人造成损害的，由第三人负责人 </p><p>D超越代理权的行为只有经被代理人的追认，被代理人才承担民事责任</p>,4,C,第三人知道行为人没有代理权、超越代理权或者代理权已终止还与行为人实施民事行为给他人造成损 害的，由第三人和行为人负连带责任。,0,0
1,(单选题)下列不属于银行业从业人员在从事理财产品销售时应遵循的原则的是()。 ,<p>A同业竞争 </p><p>B诚实守信 </p><p>C勤勉尽职 </p><p>D专业胜任</p>,4,A,根据《商业银行理财产品销售管理办法》，从业人员在从事理财产品销售活动时，应当遵循以下原 则：勤勉尽职原则、诚实守信原则、公平对待客户原则和专业胜任原则。,0,0
1,(单选题)期货交易的结算，由()统一组织进行。 ,<p>A期货保证金存管银行 </p><p>B期货监督管理机构 </p><p>C期货公司 </p><p>D期货交易所</p>,4,D,《期货交易管理条例》第10条规定，期货交易所履行的职责包括：①提供交易的场所、设施和服务； ②设计合约，安排合约上市；③组织并监督交易、结算和交割；④为期货交易提供几种履约担保；⑤ 按照章程和交易规则对会员进行监督管理；⑥国务院期货监督管理机构规定的其他职责。,0,0
1,(单选题)银行A与B是竞争对手，为了赢得市场份额，A以低于成本价的价格销售理财产品，则A的做法()。 ,<p>A不符合公平竞争 </p><p>B符合公平竞争 </p><p>C在公司想获得市场优势时可鼓励采用 </p><p>D正常情况下不符合公平竞争，但在公司业务发展陷入困境时可以采用</p>,4,A,该种行为违背了公平竞争的原则。,0,0
1,(单选题)关于合同生效要件的说法，不正确的是()。 ,<p>A合同标的合法，即当事人签订的合同不违反法律和社会公共利益 </p><p>B当事人意思表示真实 </p><p>C至少有一方当事人具备民事行为能力 </p><p>D合同标的需确定</p>,4,C,必须是签订合同的双方都具备民事行为能力，合同才能生效。,0,0
1,(单选题)金融中介可以分为交易中介和服务中介，下列属于交易中介的是()。 ,<p>A会计师事务所 </p><p>B投资顾问咨询公司 </p><p>C律师事务所 </p><p>D有价证券承销人</p>,4,D,会计师事务所、投资顾问咨询公司、律师事务所都是服务中介。,0,0
1,(单选题)以下基金的分类错误的是()。 ,<p>A按照收益凭证是否可以赎回，基金可分为开放式基金和封闭式基金 </p><p>B按投资对象不同，基金可分为主动型基金和被动型基金 </p><p>C根据募集方式不同，基金可分为公募基金和私募基金 </p><p>D根据基金法律地位不同，基金可分为公司型基金和契约型基金</p>,4,B,依据投资理念不同，基金可分为主动型基金和被动型基金。,0,0
1,(单选题)基金收益的主要组成部分是()。 ,<p>A证券买卖差价 </p><p>B红利收入 </p><p>C债券利息 </p><p>D存款利息收入</p>,4,B,基金收益包括红利收入、股息、债券利息、证券买卖差价、存款利息和其他收入。其中，红利收入属 于主要组成部分。,0,0
1,(单选题)一般而言，各类基金的收益特征由高到低的排序依次是()。 ,<p>A债券型基金、股票型基金、混合型基金、货币市场型基金 </p><p>B股票型基金、混合型基金、债券型基金、货币市场型基金 </p><p>C债券型基金、股票型基金、货币市场型基金、混合型基金 </p><p>D货币市场型基金、股票型基金、混合型基金、债券型基金</p>,4,B,一般而言，各类基金的收益特征由高到低的排序依次是股票型基金→混合型基金→债券型基金→货币 市场型基金。,0,0
1,(单选题)()指商业银行在产品销售之后，对产品的风险指标进行追踪管理，定期作出评估。 ,<p>A产品设计风险管理 </p><p>B产品运作风险管理 </p><p>C产品销售风险管理 </p><p>D产品到期风险管理</p>,4,B,产品运作风险管理指商业银行在产品销售之后，对产品的风险指标进行追踪管理，定期作出评估。 【专家点拨】商品设计风险管理是指商业银行应该制定合理的产品研发流程以及内部审批程序，明确 主要风险以及相对风险管理措施，并按要求向监管部门报送。产品到期风险管理是指商业银行应监督 客户资金的偿还和分配以及财务处理。对于一些特殊情况，商业银行应制订相应的应急处理方案。,0,0
1,(单选题)客户信息可以分为定量信息和定性信息，下面属于定量信息的是()。 ,<p>A投资偏好 </p><p>B现有和预见的经济状况 </p><p>C养老金规划 </p><p>D理财决策模式</p>,4,C,A、B、D选项均属于定性信息。,0,0
1,(单选题)银行业从业人员在接洽业务过程中，对客户提出的合理要求应尽量满足，对暂时无法满足或明显不合理 的要求，应当()。 ,<p>A将客户交与保卫部门 </p><p>B耐心说明情况，取得理解和谅解 </p><p>C作出日后满足的承诺 </p><p>D向上级汇报</p>,4,B,银行业从业人员在接洽业务过程中，对客户提出的合理要求应尽量满足，对暂时无法满足或明显不合 理的要求，应当耐心说明情况，取得理解和谅解。,0,0
1,(单选题)金融市场的最基本、最重要的功能是()。 ,<p>A融通货币资金 </p><p>B资源配置 </p><p>C信号功能 </p><p>D调节经济</p>,4,A,金融市场的最基本、最重要的功能是融通货币资金。,0,0
1,(单选题)下列金融资产不属于基础资产的是()。 ,<p>A普通股票</p><p>B国债 </p><p>C优先股股票 </p><p>D远期合约</p>,4,D,基础资产又叫原生资产，是相对于衍生资产而言的，它们的主要职能是媒介储蓄向投资转化或者用于 债权债务清偿的凭证，如股票和债券。衍生金融工具是在原生金融工具基础上派生出来的金融产品， 包括远期合约、期货、期权、互换合约等，它们的价值取决于相关原生产品的价格，主要功能是管理 与原生工具相关的风险。远期合约是金融衍生品。,0,0
1,(单选题)扣缴义务人每月所扣的税款和自行申报纳税人每月应纳的税款应当在()缴入国库。 ,<p>A当月月底 </p><p>B次月1日内 </p><p>C次月15日内 </p><p>D次月7日内</p>,4,C,《个人所得税法》第9条规定，扣缴义务人每月所扣的税款，自行申报纳税人每月应纳的税款，都应当 在次月15日内缴入国库，并向税务机关报送纳税申报表。,0,0
1,(单选题)证券投资基金可以同时投资于数十种甚至数百种证券，从而可以充分分散基金所持有的证券组合的()。 ,<p>A利率风险 </p><p>B违约风险 </p><p>C非系统风险 </p><p>D系统风险</p>,4,C,非系统性风险是指对某个行业或个别证券产生影响的风险，它通常由某一特殊的因素引起，与整个证 券市场的价格不存在系统的全面联系，而只对个别或少数证券的收益产生影响。由于不同的证券非系 统性风险不同，投资分散化可以降低组合的非系统风险。B项违约风险是非系统风险的一种，A项利率 风险属于系统风险。,0,0
1,(单选题)在不同的沟通方式中，()是组织间进行沟通的基础，因具有便于使用、持久性的功能而被广泛运用。 ,<p>A图像语言 </p><p>B电子邮件 </p><p>C书面语言</p><p>D多媒体</p>,4,C,电子邮件和多媒体，是近几年才发展起来的，有很多人尤其是年龄稍长的人都不会用，所以不选B、D 图像传输过程中可能会有丢失，而且不具有广泛适用性，所以不选A。,0,0
1,(单选题)直接标价法下1美元=7元人民币，1英镑=2美元，则相对于中国而言直接标价法下人民币元与英镑的汇率 为()。 ,<p>A14</p><p>B0.0714</p><p>C3.5</p><p>D0.2857</p>,4,A,套算汇率，即1英镑=2美元=14元人民币。注意，直接标价法是用本币表示外币的价格，即将外币看作 商品，计算1单位外币的本币价格。,0,0
1,(单选题)在外汇市场上，利率高的货币，其远期汇率表现为()。 ,<p>A升水 </p><p>B贴水 </p><p>C平价 </p><p>D不变</p>,4,B,外汇市场上的套利活动最终会消除各种投资的收益差异，使所有的货币收益趋于一致。所以当前利率 较高的货币，在未来汇率会贬值，从而使该货币的收益有所下降；而当前利率较低的货币，未来会升 值，以弥补其在利率上的劣势。,0,0
1,(单选题)下列行为中，()违反了保护商业机密与客户隐私的规定。 ,<p>A与同业工作人员交流对某些客户的评价，但未透露客户具体数据 </p><p>B避免向同事打听客户的个人信息和交易信息 </p><p>C了解调查申请贷款客户的信用记录、财务经营状况 </p><p>D与同事通过电子邮件发送银行在网上已公布的财务数据</p>,4,A,保护客户隐私要求不能与同业人员交流相关的客户信息。A项虽然未透露具体数据，但对客户的评价 也可能涉及客户的信息和隐私，因而不可与同业人员交流；B项符合规定；C项调查贷款申请者的相关 情况是银行人员进行贷款审批的必要程序，也是风险控制的必然要求；D项网站上已公布的数据属于 公开数据，不涉及泄露商业机密。,0,0
1,(单选题)银行职业道德首先应该具备的职业操守是()。 ,<p>A专业胜任 </p><p>B忠于职守 </p><p>C勤勉尽责 </p><p>D诚实守信</p>,4,D,诚实守信要求从业人员应以高标准职业道德规范行事，品行端正。【专家点拨】实际上题中四个选项 都是银行业从业人员职业道德规范的内容，但题干问的是首先应当具备的原则。银行人员每天要经手 大量现金、资产，要保证客户的财产安全，最重要的当然就是要求从业人员诚实守信；再联系国家现 在大力提倡讲诚信，得出正确答案为D。,0,0
1,(单选题)某投资者中了一张彩票，该彩票在未来20年中每年年底将收到50000元。假定利率为10%，则这个彩票的 现值为()元。 ,<p>A418246</p><p>B425678</p><p>C637241</p><p>D286375</p>,4,B,PV=50000*[1-(1+10%)-20 ]/10%=425678（元）。,0,0
1,(单选题)商业银行营业网点对客户进行产品适合度评估时，下列方式适合的是()。 ,<p>A通过电话询问，对客户的产品适合度进行评估 </p><p>B通过专门的产品适合度评估书，当面对客户的产品适合度进行评估 </p><p>C通过电子邮件，对客户的产品适合度进行评估 </p><p>D通过互联网，对客户的产品适合度进行评估</p>,4,B,商业银行在向客户销售理财产品前，应建立客户评估机制，针对不同理财产品设计专门的产品适合度 评估书，在营业网点当面对客户的产品适合度进行评估（不得通过网络或电话等手段进行），并由客 户对评估结果签字确认。,0,0
1,(单选题)俗话说：“受人之托，忠人之事”，这句话与下列《银行业从业人员职业操守》中()原则的要求相似。 ,<p>A专业胜任 </p><p>B守法合规 </p><p>C诚实信用 </p><p>D勤勉尽职</p>,4,C,C项说法符合题干要求。,0,0
1,(单选题)商业银行在经营活动中要坚持的“三性”原则不包括()。 ,<p>A安全性 </p><p>B流动性 </p><p>C效益性 </p><p>D波动性</p>,4,D,“三性”原则，即安全性原则、流动性原则和效益性原则。,0,0
1,(单选题)非系统性风险是指()。 ,<p>A不可分散的风险 </p><p>B由宏观经济环境变化引起的证券收益的不确定性 </p><p>C由于证券本身因素引起的收益的不确定性</p><p>D市场投资组合仍然包含的风险</p>,4,C,非系统风险是由于证券本身因素引起的收益的不确定性，它是可以分散的，市场投资组合经过了充分 的分散已经不存在非系统风险，但仍存在系统风险，系统风险是由宏观经济环境变化引起的证券收益 的不确定性，不可分散。,0,0
1,(单选题)依据《中华人民共和国个人所得税法》，经批准下列情形中可以减征个人所得税的是()。 ,<p>A军人转业费 </p><p>B驻华使馆的外交代表所得 </p><p>C孤老、烈属所得 </p><p>D保险赔款</p>,4,C,有下列情形之一的，经批准可以减征个人所得税：①残疾、孤老人员和烈属的所得；②因严重自然灾 害造成重大损失的；③其他经国务院财政部门批准减税的。,0,0
1,(单选题)下列关于基金认购的表述中，错误的是()。 ,<p>A认购费率通常比申购费率优惠 </p><p>B认购期利息自动转为基金份额 </p><p>C它是投资者在封闭式基金募集期间申请购买基金份额的行为 </p><p>D基金认购采用“金额认购、面额发行”的原则</p>,4,C,基金认购是指投资者在开放式基金募集期间申请购买基金份额的行为。,0,0
1,(单选题)王教授到国外讲学获得报酬1万美元，他应当在年度终了后()日内纳税。 ,<p>A7</p><p>B10</p><p>C15</p><p>D30</p>,4,D,从中国境外取得所得的纳税义务人，应当在年度终了后30日内，将应纳的税款缴入国库，并向税务机 关报送纳税申报表。,0,0
1,(单选题)根据《商业银行个人理财业务风险管理指引》，下列表述中正确的是()。 ,<p>A商业银行允许一般产品人员向客户提供理财投资规划及意见，但不允许销售理财计划 </p><p>B商业银行的理财业务人员在销售理财产品时，对产品所涉及的相关风险稍作提示即可 </p><p>C商业银行可以变更客户资金的投资方向、范围或者方式 </p><p>D商业银行应当将银行资产与客户资产分开管理</p>,4,D,商业银行应当将银行资产与客户资产分开管理，明确相关部门及其工作人员在管理、调整客户资产方 面的授权。对于可以由第三方托管的客户资产，应交由第三方托管。【专家点拨】《商业银行个人理 财业务风险管理指引》第20条规定，商业银行应当明确个人理财业务人员与一般产品销售和服务人员 的工作范围界限，禁止一般产品销售人员向客户提供理财投资咨询顾问意见、销售理财计划。第30条 规定，商业银行提供个人理财顾问服务业务时，要向客户进行风险提示。风险提示应设计客户确认栏 和签字栏。客户确认栏应载明以下语句，并要求客户抄录后签名。第35条规定，商业银行应当建立必 要的委托投资跟踪审计制度，保证商业银行代理客户的投资活动符合与客户的事先约定。未经客户书 面许可，商业银行不得擅自变更客户资金的投资方向、范围或方式。,0,0
1,(单选题)下列财务报表属于静态报表的是()。 ,<p>A资产负债表 </p><p>B利润表 </p><p>C现金流量表 </p><p>D以上都不是</p>,4,A,资产和负债都是存量指标，即某一时点上的数值，因此资产负债表是静态报表。利润表反映的收入支 出和现金流量表反映的现金流出入都是流量概念，因而是动态报表。【专家点拨】如果大家区分不好 静态报表和动态报表的话，可以这样记忆，静态报表即存量报表，动态报表即流量报表；而存量是某 一时点上的量，流量是一段时间的量。,0,0
1,(单选题)初次拜访客户前可以不准备()。 ,<p>A确定沟通的目的和重点 </p><p>B选择沟通方式 </p><p>C制作金融服务建议书 </p><p>D客户的相关文件资料</p>,4,C,金融建议书是第二次拜访的时候需要准备的，要根据初访和其他渠道收集的资料编制。初次拜访主要 是了解情况，不需要准备建议书。,0,0
1,(单选题)退休规划的最大影响因素不包括()。 ,<p>A通货膨胀率 </p><p>B投资报酬率 </p><p>C银行贷款利率 </p><p>D工资薪金收入成长率</p>,4,C,退休规划的最大影响因素分别是通货膨胀率、工资薪金收入成长率与投资报酬率。,0,0
1,(单选题)以下关于现值和终值的说法，错误的是()。 ,<p>A随着复利计算频率的增加，实际利率增加，现金流量的现值增加 </p><p>B期限越长，利率越高，终值就越大 </p><p>C货币投资的时间越早，在一定时期期末所积累的金额就越高. </p><p>D利率越低或年金的期间越长，年金的现值越大</p>,4,A,根据年金现值的计算公式，计息次数和实际利率都是在分母上的，分母越大，现金流量的现值越小。,0,0
1,(单选题)某公司债券年利率为12%，每季复利一次，其实际利率为()。 ,<p>A0.0766</p><p>B0.1278</p><p>C0.1353</p><p>D0.1255</p>,4,D,根据复利计算公式，实际利率=(1+12%*1/4) 4-1，计算得，实际利率=12.55%。,0,0
1,(单选题)王某投保了一份生死两全保险，后经医院诊断为突发性精神分裂症。治疗期间，王某病情进一步恶化， 终日意识模糊，狂躁不止，最终自杀身亡。这一死亡事故的近因是()。,<p>A精神分裂症 </p><p>B自杀 </p><p>C精神分裂症和自杀 </p><p>D由于精神分裂症引起的自杀</p>,4,A,自杀是某人死亡的形式，自杀的直接原因是精神分裂症，因此死亡事故的近因是精神分裂症。【专家 点拨】D项具有一定的迷惑性，但注意该项的中心词是自杀，如果投保人精神状况正常状态下自杀， 则自杀为死亡近因；但本题中投保人精神状况异常，自杀不能成为死亡的直接原因。,0,0
1,(单选题)基金通过汇集众多中小投资者的小额资金，形成较大的资金实力，将资产分别配置到股票、债券等多种 资产上，通过有效的资产组合降低投资风险是指基金的()特点。 ,<p>A集合理财、专业管理 </p><p>B组合投资、分散投资 </p><p>C严格监管、信息透明 </p><p>D利益共享、风险共担</p>,4,B,组合投资、分散投资是指基金通过汇集众多中小投资者的小额资金，形成较大的资金实力，将资产分 别配置到股票、债券等多种资产上，通过有效的资产组合降低投资风险。,0,0
1,(单选题)以下说法正确的是()。 ,<p>A成长型基金强调基金单位价格的增长 </p><p>B成长型基金一般按时派息 </p><p>C成长型基金投资对象一般为风险较小、资本增值有限的金融产品 </p><p>D成长型基金资产中，现金持有量较小，大部分资金投资于资本市场</p>,4,D,A、B、C项均是收入型基金的特征。,0,0
1,(单选题)不同的基金具有不同的流动性，从基金赎回角度来看，股票型基金一般为或______到账。() ,<p>AT+1；T+2 </p><p>BT+2；T+3 </p><p>CT+3；T+4 </p><p>DT+4；T+5</p>,4,D,不同的基金具有不同的流动性，从基金赎回角度来看，股票型基金一般为T+4或T+5到账。,0,0
1,(单选题)以下不属于分红险的收益风险来源的是()。 ,<p>A利率的波动 </p><p>B通货膨胀 </p><p>C预定营运管理费用 </p><p>D保险公司制定的预定死亡率</p>,4,B,分红险的收益风险来源于利率的波动和保险公司制定的预定死亡率、预定投资回报率和预定营运管理 费用。,0,0
1,(单选题)下列关于国债风险的说法中，错误的是()。 ,<p>A债券的到期时间越长，利率风险越大 </p><p>B一般说来，国债的违约风险最低 </p><p>C可赎回债券可以在任何时间赎回 </p><p>D如果利率下降，债券的提前偿付就会使投资者面临再投资风险</p>,4,C,可赎回债券往往规定有赎回保护期，在保护期内，发行者不得行使赎回权。,0,0
