1,(单选题)下列关于税收规划的说法，不正确的是()。 ,<p>A合法性原则是税收规划最基本的原则，是税收规划与偷税漏税乃至避税行为区别开来的根本所在 </p><p>B目的性原则是税收规划最根本的原则，是由税法基本原则中的税收公平原则所决定的 </p><p>C规划性原则是税收规划最有特色的原则，这是由作为税收基本原则的社会政策原则所引发的 </p><p>D为客户进行税收规划应该以税负轻重作为选择纳税的唯一标准</p>,4,D,为客户进行税收规划不能以税负轻重作为选择纳税的唯一标准，应该着眼于实现客户的综合利益目 标。,0,0
1,(单选题)下列四种理财计划中，对投资者而言投资风险最高的是()。 ,<p>A保证收益理财计划</p><p>B非保证收益理财计划 </p><p>C保本浮动收益理财计划 </p><p>D非保本浮动收益理财计划</p>,4,D,保证收益理财计划风险最低，因为它是既保本又保证收益；C、D是非保证收益的两种形式。其中，保 本浮动收益只保本不保证收益；非保本浮动收益本金和收益都不保证，因此风险最大。【专家点拨】 理财计划的名称反映了其风险和收益状况，因此我们可以从理财计划的名称上进行分析，做出选择。,0,0
1,(单选题)在商业银行集合境内机构和居民个人的人民币资金购汇投资境外金融产品的理财业务中，商业银行成为 ()。 ,<p>A合格的境内机构投资者 </p><p>B集合投资者 </p><p>C合格的境外机构投资者 </p><p>D战略投资者</p>,4,A,合格境内机构投资者的定义。由于目前我国法律不允许个人投资境外金融产品（限制资本外逃），因 此需要批准审批合格境内机构投资者作为资本项目完全开放的过渡手段。合格境外机构投资者是指经 中国证监会批准投资于中国证券市场，并取得国家外汇管理局额度批准的中国境外基金管理机构、保 险公司、证券公司、其他资产管理机构。战略投资者是指具有资金、技术、管理、市场、人才优势， 能够促进产业结构升级，增强企业核心竞争力和创新能力，拓展企业产品市场占有率，致力于长期投 资合作，谋求获得长期利益回报和企业可持续发展的境内外大企业、大集团。集合投资者不是标准概 念。,0,0
1,(单选题)以下不属于产品风险的管理阶段的是()。 ,<p>A产品设计风险管理 </p><p>B产品运作风险管理 </p><p>C产品销售风险管理 </p><p>D产品到期风险管理</p>,4,C,产品风险的管理分为三个阶段：产品设计风险管理，产品运作风险管理，以及产品到期风险管理。,0,0
1,(单选题)当经济增长处于收缩阶段时，个人和家庭应考虑更多投资于()。 ,<p>A房地产</p><p>B股票 </p><p>C外汇产品 </p><p>D储蓄产品</p>,4,D,经济处于收缩阶段时，个人和家庭应考虑更多投资于防御性资产，如储蓄资产、固定收益类产品等。,0,0
1,(单选题)商业银行接受投资者委托以投资者自有外汇进行境外理财投资的，其委托的金额()外汇局批准的投资购汇 额度。 ,<p>A应计入 </p><p>B不计入 </p><p>C由投资者选择是否计入 </p><p>D由商业银行选择是否计入</p>,4,B,《商业银行开办代客境外理财业务管理暂行办法》第13条规定，商业银行受投资者委托以人民币购汇 办理代客境外理财业务，应向外汇局申请代客境外理财购汇额度。商业银行接受投资者委托以投资者 的自有外汇进行境外理财投资的，其委托的金额不计入外汇局批准的投资购汇额度。【专家点拨】题 干中说了银行用于投资的外汇是客户自有的，不需要申请购汇，当然也就不计入购汇额度。,0,0
1,(单选题)以下不属于风险测量的常用指标的是()。 ,<p>A产品收益率 </p><p>B产品收益率的方差 </p><p>C产品收益率的标准差 </p><p>DVaR</p>,4,A,理财产品的风险评估可采用定性、定量两种方法，其中定量的风险测量的常用指标是产品收益率的方 差、标准差、VaR。,0,0
1,(单选题)对债券类理财产品进行风险评估的主要评估主体是()对收益率的影响。 ,<p>A利率波动 </p><p>B汇率波动 </p><p>C系统风险 </p><p>D存款利率和汇率的变动</p>,4,D,对债券类风险的主要评估主体是存款利率及汇率的变动对收益的影响。对于利率类理财产品而言，风 险的主要评估主体是利率波动对收益率的影响；对于汇率类理财产品而言，风险的主要评估主体是汇 率波动对收益率的影响；对于股票类理财产品而言，风险的主要评估主体是系统风险和个股风险等。,0,0
1,(单选题)在商业银行的声誉风险管理中，可以提高对声誉风险的发现和声誉事件应对能力的措施是()。 ,<p>A建立投诉处理监督评估机制 </p><p>B建立声誉内部培训和激励机制 </p><p>C建立声誉风险排查机制 </p><p>D建立新闻工作归口管理制度</p>,4,C,A、D选项，属于解决声誉风险管理部门和业务部门相脱离问题的措施；B选项是形成良好的声誉风险 管理文化的措施。,0,0
1,(单选题)商业银行应在向信托公司出售信贷资产、票据资产等资产后的()个工作日内书面通知债务人资产转让事 宜，保证信托公司真实持有上述资产。 ,<p>A5</p><p>B7</p><p>C10</p><p>D15</p>,4,C,商业银行应在向信托公司出售信贷资产、票据资产等资产后的10个工作日内，书面通知债务人资产转 让事宜，保证信托公司真实持有上述资产。,0,0
1,(单选题)理财产品最常见、最主要的风险是()。 ,<p>A市场风险 </p><p>B流动性风险 </p><p>C支付结构风险 </p><p>D投资管理风险</p>,4,A,理财资金的最终运用方向（即基础资产）所面临的市场风险是理财产品最常见甚至最主要的风险。,0,0
1,(单选题)以下不是VaR方法的是()。,<p>A风险价值模型 </p><p>B受险价值方法 </p><p>C在险价值方法 </p><p>D投资价值模型</p>,4,D,VaR方法称为风险价值模型，也称受险价值方法、在险价值方法。,0,0
1,(单选题)理财产品常见的收益类型不含()。 ,<p>A保本收益 </p><p>B保本浮动收益 </p><p>C非保本浮动收益 </p><p>D非保本固定收益</p>,4,D,常见理财产品种类主要有三类，分别是固定收益类理财产品、保本浮动收益理财产品、非保本浮动收 益类理财产品。,0,0
1,(单选题)下列对个人理财产品开发管理的说法错误的是()。 ,<p>A商业银行根据理财业务发展需要研发的新投资产品的介绍和宣传材料，应当按照内部管理有关规定经 相关部门审核批准 </p><p>B商业银行本着符合顾客利益和风险承受能力的原则，审慎、合规的开发设计理财产品 </p><p>C在理财产品命名时，不得使用带有诱惑性、误导性和承诺性的称谓和蕴涵潜在风险或易引发争议的模 糊性语言 </p><p>D商业银行根据客户的意愿向客户销售无市场分析预测和无定价依据的理财产品</p>,4,D,商业银行不得销售无市场分析预测和无定价依据的理财产品，D选项错。,0,0
1,(单选题)下列不属于银行客户关系管理系统的是()。 ,<p>A客户综合评价体系 </p><p>B客户经理管理体系 </p><p>C客户服务系统 </p><p>D客户风险管理系统</p>,4,D,银行客户关系管理系统包括以下几个模块：客户综合评价体系、客户经理管理体系、客户服务系统、 银行经营状况综合分析、辅助决策系统。,0,0
1,(单选题)金融市场按交割时间分类，可以划分为()。 ,<p>A货币市场与资本市场 </p><p>B一级市场与二级市场 </p><p>C现货市场与期货市场 </p><p>D股票市场与债券市场</p>,4,C,A是按照交易标的物期限的不同划分的，B是按照金融工具发行和流通特征划分的，D是按照交易标的 物的不同划分的。现货是即期交割，期货是远期交割或不交割。,0,0
1,(单选题)若理财客户的投资目标是获得较稳定的但是超过银行存款的收益，则以下最适合的投资工具是()。 ,<p>A债券 </p><p>B股票 </p><p>C股指期货 </p><p>D认股权证</p>,4,A,B、C、D三项的收益不是稳定的。债券的收益较为稳定，但其风险高于银行存款，因此能获得超过银 行存款的收益。,0,0
1,(单选题)宏伟建筑公司的资产负债表显示：货币资金20万元，应收账款15万元，存货10万元，固定资产25万元， 总资产70万元，流动负债15万元，则该公司的流动比率为()。 ,<p>A1.33</p><p>B3</p><p>C2.33</p><p>D4.67</p>,4,B,流动比率=流动资产/流动负债，流动资产包括货币资金、有价证券、应收票据、应收账款和存货等项 目，因此，该企业流动比率=(20+15+10)/15=3。,0,0
1,(单选题)银行业从业人员在()的监督下，自觉遵守《银行业从业人员职业操守》。 ,<p>A公众 </p><p>B银监会 </p><p>C同业协会 </p><p>D以上都对</p>,4,D,银行业从业人员应当接受所在机构、银行业自律组织、监管机构和社会公众的监督。,0,0
1,(单选题)受托人向受益人承担支付信托利益的义务以()为限。 ,<p>A受托人财产 </p><p>B托管人财产 </p><p>C委托人财产 </p><p>D信托财产</p>,4,D,《信托法》第34条，受托人和委托人按合同约定建立信托关系，双方权利义务的标的是信托财产。 【专家点拨】题中其余选项都是出题人故意设置的形式相似的干扰项。,0,0
1,(单选题)家庭成长期的特征是()。 ,<p>A从结婚到子女出生，家庭成员随子女出生而增加 </p><p>B从子女出生到完成学业为止，家庭成员数固定 </p><p>C从子女完成学业到夫妻均退休为止，家庭成员数随子女独立而减少 </p><p>D从夫妻均退休到夫妻一方过世为止，家庭成员只有夫妻两人</p>,4,B,选项A、B、C、D分别为家庭形成期、成长期、成熟期和衰老期的特征。【专家点拨】这里主要区别 成长期和成熟期的特征。,0,0
1,(单选题)《商业银行开办代客境外理财业务管理暂行办法》中规定，商业银行进行境外理财投资，其用于境外投 资的全部资产应当()。,<p>A由银监会进行保管 </p><p>B由外汇管理局进行保管 </p><p>C委托有托管资格的其他境内商业银行托管 </p><p>D委托有托管资格的其他境外商业银行托管</p>,4,C,商业银行境外理财投资，应当委托经银监会批准具有托管业务资格的其他境内商业银行作为托管入托 管其用于境外投资的全部资产。,0,0
1,(单选题)我国证券投资基金的基金管理人是()。 ,<p>A保险公司 </p><p>B信托公司 </p><p>C商业银行 </p><p>D基金公司</p>,4,D,我国的基金管理人由依法设立的基金管理公司担任。,0,0
1,(单选题)当事人互负债务，没有先后履行顺序，一方在对方履行之前有权拒绝其履行要求，这是()。 ,<p>A同时履行抗辩权 </p><p>B先履行抗辩权 </p><p>C后履行抗辩权 </p><p>D不安抗辩权</p>,4,A,《合同法》第66条规定，当事人互负债务，没有先后履行顺序的，应当同时履行。一方在对方履行前 有权拒绝其履行要求。一方在对方履行债务不符合约定时，有权拒绝其相应的履行要求。,0,0
1,(单选题)以下关于代理的说法正确的是()。 ,<p>A委托代理只能用书面形式 </p><p>B委托代理人将代理事项转托他人代理，事先没有取得被代理人同意的，由代理人对自己所转托的人的 行为负民事责任 </p><p>C超越代理权的行为未经被代理人的追认，由行为人承担民事责任 </p><p>D代理人知道被委托的事项违法仍然进行代理活动的，由代理人负民事责任</p>,4,C,A委托代理可以用书面形式，也可以用口头形式；B委托代理人将代理事项转托他人代理，事先没有取 得被代理人同意的，应当在事后及时告诉被代理人，如果被代理人不同意，由代理人对自己所转托的 人的行为负民事责任，但在紧急情况下，为了保护被代理人的利益而转托他人的除外；D代理人知道 被委托的事项违法仍然进行代理活动的，由代理人和被代理人负连带责任。,0,0
1,(单选题)在普通年金现值系数的基础上，期数减1、系数加1的计算结果，应当等于()。 ,<p>A递延年金现值系数 </p><p>B预付年金现值系数 </p><p>C永续年金现值系数 </p><p>D以上都不正确</p>,4,B,N期先付年金与N-1期后付年金比较，两者贴现期数相同，但N期先付年金比N-1期后付年金多一期不 需贴现的付款。因此先付年金的计算公式为：V=A*PVIFA+A=A*(1+PVIFA)，其中A为每期收付的款 项金额，PVIFA是N-1期普通年金现值系数。综上，先付年金现值系数等于普通年金现值系数的期数减 一、系数加一的计算结果。,0,0
1,(单选题)2007年9月1日，某企业将持有的面值为10000元、到期日为2007年9月16日的银行承兑汇票到银行贴现， 假定月贴现利率为0.2%，则银行实付贴现金额为()元。 ,<p>A10000</p><p>B9980</p><p>C9990</p><p>D10010</p>,4,C,贴现利息的计算公式为：贴现利息=汇票面值*实际贴现天数*月贴现率/30；实付贴现金额=汇票面值-贴现利息。根据题中条件，贴现利息=10000*0.2%*15/30=10，实付贴限额=10000-10=9990(元)。,0,0
1,(单选题)下列关于个人理财业务和储蓄业务区别的叙述，正确的是()。 ,<p>A个人理财业务是银行的负债业务，储蓄是向客户提供的一种服务方式 </p><p>B个人理财业务中资金的运用是定向的，储蓄的资金运用是非定向的 </p><p>C个人理财业务的风险一般由商业银行独立承担，储蓄的风险由客户承担或者商业银行和客户共同承担 </p><p>D个人理财业务中客户的资产与商业银行其他资产不严格区分，储蓄财产与商业银行的财产严格区分</p>,4,B,A项中个人理财业务是向客户提供的一种服务方式，储蓄是银行的负债业务；C项个人理财业务的风险 一般是客户承担或者商业银行和客户共同承担的，储蓄的风险是商业银行独立承担的；D项中储蓄财 产与商业银行的财产不严格区分。,0,0
1,(单选题)资产负债率用于揭示企业的()。 ,<p>A短期偿债能力 </p><p>B长期偿债能力 </p><p>C长期获利能力 </p><p>D营运能力</p>,4,B,资产负债率=负债总额/资产总额。由于负债要用资产来偿还，负债占资产总额的比率越低，说明企业 用于归还债务的资产越充足，因而，资产负债率越低说明企业长期偿债能力越强。,0,0
1,(单选题)《银行业从业人员职业操守》由()负责解释。 ,<p>A国务院 </p><p>B各商业银行 </p><p>C中国银行业监督管理委员会 </p><p>D中国银行业协会</p>,4,D,《银行业从业人员职业操守》由中国银行业协会制定并公布，其解释权必须归属于中国银行业协会。,0,0
1,(单选题)下列理财目标中属于短期目标的是()。 ,<p>A子女教育储蓄 </p><p>B按揭买房 </p><p>C退休 </p><p>D休假</p>,4,D,教育、买房和退休养老都是需要大笔资金的活动，需要长期积累，属于长期目标；休假相对来说需要 的钱少，属于短期理财能够实现的目标。,0,0
1,(单选题)下列不属于固定收益证券的金融工具的是()。 ,<p>A银行存款</p><p>B普通股票 </p><p>C优先股票 </p><p>D国债</p>,4,B,普通股票的收益主要是股息、分红和资本利得；前两者与公司的盈利情况和股息分配政策有关，资本 利得取决于市场价格，三者都不是固定的。,0,0
1,(单选题)客户信息可以分为财务信息和非财务信息，下列属于财务信息的是()。 ,<p>A客户当前的收支状况 </p><p>B客户的社会地位 </p><p>C客户的年龄 </p><p>D客户的投资偏好</p>,4,A,客户的财务信息指客户当前的收支状况、财务安排以及这些情况的未来发展趋势等，是银行从业人员 制定个人理财规划的基础和根据，决定了客户的目标和期望是否合理，以及完成个人财务规划的可能 性.,0,0
1,(单选题)半年期的无息政府债券（182天）面值为1000元，发行价为982.35元，则该债券的投资收益率为()。 ,<p>A0.0176</p><p>B0.0179</p><p>C0.0359</p><p>D0.0349</p>,4,C,持有期收益率=（1000-982.35）/982.35=1.798%，但这是半年期的，投资收益率应计算一年期的，所以 应为1.798%*2，约为3.59%。,0,0
1,(单选题)下列关于信托产品的风险的叙述，不正确的是()。 ,<p>A在已发行的信托产品中，多数是依靠项目自身产生的现金流或利润作为还款来源，因此项目自身的风 险是信托产品的最大风险之一 </p><p>B多数项目是由某一特定、持续经营的主体发起的，由该主体负责项目的实际操作和管理，因此，该主 体的经营管理水平、财务状况以及还款意愿将在很大程度上影响信托产品的安全程度 </p><p>C信托公司项目评估能力的高低和信托产品设计水平对信托产品的风险高低没有影响 </p><p>D信托产品流动性差，缺少转让平台，存在较大的流动性风险</p>,4,C,信托公司项目评估能力的高低和信托产品设计水平将直接决定信托产品的风险高低。,0,0
1,(单选题)投资本金20万元，在年复利5.5%情况下，大约需要()年可使本金达到40万元。 ,<p>A14.4</p><p>B13.09</p><p>C13.5</p><p>D14.21</p>,4,B,根据复利计算公式，本息和=本金*（1+年复利利率） 投资年限 ，把题中数值代入后得出投资年限约为13 年。,0,0
1,(单选题)下面国家不使用间接标价法的是()。 ,<p>A美国 </p><p>B新西兰 </p><p>C南非 </p><p>D中国</p>,4,D,本题还可以出多项选择题，考查使用间接标价法的国家。我国的汇率标价法采用直接标价法。,0,0
1,(单选题)个人理财业务从业人员不应当()。 ,<p>A在对客户分层的基础上，结合不同个人理财顾问服务类型的特点，确定向不同客户群提供个人理财顾 问服务的通道 </p><p>B客户主动要求了解或购买有关产品时，应向客户当面说明有关产品的投资风险和风险管理基本知识， 并以书面形式确认是客户主动要求了解和购买产品 </p><p>C对于市场风险较大的投资产品，不应主动向无相关交易经验的客户推介或销售 </p><p>D客户评估报告认为某一客户不适宜购买某一产品或计划，但客户仍要求购买的，应与其解除合同</p>,4,D,客户评估报告认为某一客户不适宜购买某一产品或计划，但客户仍要求购买的，商业银行应制定专门 的文件，列明商业银行的意见、客户的意愿和其他的必要说明事项，双方签字认可。,0,0
2,(多选题)根据市场有效假说，市场可以划分为()。 ,<p>A强型有效市场 </p><p>B半弱型有效市场 </p><p>C弱型有效市场 </p><p>D中度有效市场 </p><p>E半强型有效市场</p>,5,ACE,市场有效假说的三种形态为：弱型有效市场假说，半强型有效市场假说，强型有效市场假说。由此可 分为对应的三类市场，因此选择ACE。,0,0
2,(多选题)基金的基本当事人包括()。 ,<p>A基金持有人 </p><p>B基金管理人 </p><p>C证监会 </p><p>D证券交易所 </p><p>E基金托管人</p>,5,ABE,基金的当事人主要包括：基金投资者（又称基金持有人）、基金管理人、基金托管人以及基金销售机 构、注册登记机构、注册会计师、律师等中介服务机构。,0,0
2,(多选题)提供个人理财服务的机构包括()。 ,<p>A基金公司 </p><p>B信托公司 </p><p>C保险公司 </p><p>D证券公司 </p><p>E商业银行</p>,5,ABCDE,商业银行是个人理财业务的供给方，是个人理财服务的提供商之一，除银行外，证券公司、基金、信 托公司以及投资公司等其他金融机构也为个人客户提供理财服务。非银行机构除了通过自身渠道外， 还可利用商业银行渠道，向客户提供个人理财服务。,0,0
2,(多选题)下列关于《中华人民共和国物权法》的表述，正确的有()。 ,<p>A《物权法》是一部明确物的归属，保护物权，充分发挥物的效用的法律 </p><p>B依法属于国家所有的自然资源，所有权可以不登记 </p><p>C土地所有权应与土地附着物一并抵押 </p><p>D不动产权的设立、变更、转让和消灭，依照法律规定应当登记的，自记载于不动产登记簿时发生效力 </p><p>E第三人为债务人向债权人提供担保的，可以要求债务人提供反担保</p>,5,ABDE,C土地所有权不得抵押，C错误。ABDE均在《物权法》中明确规定，因此选择ABDE。,0,0
2,(多选题)商业银行声誉风险管理需要建立()。 ,<p>A声誉风险内部培训和激励机制 </p><p>B声誉风险信息管理制度和后评价机制 </p><p>C投诉机制和监督评估机制 </p><p>D信息发布、新闻工作归口管理制度和舆论信息研判机制 </p><p>E声誉风险排查机制、声誉事件分类分级管理和应急处理机制</p>,5,ABCDE,商业银行声誉风险管理指引内容包括：要求商业银行建立声誉风险排查机制、声誉事件分类分级管理 和应急处理机制，提高对声誉风险的发现和声誉事件的应对能力；建立投诉处理监督评估机制、信息 发布和新闻工作归口管理制度和舆情信息研判机制，解决声誉风险管理部门和业务部门相脱离的问 题；建立声誉风险内部培训和激励机制、声誉风险信息管理制度和后评价机制，形成良好的声誉风险 管理文化。,0,0
2,(多选题)《中华人民共和国外资银行管理条例》规定，外商投资银行、中外合资银行按照国务院银行业监督管理 机构批准的业务范围，可以经营的业务包括()。 ,<p>A买卖、代理买卖外汇 </p><p>B办理国内外结算 </p><p>C办理票据承兑与贴现 </p><p>D从事同业拆借 </p><p>E提供保管箱服务</p>,5,ABCDE,可以经营的业务包括下列部分或全部外汇业务和人民币业务：①吸收公众存款；②发放短期、中期和 长期贷款；③办理票据承兑与贴现；④买卖政府债券、金融债券，买卖股票以外的其他外币有价证 券；⑤提供信用证服务及担保；⑥办理国内外结算；⑦买卖、代理买卖外汇；⑧代理保险；⑨从事同 业拆借；⑩从事银行卡业务；(11)提供保管箱服务；(12)提供资信调查和咨询服务；（13）经国务院银 行业监督管理机构批准的其他业务。外商独资银行、中外合资银行经中国人民银行批准，可以经营结 汇、售汇业务。,0,0
2,(多选题)商业银行开展个人理财业务时，下列情形应予以禁止的有()。 ,<p>A利用个人理财业务从事洗钱活动 </p><p>B泄露客户个人交易信息 </p><p>C向客户披露理财产品的有关投资管理信息 </p><p>D不当使用客户个人资料 </p><p>E为客户进行理财产品风险揭示</p>,5,ABD,商业银行开展个人理财业务有下列情形之一的，银行业监督管理机构可依据《中华人民共和国银行业 监督管理法》第47条的规定和《金融违法行为处罚办法》的相关规定对直接负责的董事、高级管理人 员和其他直接责任人员进行处理，构成犯罪的，依法追究刑事责任：①违规开展个人理财业务造成银 行或客户重大经济损失的；②未建立相关风险管理制度和管理体系，或虽建立了相关制度但未实际落 实风险评估、监测与管控措施，造成银行重大损失的；③泄露或不当使用客户个人资料和交易信息记 录造成严重后果的；④利用个人理财业务从事洗钱、逃税等违法犯罪活动的；⑤挪用单独管理的客户 资产的。商业银行应尽责履行信息披露义务，向客户充分披露理财资金的投资方向、具体投资品种以 及投资比例等有关投资管理信息，并及时向客户披露对投资者权益或者投资收益等产生重大影响的突 发事件。,0,0
2,(多选题)商业银行对理财产品进行风险评级的依据应当包括但不限于以下因素()。 ,<p>A理财产品运营过程中存在的各类风险 </p><p>B理财产品期限、成本、收益测算 </p><p>C理财产品投资范围、投资资产和投资比例 </p><p>D本行过往产品业绩 </p><p>E本行开发设计的同类理财产品过往业绩</p>,5,ABCE,根据《中国银行业监督管理委员会令》第26条规定；商业银行对理财产品进行风险评级的依据应当包 括但不限于以下因素：①理财产品投资范围、投资资产和投资比例；②理财产品期限、成本、收益测 算；③本行开发设计的同类理财产品过往业绩；④理财产品运营过程中存在的各类风险。,0,0
2,(多选题)一般来说，下列关于国债风险的表述正确的有()。 ,<p>A国债的利率风险和再投资风险是此消彼长的关系 </p><p>B国债到期时间长短与利率风险大小同方向变化 </p><p>C附有赎回权的国债的现金流更具有不确定性 </p><p>D国债的违约风险最低，公司债券的违约风险相对比较高 </p><p>E在通货膨胀的情况下，国债投资人的利息收入和本金都会发生价值折损</p>,5,ABCDE,无,0,0
