2,(多选题)从业人员向个人客户提供财务分析、财务规划的顾问服务时，需掌握的财务报表包括()。 ,<p>A资产负债表 </p><p>B损益表 </p><p>C收入表 </p><p>D现金流量表 </p><p>E预算表</p>,5,AD,银行从业人员向客户提供财务分析、财务规划的顾问服务时，需要掌握两类个人财务报表资产负 债表和现金流量表。,0,0
2,(多选题)一般来说，下列属于商业票据特征的有()。 ,<p>A融资成本低 </p><p>B利率敏感性高 </p><p>C期限短 </p><p>D信用度高 </p><p>E融资灵活性高</p>,5,ABCDE,无,0,0
2,(多选题)下列属于信托产品特点的有()。 ,<p>A信托是以信任为基础的财产管理制度 </p><p>B信托财产权利主体与利益主体相分离 </p><p>C信托经营方式灵活、适应性强 </p><p>D信托财产具有独立性 </p><p>E信托管理具有连续性</p>,5,ABCDE,信托具有以下特点：①信托是以信任为基础的财产管理制度；②信托财产权利主体与利益主体相分 离；③信托经营方式灵活、适应性强；④信托财产具有独立性；⑤信托管理具有连续性；⑥受托人不 承担无过失的损失风险；⑦信托利益分配、损益计算遵循实绩原则；⑧信托具有资金融通的职能。,0,0
2,(多选题)金融期货和金融远期合约的重要区别在于()。 ,<p>A金融远期合约能够降低风险，但金融期货合约不能 </p><p>B金融远期合约大多在场外进行交易，金融期货合约在交易所内进行交易 </p><p>C金融远期合约的收益和损失一般在合约到期日实现，金融期货合约的盈利和亏损在每个交易日结束前 清算和执行 </p><p>D金融远期合约买卖双方一般不进行实物交割，金融期货合约一般都进行实物交割 </p><p>E金融远期合约的二级市场非常活跃，金融期货合约的二级市场非常不活跃</p>,5,BC,金融期货是标准化的金融远期合约，一般在交易所里进行。由于其标准性，金融期货的流动性较强， 二级市场活跃。期货合约实行每日结算制度，盈利和亏损在每个交易日结束前清算和执行。远期交易 主要是为了避险，所以一般都进行实物交割，金融期货主要的功能是套期保值，很少进行实物交割。 到期日前平仓即可。,0,0
2,(多选题)下列关于凭证式债券的说法，正确的有()。 ,<p>A可到购买网点提前兑付 </p><p>B凭证式债券是一种国家储蓄债，可记名、挂失 </p><p>C“凭证式国债收款凭证”记录债权，不能上市流通 </p><p>D凭证式债券不可以提前兑付 </p><p>E凭证式国债流动性强于记账式国债</p>,5,ABC,在凭证式国债持有期间，持券人如遇特殊情况需要提取现金，可以到购买网点提前兑取。由于凭证式 国债不可以上市流通，而记账式国债可以在交易所进行交易，故凭证式国债的流动性要弱于记账式国 债。,0,0
2,(多选题)根据货币的时间价值理论，影响现值大小的因素主要有()。 ,<p>A市盈率 </p><p>B投资年限 </p><p>C资产/负债比率 </p><p>D投资收益率 </p><p>E通货膨胀率</p>,5,BD,一笔投资的现值=∑各期现金流/(1+R) N ，其中，R为投资收益率，N为投资年限。,0,0
2,(多选题)目前，我国商业银行个人理财计划资金的主要投资对象包括()。 ,<p>A保本性资产 </p><p>B股票类资产 </p><p>C债券类资产 </p><p>D风险性资产 </p><p>E保利资产</p>,5,AD,我国商业银行个人理财计划资金的主要投资对象包括两部分：第一部分为保本性资产，即将理财资金 的大部分投资于一些低风险资产如国债、央行票据、政策性金融债券，或者投资于信用等级较高的企 业债券、短期融资券、货币市场基金等；第二部分是风险性资产，即将剩余理财资金购买外汇产品。 例如，美元、欧元、港币、日元、英镑等。这些资产的风险性水平较高，但同时预期收益也较高。,0,0
2,(多选题)家庭的生命周期是指()的整个过程。 ,<p>A家庭形成期 </p><p>B家庭建立期 </p><p>C家庭成长期 </p><p>D家庭成熟期 </p><p>E家庭衰老期</p>,5,ACDE,家庭的生命周期是指家庭形成期、家庭成长期、家庭成熟期、家庭衰老期的整个过程。,0,0
2,(多选题)下列属于基金的风险和收益特性的有()。 ,<p>A收益率高于存款 </p><p>B流动性高于存款 </p><p>C流动性低于股票 </p><p>D风险低于股票 </p><p>E风险高于股票</p>,5,ACD,基金是介于证券与储蓄之间的一种投资工具，具有中高收益、中低风险、流动性一般的特征。,0,0
2,(多选题)弹性较小的理财目标有()。 ,<p>A房产投资 </p><p>B子女教育 </p><p>C父母赡养 </p><p>D未来购车 </p><p>E购买高档珠宝</p>,5,BC,如果某项投资是为了子女教育或者赡养父母，那么这笔资金就必须在保证安全性的前提下在特定时间 内获得理想的收益，这样的理财目标既缺乏金额弹性又没有时间弹性。,0,0
2,(多选题)以下对不同理财观念客户的投资建议，正确的有()。 ,<p>A对于后享受型的客户，应建议其购买养老保险或投资型保单 </p><p>B单一指数型基金适合推荐给购房型客户 </p><p>C对于先享受型客户，应建议其购买基本需求养老保险</p><p>D对于购房型客户，建议其投资中短期必须稳定的基金 </p><p>E对于以子女为中心型客户，应建议其投资中长期比较看好的基金</p>,5,ACDE,单一指数型基金适合推荐给先享受型客户。,0,0
2,(多选题)以下关于市场有效性的说法正确的有()。 ,<p>A如果相信市场无效，投资者应采取被动投资策略 </p><p>B在半强型有效市场中，基本面分析不能为投资者带来超额利润 </p><p>C强型有效市场中，证券价格充分反映了所有信息，包括公开信息和内幕信息 </p><p>D市场有效性假定意味着，只要市场达到弱有效，技术分析将毫无可取之处 </p><p>E强型有效市场包含半强型有效市场，半强型有效市场包含弱型有效市场</p>,5,BCDE,如果相信市场无效，投资者应采取主动投资策略。,0,0
2,(多选题)商业银行深刻认识客户关系管理的丰富内涵，需要把握()。 ,<p>A客户关系管理是银行的一种经营哲学和经营战略 </p><p>B客户关系管理强调客户价值、银行价值和员工价值三者的高度统一 </p><p>C客户关系管理是贯穿于银行各部门、各环节的经营思想 </p><p>D客户关系管理强调从客户的行为因素和情感因素两个层面同时研究与建立客户关系 </p><p>E客户关系管理强调客户价值、银行价值和社会价值三者的高度统一</p>,5,ABCD,深刻认识客户关系管理的丰富内涵。尤其应当把握以下几点：①客户关系管理是银行的一种经营哲学 和经营战略；②客户关系管理强调客户价值、银行价值和员工价值三者的高度统一；③客户关系管理 是贯穿于银行各部门、各环节的经营思想，建立持久、稳固的客户关系，需要让银行所有部门的人员 都了解什么使客户感到满意和什么是客户价值；④客户关系管理强调从客户的行为因素和情感因素两 个层面同时研究和建立客户关系。,0,0
2,(多选题)利用个人客户的资产负债表可以明确()。 ,<p>A客户的偿付比例 </p><p>B储蓄比例 </p><p>C资产 </p><p>D负债 </p><p>E净资产</p>,5,ACDE,资产负债表可以反映资产和负债情况。偿付比例是净资产与总资产的比例。净资产等于资产减负债。,0,0
2,(多选题)金融市场特点包括()。 ,<p>A市场商品的特殊性 </p><p>B市场交易价格的一致性 </p><p>C市场交易活动的集中性 </p><p>D交易主体角色的可变性 </p><p>E市场主体的多样性</p>,5,ABCD,金融市场特点包括：①市场商品的特殊性。金融市场交易的对象是货币、资金以及其他金融工具。② 市场交易价格的一致性。利率作为货币资金价格的表现形式，在市场机制的作用下，不同市场的利率 水平将趋于一致。③市场交易活动的集中性。在金融市场上，金融工具的交易是通过一些专业机构组 织实现的，通常有固定的交易场所和无形的交易平台。④交易主体角色的可变性。在金融市场上，市 场交易主体角色并非固定。,0,0
2,(多选题)银行业监督管理目标有()。 ,<p>A为国家建设提供资金支持 </p><p>B促进银行业合法、稳健经营 </p><p>C维护公众对银行业的信心 </p><p>D保护银行业公平竞争 </p><p>E提高银行业竞争能力</p>,5,BCDE,银行业监管目标：①促进银行业的合法、稳健运行、维护公众对银行业的信心；②保护银行业公平竞 争、提高银行业竞争能力。,0,0
2,(多选题)下列对年金分类对应关系划分正确的有()。 ,<p>A按照起讫日期，划分为简单年金和一般年金 </p><p>B按照每期年金收支额是否相等，划分为等额年金和不等额年金 </p><p>C按照持续期，划分为有限年金和无限年金 </p><p>D按照每期年金额发生的时间，划分为确定年金和不确定年金 </p><p>E按照年金发生期间与计息期间是否一致，划分为后付年金、先付年金等</p>,5,BC,按照起讫日期是否确定，分为确定年金和不确定年金；按照每期年金额发生的时间，分为先付年金和 后付年金；按照发生期间与计息期间是否一致，分为简单年金和一般年金。,0,0
2,(多选题)关于商业银行综合理财服务，下列说法正确的有()。 ,<p>A是个人理财业务中的一类 </p><p>B投资收益与风险由客户或客户与银行按照约定方式承担 </p><p>C客户授权银行代表客户按照合同约定的投资方向和方式进行投资和资产管理 </p><p>D银行为客户提供投资方向和投资方式，由客户自己进行投资和资产管理 </p><p>E分为理财计划和私人银行业务两类</p>,5,ABCE,无,0,0
2,(多选题)一般来说，下列可能会导致房地产价格升高的有()。 ,<p>A土地供给减少 </p><p>B经济衰退 </p><p>C房地产需求下降 </p><p>D房地产周边交通状况大幅改善 </p><p>E居民收入下降</p>,5,AD,B、C、E选项均会导致房地产价格下降。,0,0
2,(多选题)避税规划的主要特征有()。 ,<p>A非违法性 </p><p>B有规则性 </p><p>C经营的调整性 </p><p>D前期规划性 </p><p>E后期无风险性</p>,5,ABD,C、E选项是节税规划的特点。,0,0
2,(多选题)以概率和收益的权衡作为客户风险评估的方法不包括()。 ,<p>A确定/不确定性偏好法 </p><p>B最低成功概率法 </p><p>C最低收益法 </p><p>D最高收益法 </p><p>E预期收益法</p>,5,DE,以概率和收益的权衡作为客户风险评估的方法主要包括确定/不确定性偏好法、最低成功概率法、最低 收益法。,0,0
2,(多选题)依据现行规定，申请保险兼业代理资格应具备的条件有()。 ,<p>A具有工商行政管理机关核发的营业执照 </p><p>B有同经营主业直接相关的一定规模的保险代理业务来源 </p><p>C有固定的营业场所 </p><p>D具有在其营业场所直接代理保险业务的便利条件 </p><p>E具有保险业务2年以上经验</p>,5,ABCD,《保险兼业代理管理暂行办法》第6条规定，申请保险兼业代理资格应具备的条件有：具有工商行政管 理机关核发的营业执照；有同经营主业直接相关的一定规模的保险代理业务来源；有固定的营业场 所；具有在其营业场所直接代理保险业务的便利条件。,0,0
2,(多选题)以下关于股票的表述中正确的有()。 ,<p>A股票的理论价格和市场价格不一定相等 </p><p>B股票投资收益由股息、资本损益和资本增值收益组成 </p><p>C股票价格指数可以反映整个股票市场上各种股票的市场价格总体水平及其变动情况 </p><p>D资本损益的存在是长期投资者选择优质公司股票长期持有的主要投资目的 </p><p>E以股票市场各个股票的市值与股市总市值的比例为标准构造股票投资组合，能够极大地降低非系统性风险</p>,5,ABCE,资本损益是股票买入价与卖出价之间的差额，又称资本利得。长期投资者选择优质公司股票长期持有 的主要投资目的是从企业的增长过程中分享更多的利润，即为了分红。,0,0
2,(多选题)根据《中华人民共和国公司法》的规定，必须经代表2/3以上表决权的股东通过的决议有()。 ,<p>A增加或者减少注册资本 </p><p>B修改公司章程 </p><p>C选举和更换董事长 </p><p>D决定有关董事和监事的报酬 </p><p>E分立、合并、解散</p>,5,ABE,股东会对公司修改章程、增加或者减少注册资本、分立、合并、解散或者变更公司形式的决议，必须 经代表2/3以上表决权的股东通过方可做出。,0,0
2,(多选题)对个人理财业务造成影响的经济环境因素包括()。 ,<p>A货币政策 </p><p>B消费者收入水平 </p><p>C通货膨胀 </p><p>D经济发展阶段 </p><p>E失业保险制度</p>,5,BCD,A项属于政治、法律与政策环境中的国家宏观经济政策因素。E项属于社会环境因素。,0,0
2,(多选题)银行业从业人员应调查了解()，以实现银行风险控制的要求。 ,<p>A客户的财务状况 </p><p>B客户的业务状况、业务单据 </p><p>C客户家庭地址、婚姻状况 </p><p>D客户风险承受能力 </p><p>E客户隐私、不愿被人知的秘密</p>,5,ABD,C、E不属于应了解的客户情况，而是客户隐私。,0,0
2,(多选题)基金份额持有人享有的权利包括()。 ,<p>A分享基金财产收益 </p><p>B参与分配清算后的剩余基金财产 </p><p>C依法转让或者申请赎回其持有的基金份额 </p><p>D对基金份额持有人大会审议事项行使表决权 </p><p>E查阅或者复制基金公司的内部基金信息资料</p>,5,ABCD,基金份额持有人享有的权利包括分享基金财产收益、参与分配清算后的剩余基金财产、依法转让或者 申请赎回其持有的基金份额、对基金份额持有人大会审议事项行使表决权、查阅或者复制公开披露的 基金信息资料。【专家点拨】《证券投资基金法》第47条规定，基金份额持有人享有下列权利：①分 享基金财产收益；②参与分配清算后的剩余基金财产；③依法转让或者申请赎回其持有的基金份额； ④按照规定要求召开基金份额持有人大会或者召集基金份额持有人大会；⑤对基金份额持有人大会审 议事项行使表决权；⑥对基金管理人、基金托管人、基金服务机构损害其合法权益的行为依法提起诉 讼；⑦基金合同约定的其他权利。公开募集基金的基金份额持有人有权查阅或者复制公开披露的基金 信息资料；非公开募集基金的基金份额持有人对涉及自身利益的情况，有权查阅基金的财务会计账簿 等财务资料。,0,0
2,(多选题)基金管理人、代销机构在基金销售活动中，不正确的做法有()。 ,<p>A附送实物 </p><p>B抽奖销售 </p><p>C以低于成本价销售 </p><p>D认购费打折 </p><p>E附送基金份额</p>,5,ABCDE,以上选项均属于基金销售的禁止性行为。【专家点拨】《证券投资基金销售管理办法》第82条规定， 基金销售机构从事基金销售活动，不得有下列情形：①以排挤竞争对手为目的，压低基金的收费水 平；②采取抽奖、回扣或者送实物、保险、基金份额等方式销售基金；③以低于成本的销售费用销售 基金；④承诺利用基金资产进行利益输送；⑤进行预约认购或者预约申购（基金定期定额投资业务除 外），未按规定公告擅自变更基金的发售日期；⑥挪用基金销售结算资金；⑦本办法第35条规定的情 形；⑧中国证监会规定禁止的其他情形。,0,0
2,(多选题)最基本的金融互换不包括()。 ,<p>A利率互换 </p><p>B货币互换 </p><p>C远期互换 </p><p>D期货互换 </p><p>E期权互换</p>,5,CDE,最基本的金融互换品种是指货币互换和利率互换。,0,0
2,(多选题)以下属于合同订立的书面形式的有()。 ,<p>A合同书 </p><p>B信件 </p><p>C电报 </p><p>D传真 </p><p>E电子邮件</p>,5,ABCDE,以上选项都属于合同订立的书面形式。【专家点拨】书面形式是指合同书、信件和数据电文（包括电 报、电传、传真、电子数据交换和电子邮件）等可以有形地表现所载内容的形式。,0,0
2,(多选题)理财策略在()情形下应增加股票配置。 ,<p>A预期未来利率水平上升 </p><p>B预期未来利率水平下降 </p><p>C预期未来本币贬值 </p><p>D预期未来通货紧缩 </p><p>E预期未来经济增长较快</p>,5,BE,理财策略在预期未来利率水平下降和预期未来经济增长较快的情形下应增加股票配置。,0,0
3,(判断题)根据投资品的具体形态，可以把投资分为实物投资和金融投资。(),<p>A正确</p><p>B错误</p>,2,A,无,0,0
3,(判断题)根据生命周期理论，30岁的投资人应该采取稳健的理财策略。(),<p>A正确</p><p>B错误</p>,2,B,30岁的投资人属于青年成长期，应当采取积极的理财策略。,0,0
3,(判断题)外汇理财产品只面临标的投资风险，不存在汇率换算风险。,<p>A正确</p><p>B错误</p>,2,B,对于外汇理财产品需要面对的风险包括：投资本金风险、投资收益风险、汇率风险、流动性风险。,0,0
3,(判断题)对于商业银行违反个人理财业务投资管理相关规定的，监管部门将依据《银监法》的有关规定，追究发 售银行高级管理层、理财业务管理部门及相关风险管理部门、内部审计部门负责人的相关责任，暂停该 机构发售新的理财产品。(),<p>A正确</p><p>B错误</p>,2,A,无,0,0
3,(判断题)客户根据商业银行和理财人员提供的理财顾问服务来管理和运用资金，并自行承担由此产生的收益和风 险。(),<p>A正确</p><p>B错误</p>,2,A,在商业银行理财顾问服务中，客户根据商业银行和理财人员提供的理财顾问服务自行管理和运用资 金，并承担由此产生的收益和风险。,0,0
3,(判断题)客户用信用卡进行透支消费，由于没有付现金，因此增加了客户的净资产；如果用现金消费，则减少了 净资产。(),<p>A正确</p><p>B错误</p>,2,B,净资产是指个人资产扣除个人负债后的剩余部分，无论是进行现金消费还是透支消费都减少了净资 产。,0,0
3,(判断题)个人理财主要考虑的是资产的增值，因此，个人理财就是如何进行投资。(),<p>A正确</p><p>B错误</p>,2,B,个人理财是指客户根据自身生涯规划、财务状况和风险属性，制定理财目标和理财规划，执行理财规 划，实现理财目标的过程。因此，个人理财不能仅仅考虑资产增值，还要考虑其他因素，例如规避风 险，不仅仅是投资。,0,0
3,(判断题)在信托产品中，信托资产管理人的信誉状况和投资运作水平对资产收益具有决定性的影响。(),<p>A正确</p><p>B错误</p>,2,A,信托资产管理人的信誉状况和投资运作水平对资产收益有决定性影响。一般来说.拥有一批精通投资管 理业务、经验丰富的理财专业人士的信托机构，利用专业知识和特有的信息优势，将使信托产品获得 更大的收益。,0,0
3,(判断题)代理人须以代理人自身的名义进行代理行为。(),<p>A正确</p><p>B错误</p>,2,B,代理人在代理权限之内，可以以被代理人的名义实施民事法律行为。,0,0
3,(判断题)同一只股票，其风险是客观的，但是有的人买，有的人卖，这可能是因为买者和卖者的风险认知度有差 异。(),<p>A正确</p><p>B错误</p>,2,A,说法正确，故选A。,0,0
3,(判断题)结构性理财产品的流动性相对银行货币型理财产品较低。(),<p>A正确</p><p>B错误</p>,2,A,结构性理财产品的流动性相对银行货币型理财产品较低。,0,0
3,(判断题)投资者教育对象是广大理财服务对象，即银行个人理财客户。(),<p>A正确</p><p>B错误</p>,2,B,投资者教育对象是广大理财服务对象，包括银行个人理财客户以及潜在银行个人理财客户。,0,0
3,(判断题)商业银行理财产品的委托金额递增单位一定小于委托起始金额。(),<p>A正确</p><p>B错误</p>,2,B,一般来说，商业银行理财产品规定的递增金额会小于起点金额，但也有部分理财产品计划规定投资者 需以起点金额的整数倍购买产品，这等于使递增金额与起点金额相等。,0,0
3,(判断题)某商业银行大厅中有专人负责向前来储蓄的客户介绍不同种储蓄产品的区别，这属于理财顾问服务。(),<p>A正确</p><p>B错误</p>,2,B,理财顾问服务是指商业银行向客户提供的财务分析与规划、投资建议、个人投资产品推介等专业化的 服务。商业银行为销售储蓄存款产品、信贷产品等进行的产品介绍、宣传和推介等一般性业务咨询活 动，不属于理财顾问服务。,0,0
3,(判断题)商业银行对信用风险限额的管理，应当包括结算前信用风险限额和结算信用风险限额。(),<p>A正确</p><p>B错误</p>,2,A,商业银行对信用风险限额的管理，应当包括结算前信用风险限额和结算信用风险限额。,0,0
