1,(单选题)2003年12月27日修订后的《中国人民银行法》规定了中国人民银行的职能，下列不属于中国人民银行职能的是()。,<p>A制定和执行货币政策</p><p>B管理中央公共财政支出</p><p>C防范和化解金融风险</p><p>D维护金融稳定</p>,4,B,2003年12月27日修订后的《中国人民银行法》第2条规定了中国人民银行的职能：“中国人民银行在国务院领导下，制定和执行货币政策，防范和化解金融风险，维护金融稳定。”B选项中，管理中央公共财政支出是财政部的职能。,0,0
1,(单选题)银监会监管的职责不包括()。,<p>A监督管理银行间债券市场、外汇市场</p><p>B发行人民币，管理人民币流通</p><p>C开展与银行监督管理有关的国际交流、合作活动</p><p>D依照法律、行政法规制定银行业金融机构的审慎经营规则</p>,4,B,根据《银行业监督管理法》的规定和国务院关于金融监管的分工，银监会监管的具体职责有17种，其中包括A、C、D三项。B选项属于中国人民银行的职责。,0,0
1,(单选题)()是中国银行业协会的最高权力机构的执行机构。,<p>A会员大会</p><p>B理事会</p><p>C常务理事会</p><p>D专业委员会</p>,4,B,中国银行业协会的最高权力机构为会员大会，由参加协会的全体会员单位组成。会员大会的执行机构为理事会，对会员大会负责。,0,0
1,(单选题)2006年4月26日，()开业，成为城市商业银行第一家跨省区设立的分支机构。,<p>A上海银行宁波分行</p><p>B北京银行天津分行</p><p>C徽商银行</p><p>D江苏银行</p>,4,A,2006年4月26日，上海银行宁波分行开业，成为城市商业银行第一家跨省区设立的分支机构。,0,0
1,(单选题)()方式是指监管人员到商业银行约见高级管理人员，要求其就业务活动和风险管理重大事项进行说明。,<p>A市场准入</p><p>B监管谈话</p><p>C非现场监管</p><p>D现场监管</p>,4,B,银监会的监管措施包括市场准入、现场检查、非现场监管、监管谈话、信息披露监管。题十所述为监管谈话方式。,0,0
1,(单选题)下列不属于外汇管理内容的是()。,<p>A外汇汇率</p><p>B国际间结算</p><p>C外汇的借贷、转移</p><p>D反洗钱</p>,4,D,外汇管理，是指一国政府授权国家货币金融管理当局或其他国家机关，对外汇收支、买卖、借贷、转移以及国际间的结算、外汇汇率和外汇市场等实行的管理措施。D选项反洗钱属于中央银行的监管职责。,0,0
1,(单选题)下列不属于外资银行营业性机构的是()。,<p>A外国银行分行</p><p>B中外合资银行</p><p>C外商独资银行</p><p>D外国银行代表处</p>,4,D,外资银行是指依照中华人民共和国有关法律、法规，经批准在中华人民共和国境内建立的下列机构：一家外国银行单独出资或者一家外国银行与其他外国金融机构共同出资设立的外商独资银行；外国金融机构与中国的公司、企业共同出资设立的中外合资银行；外国银行分行；外国银行代表处。其中，外商独资银行、中外合资银行和外国银行分行统称为外资银行营业性机构。,0,0
1,(单选题)国内商业银行资产托管业务不包括()。,<p>A企业年金基金托管</p><p>B券商资产管理计划资产托管</p><p>C社保基金托管</p><p>D股票资产托管</p>,4,D,国内商业银行资产托管业务品种主要包括证券投资基金托管、保险资产托管、社保基金托管、企业年金基金托管、券商资产管理计划资产托管、信托资产托管、商业银行人民币理财产品托管、QFII（合格境外机构投资者）资产托管、QDII（合格境内机构投资者）资产托管等。,0,0
1,(单选题)在一国经济过度繁荣时，最有可能采取以下()政策。,<p>A扩张性财政政策，抑制通货膨胀</p><p>B紧缩性财政政策，抑制通货膨胀</p><p>C扩张性财政政策，防止通货紧缩</p><p>D紧缩性财政政策，防止通货紧缩</p>,4,B,当经济过度繁荣时，社会总需求膨胀，要抑制需求，应采取紧缩性财政政策，抑制通货膨胀。,0,0
1,(单选题)下列关于宏观经济发展目标及对应的衡量指标不正确的是()。,<p>A经济增长国民生产总值</p><p>B充分就业失业率</p><p>C物价稳定通货膨胀率</p><p>D国际收支平衡国际收支</p>,4,A,宏观经济发展的总体目标一般包括四个，即经济增长、充分就业、物价稳定和国际收支平衡。这四大目标分别通过实际国内生产总值增长率、失业率、通货膨胀率和国际收支指标来衡量。,0,0
1,(单选题)金融市场最主要、最基本的功能是()。,<p>A优化资源配置功能</p><p>B货币资金融通功能</p><p>C风险分散与风险管理功能</p><p>D经济调节功能</p>,4,B,金融市场是金融工具交易的场所，具有货币资金融通功能、优化资源配置功能、风险分散与风险管理功能、经济调节功能和定价功能。其中，融通货币资金是金融市场最主要、最基本的功能。,0,0
1,(单选题)从支出的角度来看，私人购买住房的支出包含在()之中。,<p>A私人消费</p><p>B政府消费</p><p>C固定资本形成</p><p>D存货增加</p>,4,C,从支出角度来看，GDP由消费、投资、净出口和政府购买支出四大部分构成。其中，消费包括私人消费和政府消费两部分；投资也称资本形成，包括固定资本形成（其中含房地产和非房地产投资）和存货增加两部分。私人购买住房支出属于房地产投资，包含在投资的固定资本形成之中，不包含在私人消费之中。,0,0
1,(单选题)我国货币市场不包括()。,<p>A银行业同业拆借市场</p><p>B银行间债券回购市场</p><p>C银行间债券市场</p><p>D票据市场</p>,4,C,我国货币市场主要包括银行间同业拆借市场、银行间债券回购市场和票据市场。,0,0
1,(单选题)直接融资工具不包括()。,<p>A股票</p><p>B可转让大额存单</p><p>C政府债券</p><p>D商业票据</p>,4,B,按融资方式划分，金融工具可分为直接融资工具和间接融资工具。直接融资工具包括政府、企业发行的国库券、企业债券、商业票据、公司股票等。间接融资工具包括银行债券、银行承兑汇票、可转让大额存单、人寿保险单等。,0,0
1,(单选题)下列资产中，流动性最强的是()。,<p>A普通股票</p><p>B金融债券</p><p>C企业债券</p><p>D中央银行票据</p>,4,D,中央银行票据简称央行票据或央票，是指中国人民银行面向全国银行间债券市场成员发行的、期限一般在3年以内的中短期债券。这种票据具有无风险、期限短、流动性高的特点。中央银行票据的流动性要高于一般的金融债券、企业债券和普通股票。,0,0
1,(单选题)银行外汇牌价表中的现钞买入价是指()。,<p>A中国人民银行公布的当日外汇牌价</p><p>B银行买入外汇的价格</p><p>C居民个人到银行换取外汇的价格</p><p>D银行买入外币现钞的价格</p>,4,D,银行外汇牌价表中的现汇买入价/现钞买入价/现汇卖出价/现钞卖出价都是以银行为主体的表示方法。其中，现钞买入价是指银行买人外币现钞的价格。,0,0
1,(单选题)()是银行对个人客户发放的可在一定期限和额度内随时支用的人民币贷款。,<p>A个人消费额度贷款</p><p>B个人权利质押贷款</p><p>C个人经营类贷款</p><p>D个人住房最高额贷款</p>,4,A,本题是对个人消费额度贷款定义的考查。个人消费额度贷款是银行对个人客户发放的可在一定期限和额度内随时支用的人民币贷款。,0,0
1,(单选题)在个人消费额度贷款时，质押额度一般不超过借款人提供的质押权利凭证票面价值的()。,<p>A0.3</p><p>B0.5</p><p>C0.9</p><p>D1</p>,4,C,在个人消费额度贷款时，借款人提供银行认可的质押、抵押、第三方保证或具有一定信用资格后，银行核定借款人相应的质押额度、抵押额度、保证额度或信用额度。质押额度一般不超过借款人提供的质押权利凭证票面价值的90%；抵押额度一般不超过抵押物评估价值的70%；保证额度和信用额度根据借款人的信用等级确定。,0,0
1,(单选题)下列选项中，()不属于融资类保函。,<p>A融资租赁保函</p><p>B经营租赁保函</p><p>C授信额度保函</p><p>D延期付款保函</p>,4,B,银行保函根据担保银行承担风险的不同及管理的需要，可以分为融资类保函和非融资类保函两大类。融资类保函包括：借款保函、授信额度保函、有价证券保付保函、融资租赁保函、延期付款保函。【专家点拨】非融资类保函是指为保函申请人的非融资行为承担担保责任的保函。主要包括：投标保函、履约保函、预付款保函、海事保函、即期付款保函、关税保付保函、诉讼保函等。,0,0
1,(单选题)王某在2011年9月1日存入一笔100000元1年期整存整取定期存款，假设年利率为2.00%，1年后存款到期时，他从银行取回的全部金额是()元。,<p>A120000</p><p>B102000</p><p>C2000</p><p>D124000</p>,4,B,一年后存款到期时，王某从银行取回的全部金额为：100000+100000*1*2.00%=102000（元）。,0,0
1,(单选题)持有期收益率的计算公式为()。,<p>A持有期收益率=（购买价格-出售价格+利息）/购买价格*100%</p><p>B持有期收益率=（出售价格-购买价格+持有期利息）/购买价格*100%</p><p>C持有期收益率=（出售价格-购买价格+利息）/出售价格*100%</p><p>D持有期收益率=（购买价格-出售价格+利息）/出售价格*100%</p>,4,B,持有期收益率，是债券买卖价格差价加上利息收入后与购买价格之间的比率，其计算公式是：持有期收益率=（购买价格-出售价格+持有期利息）/购买价格*100%。,0,0
1,(单选题)下列选项中，()属于商业银行非营利性资产。,<p>A短期贷款</p><p>B银团贷款</p><p>C债券投资</p><p>D库存现金</p>,4,D,库存现金是指商业银行保存在金库中的现钞和硬币。库存现金的主要作用是银行用来应付客户提现和银行本身的日常零星开支。因此，库存现金属于商业银行非营利性资产。,0,0
1,(单选题)既可以转账也可以提取现金的银行票据是()。,<p>A现金支票</p><p>B转账支票</p><p>C普通支票</p><p>D划线支票</p>,4,C,支票是出票人签发的，委托出票人支票账户所在的银行在见票时无条件支付确定的金额给收款人或持票人的票据，可用于单位和个人的各种款项结算。分为现金支票、转账支票、普通支票等。其中，普通支票可以支取现金，也可以转账。【专家点拨】现金支票用于支取现金，它可以由存款人签发用于到银行为本单位提取现金，也可以签发给其他单位和个人用来办理结算或者委托银行代为支付现金给收款人。当客户不用现金支付收款人的款项时，可签发转账支票，自己到开户银行或将转账支票交给收款人到开户银行办理支付款项手续。转账支票只能用于转账，不能用于提取现金。划线支票，是在支票正面划两道平行线的支票。划线支票与一般支票不同。一般支票可委托银行收款入账。而划线支票只能委托银行代收票款入账。使用划线支票的目的是为了在支票遗失，被人冒领时，还可能通过银行代收的线索追回票款。划线支票只能用于转账不能支取现金。,0,0
1,(单选题)下列关于我国金融债券的说法，不正确的是()。,<p>A金融债券是在银行间市场上发行的</p><p>B金融机构发行金融债券必须获得银监会的行政许可</p><p>C银行可以通过发行金融债券获得资金</p><p>D金融债券可以成为银行主动负债的工具</p>,4,B,金融机构在银行间市场发行金融债券必须获得中国人民银行的行政许可，但申请行政许可前必须首先获得其监管机构的同意。,0,0
1,(单选题)下列关于教育储蓄存款的说法，正确的是()。,<p>A利率优惠，按同期限档次的零存整取定期储蓄存款利率计息</p><p>B存期灵活，最长存期为6年</p><p>C总额控制，本金合计最高限额为5万元</p><p>D分次存入，分次支取</p>,4,B,A选项应为1年期、3年期教育储蓄按开户日同期同档次整存整取定期储蓄存款利率计息；C选项应为本金合计最高限额为两万元；D选项应为父母为了子女接受非义务教育而存钱，分次存入，到期一次支取本金和利息。,0,0
1,(单选题)由法律规定而直接产生的代理关系是()。,<p>A表见代理</p><p>B法定代理</p><p>C委托代理</p><p>D指定代理</p>,4,B,法定代理是根据法律的规定而直接产生的代理关系。,0,0
1,(单选题)银行应申请人的要求，向受益人作出的书面付款保证承诺，受益人提交条款相符的书面索赔后，银行将履行担保支付或赔偿责任的是()。,<p>A银行保理</p><p>B银行保函</p><p>C备用信用证</p><p>D进口押汇</p>,4,B,本题是对银行保函定义的考查。银行保函是指银行应申请人的要求，向受益人作出的书面付款保证承诺，银行将凭受益人提交的与保函条款相符的书面索赔履行担保支付或赔偿责任。,0,0
1,(单选题)目前，我国银行存款中，采取复利计算利息的是()。,<p>A1年期的定期存款</p><p>B5年期的定期存款</p><p>C个人活期存款</p><p>D4年期教育储蓄存款</p>,4,C,目前，我国银行存款中，除活期存款在每季结息日时将利息计入本金作为下季的本金计算复利外，其他存款不论存期多长，一律不计复利。,0,0
1,(单选题)()是指由银行签发，承诺自己在见票时无条件支付确定金额给收款人或者持票人的票据。,<p>A商业承兑汇票</p><p>B银行本票</p><p>C支票</p><p>D银行承兑汇票</p>,4,B,本题是对银行本票定义的考查。银行本票是银行签发的，承诺在见票时无条件支付确定金额给收款人或者持票人的票据。用于单位和个人在同一交换区域支付各种款项。,0,0
1,(单选题)下列属于核心一级资本的是()。,<p>A经济资本或普通股</p><p>B实收资本或普通股</p><p>C监管资本或普通股</p><p>D优先股及其溢价</p>,4,B,核心一级资本，是指在银行持续经营条件下无条件用来吸收损失的资本工具，具有永久性、清偿顺序排在所有其他融资工具之后的特征。核心一级资本包括：实收资本或普通股、资本公积可计入部分、盈余公积、一般风险准备、未分配利润、少数股东资本可计入部分。,0,0
1,(单选题)()是指由债务人或交易对手未能履行合同所规定的义务从而给银行带来损失的可能性。,<p>A市场风险</p><p>B信用风险</p><p>C声誉风险</p><p>D操作风险</p>,4,B,本题是对信用风险定义的考查。信用风险是指债务人或交易对手未能履行合同所规定的义务或信用质量发生变化，从而给银行带来损失的可能性。【专家点拨】市场风险指因股市价格、利率、汇率等的变动而导致价值未预料到的潜在损失的风险。因此，市场风险包括权益风险、汇率风险、利率风险以及商品价格风险。声誉风险是指由商业银行经营、管理及其他行为或外部事件导致利益相关方对商业银行负面评价的风险。操作风险是遭受潜在损失的可能，是指由于客户、设计不当的控制体系、控制系统失灵以及不可控事件导致的各类风险。,0,0
1,(单选题)20世纪80年代之后，随着银行业竞争的加剧、存贷利差的变窄、金融衍生工具的广泛使用，银行业进人了()阶段。,<p>A资产风险管理</p><p>B负债风险管理</p><p>C资产负债风险管理</p><p>D全面风险管理</p>,4,D,20世纪80年代之后，随着银行业竞争的加剧、存贷利差的变窄、金融衍生工具的广泛使用，银行开始发现自己可以从事更多的风险中介工作，从此进入了全面风险管理阶段。,0,0
1,(单选题)在20世纪60年代之前，商业银行的风险管理强调()。,<p>A资产的高收益</p><p>B保持资产的流动性</p><p>C资产的低风险</p><p>D贷款的产业方向</p>,4,B,在20世纪60年代之前，商业银行的风险管理处于资产管理阶段，强调保持资产的流动性。,0,0
1,(单选题)商业银行若未行使混合资本债券的赎回权，在债券距到期日前最后_______年，其可计人附属资本的数量每年累计折扣_______。(),<p>A1；5%</p><p>B2；10%</p><p>C5；20%</p><p>D5；10%</p>,4,C,商业银行发行的混合资本债券，要计入附属资本，需要满足三个条件，其中之一是商业银行若未行使混合资本债券的赎回权，在债券距到期日前最后5年，其可计人附属资本的数量每年累计折扣20%。,0,0
1,(单选题)根据规定，商业银行监事会中外部监事的人数不得少于()名。,<p>A2</p><p>B3</p><p>C4</p><p>D5</p>,4,A,监事会由职工代表出任的监事、股东大会选举的外部监事和其他监事组成，其中外部监事的人数不得少于两名。,0,0
1,(单选题)我国正式启动实施《巴塞尔新资本协议》工程的时间是()。,<p>A2006年2月28日</p><p>B2007年2月28日</p><p>C2006年8月28日</p><p>D2007年8月28日</p>,4,B,2007年2月28日，我国正式启动实施《巴塞尔新资本协议》的工程。【专家点拨】2007年2月28日，中国银监会发布了《中国银行业实施新资本协议指导意见》，标志着我国正式启动了实施《巴塞尔新资本协议》的工程。按照我国商业银行的发展水平和外部环境，短期内我国银行业尚不具备全面实施《巴塞尔新资本协议》的条件。因此，中国银监会确立了分类实施、分层推进、分步达标的基本原则。,0,0
1,(单选题)商业银行的附属资本不包括()。,<p>A未分配利润</p><p>B优先股</p><p>C可转债</p><p>D混合资本债券</p>,4,A,未分配利润属于商业银行的核心资本。,0,0
1,(单选题)利率变化引起的风险属于()。,<p>A市场风险</p><p>B信用风险</p><p>C流动性风险</p><p>D操作风险</p>,4,A,市场风险是指因市场价格（包括利率、汇率、股票价格和商品价格）的不利变动而使银行表内和表外业务发生损失的风险。市场风险包括利率风险、汇率风险、股票价格风险和商品价格风险四大类。,0,0
1,(单选题)按照《巴塞尔新资本协议》规定，若某银行风险加权资产为20000亿元，则其核心资本不得()亿元。,<p>A高于800</p><p>B低于800</p><p>C高于1600</p><p>D低于1600</p>,4,B,根据《巴塞尔新资本协议》规定，银行的资本与风险加权总资产之比不得低于8%，其中核心资本与风险加权总资产之比不得低于4%。题中风险加权总资产为20000亿元，则核心资本不得低于20000*4%=800（亿元）。,0,0
1,(单选题)对涉嫌转移或者隐匿违法资金的银行业金融机构及其工作人员以及关联行为人的账户，经()批准，可以申请司法机关予以冻结。,<p>A中国人民银行</p><p>B地方政府</p><p>C纪检部门</p><p>D银行业监督管理机构负责人</p>,4,D,对涉嫌转移或者隐匿违法资金的银行业金融机构及其工作人员以及关联行为人的账户，经银行业监督管理机构负责人批准，可以申请司法机关予以冻结。,0,0
1,(单选题)根据规定，中国人民银行根据执行货币政策和维护金融稳定的需要，可以建议国务院银行业监督管理机构对银行业金融机构进行检查监督，国务院银行业监督管理机构应当自收到建议之日起()日内予以回复。,<p>A60</p><p>B50</p><p>C30</p><p>D7</p>,4,C,中国人民银行根据执行货币政策和维护金融稳定的需要，可以建议国务院银行业监督管理机构对银行业金融机构进行检查监督.国务院银行业监督管理机构应当自收到建议之日起30日内予以回复。,0,0
1,(单选题)下列不属于银行信用风险的是()。,<p>A借款人的信用评级从AA级降为A级</p><p>B债务人因经济危机陷入经营困难</p><p>C信贷调查人员在调查过程中接受贿赂协助骗贷</p><p>D即期外汇交易中，交易对手未能在第二个交易日按期交割</p>,4,C,信用风险又称为违约风险，是指债务人、或交易对手未能履行合同所规定的义务或信用质量发生变化，从而给银行带来损失的可能性。C选项属于操作风险。,0,0
1,(单选题)()是指商业银行根据全部贷款余额按一定比例计提，用于弥补尚未识别的可能性损失的准备。,<p>A一般准备</p><p>B专项准备</p><p>C特别准备</p><p>D重估准备</p>,4,A,本题是对一般准备定义的考查。一般准备是指根据全部贷款余额一定比例计提的，用于弥补尚未识别的可能性损失的准备。,0,0
1,(单选题)银监会对金融机构高级管理人员的任职资格进行审查核准属于监管措施中的()。,<p>A市场准入</p><p>B非现场监管</p><p>C监管谈话</p><p>D信息披露监管</p>,4,A,银监会对银行业的监管措施包括市场准入、非现场监管、现场检查、监管谈话和信息披露监管。其中，银行业金融机构的市场准入主要包括三个方面：机构、业务和高级管理人员的准人。高级管理人员准入是指对金融机构董事及高级管理人员的任职资格进行审查核准。,0,0
1,(单选题)下列关于信用风险的说法，正确的是()。,<p>A信用风险只存在乎银行的表内业务</p><p>B对商业银行来说，贷款是唯一的信用风险来源</p><p>C信用风险是银行面临的最复杂和最主要的风险</p><p>D场外衍生品交易中不存在信用风险</p>,4,C,信用风险既存在于银行的表内业务，也存在于银行的表外业务。对于商业银行来说，贷款不是信用风险的唯一来源。场外衍生品交易中也存在信用风险。,0,0
1,(单选题)在商业银行已经或者可能发生信用危机，严重影响存款人的利益时，国务院银行业监督管理机构可以对该银行实行接管，接管期限最长不得超过()年。,<p>A5</p><p>B3</p><p>C2</p><p>D1</p>,4,C,根据《商业银行法》第64条规定：“商业银行已经或者可能发生信用危机，严重影响存款人的利益时.国务院银行业监督管理机构可以对该银行实行接管。接管期限最长不得超过2年。”,0,0
1,(单选题)根据有关规定，客户身份资料在业务关系结束后、客户交易信息在交易结束后，金融机构应当()。,<p>A至少保存5年</p><p>B至少保存10年</p><p>C立即销毁</p><p>D退还给客户</p>,4,A,根据《反洗钱法》第19条规定，客户身份资料在业务关系结束后、客户交易信息在交易结束后，金融机构应当至少保存五年。,0,0
1,(单选题)在资产负债比例管理中，贷款余额与存款余额的比例不得超过()。,<p>A0.75</p><p>B0.5</p><p>C0.25</p><p>D0.1</p>,4,A,商业银行贷款，应当遵守下列资产负债比例管理的规定：(1)资本充足率不得低于8%；(2)贷款余额与存款余额的比例不得超过75%；(3)流动性资产余额与流动性负债余额的比例不得低于25%；(4)对同一借款人的贷款余额与商业银行资本余额的比例不得超过10%；(5)国务院银行业监督管理机构对资产负债比例管理的其他规定。,0,0
1,(单选题)实践中，()是商业银行最常见的利率违法行为。,<p>A以低于法定基准利率发放贷款</p><p>B以高于法定基准利率吸收存款</p><p>C以高于法定基准利率发放贷款</p><p>D以低于法定基准利率吸收存款</p>,4,B,金融机构的下列行为属于利率违规行为：(1)擅自提高或降低存、贷款利率的；(2)变相提高或降低存、贷款利率的；(3)擅自或变相以高利率发行债券的；(4)其他违反《人民币利率管理规定》和国家利率政策的。实践中，最常见的利率违法行为是银行高于法定基准利率吸收存款的行为。,0,0
1,(单选题)下列关于司法机关到银行查询单位存款的表述中，正确的是()。,<p>A允许复制抄写资料</p><p>B允许借取资料</p><p>C凭县级以上人民政府签发的“协查通知”</p><p>D凭身份证查询</p>,4,A,司法机关到银行查询单位存款时，查询人必须出示本人工作证或执行公务证和出具县级（含）以上人民法院、人民检察院、公安局签发的“协助查询存款通知书”，由银行行长或其他负责人签字后并指定银行有关业务部门凭此提供情况和资料，并派专人接待。查询人不得借走原件，需要的资料可以抄录、复制或照相，并经银行盖章。,0,0
1,(单选题)冻结单位存款的，其冻结期限不得超过()。,<p>A7天</p><p>B1个月</p><p>C3个月</p><p>D6个月</p>,4,D,人民法院、人民检察院、公安机关冻结单位存款的期限不超过6个月。如有特殊原因需要延长的，人民法院、人民检察院、公安机关应当在冻结期满前办理继续冻结手续，每次继续冻结期限最长不超过6个月。逾期不办理继续冻结手续的视为自动撤销冻结。,0,0
