1,(单选题)许多国家把调高或降低（）作为紧缩或扩张信用的一个重要手段。,<p>A现金漏损率</p><p>B法定存款准备金率</p><p>C超额准备金率</p><p>D定期存款准备金率</p>,4,B,许多国家把调高或降低法定存款准备金率作为紧缩或扩张信用的一个重要手段。,0,0
1,(单选题)以下不属于附加刑的是（）。,<p>A罚金</p><p>B拘役</p><p>C没收财产</p><p>D剥夺政治权利</p>,4,B,B项属于主刑的内客。,0,0
1,(单选题)以下不属于收益率曲线的作用的是（）。,<p>A计算相似期限不同债券的相对价值</p><p>B用于债券市场工具的定价</p><p>C反映远期收益率水平的指标</p><p>D用于计算和比较各种期限安排的收益</p>,4,B,收益率曲线主要具有五方面的用途：（1)用于设定所有债务市场工具的收益率（2)用于远期收益率水平的指标（3)用于计算和比较各种期限安排的收益（4)用于计算相似期限不同债券的相对价值（5)用于利率衍生工具的定价。,0,0
1,(单选题)以下不属于银行经营管理评价的基本指标是（）。,<p>A规模指标</p><p>B效率指标</p><p>C流动性指标</p><p>D风险程度指标</p>,4,D,D选项不属于银行管理的基本指标。,0,0
1,(单选题)以下关于货款公司的说法正确的是（）。,<p>A单一集团企业客户的授信余额不得超过资本金额的10%</p><p>B贷款公司对同一借款人的货款余额不得超过资本净额的15%</p><p>C货款公司的营运资金来源包括实收资本、向投资人的借款、向其他金融机构融资但融资资金余额不得超过其资本净额的50%</p><p>D2008年9月，银监会发布并实施了《货款公司管理规定》</p>,4,C,单一集团企业客户的授信余额不得超过资本金额的15%，贷款公司对同一借款人的贷款余额不得超过资本净额10%，2009年8月银监会发布并实施了《贷款公司管理规定》。（本题来自嗨考网）,0,0
1,(单选题)以下关于市盈率说法不正确的是（）。,<p>A在股价一定时，每股收益水平越高，市盈率水平越低，则股票风险越小，反之则风险越高</p><p>B市盈率也被称为股价收益比率，是衡量股票投资价值的重要指标</p><p>C若每股收益取的是已公布的上年数据，则计算结果为静态市盈率，若是按照今年及未来每股收益的预测值，则得到动态市盈率</p><p>D在计算市盈率时，股价通常取的是最新的结算价</p>,4,D,D选项不正确，在计算市盈率时，股价通常取的是最新的收盘价。,0,0
1,(单选题)以下哪一项不是代理的法律待征（）。,<p>A代理行为是指能够引起民事法律后的民事法律行为</p><p>B代理人一般应以被代理人的名义从事代理活动</p><p>C代理人在代理权限范围内独立意思表示</p><p>D代理行为的法律后果直接归属代理人</p>,4,D,代理行为的法律后果直接归属被代理人。,0,0
1,(单选题)以下选项中关于货款业务流程中合同签订说法错误的是（）。,<p>A合同签订强调协议承诺原则</p><p>B借款合同应明确借贷双方的权利和义务</p><p>C借款合同应包括金额、期限、利率等要素和有关细节</p><p>D对于保证担保货款，银行还需签订抵质押担保合同</p>,4,D,"对于保证担保贷款,银行还需与担保人签订书面担保合同;对于抵制担保贷款，银行还需签订抵质押保合同，并办理登记等相关法律。",0,0
1,(单选题)银行面临的主要市场风险是（）。,<p>A汇率风险</p><p>B利率风险</p><p>C商品价格风险</p><p>D股票价格风险</p>,4,B,利率风险是银行面临的主要市场风险,0,0
1,(单选题)银行属于我国的第（）产业。,<p>A第一产业</p><p>B第二产业</p><p>C第三产业</p><p>D综合产业</p>,4,C,第一产业是指农、林、牧、渔业；第二产业是指采矿业、制造业、电力、燃气及水的生产及供应业、建筑业；第三产业是指除第一产业、第二产业以外的其他行业，具体包括：交通运输、仓储和邮政业，信息传输、计算机服务和软件业，批发和零售业，住宿和餐饮业，金融业和房地产业，租赁和商务服务业，科学研究、技术服务和地地质勘察业，水利、环境和公共设施管理业，居民服务和其他服务业，教育、卫生、社会保障和社会福利业，文化、体育和娱乐业，公共管理和社会组织、国际组织。,0,0
1,(单选题)银行业从业人员对同级别同事违反内部规章制度的行为进行监督，不宜采取的方式是（）。,"<p>A不能制止的,及时向所在机构报告</p><p>B进行提示</p><p>C不予以提示,直接报告司法机关</p><p>D及时制止</p>",4,C,对于同事非敌意的违反规章行为要及时地进行善意的提示，对违规行为要及时制止，不能制止的，要及时向所在机构、银行业协会、监管者及公检法等部门报告。,0,0
1,(单选题)银行因设立有效的内部控制和风险管理部门（包括首席风险官或类似职位)，并确保其获得从分的授权、地位、独立性、资源保障和向（）报告的路径。,<p>A股东会</p><p>B监事会</p><p>C董事会</p><p>D高级管理层</p>,4,C,银行因设立有效的内部控制和风险管理部门（包括首席风险官或类似职位)，并确保其获得从分的授权、地位、独立性、资源保障和向董事会报告的路径。,0,0
1,(单选题)影响银行价值的主要变量是（）。,<p>A净现金流量</p><p>B获取现金流量的时间</p><p>C与现金流量相关的风险</p><p>D净利息收益率</p>,4,A,影响银行价值的主要变量是净现金流量。,0,0
1,(单选题)有固定的存续期限且在产品到期前客户不能进行申购赎回的净值型产品是（）。,<p>A封闭式净值型产品</p><p>B开放式非净值型产品</p><p>C开放式净值型产品</p><p>D封闭式非净值型产品</p>,4,A,封闭式净值型产品是指有固定的存续期限且在产品到期前客户不能进行申购赎回的净值型产品。（本题来自嗨考网）,0,0
1,(单选题)在产品到期日对本金和收益一次性核算兑付的是（）。,<p>A封闭式净值型产品</p><p>B封闭式非净值型产品</p><p>C开放式非净值产品</p><p>D开放式净值产品</p>,4,B,对封闭式非净值型产品，商业银行在产品存续期内不公布产品资产估值情况，而是在产品到期日对本金和收益一次性核算兑付。,0,0
1,(单选题)在其他条件不变的情况下，商业银行可以提高资本充足率的方法是（）。,<p>A将持有的国债换成企业债</p><p>B降低核心资本</p><p>C增加风险加权总资产</p><p>D加附属资本</p>,4,D,商业银行提高资本充足率，主要有两个途径，一是增加资本；二是降低险加权总资产。其余三项属于降低资本充足率。,0,0
1,(单选题)在我国的货币层次中，M1表示（）。,<p>A实物货币</p><p>B狭义货币</p><p>C广义货币</p><p>D准货币</p>,4,B,M1被称为狭义货币，实现是购买力，M2被称为广义货币；M1与M2之差被称为准货币，是潜在购买力。,0,0
1,(单选题)在资产业务中，不属于其他资产业务的是（）。,<p>A债券投资业务</p><p>B表外资产业务</p><p>C现金资产业务</p><p>D外汇交易业务</p>,4,A,其他资产业务包括：表外资产业务、现金资产业务和外汇交易业务。,0,0
1,(单选题)张某接受王某的委托，以王某代理人的身份依法与李某签订了合同，对于该合同的签订（）。,<p>A张某承担民事责任</p><p>B王某承担民事责任</p><p>C张某与王某共同承担民事责任</p><p>D张某与王某均不承担民事责任</p>,4,B,委托代理的定义。,0,0
1,(单选题)中国人民银行为执行货币政策，可以规定具体的条件和程序，可以决定对商业银行贷款的数额、期限、利率和方式，但贷款的期限不得超过（）。,<p>A1年</p><p>B2年</p><p>C3年</p><p>D4年</p>,4,A,中国人民银行为执行货币政策，可以规定具体的条件和程序，可以决定对商业银行贷款的数额、期限、利率和方式，但贷款的期限不得超过1年。,0,0
1,(单选题)资产负债管理长期目标可概括为：从银行整体战略出发，建立符合现代商业银行要求的资产负债管理体系，强化资本约束，提高风险控制水平，加强业务经营引导和调控能力，实现（）最大化，进而持续提升股东价值回报。,<p>A净现金流量</p><p>B经济利益</p><p>C净利息收益率</p><p>D经济资本回报率</p>,4,D,资产负债管理目标可概括为：从银行整体战略出发，建立符合现代商业银行要求的资产负债管理体系，强化资本约束，提高风险控制水平，加强业务经营引导和调控能力，实现经济资本回报率最大化，进而持续提升股东价值回报。（本题来自嗨考网）,0,0
1,(单选题)最后贷款人只向暂时出现流动性不足但仍具有偿清力的机构援助，而对出现偿清力危机的银行不施以救助，这是为了避免（）。,<p>A道德风险</p><p>B系统性金融风险</p><p>C非系统性风险</p><p>D信用风险</p>,4,A,为了避免道德风险，最后贷款人应只向皙时出现流动性不足但仍具有偿清力的机构援助。,0,0
1,(单选题)最后货款人功能应该也必须由（）来承担。,<p>A中国银行</p><p>B中央银行</p><p>C商业银行</p><p>D银监会</p>,4,B,中央银行对法定货币发行权的垄断，决定了最后功能应该也必须由中央银行来承担。,0,0
2,(多选题)我国《商业银行法》规定，商业银行的经营原则是（）。,<p>A安全性</p><p>B盈利性</p><p>C流动性</p><p>D效益性</p><p>E独立性</p>,5,ACD,"我国《商业银行法》规定,商业银行以""安全性、流动性、效益性""为经营原则。",0,0
2,(多选题)按照《中华人民共和国担保法》的规定不得作为保证人的有（）。,<p>A国家机关</p><p>B企业法人的职能部门</p><p>C未授权的企业法人的分支机构</p><p>D学校、幼儿园、医院等以公益为目的的事业单位</p><p>E不从事经营活动的社会团体</p>,5,ABCDE,考核关于保证人主体资格的规定的知识。,0,0
2,(多选题)按照客户要求，资信证明的内客包括（）。,<p>A验资证明</p><p>B询征函</p><p>C财务证明</p><p>D招投标资信证明</p><p>E存款证明</p>,5,ABDE,"按照客户要求,资信证明提供各类验资证明、询征函、招投标资信证明和存款证明等服务。",0,0
2,(多选题)被称为货币政策的"三大法宝"是（）。,<p>A公开市场业务</p><p>B存款准备金</p><p>C再贴现</p><p>D利率政策</p><p>E汇率政策</p>,5,ABC,我国货币政策工具主要包括公开市场业务、存款准备金、再贷款与再贴现、利率政策、汇率政策和窗口指导六大类。在这六大类货币政策工具中公开市场业务、存款准备金和再贴是现代中央银行应用最为广泛的货币政策工具被称为货币政策的"三大法宝"。,0,0
2,(多选题)财务重组顾问是商业银行为因经营管理不善或受外部不利因素影响导致盈利下降、经营亏损、资金短缺、偿债困难等情况的客户提供服务，其作用包括（）。,<p>A提高财务管理效率和质量</p><p>B协助客户与债权人达成和解</p><p>C争取减少债务本金、利息</p><p>D修改其他债务条件以解决财务危机</p><p>E已尽早恢复客户正常经营管理</p>,5,BCDE,财务重组顾问是商业银行为因经营管理不善或受外部不利因素影响导致盈利下降、经营亏损、资金短缺、债券困难等情况的客户提供服务，协助客户与债权人达成和解，争取减少债务本金、利息或修改其他债务条件以解决财务危机，尽早恢复客户正常经营管理。,0,0
2,(多选题)常用的风险参数包括（）。,<p>A违约概率</p><p>B违约损失率</p><p>C违约风险暴露</p><p>D有效期限</p><p>E预期损失</p>,5,ABCDE,商业银行通过计量不同的风险参数，可以从不同的角度来反映银行承担的信用风险水平，常用的风险参数包括违约概率、违约损失、违约风险暴露、有效期限和非预期损失等。,0,0
2,(多选题)票人（持票人）向银行申请办理承兑和贴现时，承兑行和贴现机构应按照支付结算制度的相关规定，对〔）进行审核。,<p>A商业汇票的合法合规性</p><p>B商业汇票的真实交易关系</p><p>C商业汇票的债权债务关系</p><p>D出票人（持票人）的真实身份</p><p>E出票人（持票人）的信用记录</p>,5,BC,出票人（持票人）向银行申请办理承兑和贴现时，承兑行和贴现机构应按照支付结算制度的相关规定对商业汇票的真实交易关系和债权债务关系进行审核。,0,0
2,(多选题)抵押合同一般包括的条款有（）。,<p>A被担保债权的种类和数额</p><p>B债务人履行债务的期限</p><p>C低押财产的名称</p><p>D抵押财产的数量、质量、状况、所在地、所有权归属或者便用权归属</p><p>E担保的范围</p>,5,ABCDE,抵押合同一般包括的条款有：被担保债权的种类和数额；债务人履行债务的期限；抵押财产的名称的数量、质量、状况、所在地、所有权归属或者使用权归;担保的范围。,0,0
2,(多选题)董事会作出决议，必须经商业银行全体董事会过半数通过，而对（）应当由董事2/3以上董事通过方可有效。,<p>A重大投资</p><p>B聘任或解聘高级管理人员</p><p>C资本补充方案</p><p>D财产重组</p><p>E利润分配方案</p>,5,ABCDE,对利润分配方案、重大投资、重大资产处置方案、聘任或解聘高级理人员、资本补充方案、重大股权变动以及财务重组等重大事项，应当由董事2/3以上董事通过方可有效。（本题来自嗨考网）,0,0
2,(多选题)法人机关一般可以分为（）。,<p>A意思机关</p><p>B执行机关</p><p>C代表机关</p><p>D检查机关</p><p>E监督机关</p>,5,ABCD,法人机关一般可分为意思机关、执行机关、代表机关和检机关。,0,0
2,(多选题)风险计量的结果可用于（）。,<p>A客户准入</p><p>B经济成本</p><p>C风险定价</p><p>D绩效考核</p><p>E限额管理</p>,5,ABCDE,风险计量是提升银行情绪化管理水平、优化资源配的基础，风险计量的结果可以应用客户准入、授信审批、限额管理、经济成本、风险定价、绩效考核等领域。,0,0
2,(多选题)根据《商业银行法》，按照商业银行的业务活动范围不同，我国境内商业银行分为（）两类。,<p>A全国性商业银行</p><p>B农村信用社</p><p>C股份制商业银行</p><p>D区域性商业银行</p><p>E农村商业银行</p>,5,AD,根据《商业银行法》，按照商业银行的业务活动范围不同，我国境内商业银行分为全国性商业银行和区域性商业银行两类。,0,0
2,(多选题)行业的生命周期分为（）。,<p>A初创期</p><p>B萌芽期</p><p>C成长期</p><p>D成孰期</p><p>E衰退期</p>,5,ACDE,一般来说，行业的生命周期分为初创期、成长期、成熟期和衰退期四个阶段。,0,0
2,(多选题)理财业务与传统信贷业务的差异包括（）。,<p>A资金来源于银行义务不同</p><p>B交易方式不同</p><p>C风险因素不同</p><p>D交易结构不同</p><p>E投资运作不同</p>,5,ACD,理财业务与传统信贷业务的差异包括资金来源及银行义务，不同、交易结构不同、风险因素不同。,0,0
2,(多选题)内部资金转移定价的作用主要表现在（）。,<p>A核算收益与成本</p><p>B公平绩效考核</p><p>C衡量银行总体利率风险</p><p>D剥离利率风险</p><p>E减少银行资金风险</p>,5,BD,内部资金转移定价的作用主要表现在公平绩效考核和剥离利率风险两方面。,0,0
2,(多选题)人民法院审理民事案件，依照法律规定实行的制度有（）。,<p>A合议</p><p>B回避</p><p>C公开审判</p><p>D两审终审制度</p><p>E公平</p>,5,ABCD,人民法院审理民事案件，依照法律规定实行合议、回避、公开审判和两审终审制度。,0,0
2,(多选题)商业银行的风险管理流程包括（）。,<p>A风险识别</p><p>B风险计量</p><p>C风险监测</p><p>D风险预测</p><p>E风险控制</p>,5,ABCE,商业银行的风险管理流程可以概括为风险识别、风险计量、风险监测和风险控制四个环节。,0,0
2,(多选题)商业银行内部控制应当遵循的墓本原则是（）。,<p>A全覆盖原则</p><p>B制衡性原则</p><p>C审慎性原则</p><p>D相匹配原则</p><p>E客观性原则</p>,5,ABCD,商业银行内部控制应当遵循的基本原则：全覆盖原则、制衡性原则、审慎性原则和相匹配原则。,0,0
2,(多选题)商业银行向中央银行借款的主要途径有（）。,<p>A再贴现</p><p>B债券回购</p><p>C同业拆借</p><p>D发行金融债券</p><p>E再贷款</p>,5,AE,商业银行向中央银行借款有再贴现和再贷款两种途径。,0,0
2,(多选题)商业银行与客户的业务往来，应当遵循（）的原则,<p>A平等</p><p>B自愿</p><p>C公平</p><p>D公开</p><p>E诚实信用</p>,5,ACE,商业银行与客户的业务往来，应当遵循平等、公平和诚实信用的原则，开展业务应当遵守公平竞争的原则，不得从事不正当竞争。,0,0
2,(多选题)商业银行组织构架的形式从内部管理模式划分，可分为〔）。,<p>A以区域管理为主的总分行型组织构架</p><p>B以业务线管理为主的事业部制组织构架</p><p>C矩阵型组织构架</p><p>D以成本为中心的组织构架</p><p>E发展型组织构架</p>,5,ABC,从内部管理模式划分，商业银行的组织构架可划分为以区域管理为主的总分行型组织构架；以业务线管理为主的事业部制组织构架和矩阵型组织构架。（本题来自嗨考网）,0,0
2,(多选题)商业银行组织架构是银行个部分（包括一切机构和部门）按照一定的（）组成的一个有机系统。,<p>A排列顺序</p><p>B空间位置</p><p>C聚集状态</p><p>D联系方式</p><p>E各部门之间的相互关系</p>,5,ABCDE,商业银行组织架构是银行个部分（包括一切机构和部门）按照一定的排列服序、空间位置、聚集状态、联系方式以及各部门之间相互关系组成的一个有机系统。,0,0
2,(多选题)市场风险的计量方法包括（）。,<p>A缺口分折</p><p>B久期分析</p><p>C风险价值法</p><p>D风险指数</p><p>E压力测试</p>,5,ABCE,市场风险的计量方法有六种，分别是：缺口分析、久期分析、外汇散口分析、风险价值法、敏感性分析和情景分析、压力测试。,0,0
2,(多选题)通货紧缩的原因包括（）。,<p>A货市供给减少</p><p>B需求拉上</p><p>C有效需求不足</p><p>D供需结构不合理</p><p>E国际市场的冲击</p>,5,ACDE,B选项是通货膨胀的原因。,0,0
2,(多选题)完全垄断的行业具有（）的特点。,<p>A产品被独占</p><p>B市场处于一家企业的控制之中</p><p>C企业的获利能力强</p><p>D替代产品已经被研发</p><p>E对产品价格的控制能力强</p>,5,ABCE,完全垄断的行业主要特点是：市场完全处于一家企业的控制口，产品被独占，产品又缺乏合适的替代品，所以垄断行业对自己的产品价格有很强的控制力，能够获得最大利润。,0,0
2,(多选题)我国《商业银行法》规定，商业银行的经营原则是（）。,<p>A安全性</p><p>B盈利性</p><p>C流动性</p><p>D效益性</p><p>E独立性</p>,5,ACD,"我国《商业银行法》规定,商业银行以""安全性、流动性、效益性""为经营原则。",0,0
2,(多选题)我国银行业监管规则体系主要包括（）.,<p>A法律</p><p>B行政法规</p><p>C部门规章</p><p>D规范文件</p><p>E行为准则</p>,5,ABCD,银行业监管规则体系主要由法律、行政法规、部门规章、规范性文件四个层次构成，法律、行政法规是基础和主干，部门规章和规范性文件构成了实际监管工作依据和准则。,0,0
2,(多选题)无权代理的构成要素有（）。,<p>A行为人既没有代理权，又没有令人相信其有代理权的事实或理由</p><p>B行为人以本人的名义与他人所为的民行事为</p><p>C第三人须为善意且无过失</p><p>D行为人的行为不违法</p><p>E行为人与第三人具有相应的行为能力</p>,5,ABCDE,无权代理的成要素有：行为人既没有代理权，又没有令人相信其有代理权的事实或理由，行为人以本人的名义与他人所为的民事行为，第三人须为善意且无过失，行为人的行为不违法，行为人与第三人具有有相应的行为能力。,0,0
2,"(多选题)下列业务中,属于贸易融资的有（）。",<p>A出口押汇</p><p>B信用证</p><p>C国际保理</p><p>D福费廷</p><p>E票据贴现</p>,5,ABCD,考察贸易融资的内客。（本题来自嗨考网）,0,0
2,(多选题)依照《商业银行法》，有下列情形之一的，接管终止（）。,<p>A接管决定规定的期限届满</p><p>B银监会决定的接管延期届满</p><p>C接管期限届满前，该商业银行已恢复正常经营能力</p><p>D接管期限届满前，该商业银行被合并</p><p>E接管期限届满前，该商业银行被依法宣告破产</p>,5,ABCDE,"依照《商业银行法》,有下列情形之一的，接管终止：（1）接管决定规定的期限届满（2）银监会决定的接管延期届满（3）接管期限届满前，该商业银行已恢复正常经营能力（4）接管期限届满前，该商业银行被合并（5）接管期限届满前，该商业银行被依法宣告破产。",0,0
2,(多选题)遗嘱的形式包括（）。,<p>A口头遗嘱</p><p>B录音遗嘱</p><p>C代书遗嘱</p><p>D公证遗嘱</p><p>E书面遗嘱</p>,5,ABCD,遗嘱的形式包括公证遗嘱、代书遗嘱、自书遗嘱、录音遗嘱、口头遗嘱五种形式。,0,0
2,(多选题)以下关于人均净利润说法正确的是（）。,<p>A人均净利润是反映银行效率的重要指标之一</p><p>B人均净利润=（净利润/员工数量）100%</p><p>C人均净利润数值越大，则人均创造的净利润越多，那么银行的效率值就越高</p><p>D人均净利润是从员工创造性和人力资源管理的角度去度量商业银行效率水平</p><p>E人均净利润是银行创造的净利润总额在职员工人数的对比</p>,5,ABCDE,以上说法均正确。,0,0
2,(多选题)以业务线管理为主的事业部组织架构的特点是：全行所有业务划分为若干业务线，总行按业务设立若干事业部，行使本业务线的（）。,<p>A经营决策权</p><p>B业务管理权</p><p>C资源调度权</p><p>D绩效考核权</p><p>E独立自主权</p>,5,ABCD,以业务线管理为主的事业部制组织架构的特点是：全行所有业务划分为若干业务线，总行按业务设立若干事业部，行使本业务线的经营决策权、业务管理权、资源调度权和绩效考核权。,0,0
2,(多选题)银行公司治理的组织构架包括（）。,<p>A董事会</p><p>B监事会</p><p>C股东会</p><p>D首席风险官</p><p>E高级管理层</p>,5,ABCE,银行公司治理的组织构架包括股东会、董事会、监事会、高级管理层（简称“三会一层"),0,0
2,(多选题)银行业从业人员在了解客户时必须道循的规则有（）。,"<p>A银行在与客户建立业务关系时,应当要求客户出示真实有效的身份证明并进行和核对登记</p><p>B不得为身份不明的客户提供服务或与其交易</p><p>C不得为客户开立匿名账户或假名账户</p><p>D客户由他人代理办理业务时，银行应当对被代理人的身份证件或者其他身份证明文件进行核对和登记，对代理人则免除此手续</p><p>E保证客户所购买产品的收益率</p>",5,ABC,客户由他人代理办理业务的，银行应当同时对和被代理人的身份证件或者其他身份证明文件进行核对并登记。,0,0
2,(多选题)影响货币需求的主要因素（）。,<p>A收入水平</p><p>B利率水平</p><p>C汇率</p><p>D经济周期</p><p>E公众的预期和偏好</p>,5,ABCE,影响货币需求的主要因素包括：收入水平；利率水平；社会商品可供量、物价水平、货币流通速度：信用制度发达程度：汇率；公众的预期和偏好，另外，人口数量、人口密集程度、经济结构，社会分工，交通通讯等技术状况都会影响货币需求。,0,0
2,(多选题)在商业银行资产负债管理过程中，利用久期管理可以采用下列方法〔）,<p>A资产久期分析策略</p><p>B负债久期分析策略</p><p>C风险免疫管理策略</p><p>D成本分析策略</p><p>E久期缺口风险管理策略</p>,5,CE,在商业银行资产负债管理过程口，利用久期管理可以采用风险免疫管理策略和久期缺口风险管理策略两种方法。,0,0
2,(多选题)债务人财产范围包括（）。,<p>A对不当行为行使追回权而取得的财产</p><p>B取回的质物、留置物</p><p>C他人应对债务人的出资</p><p>D破产申请后至破产程序终结前债质务人取得的财产</p><p>E已破产申请受理时属于债务人的全部财产</p>,5,ABCDE,除了这五个选项外，债务人财产的范围还包括债务人的董事、监事高级管理人员利用职权从企业获取的非正常收入和侵占的企业财产，管理人应当追回。,0,0
