1,(单选题)个人耐用消费品贷款的贷款期限一般为（）。,<p>A个人住房装修贷款期限一般为1～3年。最长不超过5年(含5年) </p><p>B有的银行规定个人住房装修贷款金额不超过人民币20万元</p><p>C个人耐用消费品贷款期限一般在1年以内，最长为3年(含3年)</p><p>D申请个人耐用消费品贷款的女性贷款人年龄不得超过60岁</p>,4,C,个人耐用消费品贷款期限一般在1年以内，最长为3年(含3年)。将至退休年龄的借款人，借款期限不得超过退休年限(一般女性为55岁，男性为60岁)。,0,0
1,(单选题)一个借款人可以有（）个贷款主办行。,<p>A1</p><p>B2</p><p>C3</p><p>D4</p>,4,A,一个借款人只能有一个贷款主办行，主办行应当随基本账户的变更而变更。,0,0
1,(单选题)以下关于下岗失业人员小额担保贷款说法，不正确的是（）。,<p>A贷款未清偿之前，不得对同一借款人发放新的贷款</p><p>B合伙经营项目申请小额担保贷款的，实行项目额度总量控制、贷款单户管理的原则</p><p>C每个申请人均由同一担保机构进行独立的担保，项目总额度为各借款人额度之和，且总额度最高不超过20万元(含20万元)</p><p>D合伙经营借款人之间要承担连带责任保证</p>,4,C,每个申请人均由同一担保机构进行独立的担保，项目总额度为各借款人额度之和且总额度最高不超过10万元(含10万元)，选项C说法错误。,0,0
1,(单选题)网点机构随着对客户定位的不同而各有差异，其中不包括（）。,<p>A咨询性网点机构营销渠道</p><p>B专业性网点机构营销渠道</p><p>C全方位网点机构营销渠道</p><p>D零售型网点机构营销渠道</p>,4,A,网点机构营销渠道包括：(1)全方位网点机构营销渠道；(2)专业性网点机构营销渠道；(3)高端化网点机构营销渠道；(4)零售型网点机构营销渠道。,0,0
1,(单选题)个人住房装修贷款是银行向个人发放的，用于装修（）的人民币担保贷款。,<p>A厂房</p><p>B办公用房</p><p>C自用住房</p><p>D商用房</p>,4,C,个人住房装修贷款是指银行向个人发放的、用于装修自用住房的人民币担保贷款。个人住房装修贷款可以用于支付家庭装潢和维修工程的施工款、相关的装修材料和厨卫设备款等。,0,0
1,(单选题)个人抵押授信贷款中，抵押率一般不超过（）。,<p>A0.5</p><p>B0.6</p><p>C0.7</p><p>D0.8</p>,4,C,根据规定，抵押率根据抵押房产的房龄、当地房地产价格水平、房地产价格走势、抵押物变现情况等因素确定，一般不超过70%。,0,0
1,(单选题)一般保证的保证人与债权人未约定保证期间的，保证期问为主债务履行期届满之日起（）个月。,<p>A3</p><p>B4</p><p>C5</p><p>D6</p>,4,D,一般保证的保证人与债权人未约定保证期间的，保证期间为主债务履行期届满之日起6个月。,0,0
1,(单选题)下列不属于个人住房贷款操作风险的是（）。,<p>A贷款行所在地区抵押登记制度不健全</p><p>B降低借款人首付比例</p><p>C放松对借款人的审批条件</p><p>D贷款前、中、后台没有进行严格的责任区分</p>,4,A,从操作风险的角度看，由于缺乏必要相关法律约束，再加上各大商业银行之间激烈的竞争，银行的业务部门有时为了扩大其业务范围，放松对借款人的审批条件。在操作过程中，没有严格的抵押住房登记制度，贷款的前台、中台与后台没有进行责任上的严格区分，对客户的资信情况没有进行严格把关。,0,0
1,(单选题)经贷款人同意，个人贷款可以展期，（）的个人贷款，展期期限累计不得超过原贷款期限。,<p>A1年以上</p><p>B1年以内(含)</p><p>C2年以上</p><p>D2年以内(含)</p>,4,B,经贷款人同意，个人贷款可以展期。1年以内(含)的个人贷款，展期期限累计不得超过原贷款期限；1年以上的个人贷款，展期期限累计与原贷款期限相加，不得超过该贷款品种规定的最长贷款期限。,0,0
1,(单选题)下列不属于银行在与保险公司的合作过程中的风险的是（）。,<p>A保险公司依法解除保险合同，贷款银行的债权难以得到保障</p><p>B免责条款成为保险公司的“护身符”，贷款银行难以追究保险公司的保险责任</p><p>C保证保险的责任限制制造成风险缺口</p><p>D一车多贷和虚报车价</p>,4,D,银行在与保险公司的合作过程中的风险有：(1)保险公司依法解除保险合同，贷款银行的债权难以得到保障；(2)免责条款成为保险公司的“护身符”，贷款银行难以追究保险公司的保险责任；(3)保证保险的责任限制造成风险缺口；(4)银保合作协议的效力有待确认，银行降低风险的努力难以达到预期效果。,0,0
1,(单选题)下列不属于个人汽车贷款贷前调查的重点内容的是（）。,<p>A材料一致性的调查</p><p>B借款人身份、资信、经济状况和借款用途的调查</p><p>C担保情况的调查</p><p>D汽车经销商的资信调查</p>,4,D,个人汽车贷款贷前调查人在调查申请人基本情况、贷款用途和贷款担保等情况时，应重点调查以下内容：(1)材料一致性的调查；(2)借款人身份、资信、经济状况和借款用途的调查；(3)担保情况的调查。,0,0
1,(单选题)经销商汽车贷款的贷款期限不得超过（）年。,<p>A1</p><p>B3</p><p>C2</p><p>D5</p>,4,A,汽车贷款的贷款期限(含展期)不得超过5年，其中，二手车贷款的贷款期限(含展期)不得超过3年，经销商汽车贷款的贷款期限不得超过1年。 ,0,0
1,(单选题)银行业金融机构要严格对照（）的具体规定和要求，对各类贷款合同进行修订，着重强化贷款支付环节的约定和要求借款人和担保人履行承诺的条款。,<p>A《个人贷款管理暂行办法》</p><p>B《关予开展个人消费贷款的指导意见》</p><p>C《贷款通则》</p><p>D《汽车贷款管理办法》</p>,4,A,银行业金融机构要严格对照《个人贷款管理暂行办法》的具体规定和要求，对各类贷款合同进行修订，着重强化贷款支付环节的约定和要求借款人和担保人履行承诺的条款，提高贷款合同中承诺条款的执行力，保证贷款用途符合合同约定，切实维护银行业金融机构的合法权益。,0,0
1,(单选题)小张于2008年3月3日购买新房，当年3月20日申请住房抵押贷款，当年4月2日银行放款。2009年4月7日，小张申请将原住房抵押贷款转为个人抵押授信贷款，则该授信贷款有效期间起始日为（）。,<p>A2008年3月12日</p><p>B2008年3月19日</p><p>C2008年4月1日</p><p>D2009年4月6日</p>,4,C,将银行原住房抵押贷款转为个人抵押授信贷款的，有效期间起始日为原住房抵押贷款发放日的前一日。,0,0
1,(单选题)《个人贷款管理暂行办法》在法律责任上首先规定采取监管措施的情形，其次规定给予行政处罚的情形。行政处罚所针对的多是具体的行为。下列不属于采取监管措施行为的是（）。,<p>A相关制度是否建立</p><p>B贷前管理的违法行为</p><p>C流畅是否健全</p><p>D制度是否得到执行</p>,4,B,贷前管理的违法行为属于采取行政处罚的行为，而不是采取监管措施的行为。,0,0
1,(单选题)下列行为中，不发生在贷款发放环节的是（）。,<p>A审核合同</p><p>B出账前审核</p><p>C开户放款</p><p>D放款通知</p>,4,A,贷款发放的具体流程为：出账前审核、开户放款、放款通知。审核合同属于贷款签约流程中的程序，不属于贷款发放环节。,0,0
1,(单选题)下列关于个人教育贷款的说法，错误的是（）。,<p>A个人教育贷款分为国家助学贷款和商业助学贷款</p><p>B国家助学贷款是由国家指定的商业银行面向在校的全日制高等学校中经济确实困难的本专科学生等发放的贷款</p><p>C各商业银行、城市信用社和农村信用社均可开办国家助学贷款业务</p><p>D商业助学贷款是指银行按商业原则自主向个人发放的用于支持境内高等院校困难学生学费、住宿费和就读期间基本生活费的商业贷款</p>,4,C,中国工商银行、中国农业银行、中国银行和中国建设银行为中国人民银行批准的国家助学贷款经办银行，负责办理国家助学贷款的审核、发放和回收等工作。,0,0
1,(单选题)个人质押贷款的风险控制重点在于（）。,<p>A确定出质人的职业</p><p>B质押物的真实性、合法性和可变现性</p><p>C明确出质人的担保意愿</p><p>D防止虚报质押财产价值</p>,4,B,个人质押贷款的风险控制重点是关注质物的真实性、合法性和可变现性。,0,0
1,(单选题)2010年3月，某人向银行申请贷款50万元，下列各种还款方式中，最终所付利息最少的是（）。,<p>A等额本息还款法</p><p>B等额本金还款法</p><p>C一次性还本付息法</p><p>D组合还款法</p>,4,B,等额本金还款法偿还本金的速度最快，因而整个还款过程中承担的利息最少；一次性还本付息法偿还本金速度最慢，承担的利息最多；等额本息还款法则是居于二者之间。,0,0
1,(单选题)完全民事行为能力人一般是指（）周岁以上的公民。,<p>A14</p><p>B16</p><p>C18</p><p>D22</p>,4,C,完全民事行为能力人一般是指18周岁以上的公民。,0,0
1,(单选题)对开发商的资信审查不包括（）。,<p>A会计报表</p><p>B房地产开发商资质审查</p><p>C税务登记证明</p><p>D项目的合法性审查</p>,4,D,开发商资信审查具体包括：(1)房地产开发商资质审查；(2)企业资信等级或信用程度；(3)经国家工商行政管理机关核发的企业法人营业执照；(4)税务登记证明；(5)会计报表；(6)开发商的债权债务和为其他债权人提供担保的情况；(7)企业法人代表的个人信用程度和管理层的决策能力。,0,0
1,(单选题)采用（）的，贷款人应与借款人在借款合同中事先约定，要求借款人定期报告或告知贷款人贷款资金支付情况。,<p>A借款人自主支付</p><p>B借款人受托支付</p><p>C贷款人自主支付</p><p>D贷款人受托支付</p>,4,A,采用借款人自主支付的，贷款人应与借款人在借款合同中事先约定，要求借款人定期报告或告知贷款人贷款资金支付情况。贷款人应当通过账户分析、凭证查验或现场调查等方式，检查贷款支付是否符合约定用途。,0,0
1,(单选题)（）是最重要的企业法人形式。,<p>A公司法人</p><p>B机关法人</p><p>C合伙企业法人</p><p>D事业单位法人</p>,4,A,在我国，公司法人是最重要的企业法人形式。,0,0
1,(单选题)个人医疗贷款一般由_________和__________联合当地特定合作医院办理。（）,<p>A保险公司；中介机构</p><p>B保险公司；卫生管理部门</p><p>C贷款银行；保险公司</p><p>D贷款银行；中介机构</p>,4,C,个人医疗贷款一般由贷款银行和保险公司联合当地特定合作医院办理，借款人到特约医院领取并填写经特约医院签章认可的借款申请书，持医院出具的诊断证明及住院证明，到开展此业务的银行机构申办贷款，获批准后持个人持有的银行卡和银行盖章的贷款申请书及个人身份证，到特约医院就医、结账。,0,0
1,(单选题)根据《合同法》，希望和他人订立合同的意思表示称为（）。,<p>A要约</p><p>B要约邀请</p><p>C承诺</p><p>D合同成立</p>,4,A,根据《合同法》第14条规定，要约是希望和他人订立合同的意思表示。 ,0,0
1,(单选题)个人信用贷款主要根据个人信用记录和（）状况确定贷款额度和贷款期限。,<p>A个人工作单位</p><p>B个人资产</p><p>C个人信用等级</p><p>D个人月收入</p>,4,C,个人信用贷款是银行向个人发放的，无须提供任何担保的贷款。个人信用贷款主要根据个人信用记录和个人信用等级状况确定贷款额度和贷款期限，信用等级越高，信用额度越大，反之越小。,0,0
1,(单选题)（）是指商业银行提供的自然人在个人贷款、信用卡等信用活动中形成的交易记录。,<p>A个人信贷交易信息</p><p>B个人身份信息</p><p>C居住信息</p><p>D个人职业信息</p>,4,A,根据人民银行公布的《个人信用信息基础数据库管理暂行办法》，个人信贷交易信息是指商业银行提供的自然人在个人贷款、信用卡等信用活动中形成的交易记录，在《个人信用报告》中，信用交易信息分为信用汇总信息和信用明细信息。其中涵盖了信用卡与贷款的明细特殊交易、个人结算账户信息、查询记录等情况。,0,0
1,(单选题)贷款人应按照借款合同约定，通过（）或（）的方式对贷款资金的支付进行管理与控制。,<p>A贷款人受托支付；担保人自主支付</p><p>B贷款人受托支付；借款人自主支付</p><p>C借款人受托支付；贷款人自主支付</p><p>D担保人受托支付；借款人自主支付</p>,4,B,贷款人应按照借款合同约定，通过贷款人受托支付或借款人自主支付的方式对贷款资金的支付进行管理与控制。,0,0
1,(单选题)个人贷款管理原则不包括（）。,<p>A全流程管理原则</p><p>B诚信申贷原则</p><p>C协议承诺原则</p><p>D公平原则</p>,4,D,个人贷款管理原则包括：(1)全流程管理原则；(2)诚信申贷原则；(3)协议承诺原则；(4)贷放分控原则；(5)实贷实付原则；(6)贷后管理原则。,0,0
1,(单选题)目前，我国个人信用数据库更新个人信息的频率是（）更新一次。,<p>A每日</p><p>B每周</p><p>C每月</p><p>D每年</p>,4,C,在我国，考虑到商业银行结算周期多以月为单位，相应地，个人信用数据库是每月更新一次信息。,0,0
1,(单选题)个人住房贷款的利率按商业性贷款利率执行，上限放开，实行下限管理，按照中国人民银行规定，2008年10月27日公布的个人住房贷款利率，商业性个人住房贷款的下限利率水平为相应档次贷款基准利率的（）倍，商业银行可根据具体情况自主确定利率水平和内部定价规则。,<p>A0.9</p><p>B1.1</p><p>C0.7</p><p>D0.85</p>,4,B,个人商用房贷款利率不得低于人民银行规定的同期同档次利率的1．1倍。故选B。,0,0
1,(单选题)（）是指贷款人根据借款人的提款申请和支付委托，将贷款资金交付给符合合同约定用途的借款人交易对象。,<p>A借款人自主支付</p><p>B借款人受托支付</p><p>C贷款人自主支付</p><p>D贷款人受托支付</p>,4,D,贷款人受托支付是指贷款人根据借款人的提款申请和支付委托，将贷款资金支付给符合合同约定用途的借款人交易对象。借款人自主支付是指贷款人根据借款人的提款申请将贷款资金直接发放至借款人账户，并由借款人自主支付给符合合同约定用途的借款人交易对象。,0,0
1,(单选题)初审工作无误后，学校机构在审查合格的贷款申请书上加盖公章予以确认，将审查结果通知学生，并编制（）与申请资料一并送交国家助学贷款经办银行。,<p>A国家助学贷款借款合同</p><p>B风险补偿金申请书</p><p>C国家助学贷款学生审核信息表</p><p>D中央部门所属高校国家助学贷款实际发放汇总表</p>,4,C,初审工作无误后，学校编制国家助学贷款学生审核信息表与申请材料一并送交助学贷款的经办银行。,0,0
1,(单选题)不以营利为目的，带有较强的政策性的贷款是（）。,<p>A自营性个人住房贷款</p><p>B个人经营类贷款</p><p>C个人消费额度贷款</p><p>D公积金个人住房贷款</p>,4,D,公积金个人住房贷款是不以营利为目的，实行“低进低出”的利率政策，带有较强的政策性，贷款额度受限制的一种贷款。因此，它是一种政策性个人住房贷款。,0,0
1,(单选题)提炼对目标人群最有吸引力的优势竞争点，并通过一定的手段传达给消费者，然后转化为消费者的心理认识，是（）的一个关键环节。,<p>A品牌营销</p><p>B电话营销</p><p>C定向营销</p><p>D策略营销</p>,4,A,要做好品牌营销，以下五个要素十分重要：质量第一、诚信至上、定位准确、个性鲜明、巧妙传播。其中定位准确是指提炼对目标人群最有吸引力的优势竞争点，并通过一定的手段传达给消费者，然后转化为消费者的心理认识，是品牌营销的一个关键环节。,0,0
1,(单选题)《个人贷款管理暂行办法》强化了贷款调查环节，要求严格执行（）制度，有助于从源头上防范风险。,<p>A贷款审查</p><p>B贷款审批</p><p>C贷款面谈</p><p>D贷款监管</p>,4,C,2010年2月12日，中国银行业监督管理委员会颁布了《个人贷款管理暂行办法》， 这是我国出台的第一部个人贷款管理的法规，强化了贷款调查环节，要求严格执行贷款面谈制度，有助于从源头上防范风险。,0,0
1,(单选题)《汽车贷款管理办法》第22条规定，贷款人发放自用车贷款的金额不得超过借款人所购汽车价格的__________；发放商用车贷款的金额不得超过借款人所购汽车价格的__________。（）,<p>A80%：70%</p><p>B70%；60%</p><p>C60%；50%</p><p>D70%；50%</p>,4,A,《汽车贷款管理办法》第22条规定，贷款人发放自用车贷款的金额不得超过借款人所购汽车价格的80%；发放商用车贷款的金额不得超过借款人所购汽车价格的70%。,0,0
1,(单选题)个人征信查询系统内容中居住信息不包括（）。,<p>A证件信息</p><p>B工作单位名称</p><p>C邮政编码</p><p>D居住状况</p>,4,A,B、C、D三项均为个人征信查询系统内容中居住信息；A选项属于个人征信查询系统内容中的个人身份信息，因此A选项符合题意。,0,0
1,(单选题)自身财务规划能力强的客户适用的还款方式是（）。,<p>A等额本金还款法</p><p>B等比累进还款法</p><p>C等额累进还款法</p><p>D组合还款法</p>,4,D,自身财务规划能力强的客户适用组合还款法。,0,0
1,(单选题)在单一营销的基础上注入人性化的营销理念是指（）。,<p>A交叉营销策略</p><p>B情感营销策略</p><p>C大众营销策略</p><p>D单一营销策略</p>,4,B,情感营销是在单一营销的基础上注入人性化的营销理念。,0,0
2,(多选题)银行在进行营销决策前首先应当对（）进行调查分析。,<p>A客户需求</p><p>B竞争对手实力</p><p>C金融市场变化趋势</p><p>D宏观经济环境</p><p>E其他银行利率</p>,5,ABC,银行在进行营销决策之前，应首先对客户需求、竞争对手实力和金融市场变化趋势等内外部市场环境进行充分的调查和分析。,0,0
2,(多选题)合作机构风险分析包括的内容有（）。,<p>A合作机构的信用状况</p><p>B合作机构的偿债能力</p><p>C合作机构的管理水平</p><p>D合作机构的关联关系</p><p>E合作机构的业界声誉</p>,5,ABCE,不包括合作机构的关联关系。,0,0
2,(多选题)农户小额信用贷款中农户资信评定等级分为（）。,<p>A优秀</p><p>B较好</p><p>C一般</p><p>D较差</p><p>E极差</p>,5,ABC,农户小额信用贷款中农户资信评定等级分为优秀、较好、一般三个信用等级。,0,0
2,(多选题)以下关于个人住房贷款利率的说法正确的包括（）。,<p>A按商业性贷款利率执行，下限放开，实行上限管理</p><p>B对贷款购买第二套住房的家庭，贷款利率不得低于基准利率的1．1倍</p><p>C个人住房贷款的计息、结息方式。由借贷双方协商确定</p><p>D一般来说，贷款期限在1年以内(含1年)的实行合同利率，遇法定利率调整时，执行原合同利率．</p><p>E银行多于次年1月1日起按相应的利率档次执行新的利率规定</p>,5,BCDE,按商业性贷款利率执行，上限放开，实行下限管理。,0,0
2,(多选题)下列关于个人汽车贷款运行模式的说法，正确的有（）。,<p>A目前，个人汽车贷款最主要的运行模式包括“间客式”与“直客式”两种</p><p>B“直客式”运行模式在目前个人汽车贷款市场中占主导地位</p><p>C在“间客式”运行模式下，汽车经销商或第三方协助银行对贷款购车人的资信情况进行调查</p><p>D“直客式”汽车贷款的运行模式是“先购车，后贷款”</p><p>E在“直客式”运行模式下，购车人首先到经销商处挑选车辆，然后通过经销商的推荐到合作银行办理贷款手续</p>,5,AC,目前，个人汽车贷款最主要的运行模式包括“间客式”与“直客式”两种。“间客式”运行模式在目前个人汽车贷款市场中占主导地位。该模式是指由购车人首先到经销商处挑选车辆。然后通过经销商的推荐到合作银行办理贷款手续。汽车经销商或第三方(如保险公司、担保公司)协助银行对贷款购车人的资信情况进行调查。【专家点拨】与“间客式”的“先购车，后贷款”相反，纯粹的“直客式”汽车贷款模式是“先贷款，后买车”，即客户先到银行申请个人汽车贷款，由银行直接面对客户，对客户资信情况进行调查审核，再综合评定后授予该客户一定的贷款额度，并与之签订贷款协议。,0,0
2,(多选题)《物权法》规定的可作为抵押的财产包括（）。,<p>A半成品</p><p>B交通运输工具</p><p>C土地所有权</p><p>D原材料</p><p>E建造中的建筑物</p>,5,ABDE,《物权法》第184条规定，土地所有权不得抵押，所以C选项不符合题意。 ,0,0
2,(多选题)下列关于公积金个人住房贷款的说法，正确的有（）。,<p>A也称作委托性个人住房公积金贷款</p><p>B贷款对象为住房公积金的缴存人</p><p>C贷款利率比自营性个人住房贷款利率低</p><p>D还款方式包括一次还本付息、等额本息还款法、等额本金还款法</p><p>E贷款年限最长为20年</p>,5,ABCD,贷款年限最长为30年。,0,0
2,(多选题)银行进行贷后检查的过程中，主要检查借款人的（）。,<p>A借款人是否提供了虚假的证明材料而取得贷款</p><p>B抵押物是否出现毁损、灭失、价值减少现象</p><p>C保证人是否失去担保能力</p><p>D借款人是否按合同约定用途使用贷款</p><p>E借款人是否卷入重大经济纠纷、诉讼或仲裁程序．足以影响其偿债能力的</p>,5,ADE,贷后检查中对借款人的检查，发现借款人出现下列情况的，应限期要求借款人进行纠正，对借款人拒绝纠正的，应提前收回已发放贷款的本息，或解除合同，并要求借款人承担违约责任。①借款人提供了虚假的证明材料而取得贷款的；②借款人未按合同约定用途使用贷款的；③借款期内，借款人累计一定月数(包括计划还款当月)未偿还贷款本息和相关费用的；④借款人拒绝或阻碍贷款银行对贷款使用情况实施监督检查的；⑤借款人卷入重大经济纠纷、诉讼或仲裁程序，足以影响其偿债能力的；⑥借款人发生其他足以影响其偿债能力的事件的。,0,0
2,(多选题)下列关于助学贷款的说法，正确的有（）。,<p>A助学贷款利率在中国人民银行规定的同期限贷款利率基础上上浮不得超过10%</p><p>B可利随本清，也可分次偿还</p><p>C提前归还贷款本息的，按当期利率和约定时间计收利息</p><p>D未按期归还的贷款本息不得收取罚息</p><p>E各级政府和社会各界为借款人提供担保或利息补贴的，其贴息比例、贴息时间由贷款人或借款人所在学校与贴息提供者共同商定</p>,5,BE,助学贷款利率按中国人民银行规定的同期限贷款利率执行，不上浮，故选项A错误；贷款本息提前归还的，提前归还的部分按合同约定利率和实际使用时间计收利息，故选项C错误；贷款本息不能按期归还的，贷款人按规定计收罚息，故选项D错误。,0,0
2,(多选题)下列属于个人汽车贷款信用风险内容的包括（）。,<p>A借款人的还款能力风险</p><p>B借款人的还款意愿风险</p><p>C借款人的欺诈风险</p><p>D借款人的收入水平波动</p><p>E借款人的工作变化</p>,5,ABC,个人汽车贷款信用风险的内容包括借款人的还款能力风险、借款人的还款意愿风险和借款人的欺诈风险。,0,0
2,(多选题)以下不属于个人贷款申请应当具备的条件的有（）。,<p>A贷款用途不明</p><p>B借款人为具有完全民事行为能力的中华人民共和国公民或符合国家有关规定的境外自然人</p><p>C贷款申请数额、期限和币种合理</p><p>D借款人有重大不良信用记录</p><p>E借款人具备还款意愿和还款能力</p>,5,AD,个人贷款申请具备以下条件：(1)借款人为具有完全民事行为能力的中华人民共和国公民或符合国家有关规定的境外自然人；(2)贷款用途明确合理、贷款申请数额、期限和币种合理；(3)借款人具备还款意愿和还款能力；(4)借款人信用状况良好，无重大不良信用记录；(5)贷款人要求的其他条件。,0,0
