2,(多选题)下列属于内部控制原则的有()。,<p>A全面性原则</p><p>B谨慎性原则</p><p>C制衡性原则</p><p>D适应性原则</p><p>E成本效益原则</p>,5,ACDE,内部控制，是由企业董事会、监事会、经理层和全体员工实施的、旨在实现控制目标的过程。其原则包括全面性原则、制衡性原则、适应性原则、成本效益原则和重要性原则。,0,0
2,(多选题)根据规定，银行业从业的基本准则包括()。,<p>A诚实信用准则</p><p>B专业胜任准则</p><p>C守法合规准则</p><p>D勤勉尽职准则</p><p>E保护商业秘密与客户隐私准则</p>,5,ABCDE,五个选项均属于《银行业从业人员职业操守》中规定的银行业从业的基本准则。,0,0
3,(判断题)再贴现不仅能够影响商业银行融资成本，干预和影响市场利率及货币供求，而且还能影响商业银行及全社会的资金投向。(),<p>A正确</p><p>B错误</p>,2,A,作为中央银行货币政策工具的再贴现政策，主要包括两方面的内容：一是通过再贴现率的调整，影响商业银行以再贴现方式融入资金的成本，干预和影响市场利率及货币供求；二是规定再贴现票据的种类，影响商业银行及全社会的资金投向，促进资金的高效流动。,0,0
3,(判断题)即期外汇交易又称为现汇交易或外汇现货交易，是指必须在成交当日办理实际货币交割的外汇交易。(),<p>A正确</p><p>B错误</p>,2,B,即期外汇交易又称为现汇交易或外汇现货交易，是指在交易日后的第二个营业日或成交当日办理实际货币交割的外汇交易。,0,0
3,(判断题)固定资产贷款一般是中长期贷款，但也有用于项目临时周转用途的短期贷款。(),<p>A正确</p><p>B错误</p>,2,A,固定资产贷款一般是中长期贷款，但也有用于项目临时周转用途的短期贷款。,0,0
3,(判断题)单位在设立临时机构或注册验资时，可以按照要求开立临时存款账户。(),<p>A正确</p><p>B错误</p>,2,A,临时存款账户是指存款人因临时需要并在规定期限内使用而开立的银行结算账户。可以开立临时存款账户的情形包括：设立临时机构、异地临时经营活动、注册验资。,0,0
3,(判断题)个人通知存款的起存金额一般为2万元。(),<p>A正确</p><p>B错误</p>,2,B,个人通知存款的特点是：开户时不约定存期，预先确定品种，支取时只要提前一定时间通知银行，约定支取日期及金额。其起存金额一般为5万元。，,0,0
3,(判断题)全面风险管理是一个动态的过程，这个过程受董事会、管理层和其他人员的影响。(),<p>A正确</p><p>B错误</p>,2,A,《全面风险管理框架》称：“全面风险管理是一个动态过程。这个过程受董事会、管理层和其他人员的影响。”,0,0
3,(判断题)按照我国反洗钱法律法规的有关规定，大额交易都应当报告。(),<p>A正确</p><p>B错误</p>,2,B,大额交易中，《金融机构大额交易和可疑交易报告管理办法》规定了九类可以免予报告的大额交易。因此，题干说法太绝对。,0,0
3,(判断题)根据规定，商业银行的资本充足率不得低于4%。(),<p>A正确</p><p>B错误</p>,2,B,商业银行贷款，应当遵守下列资产负债比例管理的规定：(1)资本充足率不得低于8%；(2)贷款余额与存款余额的比例不得超过75%；(3)流动性资产余额与流动性负债余额的比例不得低于25%；(4)对同一借款人的贷款余额与商业银行资本余额的比例不得超过10%；(5)国务院银行业监督管理机构对资产负债比例管理的其他规定。,0,0
3,(判断题)持票人对支票出票人的权利，自出票日起3个月内不行使而消灭。(),<p>A正确</p><p>B错误</p>,2,B,票据权利在下列期限内不行使而消灭：持票人对票据的出票人和承兑人的权利，自票据到期日起2年，见票即付的汇票、本票，自出票日起2年；持票人对支票出票人的权利，自出票日起6个月；持票人对前手的追索权，自被拒绝承兑或者被拒绝付款之日起6个月，持票人对前手的再追索权，自清偿日或者被提起诉讼之日起3个月。,0,0
3,(判断题)银行业金融机构对违法的票据予以承兑、付款、保证，侵犯了国家对票据的管理制度，行为人主观方面是故意，且必须对造成的重大损失有明确的认识。(),<p>A正确</p><p>B错误</p>,2,B,对违法票据予以承兑、付款、保证罪，是指银行或其他金融机构的工作人员在票据业务中，对违反《票据法》规定的票据予以承兑、付款或者保证，造成重大损失的行为。本罪主观方面一般是故意，也可能是过失。对造成重大损失，行为人不需要明确认识到。,0,0
3,(判断题)明知是假币的情况下，把假币赠予他人也应列为使用假币罪。(),<p>A正确</p><p>B错误</p>,2,A,持有、使用假币罪中的“使用”可以是以外表合法的方式使用，如购买商品、兑换他种货币、存入银行、赠予他人、缴纳罚款等，也可以是以非法的方式使用，如用于赌博等。,0,0
3,(判断题)除活期存款在每季结息日将利息计人本金作为下季度的本金计算复利外，其他存款不论存期多长，一律不计复利。(),<p>A正确</p><p>B错误</p>,2,A,暂无解析,0,0
3,(判断题)如果是对银行有利的消息，该银行从业人员可以随意将消息发布给媒体。(),<p>A正确</p><p>B错误</p>,2,B,银行业从业人员应当遵守所在机构关于接受媒体采访的规定，不擅自代表所在机构接受新闻媒体采访，或不擅自代表所在机构对外发布信息。,0,0
3,(判断题)中国人民银行作为特殊的国家机关，可以依赖《中国人民银行法》的有关规定从事以取得盈利为目的的金融业务活动。(),<p>A正确</p><p>B错误</p>,2,B,中国人民银行的经营不能以盈利为目的。,0,0
3,(判断题)银行业是一个信息对称程度很高的行业，在创新方面，信息对称程度更高。(),<p>A正确</p><p>B错误</p>,2,B,银行业是一个信息不对称程度很高的行业，在创新方面，信息不对称程度更高。,0,0
