1,(单选题)撤销权应自债权人知道或者应当知道撤销事由之日起_____内行使，自债务人的行为发生之日起_____内没有行使的，撤销权消灭。(),<p>A半年；1年</p><p>B1年；2年</p><p>C1年；5年</p><p>D2年；5年</p>,4,C,撤销权的行使有一定的时效限制，即撤销权自债权人知道或者应当知道撤销事由之日起1年内行使。自债务人的行为发生之日起5年内没有行使撤销权的，该撤销权消灭。,0,0
1,(单选题)根据《物权法》的有关规定，下列关于抵押的说法中正确的是()。,<p>A债权人不占有债务人或第三人用于抵押的财产</p><p>B债权人任何时候都无权就抵押财产优先受偿</p><p>C抵押需将财产移交给债权人，一旦债务人不能履行到期债务，可直接用于清偿</p><p>D抵押财产的使用权归债权人所有</p>,4,A,所谓抵押是指为担保债务的履行，债务人或者第三人不转移财产的占有，将该财产设定为担保物，债务人不履行到期债务或者发生当事人约定的实现担保物权的情形，债权人有权就该财产优先受偿。作为抵押物的财产既可以是动产，也可以是不动产。以抵押方式设定的担保方式最突出的特点在于不转移财产的占有，所以抵押财产的使用权在抵押期间仍归债务人所有。,0,0
1,(单选题)企业A与企业B签订合同，为其提供某项工程的建设施工。企业B若担心企业A不能如期完工而给自己经营造成损失，可以要求企业A向银行申请()。,<p>A项目贷款承诺</p><p>B开立信贷证明</p><p>C履约保函</p><p>D借款保函</p>,4,C,该事项具有担保性质，为保证客户履行约定，故选择C。,0,0
1,(单选题)根据公司资本制度要求，公司增加或减少注册资本，须由股东大会作出决议，并由代表()以上表决权的股东通过。,<p>A2/3</p><p>B1/2</p><p>C1/3</p><p>D1/5</p>,4,A,公司增加或减少注册资本，须由公司股东会（或股东大会）作出决议，并由代表2/3以上表决权的股东通过，并须进行相应的变更登记。,0,0
1,(单选题)在商业银行违反有关法律规定的法律责任形式中，行政处罚是()。,<p>A对违反行政纪律的行为给予的行政制裁</p><p>B对触犯《刑法》的行为给予的刑事制裁</p><p>C只针对公民，不针对法人</p><p>D对轻微违法行为，尚不构成犯罪的行为人的法律制裁</p>,4,D,行政处罚是国家行政机关对犯有轻微违法行为，尚不构成犯罪的公民、法人或其他组织的一种法律制裁，是追究法律责任的形式之一。【专家点拨】行政处罚的种类包括：警告、罚款、责令停产停业、暂扣或者吊销许可证、暂扣或者吊销执照、行政拘留以及法律和行政法规规定的其他行政处罚。,0,0
1,(单选题)下列关于无权代理后果的说法，正确的是()。,<p>A第三人主观为故意是无权代理的构成要件</p><p>B无权代理人行为人的行为是违法的</p><p>C在任何情况之下，无权代理人的代理行为后果由代理人承担</p><p>D无权代理经被代理人追认，即直接对被代理人发生法律效力，产生与有权代理相同的法律后果</p>,4,D,无权代理的构成要件为：(1)行为人既没有代理权，也没有令人相信其有代理权的事实或理由；(2)行为人以本人的名义与他人所为的民事行为；(3)第三人须为善意且无过失；(4)行为人的行为不违法；(5)行为人与第三人具有相应的民事行为能力。所以，A、B选项错误；无权代理经被代理人追认，即直接对被代理人发生法律效力，产生与有权代理相同的法律后果。相对人可以催告被代理人在1个月内予以追认。如果得不到本人的追认，第三人也没有撤销其意思表示，则该代理行为无效，由无权代理人承担相应的民事责任。所以，C选项错误，D选项正确。,0,0
1,(单选题)下列关于要约的撤销和撤回的说法，不正确的是()。,<p>A要约既可以撤回也可以撤销</p><p>B要约人确定了承诺期限的要约不可撤销</p><p>C撤销通知应当在受要约人发出承诺之前到达受要约人方才有效</p><p>D受要约人对要约的内容作出实质性变更的，要约可以撤回</p>,4,D,D选项，受要约人对要约的内容作出实质性变更属于要约失效的情形之一，而不属于要约可撤回的情形。,0,0
1,(单选题)中国反洗钱监测分析中心设在()。,<p>A公安部</p><p>B中国人民银行</p><p>C中国银监会</p><p>D中国银联</p>,4,B,中国人民银行设立中国反洗钱监测分析中心。【专家点拨】反洗钱监测分析中心依法履行下列职责：(1)接收并分析人民币、外币大额交易和可疑交易报告；(2)建立国家反洗钱数据库，妥善保存金融机构提交的大额交易和可疑交易报告信息；(3)按照规定向中国人民银行报告分析结果；(4)要求金融机构及时补正人民币、外币大额交易和可疑交易报告；(5)经中国人民银行批准，与境外有关机构变换信息、资料；(6)中国人民银行规定的其他职责。,0,0
1,(单选题)下列关于合同成立的说法，不正确的是()。,<p>A采用合同书形式订立合同的，自双方当事人签字或者盖章时合同成立</p><p>B当事人采用信件、数据电文等形式订立合同的，签订确认书时合同成立</p><p>C采用数据电文形式订立合同的，发件人的主营业地为合同成立的地点</p><p>D当事人采用合同书形式订立合同的，双方当事人签字或者盖章的地点为合同成立的地点</p>,4,C,采用数据电文形式订立合同的，收件入主营业地为合同成立的地点；没有主营业地的，其经常居住地为合同成立的地点。当事人另有约定的，按照其约定。当事人采用合同书形式订立合同的，双方当事人签字或者盖章的地点为合同成立的地点。,0,0
1,(单选题)根据法律规定，我国采取的公司资本制度是()。,<p>A法定资本制度</p><p>B授权资本制度</p><p>C折中资本制度</p><p>D代理资本制度</p>,4,A,公司资本，是股东为达到公司目的所实施的财产出资的总额。公司资本制度是《公司法》确认的资本筹措与运营的重要制度。我国的公司资本制度是法定资本制度。【专家点拨】法定资本制度的特点有：(1)资本法定；(2)强调公司必须有相当的财产与其资本总额相维持；(3)强调公司资本不得任意变更。,0,0
1,(单选题)票据行为中，()是汇票所独有的一种票据行为。,<p>A出票</p><p>B背书</p><p>C承兑</p><p>D保证</p>,4,C,票据行为是指以发生、变更或消灭票据的权利义务关系为目的的法律行为，包括出票、背书、承兑、保证。其中，承兑是汇票所独有的一种票据行为。,0,0
1,(单选题)某城市商业银行为争揽储户，在存款时以先支付利息等手段来吸引公众存款，这种行为属于非法吸收公众存款罪中的()。,<p>A主体不合法</p><p>B客体不合法</p><p>C方式不合法</p><p>D对象不合法</p>,4,C,非法吸收公众存款罪中，“非法”包括主体不合法和方式不合法两种情况：一种是行为人不具有吸收公众存款的法定资格而吸取公众存款，如个人私设银行、钱庄，企事业单位私设银行、储蓄所等，非法办理存款贷款业务，吸收公众存款；另一种是行为人虽然有吸收公众存款的法定资格，但采取非法的方式吸收公众存款，如有些商业银行和信用社，为争揽客户，以擅自提高利率或在存款时以先支付利息等手段吸收公众存款。,0,0
1,(单选题)下列有关票据行为的表述，正确的是()。,<p>A承兑只适用于汇票和本票</p><p>B背书只能在汇票上进行</p><p>C汇票的出票人可以是银行</p><p>D保证可以适用于支票</p>,4,C,票据行为是指以发生、变更或消灭票据的权利义务关系为目的的法律行为，包括出票、背书、承兑、保证。承兑为汇票所独有，故A选项表述错误。背书适用于汇票、本票和支票，故B选项表述错误。保证适用于汇票和本票，不适用于支票，故D选项表述错误。汇票分为银行汇票和商业汇票。其中银行汇票是由出票银行签发的，商业汇票是由出票人签发的，出票人一般是企业。故C选项表述正确。,0,0
1,(单选题)根据《民法通则》的规定，法人应具备的条件中，不属于法人成立要件的是()。,<p>A有必要的财产和经费</p><p>B以营利为目的</p><p>C有自己的名称和场所</p><p>D能够独立承担民事责任</p>,4,B,《民法通则》第37条规定，法人应当具备下列条件：(1)依法成立；(2)有必要的财产和经费；(3)有自己的名称、组织机构和场所；(4)能够独立承担民事责任。以营利为目的不是法人成立的要件，如事业单位法人是指从事非营利性的社会公益事业的法人。,0,0
1,(单选题)王某在使用信用卡过程中，超过规定的限额进行投资，发卡银行再三催讨欠款，王某故意不予理会，经银行核实，王某完全没有偿还能力。王某的行为()。,<p>A是合法的，因为王某使用的是自己的信用卡，而信用卡本身就是具有透支功能的</p><p>B是合法的，因为王某没有伪造、使用作废的或冒用他人的信用卡</p><p>C是不合法的，因为王某恶意透支了信用卡</p><p>D是不合法的，因为王某冒用了他人的信用卡</p>,4,C,信用卡诈骗罪，是指使用伪造的信用卡，或者使用以虚假的身份证明骗领的信用卡，或者使用作废的信用卡，或者冒用他人的信用卡，或者使用信用卡恶意透支进行诈骗活动，数额较大的行为。由题意可知，王某恶意透支了信用卡，所以是不合法的。,0,0
1,(单选题)从民事法律行为来说，某商业银行授权其业务经理李某与客户商谈业务并签订合同，该代理属于()。,<p>A指定代理</p><p>B法定代理</p><p>C委托代理</p><p>D业务代理</p>,4,C,《民法通则》第64条规定，代理包括法定代理、委托代理和指定代理。委托代理是根据被代理人的委托授权而产生的代理关系，一般建立在特定的基础法律关系之上，可以是劳动合同关系、合伙关系、工作职务关系，而多数是委托合同关系。商业银行授权其业务经理与客户进行业务往来是根据商业银行的委托授权而产生的代理关系，属于委托代理。,0,0
1,(单选题)根据我国法律的规定，金融诈骗罪的违法行为不包括()。,<p>A自制信用卡从银行提款机取款</p><p>B上市公司董事长变更，没有进行披露</p><p>C提供虚假财务报表，获取银行贷款</p><p>D编造引进资金的理由从银行贷款</p>,4,B,金融诈骗罪，是指在金融活动中，违反金融管理法规，采取虚构事实或者隐瞒真相的方法，以非法占有为目的，骗取数额较大的财物的行为。B选项属于违规行为，不属于金融诈骗罪的违法行为。,0,0
1,(单选题)甲企业与其债权人乙企业协议拍卖甲的抵押物以偿还乙的债务，但该协议损害了甲的另一债权人丙银行的利益。根据规定，丙银行可以在知道该协议之日起()个月内请求人民法院撤销该协议。,<p>A3</p><p>B6</p><p>C9</p><p>D12</p>,4,D,债务人不履行到期债务或者发生当事人约定的实现抵押权的情形，抵押权人可以与抵押人协议以抵押财产折价或者以拍卖、变卖该抵押财产所得的价款优先受偿。协议损害其他债权人利益的，其他债权人可以在知道或者应当知道撤销事由之日起1年内请求人民法院撤销该协议。,0,0
1,(单选题)下列机构从业人员中，不属于必须遵守《银行业从业人员职业操守》的人员是()。,<p>A商业银行工作人员</p><p>B基金管理公司工作人员</p><p>C政策性银行工作人员</p><p>D农村信用社工作人员</p>,4,B,银行业从业人员是指在中国境内设立的银行业金融机构工作的人员。商业银行、政策性银行、农村信用社均为《银行业监督管理法》规定的银行业金融机构，其工作人员即为银行业从业人员，因此，均应遵守《银行业从业人员职业操守》的内容。,0,0
1,(单选题)下列不属于破坏金融管理秩序的行为是()。,<p>A银行工作人员为不符合条件的社会公益组织出具资信证明</p><p>B银行根据客户的指示，运用客户的资金进行债券投资</p><p>C收买他人银行信用卡信息资料</p><p>D某公司根据自身资金需要，吸收社会公众存款</p>,4,B,金融管理秩序是银行管理秩序、货币管理秩序、外汇管理秩序、信贷管理秩序、证券管理秩序、票据管理秩序、保险管理秩序等的总称，侵犯其中任何一种秩序都属于侵害金融管理秩序。A选项属于非法出具金融票据罪；C选项属于伪造、变造金融票证罪；D选项属于非法吸收公众存款罪。,0,0
1,(单选题)下列行为不符合《银行业从业人员职业操守》中关于银行业从业人员与同事之间相关规定的是()。,<p>A尊重同事的工作方式及工作成果</p><p>B尊重同事的爱好及个人信仰</p><p>C引用共同成果需经所在机构及同事的同意与授权</p><p>D将同事的不当行为通知媒体</p>,4,D,根据《银行业从业人员职业操守》中“互相监督”原则规定，对于同事非故意的违反规章行为要及时地进行善意的提示，对违规行为要及时制止，不能制止的，要及时向所在机构、银行业协会、监管者及公检法等部门报告（而不是通知媒体）。故D选项符合题意。【专家点拨】根据《银行业从业人员职业操守》中“尊重同事”的要求，银行业从业人员应当尊重同事，不得因同事的国籍、肤色、民族、年龄、性别、宗教信仰、婚姻状况、身体健康或残障而进行任何形式的骚扰和侵害。禁止带有任何歧视性的语言和行为。故B选项不符合题意。“尊重同事”还要求尊重同事的个人隐私，工作中接触到同事个人隐私的，不得擅自向他人透露。尊重同事的工作方式和工作成果，不得不当引用、剽窃同事的工作成果，不得以任何方式予以贬低、攻击、诋毁。故A、C选项不符合题意。,0,0
1,(单选题)持票人对票据的出票人和承兑人的权利，自票据到期日期()内不行使，票据权利消灭。,<p>A3个月</p><p>B6个月</p><p>C1年</p><p>D2年</p>,4,D,持票人对票据的出票人和承兑人的权利，自票据到期日期2年内不行使，票据权利消灭。,0,0
1,(单选题)下列不属于银行工作人员违反内幕交易的行为是()。,<p>A银行工作人员无意透漏给家人某机构投资者近期面临的重大诉讼信息</p><p>B银行工作人员匿名开设账户进行股票投资</p><p>C工作休息期间，银行工作人员可以和同事谈论工作话题</p><p>D银行工作人员不得随便将涉及内幕信息的资料委托其他部门同事进行保管</p>,4,D,作为一名银行业从业人员，应该熟知相关法律法规以及职业操守对内幕信息和内幕交易的禁止规定，在日常工作和生活中，恪守有关内幕信息和内幕交易的禁止性规定：(1)不在不当时间和地点谈论工作话题；(2)不以明示或暗示的方式向不应该知道该项信息的内部人员提及内幕信息；(3)不违反有关规定，将内幕信息以明示或暗示的方式告知自己的亲友；(4)按照内部秘密信息保管规定妥善保管涉及内幕信息的文件和电子文档；(5)不得采取匿名、假名或委托他人利用内幕信息进行内幕变易，为自己谋取不当利益。,0,0
1,(单选题)根据规定，银行工作人员为客户服务时要做风险提示，下列做法不正确的是()。,<p>A提醒客户留意合约中的免责条款</p><p>B向客户承诺产品收益</p><p>C给客户做产品的风险提示</p><p>D根据客户需求推荐适合的产品</p>,4,B,向客户推荐产品或提供服务时，银行业从业人员应当根据监管规定要求，对所推荐的产品及服务涉及的法律风险、政策风险以及市场风险等进行充分的提示，对客户提出的问题应当本着诚实信用的原则答复，不得为达成交易而隐瞒风险或进行虚假或误导性陈述，并不得向客户作出不符合有关法律法规及所在机构有关规章制度的承诺或保证。,0,0
1,(单选题)根据《反洗钱法》的规定，金融机构在反洗钱方面的义务之一是建立()制度。,<p>A居民身份识别</p><p>B客户身份识别</p><p>C公民身份识别</p><p>D法人身份识别</p>,4,B,根据《反洗钱法》的规定，金融机构在反洗钱方面的义务主要有：(1)健全反洗钱内控制度；(2)建立客户身份识别制度；(3)金融机构应当按照规定建立客户身份资料和交易记录保存制度；(4)金融机构应当按照规定执行大额交易和可疑交易报告制度；(5)金融机构应当按照反洗钱预防、监控制度的要求，开展反洗钱培训和宣传工作。,0,0
1,(单选题)某上市银行职员获知该银行正面临诉讼，但外界尚不知情，消息一旦传出该银行股票价格很可能下跌，则该职员()。,<p>A应建议自己的朋友马上卖掉持有的该银行股票</p><p>B应向社会公众透露这个消息，以尽到信息披露的职责</p><p>C秘密卖掉自己持有的该银行的股票，但不能告知他人</p><p>D不能利用此信息进行该银行股票的买卖，也不能将信息告知他人</p>,4,D,银行业从业人员在业务活动中应当遵守有关禁止内幕交易的规定，不得将内幕信息以明示或暗示形式告知法律和所在机构允许范围以外的人员，不得利用内幕信息获取个人利益，也不得基于内幕信息为他人提供理财或投资方面的建议。,0,0
1,(单选题)某上市银行工作人员小王在编制本行年度报告的过程中，建议其亲友购买该银行的股票，此行为违反了职业操守的()规定。,<p>A内幕交易</p><p>B监管规避</p><p>C利益冲突</p><p>D信息保密</p>,4,A,根据《证券法》的规定，内幕交易主要包括下列行为：(1)内幕信息知情人利用内幕信息买卖证券，或者根据内幕信息建议他人买卖证券的行为；(2)内幕信息知情人向他人泄露内幕信息，使他人利用该信息获利的行为；(3)非内幕信息知情人通过不正当的手段或者其他途径获得内幕信息，并根据该内幕信息买卖证券，或者建议他人买卖证券的行为。,0,0
1,(单选题)下列不属于商业银行不正当竞争的行为是()。,<p>A有奖储蓄</p><p>B放松现金管制</p><p>C对其他金融机构采取压票或退票</p><p>D降低利率吸收储蓄</p>,4,D,商业银行的竞争必须是正当的，不得从事不正当竞争行为。目前，我国商业银行不正当竞争行为的具体表现为：一是利率方面的不正当竞争（贴息、放松现金管制）；二是金融服务方面的不正当竞争（封锁有关金融信息，对其他金融机构采取压票、退票、压汇等方式）。现实中常见到的不正当竞争行为主要有有奖储蓄，储蓄赠送物品、现金等。,0,0
1,(单选题)下面各组金融工具中，按职能划分搭配错误的是()。,<p>A用于保值投机目的期权、期货</p><p>B用于支付回购协议</p><p>C用于投资、筹资可转换公司债券</p><p>D用于商品流通银行承兑汇票</p>,4,B,金融工具中，按职能划分：用于投资和筹资；用于支付、便于商品流通的；用于保值、投机。用于支付和商品流通的金融工具主要是指各种票据。回购协议是指债券买方在卖出同时，承诺在指定时间内按协议价格购回这笔债券。这是用于暂时的融资筹资的，当资本无法周转时卖出公司债券，当资金问题得到解决时再回购从而实现一个筹资的功效。,0,0
1,(单选题)下列违反《银行业从业人员职业操守》中“信息保密”规定的是()。,<p>A把VIP客户资料泄露给其他机构</p><p>B向有权查询的机构提供客户账户信息</p><p>C向反洗钱监管部门提供反洗钱信息</p><p>D离职后不透露离职前获知的客户交易信息</p>,4,A,根据《银行业从业人员职业操守》中“信息保密”的要求，银行业从业人员应当妥善保存客户资料及其交易信息档案。在受雇期间及离职后，均不得违反法律法规和所在机构关于客户隐私保护的规定，不得透露任何客户资料和交易信息。故A选项符合题意，D选项不符合题意。【专家点拨】根据“协助执行”的要求，银行业从业人员应当按法定程序积极协助执法机关的执法活动，提供查询机构法定权限内的事项，“协助执行”与“信息保密”并不冲突。故B选项不符合题意。根据“反洗钱”的要求及《反洗钱法》的规定，银行业从业人员应当协助反洗钱调查。故C选项不符合题意。,0,0
1,(单选题)根据规定，银行业从业人员对暂时无法满足或明显不合理的客户要求，应当()。,<p>A耐心说明情况，取得理解和谅解</p><p>B直接拒绝</p><p>C尽力满足</p><p>D向上级汇报，由上级设法解决</p>,4,A,银行业从业人员在接洽业务过程中，应当衣着得体、态度稳重、礼貌周到。对客户提出的合理要求尽量满足，对暂时无法满足或明显不合理的要求，应当耐心说明情况，取得理解和谅解。,0,0
1,(单选题)与其他一般企业相比，银行的突出特点表现为()。,<p>A低负债经营</p><p>B合伙制经营</p><p>C自有资本较多</p><p>D高负债经营，自有资本较少</p>,4,D,与其他一般企业相比，银行的突出特点是高负债经营，自有资本较少，因此，银行资本发挥的作用比一般企业资本发挥的作用更为重要。,0,0
1,(单选题)已知银行的一个团队中的某个成员将要辞职到竞争对手处工作，则团队的研究成果是否应当与其共享？(),<p>A不应当与其共享</p><p>B该成员有权分享团队的研究成果，并可以将该成果带到新的工作岗位</p><p>C应当与该成员分享成果，因为该成员目前仍是团队的一员</p><p>D可以与其分享部分成果，但工作中应当处处提防该成员，不能再使其利用本团队资源增长工作经验</p>,4,C,“团结合作”要求银行业从业人员在工作中应当树立理解、信任、合作的团队精神，共同创造，共同进步，分享专业知识和工作经验。该同事尚未离职，仍是团队中的一员，因此应当相互信任与合作。故C选项符合题意，A、D选项不符合题意。根据“离职交接”的要求，该成员离职后不能将研究成果带到新机构，否则可能泄露原所在机构的商业秘密。故B选项不符合题意。,0,0
1,(单选题)下列行为中，不属于商业银行操作风险的是()。,<p>A银行贷款人员与贷款企业勾结骗取银行贷款</p><p>B商业银行资金交易员超越权限范围进行交易</p><p>C商业银行理财产品收益率未达到预期收益，从而对银行声誉产生影响</p><p>D由于清算人员过失造成客户证券清算资金未能及时入账</p>,4,C,操作风险是指由不完善或有问题的内部程序、人员及系统或外部事件所造成损失的风险。操作风险可以分为由人员、系统、流程和外部事件所引发的四类风险，并由此分为七种表现形式：内部欺诈，外部欺诈，聘用员工做法和工作场所安全性有同题，客户、产品及业务做法有问题，实物资产损坏，业务中断和系统失灵，执行、交割及流程管理不完善。这七种损失事件还可进一步细化为不同的具体业务活动和操作，使银行管理者可从引起操作风险的具体因素着手采取有效的管理措施。,0,0
1,(单选题)近期传言某银行支行因为一笔违规批贷可能导致重大损失，记者某乙找到他在该支行的一位朋友某甲欲进行采访。在这种情况下，()。,<p>A某甲本着诚实信用的原则，有责任将他所知道的情况对某乙实话实说</p><p>B某甲本着维护所在机构的形象和声誉的原则，应对该传言断然否认</p><p>C只有在某乙答应不对外宣传时，某甲才可以将他所知道的情况告诉某乙</p><p>D某甲不应擅自代表所在机构接受新闻媒体采访</p>,4,D,银行业从业人员应当遵守所在机构关于接受媒体采访的规定，不擅自代表所在机构接受新闻媒体采访，或擅自代表所在机构对外发布信息。,0,0
