1,(单选题)理财业务中，资金的来源为（）。,<p>A投资者投资</p><p>B银行存款</p><p>C同行拆借</p><p>D其他方式</p>,4,A,理财业务中，资金来源为投资者的资金，资金成本较高，需要承担信息披露的义务，充分揭示业务风险，但理论上不承担刚性兑付本息的义务。,0,0
1,(单选题)（)中是不能产生留置权的。,<p>A买卖合同</p><p>B承揽合同</p><p>C保管合同</p><p>D运输合同</p>,4,A,留置权是一项法定担保物权，它是在特定的合同关系中才能产生的，是根据法律规定而不需当事人另行约定。因此，留置权所涉及的留置物必须与它所担保的债权依据的合同有牵连关系。这就决定了留置权只能发生在特定的合同关系中。,0,0
1,(单选题)（)不属于民事法律行为必须具备的条件。,<p>A行为人具有相应的民事行为能力</p><p>B意思表示真实</p><p>C不违反法律或者社会公共利益</p><p>D年龄必须达到18岁以上</p>,4,D,民事法律行为应当具备的条件：行为人具有相应的民事行为能力;意思表示真实;不违反法律或者社会公共利益。,0,0
1,(单选题)（)不属于商业银行的“三性”目标。,<p>A公益性目标</p><p>B安全性目标</p><p>C效益性目标</p><p>D流动性目标</p>,4,A,商业银行的“三性”目标是安全性目标、效益性目标、流动性目标。,0,0
1,(单选题)汇率贴水表示（）。,<p>A远期汇率比即期汇率贵</p><p>B远期汇率比即期汇率便宜</p><p>C市场汇率比官方汇率贵</p><p>D市场汇率比官方汇率便宜</p>,4,B,升水是表示远期汇率比即期汇率贵，贴水则表示远期汇率比即期汇率便宜，平价表示两者相同。,0,0
1,(单选题)甲利用自动存款机，先后三次将手中的假人民币存入银行，数量高达20万余元，则他犯了（)。,<p>A占有假币罪</p><p>B私藏假币罪</p><p>C使用假币罪</p><p>D购买假币罪</p>,4,C,使用假币罪是指明知是伪造的货币而使用，数额较大的行为。所谓数额标准，是指：总面额在四千元以上不满五万元的，属于数额较大;总面额在五万元以上不满二十万元的，属于数额巨大;总面额在二十万元以上的，属于数额特别巨大。题中甲已使用二十万元，已经构成使用假币罪。（本题来自嗨考网）,0,0
1,(单选题)保函和贷款都属于（）。,<p>A表外业务</p><p>B衍生品业务</p><p>C授信业务</p><p>D受信业务</p>,4,C,授信业务包括贷款、贷款承诺、承兑、贸易融资、保理、信用证、保函、透支、担保等表内外业务。,0,0
1,(单选题)大量存款人的挤兑行为可能会导致商业银行面临（）危机。,<p>A流动性</p><p>B操作</p><p>C法律</p><p>D战略</p>,4,A,题干所述情形为商业银行的流动性风险。,0,0
1,(单选题)（）是指为担保债务的履行，债务人或者第三人不转移财产的占有，将该财产设定为担保物，债务人不履行到期债务或者发生当事人约定的实现担保物权的情形，债权人有权就该财产优先受偿。,<p>A留置</p><p>B质押</p><p>C抵押</p><p>D担保</p>,4,C,题干所述为抵押的概念。,0,0
1,(单选题)（)是银行经营发展的根本动力。,<p>A投融资需求和服务性需求</p><p>B居民与企业储蓄</p><p>C利息收入</p><p>D贯彻国家经济政策</p>,4,A,投融资需求支持贷款业务的发展，而存贷利息差是银行的主要收入来源；服务性需求支持银行中间业务的发展，中间业务又会给银行带来可观的手续费收入。因此，银行经营发展的根本动力是投融资需求和服务性需求。,0,0
1,(单选题)甲银行工作人员制作虚假的银行存单交付张三属于（)。,<p>A金融凭证诈骗罪</p><p>B普通民事纠纷</p><p>C非法吸收公众存款罪</p><p>D伪造、变造金融票证罪</p>,4,D,伪造、变造金融票证罪的犯罪客观方面表现为伪造、变造金融票据的行为。,0,0
1,(单选题)第三产业不包括（)。,<p>A计算机服务和软件业</p><p>B交通运输</p><p>C建筑业</p><p>D教育、环境和公共设施管理业</p>,4,C,我国的产业划分为三类：第一产业，是指农、林、牧、渔业;第二产业，是指采矿业，制造业，电力、燃气及水的生产和供应业，建筑业;第三产业，是指除第一、二产业以外的其他行业，主要包括交通运输、仓储和邮政业，信息传输、计算机服务和软件业，批发和零售业，住宿和餐饮业，金融业，房地产业，租赁和商务服务业，科学研究、技术服务和地质勘察业，水利、环境和公共设施管理业，居民服务和其他服务业，教育、卫生、社会保障和社会福利业，文化、体育和娱乐业，公共管理和社会组织，国际组织。,0,0
1,(单选题)（）是无民事行为能力人。,<p>A年满18周岁且精神正常的自然人</p><p>B年满10周岁但精神正常的未成年人</p><p>C不能完全辨认自己行为的成年精神病人</p><p>D年满16周岁不满18周岁并以自己的劳动收入为主要生活来源且精神正常的自然人</p>,4,C,我国法律规定，不满10周岁的未成年人及不能辨认自己行为的精神病人是无民事行为能力人，民事活动由他的法定代理人代理。,0,0
1,(单选题)盗窃信用卡并使用的，应该被定为（)。,<p>A信用卡诈骗罪</p><p>B盗窃罪</p><p>C金额诈骗罪</p><p>D破坏银行管理罪</p>,4,B,信用卡诈骗罪，是指使用伪造的信用卡，或者使用以虚假的身份证明骗领的信用卡，或者使用作废的信用卡，或者冒用他人的信用卡，或者利用信用卡恶意透支进行诈骗活动，数额较大的行为。盗窃信用卡并使用的，定盗窃罪。,0,0
1,(单选题)当中央银行提高法定存款准备金率时，市场的反应通常是（)。,<p>A商业银行可用资金增多，贷款下降，导致货币供应量减少</p><p>B商业银行可用资金减少，贷款上升，导致货币供应量增多</p><p>C商业银行可用资金减少，贷款下降，导致货币供应量减少</p><p>D商业银行可用资金增多，贷款上升，导致货币供应量增多</p>,4,C,央行提高法定存款准备金率，导致商业银行可用资金减少，进而收缩贷款，最终导致货币供应量减少。（本题来自嗨考网）,0,0
1,(单选题)（)构成保险诈骗罪。,<p>A计算错误而多报了事故损失并因此获取了保险金的</p><p>B行为人出于过失行为而引起保险事故发生</p><p>C因认识错误而认为发生实际未发生的保险事故</p><p>D编造未曾发生的保险事故，投保人、被保险人故意造成财产损失保险事故</p>,4,D,"ABC均不属于保险诈骗罪,选择D",0,0
1,(单选题)（)是银行同业自我管理与约束的过程。,<p>A银行自我监管</p><p>B外部监管</p><p>C行业自律</p><p>D市场约束</p>,4,C,银行同业组织的行业自律是银行同业自我管理与约束的过程。,0,0
1,(单选题)近期传言某银行支行因为一笔违规批贷可能导致重大损失，记者王某找到他在该支行的一位朋友张某欲进行采访。这种情况下（)。,<p>A张某本着诚实信用的原则，有责任对王某将他所知道的情况实话实说</p><p>B张某本着维护所在机构的形象和声誉的原则，应对该传言断然否认</p><p>C如果王某答应不对外宣传，张某就可以将他所知道的情况告诉王某</p><p>D张某不应擅自代表所在机构接受新闻媒体采访</p>,4,D,银行业从业人员应当遵循所在机构关于接受媒体采访的规定，不擅自代表所在机构接受新闻媒体采访或擅自代表所在机构对外发布信息。任何不慎重的言论都可能影响银行声誉，给银行带来声誉风险。,0,0
1,(单选题)（)是指由国务院授权成立的中国银行业监督管理委员会同意监督管理银行、金融资产管理公司、信托投资公司及其他存款类金融机构，维护银行业的合法、稳健运行。,<p>A银行自我监管</p><p>B银行业外部监管</p><p>C行业自律</p><p>D市场约束</p>,4,B,银行业外部监管是监管的最高层次，是由国务院授权成立的中国银行业监督管理委员会同意监督管理银行、金融资产管理公司、信托投资公司及其他存款类金融机构，维护银行业的合法、稳健运行。,0,0
1,(单选题)（）是指权利人依法对他人的物，依照法律的规定享有占有、使用、收益的权利。,<p>A所有权</p><p>B用益物权</p><p>C担保物权</p><p>D支配权</p>,4,B,用益物权是指权利人依法对他人的物，依照法律的规定享有占有、使用、收益的权利。,0,0
1,(单选题)按照金融工具的职能，用于投资和筹资的工具是（）。,<p>A股票</p><p>B期权</p><p>C期货</p><p>D票据</p>,4,A,用于投资和筹资的工具是股票、债券等。,0,0
1,(单选题)2014年11月某日，中国外汇市场牌价为1美元=6.45元人民币，1英镑=1.56美元，请用直接标价法标出英镑与人民币的汇率（）。,<p>A10.06</p><p>B4.13</p><p>C0.24</p><p>D11.37</p>,4,A,用直接标价法应是：1英镑=6.451.56≈10.06人民币。,0,0
1,(单选题)（)是汽车金融公司的监管机构。,<p>A中国人民银行</p><p>B银监会</p><p>C中国证监会</p><p>D中国银行业协会</p>,4,B,由银监会负责监管的非银行金融机构包括金融资产管理公司、信托公司、企业集团财务公司、金融租赁公司、汽车金融公司、货币经纪公司。（本题来自嗨考网）,0,0
1,(单选题)间接融资工具不包括（)。,<p>A银行贷款</p><p>B银团贷款</p><p>C债券</p><p>D银行承兑汇票</p>,4,C,债券属于直接融资工具，银行贷款、银团贷款和银行承兑汇票属于间接融资工具。,0,0
1,(单选题)（)是商业银行证券投资的主要对象。,<p>A国债</p><p>B金融债券</p><p>C中央银行票据</p><p>D企业债券</p>,4,A,中央银行票据是商业银行债券投资的重要对象，两者应区分开。,0,0
1,(单选题)（)的主要优点是可以通过出售资产节约或减低资本费用，还可以为发行银行带来额外的收入。,<p>A收益率曲线</p><p>B表内资产负债匹配</p><p>C资产证券化</p><p>D经济资本</p>,4,C,资产证券化的主要优点是可以通过出售资产节约或减低资本费用，还可以为发行银行带来额外的收入。,0,0
2,(多选题)下列选项中，（)没有违反“公平对待”原则。,<p>A为外国客户制定较高费率</p><p>B为VIP客户提供贵宾理财室</p><p>C为残疾人开设特别服务窗口</p><p>D为VIP客户提供专业理财师服务</p><p>E对小客户的小额业务拒绝办理</p>,5,BCD,“公平对待”原则要求银行业从业人员应当公平对待所有客户，不得因客户的国籍、肤色、民族、性别、年龄、宗教信仰、残障及业务的繁简程度和金额大小等方面的差异而歧视客户，对有残障的客户，应该尽量为其提供便利。为VIP客户提供贵宾理财室和专业理财师服务是因所在机构与客户之间的契约而产生的服务方式的差异，并不违反“公平对待”原则。,0,0
2,(多选题)关于违法票据承兑、付款、保证罪的量刑，下列表述正确的有（)。,<p>A违犯本罪的，造成重大损失，处5年以下有期徒刑或者拘役</p><p>B造成重大损失的，处2万元以上20万元以下罚金</p><p>C造成特别重大损失的，处5年以上有期徒刑</p><p>D造成特别重大损失的，处5万元以上50万元以下罚金</p><p>E单位犯本罪的，实行双罚制，即对单位判处罚金，并对其直接负责的主管人员和其他直接负责人员按照上述规定处罚</p>,5,ACE,B项的行为应处以5年以下有期徒刑或拘役。D项的行为应处以5年以上有期徒刑。,0,0
2,(多选题)我国货币政策的中介目标是货币供应量，通常所说的M1不包括（）。,<p>A在银行体系以外流通的现金</p><p>B农村存款</p><p>C企业单位定期存款</p><p>D证券公司保证金存款</p><p>E企业单位活期存款</p>,5,CD,M1=M0+企业单位活期存款+农村存款+机关团体部队存款+银行卡项下的个人人民币活期储蓄存款。,0,0
2,(多选题)商业银行根据授信形式不同，可以将客户授信额度分为（)。,<p>A贷款额度</p><p>B开证额度</p><p>C开立保函额度</p><p>D开立银行承兑汇票额度</p><p>E进口保理额度</p>,5,ABCDE,按照授信形式的不同，可分为贷款额度、开证额度、开立保函额度、开立银行承兑汇票额度、承兑汇票贴现额度、进口保理额度、出口保理额度、进口押汇额度、出口押汇额度等业务品种分项额度。,0,0
2,(多选题)属于法定继承人的有（）。,<p>A养子女、养父母</p><p>B婚生子女</p><p>C非婚生子女</p><p>D父母</p><p>E配偶</p>,5,ABCDE,本题考查法定继承人,0,0
2,(多选题)关于手机银行和电话银行，下列说法不正确的有（)。,<p>A电话银行业务是银行通过电话自动语音及人工服务应答（客户服务中心）方式，为客户提供的银行服务</p><p>B手机银行就是用手机拨打的电话银行</p><p>C电话银行提供的服务包括各类账户之间的转账、代收代付、各类个人账户资料的查询、个人实盘外汇买卖等银行服务</p><p>D手机银行和电话银行都属于电子银行</p><p>E手机银行和电话银行的收费都是只收市话费</p>,5,BE,大家需要对手机银行业务和电话银行业务有一个大致的了解。手机银行从服务渠道、接入条件、服务方式、接入费用、申办和使用等方面均有别于电话银行。仅仅使用手机拔打电话银行，还是在使用电话银行服务。手机银行和电话银行都属于提供金融服务，其收费主要是服务费和手续费。电话银行业务是银行通过电话自动语音及人工服务应答（客户服务中心）方式为客户提供的银行服务，而手机银行是银行利用移动电话技术为客户提供的金融服务。它们都属于电子银行，电话银行提供的服务包括各类账户之间的转账、代收代付、各类个人账户资料的查询、个人实盘外汇买卖等银行服务。电子银行渠道主要包括网上银行、电话银行/客户服务中心、手机银行、自助终端。,0,0
2,(多选题)对于利率互换和货币互换的异同，以下说法中正确的是（）。,<p>A它们都是银行常用的金融衍生品，都属于互换</p><p>B利率互换只涉及一种货币，而货币互换通常涉及两种货币</p><p>C当利率看涨时，可将固定利率金融工具转换成浮动利率债务类金融工具</p><p>D利率互换和货币互换均要进行本金的交换</p><p>E最常见的利率互换是在固定利率与浮动利率之间进行转换</p>,5,ABE,当利率看涨时，可将浮动利率债务类金融工具转换成固定利率金融工具。所以C说法有误。利率互换不需要进行本金的交换，所以D说法有误。,0,0
2,(多选题)下列措施中，（)不属于银监会对违反国家有关银行业监督管理规定的处罚措施。,<p>A剥夺政治权利</p><p>B取消董事、高级管理人员任职资格</p><p>C禁止从事银行业工作</p><p>D经济处罚</p><p>E刑事处罚</p>,5,AE,对违反国家有关银行业监督管理规定的银行业等金融机构的工作人员，根据《银行业监督管理法》第四十七条的规定，可以区别不同情形，采取纪律处分、警告、罚款、取消任职资格、禁止从事银行业工作等处罚措施。B、C、D三项都是银监会可以采取的处罚措施。A、E两项属于刑事制裁措施，银监会无权采用。,0,0
2,(多选题)犯罪成立的构成要件是（）。,<p>A犯罪主体</p><p>B犯罪主观方面</p><p>C犯罪客体</p><p>D犯罪客观方面</p><p>E犯罪原因</p>,5,ABCD,犯罪成立的构成要件包括犯罪主体、犯罪主观方面、犯罪客体、犯罪客观方面。,0,0
2,(多选题)某银行支行员工与客户合谋骗贷的行为被同事察觉，该同事应该（)。,<p>A立即劝阻同事停止骗贷，劝阻无效时才向领导举报</p><p>B立即向银行有关领导举报</p><p>C不得擅自代表所在机构对外发布信息</p><p>D不必私下劝阻，以免打草惊蛇</p><p>E向监管部门举报</p>,5,BCDE,根据《银行业从业人员职业操守》的规定，银行业从业人员同事之间应当互相监督，对同事的不合规行为予以提示、制止，并视情况向所在机构或行业自律组织、监管部门、司法机关报告。A项，同事的违规行为情节非常严重，一旦成立会给银行造成巨大损害，故应立即举报;C项，银行业从业人员不得擅自代表所在机构对外发布信息。,0,0
2,(多选题)商业银行的资产业务包括（)。,<p>A贷款业务</p><p>B投资国债</p><p>C现金资产业务</p><p>D购买中央银行票据</p><p>E贸易融资</p>,5,ABCDE,考查资产业务的内容。,0,0
2,(多选题)下列属于国家开发银行经营和办理的业务有（）。,<p>A经国家批准在国外发行债券</p><p>B向国内金融机构发行金融债券</p><p>C向社会发行财政担保建设债券</p><p>D为重点建设项目物色国内外合资伙伴</p><p>E办理建设项目贷款条件评审、担保和咨询等业务</p>,5,ABCDE,考核国家开发银行经营和办理的业务。（本题来自嗨考网）,0,0
2,(多选题)根据《合同法》规定，一方当事人可以请求人民法院或者仲裁机构变更或者撤销合同的情形包括（）。,<p>A因重大误解而订立的</p><p>B在订立合同时显失公平的</p><p>C一方以欺诈、胁迫的手段或者乘人之危，使对方在违背真实意思的情况下订立的</p><p>D合同期限届满</p><p>E行为人利用对方当事人的急迫需求或危难处境，迫使对方违背自己的真实意思而订立的合同</p>,5,ABCE,可撤销的合同类型包括：因重大误解而订立的合同;显失公平的合同;因欺诈而订立的合同;因胁迫而订立的合同;乘人之危的合同。,0,0
2,(多选题)下列情形中，（)可以开立临时存款账户。,<p>A设立临时机构</p><p>B日常转账结算</p><p>C注册验资</p><p>D异地临时经营活动</p><p>E日常现金收付</p>,5,ACD,可以开立临时存款账户的情形包括：设立临时机构;异地临时经营活动;注册验资。B、E两项属于基本存款账户的用途。,0,0
2,(多选题)下列选项中，属于客户隐私的有（)。,<p>A客户的住址</p><p>B客户的婚姻状况</p><p>C客户的财务状况</p><p>D客户的住房情况</p><p>E客户的身份证号码</p>,5,ABCDE,客户隐私主要是指个人客户的婚姻及家庭状况及其他不愿被他人所知悉、掌握的情况，包括婚姻状况、家庭住址、电话号码、身份证号码、财产、住房等信息。,0,0
2,(多选题)关于旅行支票，下列说法正确的有（)。,<p>A是由银行等机构为方便国际旅行者在旅行期间安全携带和支付费用而签发的一种固定面额票据</p><p>B可在世界许多大银行、兑换网点兑换现金</p><p>C可在一些国际酒店、餐厅等场所直接付账</p><p>D在欧美国家使用便捷</p><p>E若不慎丢失或被盗，可办理挂失、理赔和紧急补偿</p>,5,ABCDE,旅行支票在很多方面已接近现金且免去兑换的麻烦，还能挂失、理赔和紧急补偿，具有现金不具备的先进性，为旅行者提供了很大的方便。,0,0
2,(多选题)我国银行信贷管理一般实行（)、集中授权管理、贷款管理责任制相结合。,<p>A统一授信管理</p><p>B审贷分离</p><p>C分级审批</p><p>D分级授信</p><p>E统一审批</p>,5,ABC,目前我国银行信贷管理一般实行集中授权管理、统一授信管理、审贷分离、分级审批、贷款管理责任制相结合，以切实防范、控制和化解贷款业务风险。,0,0
2,(多选题)内部控制的构成要素包括（)。,<p>A风险识别与评估</p><p>B内部控制环境</p><p>C内部控制措施</p><p>D监督评价与纠正</p><p>E信息交流与反馈</p>,5,ABCDE,内部控制的构成要素包括：内部控制环境;风险识别与评估;内部控制措施;信息交流与反馈;监督评价与纠正。,0,0
2,(多选题)近年来，在合并农村信用社的基础上组建的农村金融机构有（）。,<p>A农村商业银行</p><p>B村镇银行</p><p>C农村合作银行</p><p>D中国农业银行</p><p>E农村资金互助社</p>,5,AC,农村商业银行和农村合作银行是在合并农村信用社的基础上组建的。,0,0
2,(多选题)根据《银行业从业人员职业操守》，银行业从业人员在与客户的接触中，做法不当的有（）。,<p>A邀请客户在员工餐厅吃工作餐</p><p>B客户是上帝，应当满足客户的一切要求</p><p>C每天都有与客户的娱乐活动</p><p>D在过年时向客户寄送贺年卡并打电话问候</p><p>E赠送客户当地商场消费卡</p>,5,BCE,其他两项都在政策法律及商业习惯允许范围内。,0,0
2,(多选题)商业银行的负债业务的构成主要有（)。,<p>A贷款</p><p>B存款</p><p>C借款</p><p>D债券</p><p>E股票</p>,5,BC,商业银行的负债业务由存款和借款组成。这两者都不是银行自有资金，是银行有偿还义务的负债。贷款和债券投资是银行的资产业务，目前国内不允许商业银行进行股票投资。（本题来自嗨考网）,0,0
2,(多选题)商业银行的流动性是商业银行满足存款人提取现金、支付到期债务和借款人正常贷款需求的能力。下列关于流动性指标说法正确的是（）。,<p>A商业银行的流动性覆盖率是确保商业银行在设定的严重流动性压力情景下，能够保持充足的、无变现障碍的优质流动性资产，并通过变现这些资产来满足未来30日的流动性需求</p><p>B商业银行的流动性覆盖率应当不低于25%</p><p>C净稳定资金比例是引导商业银行减少资金运用于资金来源的期限错配，增加长期稳定资金来源，满足各类表内业务对稳定资金的需求</p><p>D商业银行的净稳定资金比例应当不低于100%</p><p>E商业银行的流动性比例应当不低于100%</p>,5,ACD,商业银行的流动性覆盖率应当不低于100%，商业银行的流动性比例应当不低于25%。,0,0
2,(多选题)商业银行组织构架是商业银行业务运作和管理实施的组织方式，其主要内容包括（）。,<p>A总部部门的设置及其功能和权限</p><p>B部门之间的相互关系</p><p>C全行业运作的组织构架模式</p><p>D分支机构的功能、权限和部门设置</p><p>E总行对分支机构实施管理的模式</p>,5,ABCDE,商业银行组织构架是商业银行业务运作和管理实施的组织方式，其主要内容包括总部部门的设置及其功能和权限的、部门之间的相互关系，分支机构的功能、权限和部门设置，全行业运作的组织构架模式，总行对分支机构实施管理的模式等。,0,0
2,(多选题)收入结构主要表现为净利息收入与非利息收入。非利息收入主要包括（），它对资本消耗低，风险也易于控制。,<p>A收费收入</p><p>B其他中间业务收入</p><p>C贷款收入</p><p>D营业收入</p><p>E投资业务收入</p>,5,ABE,收入结构主要表现为净利息收入与非利息收入。非利息收入主要包括收费收入、投资业务收入和其他中间业务收入等。,0,0
2,(多选题)授信业务包括（）。,<p>A贷款</p><p>B贷款承诺</p><p>C贸易融资</p><p>D担保</p><p>E再贴现</p>,5,ABCD,授信业务包括：贷款、贷款承诺、承兑、贴现、贸易融资、保理、信用证、保函、透支、担保等表内外业务。,0,0
2,(多选题)金融创新原则中的四个“认识”原则包括（）。,<p>A“认识你的业务”</p><p>B“认识你的风险”</p><p>C“认识你的收益”</p><p>D“认识你的损失”</p><p>E“认识你的交易对手”</p>,5,ABE,四个“认识”原则包括：“认识你的业务”、“认识你的风险”、“认识你的客户”、“认识你的交易对手”。,0,0
2,(多选题)违约责任的承担形式主要包括（）。,<p>A违约金责任</p><p>B赔偿损失</p><p>C强制履行</p><p>D定金责任</p><p>E采取补救措施</p>,5,ABCDE,违约责任的承担形式主要包括违约金责任、赔偿损失、强制履行、定金责任、采取补救措施。,0,0
2,(多选题)伪造、变造金融票证罪客观方面表现为伪造、变造金融票证的行为，包括（）。,<p>A伪造货币</p><p>B伪造、变造汇票、本票、支票</p><p>C伪造、变造委托收款凭证、汇款凭证、银行存单等其他银行结算凭证</p><p>D伪造、变造信用证或附随的单据、文件</p><p>E伪造信用卡</p>,5,BCDE,伪造、变造金融票证罪客观方面表现为伪造、变造金融票证的行为，包括：伪造、变造汇票、本票、支票;伪造、变造委托收款凭证、汇款凭证、银行存单等其他银行结算凭证;伪造、变造信用证或附随的单据、文件;伪造信用卡。,0,0
2,(多选题)我国民事立法确立的原则有（),<p>A平等、自愿原则</p><p>B公平原则</p><p>C诚实信用原则</p><p>D守法原则</p><p>E公序良俗原则</p>,5,ABCDE,我国民事立法确立的原则有平等原则、自愿原则、公平原则、诚实信用原则、守法原则、公序良俗原则、禁止权利滥用原则。,0,0
