2,(多选题)对于到期一次性还本付息法的说法中，正确的有()。,<p>A到期一次还本付息法又称期末清偿法</p><p>B借款人需在贷款到期日还清贷款本息</p><p>C利随本清</p><p>D一般适用于各种期限的固定利率贷款</p><p>E适用于期限在1年以内（含1年）的贷款</p>,5,ABCE,到期一次还本付息法又称期末清偿法，指借款人需在贷款到期日还清贷款本息，利随本清。此种方式一般适用于期限在1年以内的贷款。【专家点拨】长期贷款很少使用一次性还本付息法。,0,0
2,(多选题)个人抵押授信贷款的特点包括()。,<p>A先授信，后用信</p><p>B先用信，后授信</p><p>C一次授信，循环使用</p><p>D一次授信，一次使用</p><p>E贷款用途综合</p>,5,ACE,个人抵押授信贷款的特点为先授信、后用信，一次授信、循环使用，贷款用途综合。,0,0
2,(多选题)有效期内某一时点借款人的可用贷款额度是由()决定的。,<p>A借款人希望得到的贷款数额</p><p>B抵押物价值</p><p>C核定的贷款额度</p><p>D已使用的贷款总额</p><p>E未清偿贷款余额</p>,5,CE,有效期内某一时点借款人的可用贷款额度是由核定的贷款额度和未清偿贷款余额决定的。,0,0
2,(多选题)个人抵押授信贷款中，抵押率根据()因素确定。,<p>A抵押房产的房龄</p><p>B当地房地产价格水平</p><p>C房地产价格走势</p><p>D抵押物变现情况</p><p>E抵押人信用度</p>,5,ABCD,个人抵押授信贷款中，抵押率根据抵押房产的房龄、当地房地产价格水平、房地产价格走势和抵押物变现情况等因素确定。,0,0
2,(多选题)个人教育贷款不同于其他贷款的特点包括()。,<p>A政策性强</p><p>B公益性</p><p>C发放主体不同</p><p>D风险高</p><p>E贷款对象宽泛</p>,5,ABD,从各国发展情况来看，个人教育贷款具有与其他个人贷款所不同的一些特点，主要体现在以下两个方面：①具有社会公益性，政策参与程度较高。个人教育贷款是作为支持教育事业发展的政策性举措推出的，对促进教育事业发展、提高国民素质具有重要作用，因此，个人教育贷款业务的发展会得到国家政策的支持，如国家以承担部分利息的方式对国家助学贷款进行补贴。②多为信用类贷款，风险度相对较高。个人教育贷款的借款人多为在校学生，而学生属于暂时无收入群体，没有现成的资产可作为申请贷款的担保，因而个人教育贷款多为信用贷款，如国家助学贷款。同时，个人教育贷款的偿还主要依靠学生毕业后的工作收入，加之学生信用水平的不确定性，其风险度相对较高。,0,0
3,(判断题)银行市场定位战略建立在自我内部环境分析的基础上。(),<p>A正确</p><p>B错误</p>,2,B,银行市场定位战略建立在对竞争对手和客户需求分析的基础上。,0,0
3,(判断题)由政府部门或机构出资设立的住房置业担保机构或公积金担保中心，其对外担保总额的上限一般不得超过30倍。(),<p>A正确</p><p>B错误</p>,2,A,暂无解析,0,0
3,(判断题)个人贷款中的操作风险包括法律风险和声誉风险，但不包括策略风险。(),<p>A正确</p><p>B错误</p>,2,B,个人贷款中的操作风险包括法律风险，但不包括策略风险和声誉风险。,0,0
3,(判断题)银行未及时办理抵押手续或抵押手续无效而导致抵押物悬空，抵押权力无效，在发生贷款损失需处置抵押品时，银行权利无法得到法律保障。(),<p>A正确</p><p>B错误</p>,2,A,银行未及时办理抵押手续或抵押手续无效而导致抵押物悬空，抵押权力无效，在发生贷款损失需处置抵押品时，银行权利无法得到法律保障。,0,0
3,(判断题)没有参加住房公积金制度的职工就不能申请公积金个人住房贷款。(),<p>A正确</p><p>B错误</p>,2,A,暂无解析,0,0
3,(判断题)借款人的还款能力是个人汽车贷款资金安全的根本保证。(),<p>A正确</p><p>B错误</p>,2,A,本题考查个人汽车贷款信用风险的内容。,0,0
3,(判断题)贷前调查是商业助学贷款贷前处理中非常重要的环节。(),<p>A正确</p><p>B错误</p>,2,A,本题考查商业助学贷款的贷前调查。题干表述正确。,0,0
3,(判断题)在商用房贷款中，保证人经济实力下降或信用状况恶化是导致保证人还款能力下降的主要原因。(),<p>A正确</p><p>B错误</p>,2,A,在商用房贷款中，保证人经济实力下降或信用状况恶化是导致保证人还款能力下降的主要原因。题干表述正确。,0,0
3,(判断题)对个人新发放的小额担保贷款的最高额度为10万元。(),<p>A正确</p><p>B错误</p>,2,B,对个人新发放的小额担保贷款的最高额度为5万元。,0,0
3,(判断题)个人汽车贷款每笔只可以展期一次，但展期期限不限。(),<p>A正确</p><p>B错误</p>,2,B,个人汽车贷款每笔贷款只可展期一次，展期期限不得超过1年，并非不限。,0,0
3,(判断题)目前，查询个人信用报告需要支付一定的成本费用。(),<p>A正确</p><p>B错误</p>,2,B,现在，个人征信系统由政府出资建设管理，查询个人信用报告是征信中心提供的一种服务，原则上需要收取一定的成本费用，但目前暂不收费。,0,0
3,(判断题)在实践中，当借款人采用一种担保方式不能足额对贷款进行担保时，可以组合使用不同的担保方式。(),<p>A正确</p><p>B错误</p>,2,A,在实践中，当借款入采用一种担保方式不能足额对贷款进行担保时，可以组合使用不同的担保方式。,0,0
3,(判断题)当产品的每个不同子市场有不同偏好的消费群体时，银行可以采用市场型营销组织结构。(),<p>A正确</p><p>B错误</p>,2,A,当产品的每个不同子市场有不同偏好的消费群体时，银行可以采用市场型营销组织结构。,0,0
3,(判断题)贷款受托人支付完成后，应详细记录资金流向，归集保存相关凭证。(),<p>A正确</p><p>B错误</p>,2,A,贷款受托人支付完成后，应详细记录资金流向，归集保存相关凭证。,0,0
3,(判断题)集中战略适用于中小型银行。(),<p>A正确</p><p>B错误</p>,2,A,集中策略的优点是能更详细、更透彻地分析和熟悉目标客户的要求，能集中精力、集中资源于某个子市场，营销效果更明显，其所设计出的营销组合更能贴近客户的需求，从而能够使银行在子市场或某一专业市场获得垄断地位。因此适用于资源不多的中小银行。心，把客户终生套牢。,0,0
