1,(单选题)可以采取借款人自主支付方式进行的是（）。,<p>A借款人无法事先确定具体交易对象且金额不超过50万元人民币的</p><p>B借款人交易对象不具备条件有效使用现金结算方式的</p><p>C贷款资金用于生产经营且金额不超过30万元人民币的</p><p>D借款人交易对象不具备条件有效使用非现金结算方式的</p>,4,D,个人贷款原则上应当采用贷款人受托支付的方式向借款人交易对象支付；属于下列情形之一的个人贷款，经借款人同意可以采取借款人自主支付方式：①借款人无法事先确定具体交易对象且金额不超过30万元人民币的；②借款人交易对象不具备条件有效使用非现金结算方式的；③贷款资金用于生产经营且金额不超过50万元人民币的；④法律法规规定的其他情形。 ,0,0
1,(单选题)用有价证券质押贷款的，公积金个人住房贷款的最高贷款额度为有价证券票面金额的（）。,<p>A0.6</p><p>B0.7</p><p>C0.8</p><p>D0.9</p>,4,D,用有价证券质押贷款的，公积金个人住房贷款的最高贷款额度为有价证券票面金额的90%。,0,0
1,(单选题)区域型营销组织结构包括（）。,<p>A一名全国业务经理、若干名地区经理</p><p>B一名全国业务经理、若干名区域经理</p><p>C一名全国业务经理、若干名区域经理和地区经理</p><p>D若干名区域经理</p>,4,C,区域型营销组织的结构为一名负责全国业务的经理、若干名区域经理和地区经理。,0,0
1,(单选题)下岗失业人员小额担保贷款额度起点一般为__________元，对个人新发放的小额担保贷款的最高额度为__________万元。（）,<p>A1500；1</p><p>B2000；5</p><p>C1500；2</p><p>D2000；1</p>,4,B,下岗失业人员小额担保贷款额度起点一般为人民币2000元，单户贷款额度最高不超过2万元。经办金融机构对个人新发放的小额担保贷款的最高额度为5万元。,0,0
1,(单选题)下列关于国家助学贷款风险补偿金管理的说法，错误的是（）。,<p>A经办银行于每年9月底前，将上一年度(上年9月1日至当年8月31日)实际发放的国家助学贷款金额和违约率按照各高校进行统计汇总。经合作高校确认后填制“中央部门所属高校国家助学贷款贴息资金汇总表”上报分行</p><p>B分行按学校和经办银行汇总辖内上报信息后，在10个工作日内上报总行，由总行提交全国学生贷款管理中心</p><p>C全国学生贷款中心在收到经办行总行提交的“风险补偿金申请书”、“中央部门所属高校国家助学贷款贴息资金汇总表”、“中央部门所属高校国家助学贷款风险补偿确认书”后20个工作日内将对应的风险补偿金支付给贷款银行总行</p><p>D总行将风险补偿金划拨至各分行，各分行在收到总行下拨的风险补偿金的当日将其划入对应账户</p>,4,B,分行按学校和经办银行汇总辖内上报信息后，在5个工作日内上报总行，由总行提交全国学生贷款管理中心。,0,0
1,(单选题)市场定位选择的方式有主导式定位、追随式定位和补缺式定位。其中采用补缺式定位的银行具有的特征是（）。,<p>A分支机构不多</p><p>B在市场上占有极大的份额</p><p>C提供的信贷产品较少</p><p>D刚刚进入市场</p>,4,C,本题考查市场定位的选择。选项AD适宜采用追随式定位．选项B适宜采用主导式定位。,0,0
1,(单选题)国家助学贷款的计息方式是（）。,<p>A借款开始时开始计息</p><p>B借款学生毕业后开始计息</p><p>C根据银行不同有所不同</p><p>D毕业的前一年开始计息</p>,4,B,国家助学贷款的计息方式是借款学生毕业后开始计息。,0,0
1,(单选题)个人住房贷款的支付方式有__________和__________两种方式。（）,<p>A委托扣款；柜面还款</p><p>B定期扣款；柜面还款</p><p>C代理还款；委托划款</p><p>D代理还款，柜面还款</p>,4,A,个人住房贷款的支付方式有委托扣款和柜面还款两种方式。,0,0
1,(单选题)关于申请商用房贷款需要具备的条件，下列说法中错误的是（）。,<p>A必须先付清不低于所购或所租的商用房全部价款40%以上的首期付款</p><p>B与开发商签订购买或租赁商用房的合同或协议</p><p>C提供经贷款银行认可的有效担保</p><p>D当前无不利的相关民事纠纷和刑事案件责任</p>,4,A,关于申请商用房贷款，银行要求借款人必须先付清不低于所购或所租的商用房全部价款的50%以上的首期付款，所以A选项说法错误。,0,0
1,(单选题)合理的贷款期限应是（）年。,<p>A5～10</p><p>B10～15</p><p>C15～20</p><p>D20～25</p>,4,C,合理的贷款期限应是15～20年。 ,0,0
1,(单选题)下列关于国家助学贷款催收的说法，错误的是（）。,<p>A各经办银行应建立详细的还贷监测系统</p><p>B各经办银行要加强13常还贷催收工作，做好催收记录，确认借款人已收到催收信息</p><p>C各经办银行应按季将已到还款期的借款学生还款情况反馈给学校，学校负责协助经办银行联系拖欠还款的借款学生及时还款</p><p>D各经办银行应按季将已到还款期的借款学生还款情况通知家长，家长对未还清的贷款负有连带保证责任</p>,4,D,解析：无,0,0
1,(单选题)以下不能办理国家助学贷款的银行是（）。,<p>A中国银行</p><p>B交通银行</p><p>C中国农业银行</p><p>D中国建设银行</p>,4,B,国家助学贷款的经办银行包括中国工商银行、中国农业银行、中国银行和中国建设银行。,0,0
1,(单选题)贷款受理人应要求商用房贷款申请人以（）形式提出贷款申请。,<p>A书面</p><p>B口头</p><p>C电子表格</p><p>D以上都可以</p>,4,A,贷款受理人应要求商用房贷款申请人以书面形式提出贷款申请，填写借款申请书，并按银行要求提交相关申请材料。对于有共同申请人的，应同时要求共同申请人提交有关申请材料。,0,0
1,(单选题)房地产开发商和中介机构的欺诈风险主要表现为（）。,<p>A“假个贷”</p><p>B担保风险</p><p>C中介结构风险</p><p>D市场风险</p>,4,A,房地产开发商将未卖出的楼盘过户给有关联关系的房地产中介公司或个人，房地产中介公司和个人再以购房者的名义以房子为抵押向银行申请个人住房贷款。房地产开发商和中介机构的欺诈风险主要表现为“假个贷”。,0,0
1,(单选题)下列个人经营类贷款类型中．还款方式主要是等额本息还款法和每月还息到期一次还本法的是（）。,<p>A有担保流动资金贷款</p><p>B无担保流动资金贷款</p><p>C商用房贷款</p><p>D设备贷款</p>,4,B,本题考查无担保流动资金贷款的还款方式。选项ACD常用的还款方式是等额本息还款法,0,0
1,(单选题)商业助学贷款的贷款期限为在校学制年限加（）年。,<p>A2</p><p>B4</p><p>C6</p><p>D8</p>,4,C,商业助学贷款的贷款期限为在校学制年限加6年。,0,0
1,(单选题)市场细分中的集中策略适用于（）。,<p>A资源不多的中小银行</p><p>B大中型银行</p><p>C专业性银行</p><p>D投资银行</p>,4,A,市场细分中的集中策适用于资源不多的中小银行。,0,0
1,(单选题)1998年7月3日，“建立和完善以（）为主的多层次城镇住房供应体系”被确定为住房体制改革的基本方向，个人住房贷款业务逐步进入快速发展阶段。,<p>A住房实物分配</p><p>B经济适用住房</p><p>C商品房</p><p>D廉租房</p>,4,B,1998年7月3日，国务院正式宣布停止住房实物分配，逐步实行住房分配货币化，同时，“建立和完善以经济适用住房为主的多层次城镇住房供应体系”被确定为住房体制改革的基本方向，个人住房贷款业务逐步进入快速发展阶段。,0,0
1,(单选题)个人汽车贷款的还款方式不包括（）。,<p>A等额本息还款法</p><p>B等额本金还款法</p><p>C等比累进还款法</p><p>D按月还息任意还本法</p>,4,C,个人汽车贷款的还款方式包括等额本息还款法、等额本金还款法、一次还本付息法、按月还息任意还本法等多种还款方式。,0,0
1,(单选题)贷后检查的主要手段不包括（）。,<p>A监测贷款账户、查询不良贷款明细台账</p><p>B抽查不良贷款</p><p>C电话访谈、见面访谈</p><p>D实地检查、监测资金使用</p>,4,B,贷后检查的主要手段包括监测贷款账户、查询不良贷款明细台账、电话访谈、见面访谈、实地检查、监测资金使用等。其中，对次级、可疑、损失类不良贷款要采取全面检查的方式，每季度至少进行一次贷后检查。,0,0
1,(单选题)审批人员不受干扰，按照（）的原则自主审批贷款，是信贷风险管理的重要保证。,<p>A注重收益</p><p>B注重风险</p><p>C收益与风险平衡</p><p>D收益大于风险</p>,4,C,审批人员按照授权自主审批贷款。审批人员不受干扰，按照收益与风险平衡的原则自主审批贷款，是信贷风险管理的重要保证。银行业金融机构应通过制度安排，保证审批人员按照授权独立审批贷款。,0,0
1,(单选题)下列说法错误的是（）。,<p>A个人征信系统所收集的个人信用信息中的个人基本信息中，包括个人身份</p><p>B个人征信系统所收集的个人信用信息中的个人基本信息中，包括破产记录</p><p>C个人征信系统所收集的个人信用信息中的个人基本信息中，包括居住信息</p><p>D个人征信系统所收集的个人信用信息中的个人基本信息中，包括职业信息</p>,4,B,个人征信系统所收集的个人信用信息包括个人基本信息、信用交易信息、特殊交易、特别记录、客户本人声明等各类信息。其中，个人基本信息包括个人身份、配偶身份、居住信息、职业信息等，个人的职务、职称、年收入也都有详细记录。选项B属于个人信用信息中的特殊信息，不是基本信息。,0,0
1,(单选题)《个人住房贷款管理办法》规定，无住房补贴的以不低于所购住房全部价款的______作为购房的首期付款；有住房补贴的以个人承担部分的______作为购房的首期付款。（）,<p>A30%；30%</p><p>B30%；20%</p><p>C20%；20%</p><p>D20%；30%</p>,4,A,无住房补贴的以不低于所购住房全部价款的30%作为购房的首期付款；有住房补贴的以个人承担部分的30%作为购房的首期付款。,0,0
1,(单选题)以下不可以作为个人质押贷款质物的是（）。,<p>A汇票</p><p>B债券</p><p>C仓单</p><p>D应付账款</p>,4,D,按照《物权法》第223条规定，可作为个人质押贷款的质物主要有：(1)汇票、支票、本票；(2)债券、存款单；(3)仓单、提单；(4)可以转让的基金份额、股权；(5)可以转让的注册商标专用权、专利权、著作权等知识产权中的财产权；(6)应收账款；(7)法律、行政法规规定可以出质的其他财产权利。应付账款属于负债，不可以作为质物。,0,0
1,(单选题)市场环境分析的SWOT方法不包括（）。,<p>A优势</p><p>B劣势</p><p>C机遇</p><p>D前景</p>,4,D,SWOT分析方法中的S、W、O、T分别代表优势、劣势、机会和威胁。故T(Threat)代表威胁而不是前景。,0,0
1,(单选题)经核查，征信服务中心如无法确认异议信息的正误，应（）。,<p>A对该异议信息做特殊标注</p><p>B对信息进行复核</p><p>C保留原信息</p><p>D按申请人要求更改个人信用信息</p>,4,C,征信服务中心收到商业银行重新报送的更正信息后，应当在2个工作日内对异议信息进行更正。异议信息确实有误，但因技术原因暂时无法更正的，征信服务中心应当对该异议信息作特殊标注，以有别于其他异议信息；经过核查，无法确认异议信息存在错误的，征信服务中心不得按照异议申请人要求更改相关个人信用信息，即应保留原信息。 ,0,0
1,(单选题)我国银行业的汽车贷款业务萌芽于（）年。,<p>A1989</p><p>B1993</p><p>C1996</p><p>D1999</p>,4,C,银行业的汽车贷款业务萌芽于1996年，当时中国建设银行与一汽集团建立了长期战合作伙伴关系。,0,0
1,(单选题)以下不属于贷款审查和审批中的风险的是（）。,<p>A不按权限审批贷款，使得贷款超授权发放</p><p>B贷款资金发放前，未审核借款人相关交易资料和凭证</p><p>C业务不合规，业务风险和效益不匹配</p><p>D审批人对应审查的内容审查不严，导致向不具备贷款发放条件的借款人发放贷款，贷款容易发生风险或出现内外勾结骗取银行信贷资金的情况</p>,4,B,贷款审查和审批中的风险有：(1)业务不合规，业务风险与效益不匹配；(2)不按权限审批贷款，使得贷款超授权发放；(3)审批人对应审查的内容审查不严，导致向不具备贷款发放条件的借款人发放贷款，贷款容易发生风险或出现内外勾结骗取银行信贷资金的情况。,0,0
1,(单选题)设备贷款的期限由贷款银行根据贷款风险管理相关原则确定，一般为（）年，最长不超过（）年。,<p>A1；3</p><p>B1；5</p><p>C3；5</p><p>D0.213194444444444</p>,4,C,设备贷款的期限由贷款银行根据贷款风险管理相关原则确定，一般为3年，最长不超过5年。,0,0
1,(单选题)个人贷款产品有不同的还款方式供借款人选择，可以比较灵活地按照借款人的还款能力规划还款进度，满足个性化需求程度最高的还款方式是（）。,<p>A组合还款法</p><p>B等额累进还款法</p><p>C等额本金还款法</p><p>D等额本息还款法</p>,4,A,组合还款法是一种将贷款本金分段偿还，根据资金的实际占用时间计算利息的还款方式。即根据借款人未来的收支情况，首先将整个贷款本金按比例分成若干偿还阶段，然后确定每个阶段的还款年限。这种方法可以比较灵活地按照借款人的还款能力规划还款进度，真正满足个性化需求。自身财务规划能力强的客户适用此种方法。,0,0
1,(单选题)个人住房装修贷款的用途不包括（）。,<p>A支付家庭装潢施工款</p><p>B支付房屋维修工程款</p><p>C购买家用电器</p><p>D购买厨卫设备</p>,4,C,个人住房装修贷款可以用于支付家庭装潢和维修自用住房的施工款、相关的装修的材料款和厨卫设备款等。故选C。,0,0
1,(单选题)按照住房交易形态来划分，个人住房贷款不包括（）。,<p>A个人住房转让贷款</p><p>B个人住房组合贷款</p><p>C个人再交易住房贷款</p><p>D新建房个人住房贷款</p>,4,B,按照住房交易形态划分，个人住房贷款可分为新建房个人住房贷款、个人再交易住房贷款和个人住房转让贷款。选项B中个人住房组合贷款是按照资金来源划分的(包括自营性个人住房贷款、公积金个人住房贷款和个人住房组合贷款)。,0,0
1,(单选题)根据《关于进一步完善国家助学贷款工作若干意见的通知》，下列关于学生归还国家助学贷款的说法，正确的是（）。,<p>A学生自毕业之日起开始偿还贷款本金，4年内还清</p><p>B借款学生毕业或终止学业后，不得调整还款计划</p><p>C提前还贷的，经办银行不可以收取提前还贷违约金</p><p>D借款学生应归还在校期间及毕业后至还款结束时的全部利息</p>,4,C,《关于进一步完善国家助学贷款工作若干意见的通知》规定：(1)改革财政贴息方式。改变目前在整个贷款合同期间内，对学生贷款利息给予50%财政补贴的做法，实行借款学生在校期间的贷款和全部由财政补贴，毕业后全部自付的办法，借款学生毕业后开始计付利息。(2)延长还款年限。改变目前自毕业之日起即开始偿还贷款本金、4年内还清的做法，实行借款学生毕业后视就业情况，在12年后开始还贷，6年内还清的做法。贷款还本付息可以采取多种方式，可以一次或分次提前还贷。提前还贷的，经办银行要按贷款实际期限计算利息，不得加收除应付利息之外的其他任何费用。(3)对毕业后自愿到国家需要的艰苦地区、难苦行业工作，服务期达到一定年限的借款学生，经批准可以奖学金方式代偿其贷款本息。,0,0
1,(单选题)个人汽车贷款的期限(含展期)不得超过（）年。,<p>A3</p><p>B5</p><p>C1</p><p>D10</p>,4,B,个人汽车贷款的贷款期限(含展期)不得超过5年，其中，二手车贷款的贷款期限(含展期)不得超过3年。,0,0
1,(单选题)“双20标准”是指中国人民银行规定国家助学贷款违约率达到（），且违约学生达到20人的高校，经办银行可以停止对其发放助学贷款。,<p>A0.2</p><p>B0.15</p><p>C0.35</p><p>D0.4</p>,4,A,“双20标准”是指中国人民银行规定国家助学贷款违约率达到20%，且违约学生达到20人的高校，经办银行可以停止对其发放助学贷款。,0,0
1,(单选题)下列关于个人抵押授信贷款的表述中，错误的是（）。,<p>A个人抵押授信贷款的特点之一是贷款用途综合</p><p>B个人抵押授信贷款可一次授信，循环使用</p><p>C个人抵押授信贷款具有先授信、后用信的特点</p><p>D个人抵押授信贷款是指借款人将本人或第三人(自然人或法人)的物业抵押给银行，银行按抵押物评估值的一定比率为依据，设定个人最高额授信额度的贷款</p>,4,D,个人抵押授信贷款是指借款人将本人或第三人(限自然人)的物业抵押给银行，银行按抵押物评估值的一定比率为依据，设定个人最高授信额度的贷款。故这里第三人职能是自然人，不可以是法人。,0,0
1,(单选题)现在个人征信系统由（）出资建设管理。,<p>A个人</p><p>B政府</p><p>C银监会</p><p>D证监会</p>,4,B,现在，个人征信系统由政府出资建设管理，查询个人信用报告是征信中心提供的一种服务，原则上需要收取一定成本费用，目前暂不收费。,0,0
1,(单选题)个人耐用消费品贷款起点一般为人民币2000元。最高额不超过10万元。借款人用于购买耐用消费品的首期付款额不得少于购物款的（）。,<p>A5%～10%</p><p>B10%～15%</p><p>C20%～30%</p><p>D30%～50%</p>,4,C,个人耐用消费品贷款起点一般为人民币2000元，最高额不超过10万元。借款人用于购买耐用消费品的首期付款额不得少于购物款的20%一30%。,0,0
1,(单选题)个人贷款的担保方式不包括（）。,<p>A质押担保</p><p>B抵押担保</p><p>C政府担保</p><p>D保证担保</p>,4,C,个人贷款可采用多种担保方式，主要有抵押担保、质押担保和保证担保三种担保方式。政府不能担任个人贷款的保证人。,0,0
1,(单选题)采用等额累进还款法的借款人，当预期收入增加时，为减少利息负担，可（）。,<p>A减少累进额或扩大间隔期</p><p>B增大累进额或缩短间隔期</p><p>C增大累进额或扩大间隔期</p><p>D减少累进额或缩短间隔期</p>,4,B,对收入增加的客户，可采取增大累进额、缩短间隔期等办法，使借款人分期还款额增多，从而减少借款人的利息负担。,0,0
1,(单选题)以下不属于信用风险的防控措施的是（）。,<p>A严格审查客户信息资料的真实性</p><p>B详细调查客户的还款能力</p><p>C科学合理地确定客户还款方式</p><p>D掌握个人汽车贷款业务的规章制度</p>,4,D,信用风险的防控措施有：(1)严格审查客户信息资料的真实性；(2)详细调查客户的还款能力；(3)科学合理地确定客户还款方式。,0,0
1,(单选题)以下选项中，不是个人信用贷款的借款人需要具备的基本条件的是（）。,<p>A在中国境内有固定住所，有当地城镇常住户口，具有完全民事行为能力的中国公民</p><p>B有正当且有稳定经济收入的良好职业，具有按期偿还贷款本息的能力</p><p>C遵纪守法，没有违法行为及不良信用记录</p><p>D提供银行认可的有效质物作质押担保</p>,4,D,申请个人信用贷款，首先需要具备下列基本条件：(1)在中国境内有固定住所、有当地城镇常住户口、具有完全民事行为能力的中国公民；(2)有正当且有稳定经济收入的良好职业，具有按期偿还贷款本息的能力；遵纪守法，没有违法行为及不良信用记录；(3)在贷款银行开立个人结算账户(同意借款银行从其指定的个人结算账户扣收贷款本息)；(4)贷款用途证明文件；(5)各行另行规定的其他条件。,0,0
1,(单选题)下面关于个人信用报告异议的说法，正确的是（）。,<p>A个人信用报告有异议时，可以直接向人民银行征信中心提出个人信用报告的异议申请，无须出示个人身份证明</p><p>B商业银行应当在接到核查通知的7个工作日内向征信服务中心做出核查情况的书面答复</p><p>C征信服务中心收到商业银行重新报送的更正信息后，应当在5个工作日内对异议信息进行更正</p><p>D征信服务中心应当在接受异议申请后15个工作日内，向异议申请人或转交异议申请的中国人民银行征信管理部门提供书面答复</p>,4,D,个人信用报告有异议时，可以直接向人民银行征信中心提出个人信用报告的异议申请，需出示相关个人身份证明，故选项A说法错误；商业银行应当在接到核查通知的10个工作日内向征信服务中心做出核查情况的书面答复，故选项B说法错误；征信服务中心收到商业银行重新报送的更正信息后当在2个工作日内对异议信息进行更正，故选项C说法错误。,0,0
1,(单选题)商用房贷款的利率不得低于中国人民银行规定的同期同档次利率的（）倍。,<p>A1</p><p>B1.1</p><p>C1.2</p><p>D1.3</p>,4,B,商用房贷款的利率不得低于中国人民银行规定的同期同档次利率的1．1倍，具体利率水平由贷款银行根据贷款风险管理相关原则自主确定。,0,0
1,(单选题)个人商用房贷款的还款来源主要是（）。,<p>A商用房的租金收入和借款人的其他经营收入</p><p>B借款人的投资收益</p><p>C个人商用房的资产增值</p><p>D借款人的工资、薪金收入</p>,4,A,商用房贷款(特别是金额较大的商用房贷款)的还款来源主要是借款人的经营性收入，包括租金收入和其他经营收入等。,0,0
1,(单选题)以下不是贷款回收的原则的是（）。,<p>A先收息</p><p>B先收本</p><p>C全部到期</p><p>D利随本清</p>,4,B,贷款回收的原则是先收息、后收本，全部到期、利随本清。,0,0
1,(单选题)一手个人住房交易时，在借款人购买的房屋没有办好抵押登记之前，由（）提供阶段性或全程担保。,<p>A经纪公司</p><p>B有担保能力的第三人</p><p>C开发商</p><p>D借款人</p>,4,C,由银行向购买该开发商房屋的购房者提供个人住房贷款，借款人用所购房屋作抵押，在借款人购买的房屋没有办好抵押登记之前，由开发商提供阶段性或全程担保。 ,0,0
1,(单选题)信贷业务跨时长，为做好相关档案管理工作，要将一个信贷项目形成的文档资料依据信贷的执行状态划分为（）和（）两个阶段，实行分段管理。,<p>A执行中的信贷文件；结算后的信贷档案</p><p>B执行中的信贷档案；结算后的信贷文件</p><p>C执行中的信贷档案；结算后的信贷档案</p><p>D执行中的信贷文件；结算后的信贷文件</p>,4,A,信贷业务跨时长，为做好相关档案管理工作，要将一个信贷项目形成的文档材料依据信贷的执行状态划分为执行中的信贷文件和结清后的信贷档案两个阶段，实行分段管理。,0,0
1,(单选题)下列不属于个人征信系统所收集的个人信用信息中的特殊信息的是（）。,<p>A破产记录</p><p>B信用报告查询信息</p><p>C职业信息</p><p>D与个人经济生活相关的法院判决等信息</p>,4,C,特殊信息主要是破产记录、与个人经济生活相关的法院判决等信息、信用报告查询信息，包括哪些机构因何原因于何时进行过查询。选项C属于个人基本信息。,0,0
1,(单选题)产品竞争一般要经历的过程是（）。,<p>A产量竞争――价格竞争――质量竞争――服务竞争――品牌竞争</p><p>B产量竞争――质量竞争――价格竞争――服务竞争――品牌竞争2</p><p>C产量竞争――价格竞争――服务竞争――质量竞争――品牌竞争 </p><p>D产量竞争――质量竞争――品牌竞争――价格竞争――服务竞争</p>,4,B,产品竞争一般要经历的过程是：产量竞争――质量竞争――价格竞争――服务竞争――品牌竞争。,0,0
