2,(多选题)下列关于银行代理寿险产品的说法，错误的有()。,<p>A分红险的收益来源于死差益、利差益和费差益所产生的可分配盈余</p><p>B万能险的风险来源于保险公司的资产规模、发展历史、理财团队专业化水平等</p><p>C投资连结保险是一种新形式的终身财险产品，它集保障和投资于一体</p><p>D投连险的投资账户可以与其他资产账户联合管理</p><p>E万能保险是一种交费灵活、保额可调整、非约束性的寿险</p>,5,CD,C项，投资连结保险是一种寿险与投资相结合的新型寿险产品；D项，投连险的投资账户必须是资产单独管理的资金账户。,45,1,0,0
2,(多选题)下列关于黄金的表述，正确的有()。,<p>A黄金具有内在价值和实用性，但也存在一定的风险</p><p>B黄金仍然作为货币活跃在流通领域</p><p>C黄金的收益和股票市场的收益一般不相关或负相关</p><p>D美元走势会影响黄金价格</p><p>E一般而言，在通货膨胀时，黄金投资具有保值作用</p>,5,ACDE,黄金具有以下特点：①流动性，退出流通领域后，其流动性较其他证券类投资品差，国内黄金市场不充分，变现相对困难，有流动性风险；②收益情况，黄金和股票市场收益不相关甚至负相关，可以分散投资总风险，且价格会随着通货膨胀而提高，所以可以保值，黄金作为一种特殊的具有投资价值的商品，其价格受多种因素的影响（如国际经济形势、美元汇率、相关市场走势、政治局势、原油价格等）。,45,1,0,0
2,(多选题)银行理财产品的主要风险包括()。,<p>A提前终止风险</p><p>B违约风险</p><p>C流动性风险</p><p>D市场风险</p><p>E政策风险</p>,5,ABCDE,最常见的银行理财产品风险包括政策风险、违约风险或信用风险、市场风险、利率风险、汇率风险、流动性风险、提前终止风险等，其他还有操作风险、交易对手管理风险、延期风险、不可抗力及意外事件等风险。,45,1,0,0
2,(多选题)下列关于电子式储蓄国债的说法，正确的有()。,<p>A是财政部在境内发行的</p><p>B是不可流通人民币债券</p><p>C需要投资者开立个人国债托管账户</p><p>D无需投资者指定对应的资金账户</p><p>E面向境内个人投资者、企事业单位和行政机关等机构投资者发售</p>,5,ABC,电子式储蓄国债是财政部在境内发行的，以电子方式记录债权的不可流通人民币债券。它只面向境内个人投资者发售，企事业单位和行政机关等机构投资者不能购买。相较凭证式国债，由于电子式储蓄国债以电子方式记录债权，因此在便捷性方面有很大提高，但是需要投资者开立个人国债托管账户，并指定对应的资金账户。(本题来自嗨考网）,45,1,0,0
2,(多选题)下列关于债券赎回的说法，正确的有()。,<p>A可赎回债券赋予发行人在到期日前全部或部分赎回已发行债券的权利</p><p>B附有赎回权的债券的潜在资本增值有限</p><p>C在保护期内，发行人可以行使赎回权</p><p>D市场利率下降时，发行人可以通过使用这项权利以更低的利率筹集资金</p><p>E由于债券赎回条款对投资者不利，可赎回债券往往规定有赎回保护期</p>,5,ABDE,可赎回债券往往规定有赎回保护期，在保护期内，发行人不得行使赎回权。常见的赎回保护期是发行后的5～10年。,45,1,0,0
2,(多选题)结构性理财产品的主要类型包括()。,<p>A新股挂钩型</p><p>B股票挂钩型</p><p>C外汇挂钩型</p><p>D指数挂钩型</p><p>E商品挂钩型</p>,5,BCE,结构性理财产品是运用金融工程技术，将存款、零息债券等固定收益产品与金融衍生品（如远期、期权、掉期等）组合在一起而形成的一种金融产品。结构性理财产品的回报率通常取决于挂钩资产（即挂钩标的）的表现。根据挂钩资产的属性，结构性理财产品可分为外汇挂钩类、利率／债券挂钩类、股票挂钩类、商品挂钩类及混合类等。,45,1,0,0
2,(多选题)影响债券类产品收益的因素主要有()。,<p>A税收待遇</p><p>B基础利率</p><p>C流动性</p><p>D信用等级</p><p>E债券期限</p>,5,ABCDE,债券的收益主要来源于利息收益和价差收益。影响债券类产品收益的因素主要有债券期限、基础利率、市场利率、票面利率、债券的市场价格、流动性、债券信用等级、税收待遇以及宏观经济状况等。,45,1,0,0
2,(多选题)投资项目风险是信托产品面临的风险之一，其主要包括项目的()。,<p>A信托公司风险</p><p>B设计风险</p><p>C财务风险</p><p>D经营管理风险</p><p>E市场风险</p>,5,CDE,在已发行的信托产品中，多数是依靠项目自身产生的现金流或利润作为还款来源，因此项目自身的风险是信托产品的最大风险之一。投资项目风险包括项目的市场风险、财务风险、经营管理风险等。,45,1,0,0
2,(多选题)黄金投资的风险包括()。,<p>A流动性风险</p><p>B信用风险</p><p>C市场风险</p><p>D经营风险</p><p>E通货膨胀风险</p>,5,AC,投资黄金不能像投资其他金融资产一样取得利息和股利，且价格受国际市场影响较大，存在很高的市场风险；同时国内黄金市场不充分，变现相对困难，存在流动性风险。,45,1,0,0
2,(多选题)货币型理财产品的主要投资对象有()。,<p>A国债</p><p>BAAA级企业债</p><p>C中央银行票据</p><p>D债券回购</p><p>E房地产</p>,5,ABCD,货币型理财产品是投资于货币市场的银行理财产品。它主要投资于信用级别较高、流动性较好的金融工具，包括国债、金融债、中央银行票据、债券回购，高信用级别的企业债、公司债、短期融资券，以及法律法规允许投资的其他金融工具。,45,1,0,0
2,(多选题)2005年以后我国出现的银行理财新产品包括()。,<p>A货币型理财产品</p><p>B权益挂钩</p><p>C项目融资</p><p>D新股申购</p><p>EQDII</p>,5,BCDE,2005年12月，银监会允许获得衍生品业务许可证的银行发行股票类挂钩产品和商品挂钩产品，银行理财产品从此得到较快发展，权益挂钩、项目融资、新股申购、QDII等类别的新产品不断涌现。,45,1,0,0
2,(多选题)关于各种基金的特点，下列表述正确的有()。,<p>A开放式基金可以随时提出购买或赎回申请</p><p>B封闭式基金规模不固定，可以随时增加发行</p><p>C货币市场基金同时以股票、债券为主要投资对象</p><p>D成长型基金投资对象一般为风险较小、资本增值有限的金融产品</p><p>E主动型基金是通过主动管理，力求取得超越基金组合表现的基金</p>,5,AE,B项，封闭式基金规模固定，一般不能再增加发行；C项，货币市场基金以货币市场工具为投资对象，具有低风险、低收益、高流动性的特征；D项，成长型基金投资对象常常是风险较大的金融产品，收入型基金投资对象一般为风险较小、资本增值有限的金融产品。,45,1,0,0
2,(多选题)基金子公司的业务灵活，所受限制较少，目前，其主要业务包括()。,<p>A股权质押业务</p><p>B类信托业务</p><p>C主动投资类业务</p><p>D资产证券化业务</p><p>E黄金基金</p>,5,ABCD,目前基金子公司的主要业务有股权质押业务、类信托业务、主动投资类业务、资产证券化业务和通道业务。E项，黄金基金属于银行代理贵金属业务之一。,45,1,0,0
2,(多选题)银行开展的黄金业务种类包括()。,<p>A金币</p><p>B黄金股票</p><p>C纸黄金</p><p>D实物黄金</p><p>E黄金基金</p>,5,ACDE,银行代理黄金业务种类包括：①条块现货，投资黄金条块因规格大小而有不同的门槛，但有保存不便和移动不易的缺点，安全性差；②金币，有纯金币和纪念金币两种；③黄金基金，是将资金委托专业经理人全权处理，用于投资黄金类产品；④纸黄金，其让投资者免除了储存黄金的风险，也让投资者有随时提取所购买黄金的权利，或按当时的黄金价格，将账户里的黄金兑换成现金，通常也称为“黄金存折”；⑤黄金T+D交易品种，是黄金延期交收交易品种，俗称“黄金准期货”。,45,1,0,0
2,(多选题)风险偏好属于非常保守型的客户往往会选择()等产品。,<p>A债券型基金</p><p>B存款</p><p>C保本型理财产品</p><p>D房地产投资</p><p>E股票型基金</p>,5,ABC,保守型客户往往对于投资风险的承受能力很低，选择一项产品或投资工具首要考虑是否能够保本，然后才考虑追求收益。因此，这类客户往往选择国债、存款、保本型理财产品、货币与债券型基金等低风险、低收益的产品。,45,1,0,0
2,(多选题)下面关于基金专户理财的表述，正确的有()。,<p>A一对多专户每年开放期不得超过5个工作日</p><p>B单个一对多账户每个客户门槛不低于100万元</p><p>C基金专户理财又称基金管理公司独立账户资产管理业务，是基金管理公司向特定对象（主要是机构客户和高端个人客户）提供的个性化财产管理服务</p><p>D单个一对多账户人数上限为200人</p><p>E一对多专户每年最多开放一次</p>,5,ABCDE,基金专户理财又称基金管理公司独立账户资产管理业务，是基金管理公司向特定对象（主要是机构客户和高端个人客户）提供的个性化财产管理服务。“一对多”专户理财通俗来说是指多个客户把钱汇总在一个账户交给基金公司专业团队打理。根据证监会公布的基金“一对多”合同内容与格式准则，单个“一对多”账户人数上限为200人，每个客户准入门槛不得低于100万元，每年至多开放一次，开放期原则上不得超过5个工作日。“一对多”由公募基金公司中的专户团队管理，但准入要求与私募基金更接近。,45,1,0,0
2,(多选题)目前银行代理国债的种类包括()。,<p>A电子式储蓄国债</p><p>B特种国债</p><p>C凭证式国债</p><p>D建设国债</p><p>E记账式国债</p>,5,ACE,国债是国家信用的主要形式。我国的国债专指财政部代表中央政府发行的国家公债，由于以国家财政信誉作担保，国债的信誉度非常高，其收益率一般被看做是无风险收益率，是金融市场利率体系中的基准利率之一。目前银行代理国债的种类有三种：①凭证式国债；②电子式储蓄国债；③记账式国债。,45,1,0,0
2,(多选题)信托业务的当事人包括()。,<p>A受托人</p><p>B经纪人</p><p>C监管人</p><p>D受益人</p><p>E委托人</p>,5,ADE,信托业务是一种以信用为基础的法律行为，一般涉及三方面当事人，即投入信用的委托人.受信于人的受托人，以及受益于人的受益人。,45,1,0,0
2,(多选题)下列关于保险产品风险的说法，正确的有()。,<p>A投保人应当在购买保险时对保险产品的内容有足够的了解</p><p>B由于同一个保险标的可能会面临多种风险，投保人应当进行合理的险种搭配</p><p>C购买保险后很快退保，不但不能达到资产增值的目的，反而可能承受损失</p><p>D随着生命周期的变化，投保人应当根据实际需要适时地更换保险品种，达到收益最大、损失最小的目标</p><p>E投保人可以在专业人员的帮助下，分析判断自己的风险类别、风险发生概率和风险发生时可能造成损失的大小等，进行选择</p>,5,ABCDE,投保人应当在购买保险时对保险产品的内容有足够的了解，否则，购买保险后很快退保，不但不能达到资产增值的目的，反而可能承受损失；投保人可以在专业人员的帮助下，分析判断自己的风险类别、风险发生概率和风险发生时可能造成损失的大小等，进行选择；由于同一个保险标的可能会面临多种风险，投保人应当进行合理的险种搭配；随着生命周期的变化，人身保险的最优保险品种组合也会发生变化，投保人应当根据实际需要适时地更换保险品种。,45,1,0,0
2,(多选题)上海证券交易所《试点办法》列出的对中小企私募债合格个人投资者的具体要求有()。,<p>A个人名下的各类证券账户、资金账户、资产管理账户的资产总额不低于人民币500万元</p><p>B具有两年以上的证券投资经验</p><p>C理解并接受私募债券风险</p><p>D注册资本不低于人民币1000万元的企业法人</p><p>E发行人的董事、监事、高级管理人员及持股比例超过5%的股东</p>,5,ABC,上海证券交易所《试点办法》列出对合格个人投资者具体条件要求为以下三点：①个人名下的各类证券账户、资金账户、资产管理账户的资产总额不低于人民币500万元；②具有两年以上的证券投资经验；③理解并接受私募债券风险。DE两项属于对合格机构投资者的要求。(本题来自嗨考网）,45,1,0,0
2,(多选题)下列属于债券型理财产品主要投资对象的有()。,<p>A国债</p><p>B金融债</p><p>C企业债</p><p>D中央银行票据</p><p>E大额存单</p>,5,ABD,债券型理财产品是以国债、金融债和中央银行票据为主要投资对象的银行理财产品。C项，企业债的风险相对较大，不属于债券型理财产品的投资对象；E项，债券型理财产品投资风险小，目标客户主要是风险承受能力较低的投资者，大额存单也不适合。,45,1,0,0
2,(多选题)QDII的挂钩标的有()。,<p>A基金</p><p>BETF</p><p>C公司债券</p><p>D国库券</p><p>ELIBOR</p>,5,AB,QDII挂钩标的范围比较广，比较典型的有：①基金，投资者通过基金将分散的资金集中起来，交由专业的托管人和管理人进行托管、管理，投资于股票、债券、外汇、货币、实业等领域，以尽可能地减少风险，获得收益，从而使资本得到增值；②交易所上市基金ETF。,45,1,0,0
2,(多选题)下列属于银行代理类理财产品的有()。,<p>A基金</p><p>B保险</p><p>C债券型理财产品</p><p>D货币型理财产品</p><p>E信托</p>,5,ABE,银行代理服务类业务，指银行在其渠道代理其他企业、机构组织的、不构成商业银行表内资产负债业务、给商业银行带来非利息收入的业务。目前，我国商业银行共开展了约几十种的代理业务，其中包括基金、保险、国债、信托产品、贵金属以及券商资产管理计划等。,45,1,0,0
2,(多选题)下列关于贵金属投资交易风险的描述，错误的有()。,<p>A贵金属现货延期交收交易业务具有低保证金和高杠杆比例的投资特点，可能导致快速的盈利或亏损</p><p>B建仓的方向与行情的波动相反，会造成较大的亏损</p><p>C根据亏损的程度，投资者必须无条件随时追加保证金</p><p>D未追加保证金则其持仓将会被强行平仓</p><p>E投资者必须承担由被强行平仓造成的全部损失</p>,5,ABDE,投资者需要了解交易所的贵金属现货延期交收交易业务具有低保证金和高杠杆比例的投资特点，可能导致快速的盈利或亏损。若建仓的方向与行情的波动相反，会造成较大的亏损，根据亏损的程度，投资者必须有条件满足随时追加保证金的要求，否则其持仓将会被强行平仓，投资者必须承担由此造成的全部损失。,45,1,0,0
2,(多选题)我国理财产品市场发展迅速，下列属于银行理财产品的有()。,<p>A货币型理财产品</p><p>B债券类理财产品</p><p>C股票类理财产品</p><p>D结构性理财产品</p><p>EQDII基金挂钩类理财产品</p>,5,ABCDE,银行理财产品可分为货币型理财产品、债券类理财产品、股票类理财产品、组合投资类理财产品、结构性理财产品、QDII基金挂钩类理财产品、另类理财产品和其他理财产品。,45,1,0,0
2,(多选题)私募基金的组织形式有公司制、信托制和有限合伙制，下列关于其说法正确的有()。,<p>A出资形式均为货币</p><p>B有限合伙制对投资门槛无特别要求</p><p>C公司制私募基金的管理人员由股东决定</p><p>D合伙企业不征税，公司制双重征税</p><p>E有限合伙制中，普通合伙人以认缴出资额为限承担有限责任</p>,5,ACD,B项，公司制对投资门槛无特别要求，有限合伙制对投资门槛无强制要求，但如申报备案，则单个投资者不低于100万元；E项，在有限合伙制中，普通合伙人承担无限责任，有限合伙人以其认缴的出资额为限承担有限责任。,45,1,0,0
2,(多选题)设立私募基金或者推荐有限合伙时对投资人数及数额的要求包括()。,<p>A以有限责任公司和有限合伙制企业募资的，投资人数不得超过50人</p><p>B以股份有限公司形式募资的，投资人人数不得超过200人</p><p>C以有限责任公司和有限合伙制企业募资的，投资人数不得超过100人</p><p>D自然人投资者投资数额不得低于100万元</p><p>E自然人投资者投资数额不得低于200万元</p>,5,ABD,设立私募基金或者推荐有限合伙时需要遵循向特定对象募集资金：首先，投资人数要符合法律规定，以有限责任公司和有限合伙制企业募资的，投资人数不得超过50人（以股份有限公司形式募资的，投资人人数不得超过200人）；其次，要审查投资人是否存在用借贷或者他人委托的资金投资的情况，可通过要求投资人出具承诺函的形式进行审查确认；最后，投资人应当具有相应的风险承受能力，具体表现为对单个投资人的最低投资数额进行限制，如自然人投资者投资数额不得低于100万元。,45,1,0,0
2,(多选题)对于银行来说，代销产品的考虑因素包括()。,<p>A产品标准化程度</p><p>B委托人资质</p><p>C收益特征</p><p>D监管要求</p><p>E产品期限</p>,5,ABCD,对于银行来说，产品标准化程度、委托人资质、产品的风险、收益特征以及监管要求是代销产品的重要考量因素。,45,1,0,0
2,(多选题)银行代理的财产险包括()。,<p>A投连险</p><p>B万能险</p><p>C家庭财产险</p><p>D企业财产险</p><p>E房贷险</p>,5,CDE,银行主要代理的险种包括寿险和财产险。人身保险新型产品主要包括分红险、万能保险和投连险。财产险也是目前各家银行大力发展的险种，主要包括房贷险、企业财产保险、家庭财产险等。,45,1,0,0
2,(多选题)相对于结构性理财产品，债券型理财产品的优点有()。,<p>A本金安全性低</p><p>B投资收益高</p><p>C投资风险小</p><p>D预期收益稳定</p><p>E产品简单，客户容易理解</p>,5,CDE,债券型理财产品的特点是：①产品结构简单；②投资风险小；③客户预期收益稳定；④市场认知度高，客户容易理解。(本题来自嗨考网）,45,1,0,0
2,(多选题)下列关于银行代理信托类产品的表述，正确的有()。,<p>A银行代理信托往往采用信托代理资金收付的模式进行</p><p>B受托人不承担无过失的损失风险</p><p>C按信托关系建立的方式可分为任意信托和法定信托</p><p>D信托产品转让方便，具有较好的流动性</p><p>E信托机构处理受托财产而发生的亏损由委托人和受托人共同承担</p>,5,ABC,D项，信托产品是为满足客户的特定需求而设计的，因此缺少转让平台，流动性比较差；E项，信托机构根据信托合同约定管理和处理信托财产而获得的收益，全部归受益人所有，同时，信托机构根据信托合同约定处理受托财产而发生的亏损全部由委托者承担。,45,1,0,0
2,(多选题)债券型、混合型、股票型基金根据类别与基金契约的不同，其资产主要投资于()。,<p>A国债</p><p>B股票</p><p>C保险</p><p>D存放于银行</p><p>E信托</p>,5,ABD,债券型、混合型、股票型基金根据类别与基金契约的不同，其资产主要投资于国债和股票，以及存放于银行。,45,1,0,0
2,(多选题)下列属于信托的特点的有()。,<p>A信托是以信任为基础的财产管理制度</p><p>B信托财产权利主体与利益主体相分离</p><p>C信托经营方式灵活、适应性强</p><p>D信托财产具有独立性</p><p>E信托管理具有连续性</p>,5,ABCDE,信托的特点包括：①信托是以信任为基础的财产管理制度；②信托财产权利主体与利益主体相分离；③信托经营方式灵活、适应性强；④信托财产具有独立性；⑤信托管理具有连续性；⑥受托人不承担无过失的损失风险；⑦信托利益分配、损益计算遵循实绩原则；⑧信托具有融通资金的职能。,45,1,0,0
2,(多选题)银行在发行理财产品过程中，发布的产品目标客户信息包括()。,<p>A客户资产规模</p><p>B客户在银行的等级</p><p>C客户风险承受能力</p><p>D客户信誉情况</p><p>E客户从事职业</p>,5,ABC,产品目标客户信息是产品的销售对象，包括适合的客户群特征，如客户风险承受能力、客户资产规模、客户在银行的等级、产品发行地区、资金门槛（起售金额）和最小递增金额等。,45,1,0,0
2,(多选题)关于组合投资类理财产品的特点，表述正确的有()。,<p>A产品期限覆盖面广</p><p>B赋予发行主体充分的主动管理能力</p><p>C组合投资类理财产品信息透明度高</p><p>D决定产品最终收益的因素减少，投资风险减小</p><p>E扩大了银行的资金运用范围和客户收益空间</p>,5,ABE,C项，组合投资类理财产品存在信息透明度不高的缺点；D项，负债期限和资产期限的错配以及复杂衍生结构的嵌入增加了产品的复杂性，导致决定产品最终收益的因素增多，产品投资风险可能会随之扩大。,45,1,0,0
2,(多选题)设立私募股权投资基金时要考虑一系列问题，当一只基金要在市场上募资时，普通合伙人通常要准备一份汇集基金结构的条款清单，清单内容包括()。,<p>AGP的出资比例</p><p>B收益分成</p><p>C收益购回</p><p>D联合投资机会</p><p>E关键人条款及继承问题</p>,5,ABCDE,普通合伙人准备的条款清单中至少包含十大要点，除了上述5个，还有管理费、基金规模、有限合伙人的职责、投资限制、LP（有限合伙人）的违约责任。,45,1,0,0
2,(多选题)下列符合中小企业私募债发行、担保和评级要求的有()。,<p>A发行规模不受净资产的40%的限制</p><p>B需提交经具证券期货从业资格的事务所审计的最近两年财务报告</p><p>C年均可分配利润不少于公司债券1年的利息</p><p>D鼓励中小企业私募债采用担保发行，但不强制要求担保</p><p>E对是否进行信用评级没有硬性规定</p>,5,ABDE,中小企业私募债发行、担保和评级要求：①发行要求，发行规模不受净资产的40%的限制；需提交经具证券期货从业资格的事务所审计的最近两年财务报告，但对财务报告中的利润情况无要求，不受年均可分配利润不少于公司债券1年的利息的限制。②担保和评级要求，鼓励中小企业私募债采用担保发行，但不强制要求担保；对是否进行信用评级没有硬性规定。,45,1,0,0
2,(多选题)下列关于债券型理财产品的表述，正确的有()。,<p>A债券型理财产品是以国债、金融债券和中央银行票据为主要投资对象的银行理财产品</p><p>B债券型理财产品资金主要投向银行间债券市场、国债市场和企业债市场</p><p>C债券型理财产品的特点是产品结构简单、投资风险小、客户预期收益稳定</p><p>D对于投资者而言，购买债券型理财产品面临的最大风险来自利率风险和流动性风险</p><p>E其目标客户为风险承受能力较低的投资者</p>,5,ABCE,D项，目前对于投资者而言，购买债券型理财产品面临的最大风险来自利率风险、汇率风险和流动性风险。,45,1,0,0
2,(多选题)下列关于有限合伙人转让合伙企业的出资的表述，正确的有()。,<p>A对有限合伙人转让合伙企业的出资进行一定的约束，目的是保证有限合伙制私募股权基金的稳定性</p><p>B有限合伙人转让合伙企业的出资可以分为自行转让和委托转让两种形式</p><p>C自行转让的手续费费率较高</p><p>D“自行转让”是指有限合伙人自行寻找受让方，由普通合伙人审核并协助办理过户的</p><p>E“委托转让”是指有限合伙人委托普通合伙人寻找受让方，并由普通合伙人协助办理过户的方式</p>,5,ABDE,自行转让的手续费费率较低，例如可为所转让出资额的1%，委托转让的费率较高，例如可为所转让出资额的5%；通过收取一定转让手续费，可以控制有限合伙人频繁的转让对合伙企业的出资。,45,1,0,0
