2,(多选题)目前在商业银行所代理的寿险险种中，占据市场主流的险种为()。,<p>A投连险</p><p>B分红险</p><p>C万能险</p><p>D房贷险</p><p>E家庭财产险</p>,5,BC,银行主要代理的险种包括人身保险和财产保险。目前占据市场主流的险种主要是人身保险新型产品中的分红险和万能险，这些产品大部分设计比较简单，标准化程度较高，在能提供一定保障的同时兼有储蓄的投资功能。,45,1,0,0
2,(多选题)下列关于国债的表述正确的有()。,<p>A国债投资收益主要来自于利息收益和价差收益</p><p>B国债的流动性高于公司债券</p><p>C记账式国债可记名、可挂失，可以上市流通，但是交易成本高</p><p>D实物式国债不可记名、不可挂失，但可以上市流通</p><p>E凭证式国债可记名、可挂失，但是不能上市流通</p>,5,ABDE,C项，记账式国债的发行和交易均无纸化，所以效率高、成本低、交易安全。,45,1,0,0
2,(多选题)目前，我国银行代理可记名、可挂失的国债种类有()。,<p>A永久式国债</p><p>B凭证式国债</p><p>C记账式国债</p><p>D拆实式国债</p><p>E实物式国债</p>,5,BC,目前银行代理国债的种类有三种：①凭证式国债，是一种国家储蓄债，可记名、挂失，以“凭证式国债收款凭证”记录债权，不能上市流通，从购买之日起计息；②电子式储蓄国债，是财政部在境内发行的，以电子方式记录债权的不可流通人民币债券；③记账式国债，以记账形式记录债权，通过银行间市场或证券交易所的交易系统发行和交易，可以记名、挂失。,45,1,0,0
2,(多选题)下列关于万能保险，说法正确的有()。,<p>A保险公司在扣除一定费用后，将保险费转入保单账户</p><p>B为保单账户价值提供最低收益保证</p><p>C投保人可以在任何时间支付任何金额的保险费</p><p>D任意提高或者降低死亡给付金额</p><p>E客户缴纳的保险费被分成两部分</p>,5,ABDE,万能保险按合同约定，保险公司在扣除一定费用后，将保险费转入保单账户，并定期结算保单账户价值。在投资收益方面，此类产品为保单账户价值提供最低收益保证，也就是说，除了支付某一个最低金额的第一期保险费以后，投保人可以在任何时间支付任何金额的保险费，并且任意提高或者降低死亡给付金额，只要保单积存的现金价值足够支付以后各期的成本和费用就可以。客户缴纳的保险费被分成两部分：一部分同传统寿险一样，为客户提供生命保障；另一部分将进入其个人账户，由专家进行稳健投资。(本题来自嗨考网）,45,1,0,0
2,(多选题)证券投资基金的收益主要有()。,<p>A基金赎回费用</p><p>B债券利息</p><p>C红利收入</p><p>D存款利息收入</p><p>E证券买卖差价</p>,5,BCDE,证券投资基金的收益主要有：①证券买卖差价，也称资本利得；②红利收入，即因持有股票而享有的净利润分配所得；③债券利息，即基金因投资债券而获得的定期利息收入，是基金收益不可缺少的组成部分；④存款利息收入，即基金资产的银行存款利息收入。,45,1,0,0
2,(多选题)下列关于基金子公司的说法中，正确的有()。,<p>A业务种类多，业务灵活</p><p>B没有资本金限制</p><p>C成本较低</p><p>D产品收益率相对较低</p><p>E可以依靠母公司，开展业务协同以及资源共享增加自己的主动管理能力</p>,5,ABCE,基金子公司的业务种类多，业务灵活，具有一定的比较优势。与信托公司相比，基金子公司没有资本金限制，成本较低，在产品开发过程中具有一定的成本优势。另外，基金子公司可以依靠母公司，开展业务协同以及资源共享增加自己的主动管理能力。产品特点包括产品收益率相对较高。,45,1,0,0
2,(多选题)按股票持有者分类，股票可分为()。,<p>A国家股</p><p>B法人股</p><p>C社会公众股</p><p>D流通股</p><p>E限售股</p>,5,ABC,按投资主体的性质，股票分为国家股、法人股和社会公众股；按照股票是否流动，股票分为流通股及非流通股两大类。,45,1,0,0
2,(多选题)产品特征信息包括()。,<p>A产品发行地区</p><p>B产品标的资产类型</p><p>C风险等级</p><p>D产品结构</p><p>E收益类型</p>,5,BCDE,产品特征信息包括产品标的资产类型、风险等级、委托币种、产品结构、收益类型、交易类型、预期收益率、银行终止权、客户赎回权、委托期限、起息日期、到期日期、付息日期、起售日等。A项属于产品目标客户信息。,45,1,0,0
2,(多选题)按委托人或受托人的性质不同可将信托划分为()。,<p>A个人信托</p><p>B法人信托</p><p>C资金信托</p><p>D动产信托</p><p>E不动产信托</p>,5,AB,信托的种类可根据形式和内容的不同进行划分：①按信托关系建立的方式可分为任意信托和法定信托；②按委托人或受托人的性质不同可划分为法人信托和个人信托；③按信托财产的不同可划分为资金信托、动产信托、不动产信托和其他财产信托等。,45,1,0,0
3,(判断题)通常，将各种保证收益类产品.或者保障本金，且预期收益不能实现概率极低的产品称为低风险产品。(),<p>A正确</p><p>B错误</p>,2,B,极低风险产品是指经各行风险评级确定为极低风险等级产品，包括各种保证收益类产品，或者保障本金，且预期收益不能实现概率极低的产品。,45,1,0,0
3,(判断题)对于在到期日前转让债券的投资者来说，利率上涨引起的债券价格下跌会减损投资者的资产收益。(),<p>A正确</p><p>B错误</p>,2,A,一般来说，债券价格与利率变化成反比，当利率上涨时，债券价格下跌。对于在到期日前转让债券的投资者来说，利率上涨引起的债券价格下跌会带来价差损失，进而降低投资者的债券投资收益。债券的到期时间越长，所面临的利率风险越大。,45,1,0,0
3,(判断题)“回拨机制”，是指普通合伙人在已收到的管理费，以及所投资的项目退出后分配的利润中，拿出一定比例的资金存入特定账户，在基金或某些投资项目亏损或达不到最低收益时，用于弥补亏损或补足收益的机制。(),<p>A正确</p><p>B错误</p>,2,A,国内有些私募股权投资基金往往采用“优先收回投资机制”和“回拨机制”的利益分配及激励机制。“优先收回投资机制”，是指在基金期限届满，或某个投资项目进行清算时，合伙企业分配之前首先要确保有限合伙人已全部回收投资，或已达到最低的收益率。(本题来自嗨考网）,45,1,0,0
3,(判断题)在通常情况下，信托资金不可以提前支取。(),<p>A正确</p><p>B错误</p>,2,A,在通常情况下，信托资金不可以提前支取。但如果合同有约定，则在信托合约生效后几个月，委托人（受益人）可以转让信托受益权。,45,1,0,0
3,(判断题)收入型基金比较适合于风险承受能力强、追求高投资回报的投资者。(),<p>A正确</p><p>B错误</p>,2,B,成长型基金比较适合于风险承受能力强、追求高投资回报的投资者；而收入型基金则比较适合于退休的，以获得稳定现金流为目的的稳健投资者。,45,1,0,0
3,(判断题)如果利率下降，债券的提前偿付就会使投资者面临再投资风险。(),<p>A正确</p><p>B错误</p>,2,A,如果利率下降，短期债券的持有人若进行再投资，将无法获得原有的较高息票率，就面临再投资风险。,45,1,0,0
3,(判断题)按照股票是否流动，可将其分为流通股及非流通股两大类。非流通股除了流通权与流通股不一样外，其他权利和义务也是有差别的。(),<p>A正确</p><p>B错误</p>,2,B,与其他国家股票市场不同，在我国上市公司的股票中存在一些非流通股。这些非流通股股票主要是指在上市公司的股票中，暂时不能上市流通的国家股和法人股。非流通股除了流通权与流通股不一样外，其他权利和义务都是完全一样的。,45,1,0,0
3,(判断题)银行代理理财产品销售时，应遵照适合性原则，即要有适合的产品、适合的客户、适合的网点和适合的销售人员。(),<p>A正确</p><p>B错误</p>,2,A,适合性原则是指在销售代理理财产品时，要综合考虑客户所属的人生周期以及相匹配的风险承受能力、客户的投资目标、投资期限长短、产品流动性等因素气为客户推荐适合的产品。总结来说，要有适合的产品，适合的客户，适合的网点，适合的销售人员。,45,1,0,0
3,(判断题)一般来说，公司债券的违约风险一般通过计算的违约概率表示。(),<p>A正确</p><p>B错误</p>,2,B,一般来说，国债的违约风险最低，公司债券的违约风险相对较高。公司债券的违约风险一般通过信用评级表示。,45,1,0,0
3,(判断题)基金经理的投资策略决定着基金类产品收益的好坏。(),<p>A正确</p><p>B错误</p>,2,B,影响基金类产品收益的因素主要来自两方面：①基金的基础市场，即基金所投资的对象产品，如债券、股票、货币市场工具等，这些基础市场的行情波动对基金的收益有很大影响；②基金自身的因素，如基金管理公司的资产管理与投资策略、基金管理人员的业务素质、道德水平、研究团队的研究实力、基金经理的投资管理能力、基金管理公司的整体业务运行情况等。,45,1,0,0
3,(判断题)纸黄金是将资金委托专业经理人全权处理，用于投资黄金类产品，也称为“黄金存折”。()。,<p>A正确</p><p>B错误</p>,2,B,黄金基金是将资金委托专业经理人全权处理，用于投资黄金类产品；银行纸黄金让投资人免除了储存黄金的风险，也让投资者有随时提取所购买黄金，或按当时的黄金价格，将账户里的黄金兑换成现金的权利，通常也称为“黄金存折”。,45,1,0,0
3,(判断题)由于货币型理财产品的投资方向是中短期金融工具，虽然其流动性风险小，但是信用风险比较高。(),<p>A正确</p><p>B错误</p>,2,B,货币型理财产品的投资方向是具有高信用级别的中短期金融工具，(本题来自嗨考网）所以其信用风险低，流动性风险小，属于保守、稳健型产品。,45,1,0,0
3,(判断题)证券投资基金通过有效的资产组合消除投资风险。(),<p>A正确</p><p>B错误</p>,2,B,证券投资基金可以通过资产组合分散和降低非系统风险，但是无法消除系统性风险。通过集合财产，进行规模经营，降低交易成本，从而获得规模收益的好处。,45,1,0,0
3,(判断题)黄金和股票市场收益正相关，可以分散部分投资总风险。(),<p>A正确</p><p>B错误</p>,2,B,黄金和股票市场收益不相关甚至负相关，所以可以分散投资总风险，且价格会随着通货膨胀而提高，所以可以保值。,45,1,0,0
3,(判断题)2005年12月，银监会允许获得个人理财业务许可证的银行发行股票类挂钩产品和商品挂钩产品，为以后中国银行业理财产品的大发展提供了制度上的保证。(),<p>A正确</p><p>B错误</p>,2,B,2005年12月，银监会允许的是获得衍生品业务许可证的银行发行股票类挂钩产品和商品挂钩产品，而非获得个人理财业务许可证的银行。,45,1,0,0
3,(判断题)基金业务可以给商业银行带来非利息收入。(),<p>A正确</p><p>B错误</p>,2,A,基金业务属于银行的代理业务，银行代理服务类业务简称代理业务，指银行在其渠道代理其他企业、机构办理的、不构成商业银行表内资产负债业务，给商业银行带来非利息收入的业务。,45,1,0,0
3,(判断题)主动型基金是通过主动管理，力求取得超越基金组合表现的基金，主动型基金通常被称为“指数基金”。(),<p>A正确</p><p>B错误</p>,2,B,依据投资理念不同，基金可以分为主动型基金和被动型基金。主动型基金是通过主动管理，力求取得超越基金组合表现的基金；被动型基金一般不主动寻求超越市场的表现，一般选取特定指数作为跟踪对象，以复制跟踪对象的表现，因此，被动型基金通常被称为“指数基金”。,45,1,0,0
3,(判断题)货币市场基金同时以股票、债券为主要投资对象，通过不同资产类别的配置投资，实现风险和收益上的平衡。(),<p>A正确</p><p>B错误</p>,2,B,混合型基金同时以股票、债券为主要投资对象，通过不同资产类别的配置投资，实现风险和收益上的平衡；货币市场基金以货币市场工具为投资对象，具有低风险、低收益、高流动性的特征。,45,1,0,0
3,(判断题)结构性理财产品根据挂钩资产的属性.大致可以细分为外汇挂钩类、利率/债券挂钩类、股票挂钩类、商品挂钩类及混合类等。(),<p>A正确</p><p>B错误</p>,2,A,结构性理财产品是运用金融工程技术，将存款、零息债券等固定收益产品与金融衍生品（如远期、期权、掉期等）组合在一起而形成的一种金融产品。根据挂钩资产的属性，大致可以细分为外汇挂钩类、利率/债券挂钩类、股票挂钩类、商品挂钩类及混合类等。,45,1,0,0
3,(判断题)开放式基金的流动性很好，特别是货币市场基金，通过申购赎回的方式实现。(),<p>A正确</p><p>B错误</p>,2,A,开放式基金通过申购和赎回实现转让，流动性强，但须支付一定的手续费。一般来说，客户可以在每个交易日随时申购、赎回，因此具备非常好的便利性和流通性。不同的基金具有不同的流动性，从基金赎回角度来看，货币型基金的流动性较高，一般是T+1或T+2到账，债券型基金一般为T+2或T+3到账，而股票型基金一般为T+4或T+5到账。(本题来自嗨考网）,45,1,0,0
