2,(多选题)个人贷款应当遵循（）的原则。,<p>A依法合规</p><p>B审慎经营</p><p>C自主经营</p><p>D平等自愿</p><p>E公平诚信</p>,5,ABDE,根据《个人贷款管理暂行办法》第4条规定，个人贷款应当遵循依法合规、审慎经营、平等自愿、公平诚信的原则。,0,0
2,(多选题)对于到期一次性还本付息法的说法中，正确的有（）。,<p>A到期一次还本付息法又称期末清偿法</p><p>B借款人需在贷款到期日还清贷款本息</p><p>C利随本清</p><p>D一般适用于各种期限的固定利率贷款</p><p>E个人经营类贷款中的流动资金贷款常常采用到期一次性还本付息法</p>,5,ABCE,到期一次还本付息法又称期末清偿法，指借款人需在贷款到期日还清贷款本息，利随本清。此种方式一般适用于期限在1年以内的贷款。选项D说法错误。,0,0
2,(多选题)农户小额信用贷款的贷款对象包括（）。,<p>A农村中小金融机构营业区域内的农民</p><p>B农村中小金融机构营业区域内的个体经营户</p><p>C农村中小金融机构营业区域内的农联社</p><p>D农村中小金融机构营业区域内的公司</p><p>E农村中小金融机构营业区域内的合伙制企业</p>,5,AB,农户小额信用贷款的贷款对象是农村中小金融机构营业区域内的农民和个体经营户。,0,0
2,(多选题)在个人住房贷款中，对具有担保性质的合作机构的准入需要考虑的内容包括（）。,<p>A注册资金是否达到一定规模</p><p>B资信状况是否达到银行规定的要求</p><p>C是否具有一定的信贷担保经验</p><p>D是否具备符合担保业务要求的人员配置</p><p>E公司及主要经营者是否存在不良信用记录</p>,5,ABCDE,对具有担保性质的合作机构的准入需要考虑以下几个方面：(1)注册资金是否达到一定规模；(2)是否具有一定的信贷担保经验；(3)资信状况是否达到银行规定的要求；(4)是否具备符合担保业务要求的人员配置、业务流程和系统支持；(5)公司及主要经营者是否存在不良信用记录、违法涉案行为等。,0,0
2,(多选题)经过有关审批后，银行与房地产开发商签约需明确的合作事项包括（）。,<p>A保证金缴存比例</p><p>B单笔贷款最高限额</p><p>C购房者名单</p><p>D贷款总额度</p><p>E双方的权利和义务</p>,5,ABDE,经过有关审批后银行按规定与开发商签约，以明确双方合作事项，如贷款总额度、单笔贷款最高限额、保证金缴存比例以及双方的权利和义务等。购房者名单不属于需明确的合作事项，故选项C错误。,0,0
2,(多选题)以下属于审查与审批环节的风险管理的有（）。,<p>A严格贷款合同管理</p><p>B严格进行风险评估</p><p>C审慎进行信贷审批</p><p>D宽松实行审贷分离</p><p>E严格实行审贷分离</p>,5,BCE,审查与审批环节的风险管理包括：(1)严格进行风险评估；(2)审慎进行信贷审批；(3)严格实行审贷分离。严格贷款合同管理、严格实行审贷分离属于签约与发放环节的风险管理。,0,0
2,(多选题)商用房贷款，审核放款通知，业务部门在接到放款通知书后，对其（）进行审核。,<p>A真实性</p><p>B合法性</p><p>C合理性</p><p>D完整性</p><p>E针对性</p>,5,ABD,业务部门在接到放款通知书后，对其真实性、合法性和完整性进行审核。 ,0,0
2,(多选题)个人汽车贷款所购车辆按用途可以划分为（）。,<p>A新车</p><p>B二手车</p><p>C报废车</p><p>D自用车</p><p>E商用车</p>,5,DE,个人汽车贷款所购车辆按用途可以划分为自用车和商用车，按注册登记情况可以划分为新车和二手车。,0,0
2,(多选题)个人住房贷款审批流程中，审批人应进行审查的内容包括（）。,<p>A借款人的资信状况</p><p>B申请借款的金额、期限</p><p>C借款用途</p><p>D借款人所购房产的面积、结构</p><p>E借款人资格和条件</p>,5,ABCE,贷款审批人应对以下内容进行审查：(1)借款人资格和条件是否具备；(2)借款用途是否符合银行规定；(3)申请借款的金额、期限等是否符合有关贷款办法和规定；(4)借款人提供的材料是否完整、合法、有效；(5)贷前调查人的调查意见、对借款人资信状况的评价分析以及提出的贷款建议是否正确、合理；(6)对报批贷款的主要风险点及其风险防范措施是否合规有效；(7)其他需要审查的事项。,0,0
2,(多选题)大众式营销的基本手段包括（）。,<p>A感觉</p><p>B认知</p><p>C获得</p><p>D发展</p><p>E保留</p>,5,AB,在与客户的交流阶段，通常会涉及几个步骤，分别是感觉、认知、获得、发展和保留，前两个步骤容易做到，通常作为大众式营销的基本手段。,0,0
2,(多选题)关于个人汽车贷款中汽车价格，下列说法正确的有（）。,<p>A对于新车，是指汽车实际成交价格与汽车生产商公布价格中两者的低者</p><p>B对于新车，是指汽车实际成交价格与汽车生产商公布价格中两者的高者</p><p>C对于二手车，是指汽车实际成交价格与贷款银行认可的评估价格中两者的高者</p><p>D对于二手车，是指汽车实际成交价格与贷款银行认可的评估价格中两者的低者</p><p>E汽车成交价格中必须包括各类附加税、费及保费等</p>,5,AD,汽车价格，对于新车是指汽车实际成交价格与汽车生产商公布价格两者中的低者，故选项A正确；对于二手车，是指汽车实际成交价格与贷款银行认可的评估价格两者中的低者，故选项D正确。汽车成交价格不包括各类附加税、费及保费等。,0,0
2,(多选题)按照五级分类式，不良个人住房贷款包括（）。,<p>A正常贷款</p><p>B关注贷款</p><p>C次级贷款</p><p>D可疑贷款</p><p>E损失贷款</p>,5,CDE,贷款形态分正常、关注、次级、可疑和损失五类。不良个人住房贷款包括五级分类中的后三类贷款，即次级、可疑和损失类贷款。,0,0
2,(多选题)个人基础数据库信用信息查询主体包括（）。,<p>A保险公司</p><p>B证券公司</p><p>C商业银行</p><p>D金融监督机构以及司法部门等其他政府机构</p><p>E个人</p>,5,CDE,目前主要有三方面可以进行查询：一是商业银行。二是金融监督管理机构以及司法部门等其他政府机构。三是个人。,0,0
2,(多选题)诚信申贷主要包含两层含义（）。,<p>A借款人恪守诚实守信原则，按照贷款人要求的具体方式和内容提供贷款申请材料</p><p>B借款人应证明其信用记录良好、货款用途和还款来源明确合法</p><p>C监督贷款资金按用途使用</p><p>D对借款人账户进行监控</p><p>E明确贷款人按照监管要求进行贷后管理的法律责任</p>,5,AB,诚信申贷主要包含两层含义：(1)借款人恪守诚实守信原则，按照贷款人要求的具体方式和内容提供贷款申请材料，并且承诺所提供材料是真实、完整、有效的；(2)借款人应证明其信用记录良好、货款用途和还款来源明确合法等。,0,0
2,(多选题)农户联保贷款实行（）的管理办法。,<p>A多户联保</p><p>B集体申请</p><p>C一次还款</p><p>D周转使用</p><p>E按期存款</p>,5,ADE,农户联保贷款实行“多户联保、按期存款、个人申请、分期还款、周转使用”的管理办法。,0,0
2,(多选题)下列关于商用房贷款不良贷款管理的说法，正确的有（）。,<p>A银行应按照贷款风险五级分类法对不良商用贷款进行认定</p><p>B银行应把认定为不良贷款的商用房贷款全部予以核销</p><p>C银行应建立商用房贷款的不良贷款台账</p><p>D对未按期还款的借款人，有担保人的可向担保人通知催收</p><p>E已核销的商用房贷款，银行不再催收</p>,5,ACD,对认定为呆账贷款的商用房贷款，银行应按照财政部、中国人民银行和银行有关呆账认定及核销的规定组织申报材料，按规定程序批准后核销，故选项B说法错误。对银行保留追索权的贷款，银行应实行“账销案存”，建立已核销贷款台账，定期向借款人和担保人发出催收通知书，并注意诉讼时效，故选项E说法错误。,0,0
2,(多选题)个人住房贷款的要素包括（）。,<p>A贷款对象</p><p>B贷款期限</p><p>C贷款利率</p><p>D还款方式</p><p>E担保方式</p>,5,ABCDE,个人住房贷款的要素：贷款对象、贷款期限、贷款利率、还款方式、担保方式、贷款额度。,0,0
2,(多选题)根据《中华人民共和国物权法》，可作为质押物的有（）。,<p>A房屋</p><p>B电脑</p><p>C汽车</p><p>D自行车</p><p>E债券</p>,5,BCDE,质押担保分为动产质押和权利质押，选项B、C、D可作为动产质押的质押物，选项E可作为权利质押的质押物。而选项A是不动产，不在质押物的范围内。,0,0
2,(多选题)商用房贷款的对象应该具有（）等条件。,<p>A具有中国国籍</p><p>B年满18周岁</p><p>C具有完全民事行为能力</p><p>D无不良资信记录和行为记录</p><p>E自然人</p>,5,ABCDE,商用房贷款的对象应该是具有中国国籍、年满18周岁、具有完全民事行为能力、无不良资信记录和行为记录的自然人。,0,0
2,(多选题)下列情形中，抵押无效的有（）。,<p>A李四以自家宅基地使用权作为抵押，贷款10万元装修住房</p><p>B张三以夫妻名下房产作为抵押申请汽车贷款，其配偶并不知道</p><p>C某幢房产在2002年的交易价格为50万元，银行按照2009年的评估价60万元核算贷款金额</p><p>D某公司老总以公司财产为自己购买汽车提供抵押担保</p><p>E红星中学提出以学校操场为抵押，贷款50万元翻新校舍</p>,5,ABDE,根椐《担保法》规定，学校、医院等公益性事业单位公益财产，所有权不明、有争议的以及宅基地使用权不得设定抵押，共有财产的抵押须取得共有人的同意等。公司董事、经理不得以公司财产为个人提供抵押担保。选项A为宅基地使用权、选项B为共有财产抵押权、选项D为公司财产、选项E为学校财产，按照《担保法》规定，不能作为抵押，故抵押无效。,0,0
2,(多选题)在商用房贷款的贷后检查环节，要检查借款人（）。,<p>A是否按期足额归还贷款</p><p>B收入水平是否发生变化</p><p>C住所有无变动</p><p>D有无卷入重大经济纠纷</p><p>E身体状况是否变化</p>,5,ABCDE,在商用房贷款中，对借款人进行贷后检查的主要内容包括：(1)借款人是否按期足额归还贷款；(2)借款人工作单位、收入水平是否发生变化；(3)借款人的住所、联系电话有无变动；(4)有无发生能影响借款人还款能力或还款意愿的突发事件，如卷入重大经济纠纷、诉讼或仲裁程序，借款人身体状况恶化或突然死亡等；(5)商用房的出租情况及租金收入状况。,0,0
2,(多选题)个人汽车贷款中，银行内部操作流程包括（）。,<p>A贷款的受理和调查</p><p>B贷款的审查和审批</p><p>C贷款的签约与发放</p><p>D购车合同的签订</p><p>E贷后与档案管理</p>,5,ABCE,银行内部操作流程包括：贷款的受理与调查、审查与审批、签约与发放、贷后管理。 ,0,0
2,(多选题)对借款人还款能力的调查包括（）。,<p>A借款人的基本收入情况</p><p>B收入水平对偿还贷款的覆盖度</p><p>C借款人的其他收入所得</p><p>D借款人的其他资产收益情况</p><p>E借款人及其家庭所拥有总资产的状况</p>,5,ABCDE,借款人还款能力的调查包括：借款人的基本收入情况，借款人的其他收入所得，借款人其他资产收益情况，借款人及其家庭所拥有总资产的状况。主要通过以下方面来了解掌握借款人基本收入状况的稳定性：调查其在现有单位、现有职位的任职期限，所从事行业及单位的前景和稳定性等；对其收入水平的真实性进行判断，结合其个人学历学位、从业年限、职位等信息，对其收入水平的合理性作出经验判断，必要时进行调查、取证；收入水平对偿还贷款的覆盖度，对此类客户原则上应对其贷款余额与其家庭年收入水平的比率设一定的上限，原则上借款人年还款金额应不超过其家庭年收入水平总额的80%。,0,0
2,(多选题)属于“直客式”个人贷款营销模式特点的有（）。,<p>A房价折扣</p><p>B部分税费可以减免</p><p>C保险、律师和公证一站式服务</p><p>D各类费用减免优惠</p><p>E就近选择办理网点</p>,5,ABCDE,“直客式”个人贷款，就是利用银行网点和理财中心作为销售和服务的主渠道，银行客户经理按照“了解你的客户，做熟悉客户”的原则，直接营销客户，受理客户贷款需求。它的特点在于买房时享受一次性付款的优惠，主要包括房价折扣、少交税费，保险、律师和公证一站式服务，各类费用减免优惠，担保方式更灵活，就近选择办理网点，不受地理区域限制等。,0,0
2,(多选题)下列各种情形中，可以申请个人住房贷款的有（）。,<p>A房地产开发商建造某个人住房楼盘</p><p>B个人自建自住房</p><p>C个人对房屋进行大修</p><p>D个人租房</p><p>E个人购买第二套商品房</p>,5,BCE,个人住房贷款是向购买、建造、翻建、大修自住住房的个人所发放的贷款。对于选项A，房地产开发公司开发楼盘属于公司行为，不属于个人行为，应申请公司贷款。对于选项D，个人租房不可以申请个人住房贷款。,0,0
2,(多选题)个人征信报告中信用卡信息包括的内容有（）。,<p>A最大负债额</p><p>B下次应还款日期</p><p>C共享授信额度</p><p>D最近一次实际还款金额</p><p>E卡类型</p>,5,ACE,信用卡信息包括卡类型、担保方式、币种、开户日期、信用额度、共享授信额度、最大负债额、透支余额、本月应还款金额、本月实际还款金额、最近一次实际还款日期、当前逾期期数、当前逾期总额、信用卡最近24个月每月还款状态记录。,0,0
2,(多选题)银行在进行营销决策前首先对（）进行调查分析。,<p>A客户需求</p><p>B竞争对手实力</p><p>C金融市场变化趋势</p><p>D经济周期</p><p>E国际市场变化</p>,5,ABC,银行在进行营销决策之前。应首先对客户需求、竞争对手实力和金融市场变化趋势等内外部市场环境进行充分的调查和分析。,0,0
2,(多选题)商品房买卖合同中应明确（）。,<p>A商品房的销售方式</p><p>B买受人的收入来源</p><p>C交付使用条件及日期</p><p>D面积差异的处理方式</p><p>E办理产权登记有关事宜</p>,5,ACDE,买受人的收入来源无须在商品房买卖合同中明确，所以B选项不符合题意。,0,0
2,(多选题)将信贷管理大致地分为贷前管理、贷中管理和贷后管理三个环节，这种划分难以对信贷管理中的具体问题采取（）的措施。,<p>A有效性</p><p>B针对性</p><p>C操作性</p><p>D完整性</p><p>E实效性</p>,5,BC,信贷管理不能仅大致地分为贷前管理、贷中管理和贷后管理三个环节，这种划分难以对信贷管理中的具体问题采取有针对性和操作性的措施，也难以对贷款使用实施有效的管控。贷款人要从加强贷款全流程管理的思路出发，将贷款过程管理中的各个环节进行分解，按照有效制衡的原则将各环节职责落实到具体的部门和岗位，并建立明确的问责机制。 ,0,0
3,(判断题)个人信用贷款是商业银行向个人发放的需要提供特别担保的人民币贷款。（）,<p>A正确</p><p>B错误</p>,2,B,个人信用贷款是商业银行向个人发放的无须提供特别担保的人民币贷款。,0,0
3,(判断题)银行品牌间是否存在有机的内在联系，是决定银行品牌管理效率高低的关键。（）,<p>A正确</p><p>B错误</p>,2,A,决定银行品牌管理效率高低的关键是银行品牌间是否存在有机的内在联系。,0,0
3,(判断题)银行为控制风险只可以为自用商品房客户提供个人贷款。而不得向购买或租赁经营类商用房的个人提供个人贷款。（）,<p>A正确</p><p>B错误</p>,2,B,银行可以向用于定向购买或租赁商用房的个人提供贷款。,0,0
3,(判断题)目前，用户在使用个人征信系统查询个人信用报告时，需要支付一定费用。（）,<p>A正确</p><p>B错误</p>,2,B,现在，个人征信系统由政府出资建设管理，查询个人信用报告是征信中心提供的一种服务，原则上需要收取一定成本费用，目前暂不收费。,0,0
3,(判断题)为了有效规避有担保流动资金贷款保证人还款能力发生变化的风险，贷款银行应当选择信用等级高、还款能力强的保证人，且保证人信用等级不能低于借款人。（）,<p>A正确</p><p>B错误</p>,2,A,银行应加强对保证人还款能力的调查和分析。为了有效规避有担保流动资金贷款保证人还款能力发生变化的风险，贷款银行应当选择信用等级高、还款能力强的保证人，且保证人信用等级不能低于借款人，不接受股东之间和家庭成员之间的单纯第三方保证方式。,0,0
3,(判断题)商业银行如果违反规定查询个人的信用报告，或将查询结果用于规定范围之外的其他目的，将被责令整改，并处以1万元以上3万元以下的罚款。（）,<p>A正确</p><p>B错误</p>,2,A,商业银行如果违反规定查询个人的信用报告，或将查询结果用于规定范围之外的其他目的，将被责令整改，并处以1万元以上3万元以下的罚款；涉嫌犯罪的，则将依法移交司法机关处理。,0,0
3,(判断题)在实践中，当借款人采用一种担保方式不能足额对贷款进行担保时，可以组合使用不同的担保方式。（）,<p>A正确</p><p>B错误</p>,2,A,在实践中，当借款人采用一种担保方式不能足额对贷款进行担保时，可以组合使用不同的担保方式，说法正确。,0,0
3,(判断题)集中策略适用于中小型银行。（）,<p>A正确</p><p>B错误</p>,2,A,集中策的优点是能更详细、更透彻地分析和熟悉目标客户的要求，能集中精力、集中资源于某个子市场，营销效果更明显，其所设计出的营销组合更能贴近客户的需求，从而能够使银行在子市场或某一专业市场获得垄断地位。因此适用于资源不多的中小银行。,0,0
3,(判断题)商业银行查询个人信用报告时所需的书面授权可以通过在贷款、贷记卡、准贷记卡以及担保申请书中增加相应条款取得。（）,<p>A正确</p><p>B错误</p>,2,A,题干说法正确。,0,0
3,(判断题)根据迈克尔波特的竞争战略理论，单一营销策略具有针对性强、营销成本高的特点。（）,<p>A正确</p><p>B错误</p>,2,A,单一营销策具有针对性强、营销成本高的特点。,0,0
3,(判断题)信用风险是银行面临的最古老的风险之一，在全球范围内给许多金融机构造成了严重的经济损失。（）,<p>A正确</p><p>B错误</p>,2,B,题干中描述的应为操作风险，而不是信用风险。,0,0
3,(判断题)对正常、关注类贷款进行贷后检查，可采取全面检查的方式，每半年至少进行一次。（）,<p>A正确</p><p>B错误</p>,2,B,对正常、关注类贷款可采取抽查的方式不定期进行，对次级、可疑、损失类贷款采取全面检查的方式，每季度至少进行一次贷后检查。,0,0
3,(判断题)公积金个人住房贷款是不以营利为目的，实行“高进低出”的利率政策，带有较强的政策性，贷款额度受到限制的一类贷款。（）,<p>A正确</p><p>B错误</p>,2,B,我国公积金个人住房贷款实行“低进低出”的利率政策，带有较强的政策性，贷款额度受到限制。“低进”是指公积金的存款利率低于同期市场存款利率水平；“低出”是指公积金的贷款利率也低于同期市场贷款利率的水平，并不是“高进低出”。,0,0
3,(判断题)个人有处分权的权利凭证不得出质。（）,<p>A正确</p><p>B错误</p>,2,B,个人有处分权的很多权利凭证都可以出质。,0,0
3,(判断题)对于二手个人住房贷款，商业银行最主要的合作单位是房地产开发商。（）,<p>A正确</p><p>B错误</p>,2,B,对于二手个人住房贷款，商业银行最主要的合作单位是房地产经纪公司，对于一手个人住房贷款，商业银行最主要的合作单位是房地产开发商。,0,0
