2,(多选题)我国商业银行的会计资本主要包括（）。,<p>A普通股股本</p><p>B实收资本</p><p>C资本公积</p><p>D盈余公积</p><p>E投资重估储备</p>,5,ABCDE,我国商业银行的会计资本主要包括普通股股本/实收资本、资本公积、盈余公积、未分配利润、投资重估储备、一般风险准备等。,0,0
2,(多选题)我国商业银行自深化股份制改革以后，在银行组织架构的发展方面着重于（）。,<p>A渐进式推进事业部制改革</p><p>B实施以业务单元纵向为主的矩阵考核方式</p><p>C根据业务线职能设置组织架构模式</p><p>D建立垂直化风险管理体系</p><p>E建设流程银行</p>,5,ADE,我国商业银行自深化股份制改革以后，在银行组织架构的发展方面着重于渐进式推进事业部制改革、建立垂直化风险管理体系和建设流程银行。,0,0
2,(多选题)下列属于我国银行担保类业务的有（）。,<p>A银行保函</p><p>B福费廷</p><p>C备用信用证</p><p>D项目贷款承诺</p><p>E票据发行便利</p>,5,AC,我国银行的担保类业务分为银行保函业务和备用信用证业务。,0,0
2,(多选题)我国银行监管构成的层次包括（)。,<p>A银行自我监管</p><p>B外部监管</p><p>C行业自律</p><p>D市场约束</p><p>E法律制裁</p>,5,ABCD,我国银行监管的四个层次：银行自我监管、外部监管、行业自律和市场约束（本题来自嗨考网）,0,0
2,(多选题)外币存款业务和人民币存款业务的共同点有（)。,<p>A都是银行的资产业务</p><p>B都有相同的账户管理方式</p><p>C都可以按客户类型分为个人存款和单位存款</p><p>D都是存款人将资金存入银行的信用行为</p><p>E都是所有商业银行可以做的业务</p>,5,CD,外币存款业务和人民币存款业务的共同点有都可以按客户类型分为个人存款和单位存款，都是存款人将资金存入银行的信用行为。,0,0
2,(多选题)区域劳动人口应重点分析（）等问题。,<p>A人口数量</p><p>B教育水平</p><p>C人口分布</p><p>D人口素质</p><p>E区域的适度人口规模</p>,5,ACDE,应重点分析人口的数量、素质、分布及其资源数量和分布及生产布局的适应性和协调性，区域适度人口的规模等问题。,0,0
2,(多选题)基金托管业务有（)。,<p>A开放式基金托管</p><p>B企业年金托管</p><p>C全国社会保障基金托管</p><p>D证券公司受托投资托管</p><p>EQFII证券投资托管</p>,5,ABCDE,指有托管资格的银行接受基金管理公司或其他客户的委托，安全保管所托管基金的资产，并办理有关清算、资产估值、会计核算、监督基金管理人投资运作等业务。基金公司按基金托管净值的一定比例向银行支付基金托管费。除开放式和封闭式基金托管业务外，还有其他基金托管业务，包括全国社会保障基金托管、证券公司受托投资托管、合格境外机构投资者（QFII）证券投资托管、企业年金托管等。,0,0
2,(多选题)下列不属于银监会职责的有（）。,<p>A编制银行业统计报表</p><p>B对商业银行进行非现场监管</p><p>C处理银行业突发事件</p><p>D制定货币政策</p><p>E监督管理银行间外汇市场</p>,5,DE,制定货币政策、监督管理银行间外汇市场是中国人民银行的职责。,0,0
2,(多选题)根据我国《物权法》的规定，质权人的主要权利有（）。,<p>A质权人有权收取质押财产的利息</p><p>B质权人可以放弃质权</p><p>C债务人不履行到期债务，质权人可以与出质人协议以质押财产折价</p><p>D质权人在质权存续期间，擅自使用、处分质押财产，给出质人造成损害的，无须承担赔偿责任</p><p>E妥善保管质押财产</p>,5,ABC,质权人的主要权利有：（1）拍卖、变卖质押财产所得的价款优先受偿权。（2）质权人有权收取质押财产的利息;这里的利息应当先充抵收取利息的费用。（3）债务人以自己的财产出质，质权人放弃该质权的，其他担保人在质权人丧失优先受偿权益的范围内免除担保责任。（本题来自嗨考网）,0,0
2,(多选题)商业银行贷款，应当遵守下列资产负债比例管理的规定（）。,<p>A资本充足率不得低于4%</p><p>B资本充足率不得低于8%</p><p>C贷款余额与存款余额的比例不得超过75%</p><p>D流动性资产余额与流动性负债余额的比例不得低于35%</p><p>E对同一借款人的贷款余额与商业银行资本余额的比例不得超过10%</p>,5,BCE,资本充足率不得低于8%，所以A说法有误。流动性资产余额与流动性负债余额的比例不得低于25%，所以D说法有误。,0,0
2,(多选题)关于银行资金业务，下列说法不正确的有（)。,<p>A银行所有资金的取得和运用都属于资金业务</p><p>B资金业务是银行重要的资金运用，银行可以买入债券获得投资收益</p><p>C资金业务是银行重要的资金来源，银行可以拆入资金获得资金周转</p><p>D资金业务最主要的风险是信用风险</p><p>E银行开展资金业务面临着从业人员的操作风险</p>,5,AD,资金业务不包括银行贷款，因而不是所有资金的取得和运用都属于资金业务。资金业务最主要的风险是市场风险。,0,0
3,(判断题)半成品不得作为抵押物。（）,<p>A正确</p><p>B错误</p>,2,B,半成品也可以作为抵押物。,0,0
3,(判断题)备用通行证的开证行是第一付款人。（）,<p>A正确</p><p>B错误</p>,2,B,备用通行证的开证行是第二付款人。,0,0
3,(判断题)操作风险可以分为由人员、系统、流程和外部事件所引发的四类风险。（),<p>A正确</p><p>B错误</p>,2,A,根据操作风险引起的原因不同，可以分为由人员、系统、流程和外部事件所引发的四类风险。,0,0
3,(判断题)存款合同是一种诺成合同，故必须是存款人将款项交付存款机构经确认并出具存款凭证后，存款合同才成立。（）,<p>A正确</p><p>B错误</p>,2,B,存款合同是一种实践合同，故必须是存款人将款项交付存款机构经确认并出具存款凭证后，存款合同才成立。,0,0
3,(判断题)当事人订立合同应当具有要约和承诺两个阶段。（）,<p>A正确</p><p>B错误</p>,2,A,《合同法》第13条规定：“当事人订立合同，采取要约、承诺方式。”依此规定，合同的订立包括要约和承诺两个阶段。,0,0
3,(判断题)对于违反规定进行检查、调查或者采取临时冻结措施的，依法给予行政处分。（）,<p>A正确</p><p>B错误</p>,2,A,本题表述正确。,0,0
3,(判断题)金融犯罪侵犯的客体是金融管理秩序。（）,<p>A正确</p><p>B错误</p>,2,A,本题表述正确。,0,0
3,(判断题)金融机构在从事委托贷款业务时，除按规定收取手续费之外，还可收取0.1%的利息。（）,<p>A正确</p><p>B错误</p>,2,B,除按中国人民银行规定收取手续费之外，不得收取其他任何费用。（本题来自嗨考网）,0,0
3,(判断题)经济资本供给量指可用于覆盖非预期损失的资本资源，主要来源于监管资本。（）,<p>A正确</p><p>B错误</p>,2,B,经济资本供给量指可用于覆盖非预期损失的资本资源，主要来源于账面资本（所有者权益）。,0,0
3,(判断题)票据权利的保全是指票据债权人为防止其票据权利的丧失，依《票据法》规定而采取的行为。（）,<p>A正确</p><p>B错误</p>,2,A,考核票据权利保全的概念。,0,0
3,(判断题)实际履行原则是我国《民法》的基本原则，贯穿于《民法》的始终。（）,<p>A正确</p><p>B错误</p>,2,B,诚实信用原则是我国《民法》的基本原则，贯穿于《民法》的始终。,0,0
3,(判断题)银行及其从业人员在接受非现场监管的时候，提供的数据不必很完整，但一定要真实、准确。（）,<p>A正确</p><p>B错误</p>,2,B,银行业从业人员应当保证所提供数据和信息完整、真实、准确。,0,0
3,(判断题)暂扣或吊销营业执照属于行政处罚。（）,<p>A正确</p><p>B错误</p>,2,A,行政处罚的种类包括：警告、罚款、责令停产停业、暂扣或者吊销许可证、暂扣或者吊销营业执照、行政拘留以及法律和行政法规规定的其他行政处罚。,0,0
3,(判断题)长期利率又称远期利率。（）,<p>A正确</p><p>B错误</p>,2,B,一年以上的信用活动所对应的利率成为长期利率。远期利率是从未来的某个时点开始到更远的时点的利率，是未来的即期利率。（本题来自嗨考网）,0,0
3,(判断题)中国人民银行不再直接审批、监管金融机构，而主要专注于货币政策的制定和执行。（）,<p>A正确</p><p>B错误</p>,2,A,中国人民银行不再直接审批、监管金融机构，而主要专注于货币政策的制定和执行。,0,0
