1,(单选题)银行某工作人员发现同事在给客户介绍产品的时候刻意隐瞒了该产品的风险以实现销售目标，则该工作人员()。,<p>A应当帮助同事隐瞒，以便增加银行销售额</p><p>B不应越职过问，因为其他同事的行为应由有关部门监管</p><p>C应当及时提示、制止，并视情况向所在机构或有关部门报告</p><p>D应当立即向监督部门检举该同事的违规行为，并且不应事先提醒该同事</p>,4,C,“互相监督”要求银行业从业人员对同事在工作中违反法律、内部规章制度的行为应该给予提示、制止，并视情况向所在机构，或行业自律组织、监管部门、司法机关报告。故C选项符合题意，A、B选项不符合题意。对违规行为首先应当及时提示、制止，不能制止的，要及时进行报告。故D选项不符合题意。,0,0
1,(单选题)由()对《银行业从业人员职业操守》进行解释。,<p>A各银行党委</p><p>B中国银行业监督管理委员会</p><p>C中国银行业协会</p><p>D中国人民银行</p>,4,C,《银行业从业人员职业操守》由中国银行业协会制定并公布，其解释权必然归属于中国银行业协会。,0,0
1,(单选题)信用证开证银行依照客户（开证申请人）的要求和指示，承诺在符合信用证条款情况下，凭规定的单据不需要承担的是()。,<p>A向第三者（受益人）或其指定人进行付款或承兑</p><p>B授权另一银行进行该项付款或承兑</p><p>C授权另一银行议付</p><p>D保证出口商品的质量</p>,4,D,信用证开证行依照开证申请人的要求和指示，承诺在符合信用证条款的情况下，凭规定的单据付款或承兑、授权另一家银行付款或承兑、授权另一家银行议付。但不承担保证出口商品质量的责任。,0,0
1,(单选题)在代理销售产品的过程中，银行工作人员的做法正确的是()。,<p>A利用消费者的误解，追求被代理销售的产品的销量</p><p>B对产品的性质、法律关系、被代理人的名称及其责任、所在机构的责任等用不易被人注意的方式体现在销售合同或广告中，使消费者无法获得足够信息</p><p>C在合约中，或在向客户介绍产品时，能够让客户准确判断产品的特性</p><p>D利用消费者对银行的信任，夸大产品的收益性</p>,4,C,在代理销售产品的过程中，以下一些做法存在不妥之处：(1)利用消费者的误解，追求被代理销售的产品的销量；(2)对产品的性质、法律关系、被代理人的名称及其责任、所在机构的责任等含糊其辞，或用不易被人注意的方式体现在销售合同或广告中，使消费者无法获得足够信息；(3)在合约中，或在向客户介绍产品时，用晦涩或专业性很强的语言描述产品，使客户无法准确判断产品的特性；(4)利用消费者对银行的信任.夸大产品的收益性或对产品的收益性进行合约以外的承诺。,0,0
2,(多选题)银行业金融机构市场准入监管的内容主要包括()。,<p>A分支机构准入</p><p>B从业人员准入</p><p>C高级管理人员准入</p><p>D法人机构准入</p><p>E业务准入</p>,5,ACDE,银行业金融机构的市场准入主要包括三个方面：机构、业务和高级管理人员。机构准入是指批准金融机构法人或分支机构的设立和变更，业务准入是指批准金融机构的业务范围以及开办新的产品和服务；高级管理人员准入是指对金融机构董事及高级管理人员的任职资格进行审查核准。,0,0
2,(多选题)中国银行体系的组成机构包括()。,<p>A中央银行</p><p>B监管机构</p><p>C自律组织</p><p>D银行业金融机构</p><p>E投资银行</p>,5,ABCD,中国银行体系由中央银行、监管机构、自律组织和银行业金融机构组成。,0,0
2,(多选题)经批准在我国境内设立的金融机构中，()可以经营全部的外汇和人民币业务。,<p>A中外合资银行</p><p>B外国银行代表处</p><p>C外商独资银行</p><p>D外国银行分行</p><p>E中资商业银行</p>,5,AC,按照《外资银行管理条例》规定，外商独资银行、中外合资银行按照银监会批准的业务范围，可以经营部分或者全部外汇业务和人民币业务；经中国人民银行批准，可以经营结汇、售汇业务。外国银行分行按照银监会批准的业务范围，可以经营部分或者全部外汇业务以及对除中国境内公民以外客户的人民币业务。,0,0
2,(多选题)下列可以通过中央银行发放再贷款来解决资金的有()。,<p>A为解决商业银行流动性不足的需要</p><p>B为处置金融风险的需要</p><p>C为支持农业发展的需要</p><p>D为地方政府的特定需要</p><p>E为满足商业银行资本充足率的需要</p>,5,ABCD,再贷款是指中央银行对金融机构发放的贷款，是中央银行资产业务的重要组成部分。中国人民银行发放的再贷款分为三类：一是为解决流动性不足的需要而发放的贷款；二是为处置金融风险的需要而发放的贷款；三是用于特定目的的贷款，这类贷款主要有中央银行对地方政府的专项贷款、支农再贷款、短期流动贷款、无息再贷款和中小金融机构的再贷款等。,0,0
2,(多选题)下列属于国际收支项目的是()。,<p>A贸易收支</p><p>B劳务收支</p><p>C外资对华直接投资</p><p>D对其他国家的捐赠</p><p>E世行贷款</p>,5,ABCDE,国际收支包括经常项目和资本项目。经常项目主要反映一国的贸易和劳务往来状况，包括贸易收支、劳务收支（如运输、旅游等）和单方面转移（如汇款、捐赠等），是最具综合性的对外贸易的指标。资本项目则集中反映一国同国外资金往来的情况，反映了一国利用外资和偿还本金的执行情况，如直接投资、政府和银行的借款及企业信贷等。,0,0
2,(多选题)下列不属于财政政策工具的是()。,<p>A公开市场业务</p><p>B税收</p><p>C政府债券</p><p>D汇率政策</p><p>E政府支出</p>,5,AD,财政政策是一国政府为了实现一定的宏观经济目标而调整财政收支规模和收支平衡的指导原则及其相应的措施，主要包括财政收入政策和财政支出政策。财政政策可以选用的工具主要有税收、政府支出和政府债券。A、D两项属于货币政策。,0,0
2,(多选题)在我国货币供应量层次划分中，属于准货币的是()。,<p>A证券公司保证金存款</p><p>B企业单位定期存款</p><p>C城市居民储蓄存款</p><p>D企业单位活期存款</p><p>E流通中现金</p>,5,ABC,现阶段，我国按流动性不同将货币供应量划分为三个层次：M0=流通中的现金；M1=M0+企业单位活期存款+农村存款+机关团体部队存款+银行卡项下的个人人民币活期储蓄存款；M2=M1+城市居民储蓄存款+企业单位定期存款+证券公司保证金存款+其他存款。M1被称为狭义货币，是现实购买力；M2被称为广义货币；M2与M1之差被称为准货币，是潜在购买力。具体包括城乡居民储蓄存款、单位定期存款、证券公司保证金存款、其他存款。,0,0
2,(多选题)间接融资工具包括()。,<p>A银行债券</p><p>B银行承兑汇票</p><p>C可转让大额存单</p><p>D企业债券</p><p>E人寿保险单</p>,5,ABCE,按融资方式划分，金融工具可分为直接融资工具和间接融资工具。其中，间接融资工具包括银行债券、银行承兑汇票、可转让大额存单、人寿保险单等。,0,0
2,(多选题)下列属于非融资类保函的是()。,<p>A经营租赁保函</p><p>B延期付款保函</p><p>C预付款保函</p><p>D投标保函</p><p>E融资租赁保函</p>,5,ACD,银行保函分为融资类保函与非融资类保函，融资类保函包括：借款保函、授信额度保函、有价证券保付保函、融资租赁保函、延期付款保函。投标保函、经营租赁保函、预付款保函属于非融资类保函。,0,0
2,(多选题)下列关于银行债券投资业务的表述，正确的有()。,<p>A国债是银行最安全的中长期投资品种</p><p>B国债是银行最主要的中长期投资品种</p><p>C国债是银行最具有流动性的长期投资品种</p><p>D我国的公司债包括企业债和金融债</p><p>E银行可以将金融债作为投资和融资的工具</p>,5,ABCE,从逻辑关系来说，公司债和企业债并无本质区别，只是“企业”的外延比“公司”的大，企业债应该包括公司债。上市金融机构所发的金融债就是公司债的一部分，但公司债中无法包括所有的金融债。因此，金融债与公司债是有着相互交叉的两种债券。因此，D选项错误。,0,0
2,(多选题)下列关于结算方式的叙述，正确的有()。,<p>A汇票的签发人只能是银行，本票的签发人可以是银行和企业</p><p>B汇票、本票、支票均可以要求委托付款人见票即付</p><p>C转账支票既可以转账，也可以支取现金</p><p>D本票、汇票只能由银行承兑</p><p>E本票、汇票、支票属于传统的结算方式</p>,5,BE,汇票分为银行汇票和商业汇票：银行汇票是由出票银行签发的。商业汇票是由出票人签发的，出票人一般是企业。商业汇票又分为商业承兑汇票（由银行以外的付款人承兑）和银行承兑汇票（由银行承兑）两种。支票上印有“现金”字样，用来支取现金；支票上印有“转账”字样，只能用于转账，不能支取现金；普通支票可以支取现金，也可以转账。本票是由银行签发的。,0,0
2,(多选题)单位开立专用存款账户的资金用途包括()。,<p>A基本建设资金</p><p>B住房基金</p><p>C社会保障基金</p><p>D单位银行卡备用金</p><p>E信托基金</p>,5,ABCDE,专用存款账户是指存款人对其特定用途的资金进行专项管理和使用而开立的银行结算账户。存款人下列特定用途的资金可以开立专用存款账户：基本建设资金，期货交易保证金，信托基金，金融机构存放同业资金，政策性房地产开发资金，单位银行卡备用金，住房基金，社会保障基金，收入汇激资金和业务支出资金，党、团、工会设在单位的组织机构经费等。,0,0
2,(多选题)目前，我国银行信贷管理一般实行()相结合制度，以切实防范、控制和化解贷款业务风险。,<p>A集中授权管理</p><p>B统一授信管理</p><p>C审贷分离</p><p>D分级审批</p><p>E贷款管理责任制</p>,5,ABCDE,目前，我国银行信贷管理一般实行集中授权管理（总行统一制定信贷政策）、统一授信管理（控制融资总量及不同行业、不同企业的融资额度）、审贷分离、分级审批、贷款管理责任制相结合，以切实防范、控制和化解贷款业务风险。,0,0
2,(多选题)只要不超过中国人民银行同期限档次存款利率上限，计结息规则可由银行自己把握的存款种类有()。,<p>A定期整存整取</p><p>B协定存款</p><p>C通知存款</p><p>D零存整取</p><p>E活期存款</p>,5,BCD,《中国人民银行关于人民币存贷款计结息问题的通知》中规定：除活期和定期整存整取两种存款外，国内银行的通知存款、协定存款、定活两便、存本取息、零存整取、整存零取6个存款种类，只要不超过中国人民银行同期限档次存款利率上限，计结息规则由各银行自己把握。,0,0
2,(多选题)银行全面风险管理的核心包括()。,<p>A全球的风险管理体系</p><p>B全面的风险管理范围</p><p>C全程的风险管理过程</p><p>D全新的风险管理方法</p><p>E全员的风险管理文化</p>,5,ABCDE,全面风险管理是一种以先进的风险管理理念为指导，以全球的风险管理体系、全面的风险管理范围、全程的风险管理过程、全新的风险管理方法、全员的风险管理文化为核心的新型管理模式，它已经成为国际化银行谋求发展和竞争优势的最重要方式。,0,0
2,(多选题)在合并农村信用社的基础上组建的农村金融机构有()。,<p>A中国农业银行</p><p>B农村商业银行</p><p>C中国农业发展银行</p><p>D农村合作银行</p><p>E农村银行</p>,5,BD,中国农业银行属于大型商业银行，不属于农村金融机构，故A选项错误。中国农业发展银行属于政策性银行，不属于农村金融机构，故C选项错误。,0,0
2,(多选题)反洗钱行政主管部门可以建议有关金融监督管理机构责令停业整顿或者吊销金融机构的经营许可证的情形有()。,<p>A违反保密规定泄露有关信息</p><p>B未按规定对职工进行反洗钱培训的</p><p>C未按规定建立反洗钱内部控制制度的</p><p>D拒绝、阻碍反洗钱检查、调查的</p><p>E未按规定履行客户身份识别义务的</p>,5,ADE,金融机构有以下行为，致使洗钱后果发生的，情节特别严重的，反洗钱行政主管部门可以建议有关金融监督管理机构责令停业整顿或者吊销其经营许可证：(1)未按照规定履行客户身份识别义务的；(2)未按照规定保存客户身份资料和交易记录的；(3)未按照规定报送大额交易报告或者可疑交易报告的；(4)与身份不明的客户进行交易或者为客户开立匿名账户、假名账户的；(5)违反保密规定，泄露有关信息的；(6)拒绝、阻碍反洗钱检查、调查的；(7)拒绝提供调查材料或者故意提供虚假材料的。,0,0
2,(多选题)按照规定，当事人发生贷款合同纠纷后，可以通过()等方式加以解决。,<p>A第三人调解</p><p>B当事人协商和解</p><p>C代位求偿</p><p>D诉讼</p><p>E仲裁</p>,5,ABDE,当事人发生贷款合同纠纷后，可以通过第三人调解、当事人协商和解、仲裁或诉讼等方式加以解决。,0,0
2,(多选题)下列属于无效合同的情形有()。,<p>A一方以欺诈、胁迫的手段订立合同，损害国家利益的</p><p>B以合法形式掩盖非法目的的</p><p>C因重大误解而订立的</p><p>D在订立合同时显失公平的</p><p>E违反法律、行政法规的强制性规定的</p>,5,ABE,因重大误解而订立的合同、在订立时显失公平的合同属于可撤销的合同。故C、D选项不符合题意。,0,0
2,(多选题)商业银行不得在境内进行()业务。,<p>A代售基金</p><p>B黄金交易</p><p>C证券经营</p><p>D外汇买卖</p><p>E信托投资</p>,5,CE,商业银行在中华人民共和国境内不得从事信托投资和证券经营业务，不得向非自用不动产投资或者向非银行金融机构和企业投资，但国家另有规定的除外。,0,0
2,(多选题)下列方式中，物的担保方式主要包括()。,<p>A处分权</p><p>B留置权</p><p>C质押权</p><p>D抵押权</p><p>E书面承诺权</p>,5,BCD,担保的种类包括：(1)人的担保。是指如果债务人不履行债务，由保证人按照约定履行债务。其主要形式是保证人的保证，这种形式在实际工作中具有较高的可操作性。(2)物的担保。物的保证方式主要有抵押权和质押权以及留置权，但操作手续较为繁琐。(3)定金担保。是在债务之外又交付一定数额的定金，该定金的得失与债务履行与否联系在一起，从而促使其积极履行债务，保障债权实现。,0,0
2,(多选题)银行人员职务犯罪的情形有()。,<p>A挪用公款</p><p>B签订合同失职罪</p><p>C受贿</p><p>D金融诈骗罪</p><p>E贪污</p>,5,ABCE,根据金融犯罪实施主体的不同，可以划分为针对银行的犯罪和银行人员职务犯罪。针对银行的犯罪又称为外部犯罪，主要包括破坏金融管理秩序罪、金融诈骗罪等。银行人员职务犯罪又称为内部犯罪，包括贪污、受贿、挪用公款、签订合同失职罪等。,0,0
2,(多选题)金融凭证诈骗罪是指使用伪造、变造()等银行结算凭证进行诈骗活动的行为。,<p>A银行存单</p><p>B汇款凭证</p><p>C信用证</p><p>D货币</p><p>E委托收款凭证</p>,5,ABE,本题是对金融凭证诈骗罪定义的考查。金融凭证诈骗罪，是指以非法占有为目的，采用虚构事实、隐瞒真相的方法，使用伪造、变造的委托收款凭证、汇款凭证、银行存单等其他银行结算凭证进行诈骗活动的行为。,0,0
2,(多选题)目前，中国人民银行采用的利率工具包括()。,<p>A调整中央银行再贷款利率、再贴现利率</p><p>B调整中央银行存款准备金利率、超额存款准备金利率</p><p>C调整金融机构的法定存贷款利率</p><p>D制定金融机构存贷款利率的浮动范围</p><p>E制定相关政策对各类利率结构和档次进行调整</p>,5,ABCDE,目前，中央银行采用的利率工具主要有：调整中央银行基准利率（包括：再贷款利率、再贴现利率、存款准备金利率、超额存款准备金利率）、调整金融机构的法定存贷款利率、制定金融机构存贷款利率浮动范围、制定相关政策对各类利率结构和档次进行调整等。,0,0
2,(多选题)某银行行长要求其分行一名信贷经理关照一笔贷款，而信贷经理发现该笔贷款明显不符合规定，则该信贷经理的正确做法有()。,<p>A严格按照贷款审批程序办理</p><p>B若受到该行长巨大压力，可以向监管部门报告</p><p>C可以书面汇报请示有关领导</p><p>D可以同该分行行长解释相关规定以及该贷款不合规的地方</p><p>E下级服从上级，按领导指示办事</p>,5,ABCD,银行业从业人员对所在机构违反法律法规、行业公约的行为，有责任予以揭露，同时有权利、义务向上级机构或所在机构的监督管理部门直至国家司法机关举报。,0,0
2,(多选题)下列关于离职交接的说法，正确的有()。,<p>A带走所在机构的财物</p><p>B带走自己的工作资料</p><p>C按规定填写离职交接表</p><p>D保守原所在机构的商业秘密和客户隐私</p><p>E带走自己的客户资源</p>,5,CD,根据《银行业从业人员职业操守》中“离职交接”的要求，银行业从业人员离职时，应当按照规定妥善交接工作，不得擅自带走所在机构的财物、工作资料和客户资源。在离职后，仍应恪守诚信，保守原所在机构的商业秘密和客户隐私。,0,0
2,(多选题)下列关于银行业从业人员处理客户投诉的做法，正确的是()。,<p>A不管客户的投诉是否合理，都不得轻慢其投诉</p><p>B若在机构规定的投诉反馈期限内无法拿出意见，只能接受</p><p>C应当及时地将处理的进展和结果告诉客户</p><p>D应当耐心听取客户的投诉，事后若经过调查发现客户投诉不当，则不必反馈</p><p>E不理会客户错误的投诉和建议</p>,5,AC,根据《银行业从业人员职业操守》的“客户投诉”原则，银行业从业人员应当耐心、礼貌、认真处理客户的投诉，并遵循以下原则：(1)坚持客户至上、客观公正原则，不轻慢任何投诉和建议；(2)所在机构有明确的客户投诉反馈时限，应当在反馈时限内答复客户；(3)所在机构没有明确的投诉反馈时限，应当遵循行业惯例或口头承诺的时限向客户反馈情况；(4)在投诉反馈时限内无法拿出意见，应当在反馈时限内告知客户现在投诉处理的情况，并提前告知下一个反馈时限。,0,0
2,(多选题)根据执行货币政策和维护金融稳定的需要，中国人民银行可以()。,<p>A对金融机构执行有关反洗钱规定的行为进行检查监督</p><p>B直接审批银行金融机构的设立</p><p>C对金融机构执行有关外汇管理规定的行为进行检查监督</p><p>D建议国务院银行业监督管理机构对银行业金融机构进行检查监督</p><p>E直接对银行业金融机构的所有业务进行检查监督</p>,5,ACD,直接审批银行金融机构的设立与直接对银行业金融机构的所有业务进行检查监督属于中国银监会的职责。,0,0
2,(多选题)下列属于无权代理的情形有()。,<p>A无代理权的代理</p><p>B超越代理权的代理</p><p>C代理权终止后而行使的代理</p><p>D与第三人恶意串通损害被代理人的利益行为</p><p>E第三人有足够的理由相信无权代理人有代理权的代理</p>,5,ABC,无权代理是指行为人不具有代理权，但以他人的名义与第三人进行代理的行为。无权代理的构成要件为：(1)行为人既没有代理权，也没有令人相信其有代理权的事实或理由；(2)行为人以本人的名义与他人所为的民事行为；(3)第三人须为善意且无过失；(4)行为人的行为不违法；(5)行为人与第三人具有相应的民事行为能力。D选项属于滥用代理权；E选项属于表见代理。,0,0
2,(多选题)下列属于商业银行的市场风险的有()。,<p>A利率风险</p><p>B汇率风险</p><p>C股票价格风险</p><p>D商品价格风险</p><p>E内部欺诈风险</p>,5,ABCD,市场风险是指因市场价格（包括利率、汇率、股票价格和商品价格）的不利变动而使银行表内和表外业务发生损失的风险。市场风险包括利率风险、汇率风险、股票价格风险和商品价格风险四大类。,0,0
2,(多选题)商业银行的承诺业务包括()。,<p>A资产管理服务</p><p>B客户授信额度</p><p>C开立信贷证明</p><p>D票据发行便利</p><p>E项目贷款承诺</p>,5,BCDE,承诺业务是指商业银行承诺在未来某一日期按照事先约定的条件向客户提供约定的信用业务，包括贷款承诺等。贷款承诺业务可以分为：项目贷款承诺、开立信贷证明、客户授信额度和票据发行便利四大类。,0,0
2,(多选题)银行由于短期资金周转的需要，可以采用的借款方式有()。,<p>A向中央银行借款</p><p>B发行股票</p><p>C证券回购协议</p><p>D同业拆借</p><p>E发行金融债券</p>,5,ACD,短期借款是指期限在1年或1年以下的借款，主要包括同业拆借、证券回购协议和向中央银行借款等。,0,0
2,(多选题)下列属于我国个人贷款业务的有()。,<p>A个人助学贷款</p><p>B银团贷款</p><p>C个人信用卡透支</p><p>D个人汽车贷款</p><p>E个人住房贷款</p>,5,ACDE,个人贷款主要分为四大类，即个人住房贷款、个人消费贷款、个人经营贷款和个人信用卡透支。个人助学贷款和个人汽车贷款属于个人消费贷款项目。B选项银团贷款属于公司贷款业务。,0,0
2,(多选题)中国人民银行向全国银行间债券市场发行的中央银行票据的特征有()。,<p>A是一种重要的货币政策手段</p><p>B以调节金融体系的流动性为目的</p><p>C主要目的是为中国人民银行筹集资金</p><p>D具有无风险、流动性高的特点</p><p>E它是一种长期债券</p>,5,ABD,中央银行票据简称央行票据或央票，是指中国人民银行面向全国银行间债券市场成员发行的、期限一般在3年以内的中短期债券。中国人民银行于2003年第二季度开始发行中央银行票据。与财政部通过发行国债筹集资金的性质不同，中国人民银行发行票据的目的不是筹资，而是通过公开市场操作调节金融体系的流动性，是一种重要的货币政策手段。央行票据具有无风险、流动性高等特点，从而是商业银行债券投资的重要对象。,0,0
2,(多选题)下列关于金融犯罪的说法，正确的有()。,<p>A主体违反了金融管理法规</p><p>B主体可以是自然人，也可以是单位</p><p>C主观方面应以非法占有为目的</p><p>D金融犯罪的对象可以是人，也可以是金融工具</p><p>E金融犯罪是一种图利犯罪</p>,5,ABDE,金融犯罪是一种图利犯罪，其主观方面只能是故意，有的还要求具有非法占有为目的。,0,0
2,(多选题)对货币市场的监管包括对()的监管。,<p>A票据市场</p><p>B银行间同业拆借市场</p><p>C小额可转让定期存款单市场</p><p>D银行间债券回购市场</p><p>E长期债券市场</p>,5,ABD,我国货币市场主要包括银行间同业拆借市场、银行间债券回购市场和票据市场三种形式。,0,0
2,(多选题)实践中，商业银行对降低风险加权总资产采取的方法包括()。,<p>A贷款证券化</p><p>B贷款出售</p><p>C发放高风险的贷款</p><p>D购买高质量的债券</p><p>E缩小资产总规模</p>,5,ABD,降低风险加权总资产的方法，主要是减少风险权重较高的资产，增加风险权重较低的资产，其具体方法包括贷款出售或贷款证券化，即将已经发放的贷款卖出去；收回贷款，用以购买高质量的债券（如国债）；尽量少发放高风险的贷款等。,0,0
2,(多选题)下列属于抵押合同应当包含的条款的有()。,<p>A债务人履行债务的期限</p><p>B抵押财产的状况</p><p>C被担保债权的种类和数额</p><p>D担保范围</p><p>E不能实现债权时的受偿方式</p>,5,ABCD,《物权法》明确要求设立抵押权，当事人应当采取书面形式订立抵押合同。抵押合同一般包括下列条款：(1)被担保债权的种类和数额；(2)债务人履行债务的期限；(3)抵押财产的名称、数量、质量、状况、所在地、所有权归属或者使用权归属；(4)担保的范围。,0,0
