2,(多选题)中国人民银行不得从事的业务和工作是（）。,<p>A对银行业金融机构的账户透支</p><p>B不得向任何单位和个人提供担保</p><p>C不得对政府透支</p><p>D可以根据需要，为银行业金融机构开立账户</p><p>E不得向政府部门提供贷款</p>,5,ABCE,D选项属于中国人民银行可以从事的工作和业务。（本题来自嗨考网）,0,0
2,(多选题)中央银行从现代商业银行中分离出来的原因是（）。,<p>A早期银行贷款利息很高，规模不大，不能满足资本主义工商业的需要</p><p>B集中统一银行债券发行的需要</p><p>C统一票据交及清算的需要</p><p>D最后贷款人的需要</p><p>E金融业统一管理的需要</p>,5,CDE,由于银行债券发行的集中、票据清算、最后货款人和监管的需要，一些大的商业银行逐渐从商业银行体系口分离出来，演化成为中央银行。,0,0
3,(判断题)政符政策的核心是产业结构政策和产业监督政策。（）,<p>A正确</p><p>B错误</p>,2,A,政符政策的核心是产业结构政策和产业监督政策。,0,0
3,(判断题)当一国降低利率或本国利率低于外国利率时，外汇贬值，本币升值,<p>A正确</p><p>B错误</p>,2,B,当一国降低利率或本国利率低于外国利率时，会使资本从本国流出。,0,0
3,(判断题)法定夫妻财产制优先于约定夫妻财产制适用。,<p>A正确</p><p>B错误</p>,2,B,约定夫妻财产制是指夫妻双方通过协商对婚前、婚后取得财产的归属、处分以及在婚姻关系解除后的财产分割达成协议，并优先于法定夫妻财产制适用的夫妻财产制度，又称有契约财产制度，是意思自治原则在婚姻法中的贯彻和体现。,0,0
3,(判断题)夫妻在婚姻关系存续之间，任何所得财产，均属于夫妻共同财产。,<p>A正确</p><p>B错误</p>,2,A,夫妻在婚姻关系存续之间，任何所得财产，均属于夫妻共同财产。,0,0
3,(判断题)根据《仲裁法》没有仲裁协议，一方申请仲裁的，仲裁委员会不予受理。,<p>A正确</p><p>B错误</p>,2,A,根据《仲裁法》没有仲裁协议，一方申请仲裁的，仲裁委员会不予受理。（本题来自嗨考网）,0,0
3,(判断题)合同权利和义务的概括转移也可基于当事人之间的合同行为而发生。（）,<p>A正确</p><p>B错误</p>,2,A,合同权利和义务的概括转移也可基于当事人之间的合同行为而发生。,0,0
3,(判断题)货币支付的手段造成了支付危机和货币危机的可能。,<p>A正确</p><p>B错误</p>,2,A,货币支付手段的消极影响表现在：商品生产者之间形成错综复杂的债券债务关系扩大了商品经济的矛盾存在支付危机和信用危机的可能。,0,0
3,(判断题)继承开始后，第一顺序继承人继承，第二继承人不继承。,<p>A正确</p><p>B错误</p>,2,A,继承开始后，第一顺序继承人继承，第二继承人不继承。,0,0
3,(判断题)接管目接管决定实施次日起开始〔）。,<p>A正确</p><p>B错误</p>,2,B,接管目接管决定实施之日起开始。,0,0
3,(判断题)经营租赁保函是指为融资租赁合同项下的租金支付提供的担保。（）,<p>A正确</p><p>B错误</p>,2,B,经营租赁保函是指为经营租赁合同项下的租金支付提供的担保。融资租赁保函是指为融资租赁合同项下的租金支付提供的担保。,0,0
3,(判断题)如果夫妻一方对外负债末用于夫妻共同生活和家庭生活，则不属于夫妻共同债务的范围，配偶不承担偿还责任（）,<p>A正确</p><p>B错误</p>,2,A,夫妻共同债务须用于夫妻共同生活和家庭生活，如果夫妻一方对外负债未用于夫妻共同生活和家庭生活，则不属于夫妻共同债务的范围，配偶不承担偿还责任。,0,0
3,(判断题)商业银行设立分支机构必须经国务院银行业监督管理机构审查批准（）。,<p>A正确</p><p>B错误</p>,2,A,商业银行设立分支机构必须经国务院银行业监督管理机构审查批准。,0,0
3,(判断题)我国存款保险制度中被保险存款只能是投保机构吸收的人民币存款。,<p>A正确</p><p>B错误</p>,2,B,被投保存款包括投保机构吸收的人民币存款和外币存款,0,0
3,(判断题)原始存款是派生存款的基础，而派生存款是信用扩张的基础。,<p>A正确</p><p>B错误</p>,2,B,原始存款是派生存款的基础而派生存款信用扩张的条件。,0,0
3,(判断题)只有商业银行才有权经营活期存款。（）,<p>A正确</p><p>B错误</p>,2,A,只有商业银行才有权经营活期存款。,0,0
