1,(单选题)()是在一定的经济发展阶段，一定收入水平的基础上，国内和国际在零售市场上用于购买商品的货币支付能力。,<p>A社会购买力</p><p>B平均消费能力</p><p>C居民消费能力</p><p>D货币购买力</p>,4,A,社会购买力是在一定的经济发展阶段，（本题出自金考必过，网址：www.jinkaobiguo.com，最好的刷题网站。）一定收入水平的基础上，国内和国际在零售市场上用于购买商品的货币支付能力。,62,1,0,0
1,(单选题)项目的财务评估不包含(),<p>A项目投资估算与资金筹措评估</p><p>B项目基础财务数据评估</p><p>C流动性效益评估</p><p>D不确定性评估</p>,4,C,流动性效益评估属于银行效益评估的内容。,62,1,0,0
1,(单选题)下列条件分析中，关系到项目和生产物资能否顺利集聚、供应，以及产品能否顺利分销，且是项目建设和生产的关键环节的是(),<p>A厂址选择条件分析</p><p>B财务资源分析</p><p>C相关项目分析</p><p>D交通运输条件分析</p>,4,D,交通运输条件关系到项目和生产物资能否顺利集聚、供应，以及产品能否顺利分销。因此，交通运输条件是项目建设和生产的关键环节。,62,1,0,0
1,(单选题)某企业采用平均年限法进行固定资产折旧，某固定资产原值为100万，预计的残值率为3%，预计使用年限为10年，该固定资产年折旧额为()万元。,<p>A9.7</p><p>B10</p><p>C19.4</p><p>D无法计算</p>,4,A,平均年限法的固定资产折旧计算公式如下：固定资产年折旧率=（1-预计的净残值率）*100%/折旧年限；固定资产年折旧额=固定资产原值*年折旧率。因此，年折旧额=100(1-3%)/10=9.7（万元）。,62,1,0,0
1,(单选题)假设某年我国人均购买水果15公斤，若按人口为13亿，平均每公斤水果价格为12元，则我国水果市场的总市场潜量为(),<p>A2340亿元</p><p>B195亿元</p><p>C180亿元</p><p>D234亿元</p>,4,A,总市场潜量可表示为：Q=npq；所以Q=npq=15*13*12=2340（亿元）。,62,1,0,0
1,(单选题)一个良好的项目投资环境，会为项目的顺利实施提供一个好的条件，有利于项目的成功，对拟建项目投资环境的评估不需要包括(),<p>A工业建设的优惠政策和措施</p><p>B资源、市场、社会协作条件</p><p>C可利用的基础设施，建设用地条件</p><p>D当地经济发展水平</p>,4,D,对拟建项目的环境评估主要包括以下几个方面：工业建设的优惠政策和措施等条件，资源、市场、社会协作条件，可供利用的基础设施，建设用地条件，自然条件，劳动力来源，其他推动或吸引投资者提出建设意向的背景材料等，并不包括当地经济发展水平。,62,1,0,0
1,(单选题)在对贷款项目进行成本计算时，销售费用不包括(),<p>A广告费、销售服务费</p><p>B差旅费、办公费</p><p>C运输、装卸包装费</p><p>D利息净支出</p>,4,D,销售售费用=运输、装卸包装费+广告费、（本题出自金考必过，网址：www.jinkaobiguo.com，最好的刷题网站。）销售服务费+差旅费、办公费+其他；而财务费用=经营期汇兑净损失+利息净支出+金融机构手续费+其他。,62,1,0,0
1,(单选题)()既是建设条件又是生产条件，从某种意义上讲，也是项目建设和生产条件的核心内容。,<p>A厂址选择条件分析</p><p>B财务资源分析</p><p>C相关项目分析</p><p>D交通运输条件分析</p>,4,A,厂址选择条件分析是指围绕项目是否符合有关厂址选择的条件所作出的综合分析。厂址选择条件既是建设条件又是生产条件，从某种意义上讲，厂址选择条件是项目建设和生产条件的核心内容。,62,1,0,0
1,(单选题)下列关于项目的可行性研究和贷款项目评估的对比中，不正确的是(),<p>A项目的可行性研究属于项目论证工作，一般由设计和中介咨询单位去做；贷款项目评估是贷款银行为了筛选贷款对象而展开的工作</p><p>B两者都可以委托中介咨询机构进行</p><p>C项目的可行性研究在先，项目评估在后，项目评估是在项目可行性研究的基础上进行的</p><p>D项目的可行性研究必须对项目实施后可能面临的问题进行重点的研究；而贷款项目评估是在审查可行性研究报告并对项目进行全面调查的基础上进行的</p>,4,D,项目的可行性研究必须对项目实施后可能面临的问题进行全面的研究，并作出在技术上、财务上是否可行的结论；而贷款项目评估是在审查可行性研究报告并对项目进行全面调查的基础上进行的，它可以针对发现或关心的问题，有所侧重地进行研究，不必面面俱到。,62,1,0,0
1,(单选题)()是以专业职称、技术等级考察的人力资源组合情况。,<p>A人力资源自然结构</p><p>B人力资源文化结构</p><p>C人力资源专业技能结构</p><p>D人力资源业务或工种结构</p>,4,C,人力资源专业技能结构是以专业职称、技术等级考察的人力资源组合情况。,62,1,0,0
1,(单选题)工艺技术方案的分析评估是投资项目()的核心，其标准的好坏和高低，对整个项目的设立及执行有决定性影响。,<p>A技术可行性分析</p><p>B产业基础分析</p><p>C财务可行性分析</p><p>D效益分析</p>,4,A,工艺技术方案的分析评估是投资项目技术可行性分析的核心。,62,1,0,0
1,(单选题)某企业采用双倍余额递减法进行固定资产折旧，某固定资产原值为100万，残值率为3%，预计使用年限为10年，该固定资产第二年的年折旧额为()万元。,<p>A9.7</p><p>B10</p><p>C16</p><p>D20</p>,4,C,双倍余额递减法：年折旧率=2/折旧年限，年折旧额=固定资产账面净值*年折旧率。第一年年折旧额=100*2/10=20（万元）；第二年年折旧额=(100-20)*2/10=16（万元）。,62,1,0,0
1,(单选题)项目微观环境分析中的企业财务状况指的是注册资本、固定资产原值与净值以及流动资产情况，一般是企业()的财务状况，详细分析其利润表、资产负债表和现金流量表等。,<p>A最近一年</p><p>B最近两年</p><p>C最近三年</p><p>D最近四年</p>,4,C,企业财务状况：注册资本、固定资产原值与净值以及流动资产情况，企业近年来（一般是最近三年）的财务状况，详细分析其利润表、资产负债表和现金流量表等。,62,1,0,0
1,(单选题)对于贷款项目一般应采用()来估算项目流动资金。,<p>A综合指标估算法</p><p>B比例系数法</p><p>C资产负债表法</p><p>D分项详细估算法</p>,4,D,对于贷款项目一般应采用分项详细估算法来估算项目流动资金（尤其是工业项目）。,62,1,0,0
1,(单选题)银行最关心的是借款企业的财务状况和项目的效益情况，并把贷款项目的()作为评估重点。,<p>A还款能力</p><p>B盈利能力</p><p>C技术水平</p><p>D项目建设周期</p>,4,A,银行最关心的是借款企业的财务状况和项目的效益情况，并把贷款项目的还款能力作为评估重点。,62,1,0,0
1,(单选题)对设备使用寿命的评估不包括以下()因素。,<p>A设备的物质寿命</p><p>B设备的经济寿命</p><p>C设备的技术寿命</p><p>D设备的文化寿命</p>,4,D,对设备使用寿命的评估主要考虑三个方面的因素：设备的物质寿命、设备的技术寿命、设备的经济寿命。,62,1,0,0
1,(单选题)()是指由拟建项目引起的，并与建设、生产、流通、耗费有联系的原材料、燃料、动力运输和环境保护等协作配套项目。,<p>A厂址选择条件分析</p><p>B财务资源分析</p><p>C相关项目分析</p><p>D交通运输条件分析</p>,4,C,相关项目是指由拟建项目引起的，并与建设、生产、流通、耗费有联系的原材料、燃料、动力运输和环境保护等协作配套项目。,62,1,0,0
1,(单选题)根据《项目融资业务指引》的规定，贷款人从事项目融资业务，应当以()为核心。,<p>A偿债能力分析</p><p>B盈利能力分析</p><p>C营运能力分析</p><p>D现金充足情况</p>,4,A,根据《项目融资业务指引》的规定，贷款人从事项目融资业务，应当以偿债能力分析为核心。,62,1,0,0
1,(单选题)符合国家在不同时期对不同行业项目()的规定，是确定项目生产规模的前提。,<p>A最小规模</p><p>B回收期</p><p>C盈利大小</p><p>D期限</p>,4,A,符合国家在不同时期对不同行业项目最小规模的规定是确定项目生产规模的前提。,62,1,0,0
1,(单选题)潜在的市场需求量是指在一定时期内，在一定行业营销水平和一定的市场环境下，一个行业中所有企业可能达到的最大()之和。,<p>A营销量</p><p>B投资量</p><p>C消费量</p><p>D需求量</p>,4,A,潜在的市场需求量是指在一定时期内，在一定行业营销水平和一定的市场环境下，一个行业中所有企业可能达到的最大营销量之和。,62,1,0,0
1,(单选题)贷款项目评估是以()的立场为出发点，以提高其()为目的，根据项目的具体情况，剔除项目可行性研究报告中可能存在的将影响评估结果的各种非客观因素，重新对项目的可行性进行分析和判断，为银行贷款决策提供依据。,<p>A银行；信贷经营效益</p><p>B客户；信贷资产质量</p><p>C担保人；信贷流动性</p><p>D债权人；信贷安全性</p>,4,A,贷款项目评估是以银行的立场为出发点，以提高银行的信贷经营效益为目的，根据项目的具体情况，剔除项目可行性研究报告中可能存在的将影响评估结果的各种非客观因素，重新对项目的可行性进行分析和判断，为银行贷款决策提供依据。,62,1,0,0
1,(单选题)评估中对税金的审查不包括(),<p>A税种是否都已计算</p><p>B计算公式是否正确</p><p>C占销售收入比例是否过大</p><p>D税率是否符合现行规定</p>,4,C,评估中对税金的审查主要包括以下三方面：项目所涉及的税种是否都已计算；计算公式是否正确；所采用的税率是否符合现行规定。,62,1,0,0
1,(单选题)对项目微观背景的分析，下列说法不正确的是(),<p>A分析项目的微观背景主要从项目发起人和项目本身着手</p><p>B投资的理由主要是指对提出项目的理由及投资意向进行分析评估</p><p>C投资环境是指在一定时间、一定地点或范围内，影响和制约项目投资活动的各种外部境况和条件要素的有机集合体</p><p>D项目对其投资环境具有不可选择性，这正是资本寻求其生存和发展的各种必要条件的集中表现</p>,4,D,项目对其投资环境具有选择性，这正是资本寻求其生存和发展的各种必要条件的集中表现。所以D选项不正确。,62,1,0,0
1,(单选题)银行在对项目进行技术及工艺流程分析时，以下做法不正确的是(),<p>A产品技术方案分析无须考虑市场的需求状况</p><p>B分析产品的质量标准时，应将选定的标准与国家标准、国际常用标准进行对比</p><p>C对生产工艺进行评估，首先要熟悉项目产品国内外有关资料，分析各方法的优缺点</p><p>D分析工艺技术方案的选择是否与社会发展目标相符合</p>,4,A,产品技术方案分析，就是分析项目产品的规格、品种、技术性能以及产品的质量。产品技术方案分析一方面要分析产品方案和市场需求状况，另一方面要分析拟建项目的主要产品和副产品所采用的质量标准是否符合要求。所以A选项错误。,62,1,0,0
1,(单选题)()是按照购买价加上支付的运输费、保险费、包装费、安装成本和缴纳的税金确定其原值。,<p>A购买的固定资产</p><p>B自行建造的固定资产</p><p>C投资者投入的固定资产</p><p>D融资租入的固定资产</p>,4,A,购入的固定资产按照购买价加上支付的运输费、保险费、包装费、安装成本和缴纳的税金确定其原值。,62,1,0,0
1,(单选题)到目前为止，国内银行对项目进行评估时，基本上是采用以()为主进行评估的模式。,<p>A项目效益</p><p>B银行工作人员</p><p>C企业数据</p><p>D企业经营效益</p>,4,B,到目前为止，国内银行对项目进行评估时，基本上是采用以银行工作人员为主进行评估的模式，很少邀请与项目有关的技术及管理专家参加评估工作，这种评估模式在相当程度上影响了项目评估质量。,62,1,0,0
1,(单选题)在固定资产折旧到期()，要将固定资产账面净值扣除预计的残值后的净额平均摊销。,<p>A前一年</p><p>B前两年</p><p>C前三年</p><p>D前半年</p>,4,B,在固定资产折旧到期前两年，要将固定资产账面净值扣除预计的残值后的净额平均摊销。,62,1,0,0
1,(单选题)下列不属于内部条件拟建项目条件分析的是(),<p>A人力资源</p><p>B物力资源</p><p>C财务资源</p><p>D地理资源</p>,4,D,内部条件是指拟建项目的人力、物力、财务资源条件。,62,1,0,0
1,(单选题)关于无形资产与递延资产摊销，下列说法不正确的是(),<p>A无形资产与递延资产根据其原值采用平均年限法分期摊销</p><p>B无形资产规定有效期限的，按规定期限平均摊销</p><p>C无形资产没有规定使用期限的，不进行摊销</p><p>D开办费在项目投产后按不短于5年的期限平均摊销</p>,4,C,无形资产与递延资产没有规定使用期限的，按预计使用期限或者不少于10年的期限平均摊销。故C选项不正确。,62,1,0,0
1,(单选题)项目的组织机构不包括(),<p>A项目的实施机构</p><p>B项目的经营机构</p><p>C项目的承包机构</p><p>D项目的协作机构</p>,4,C,项目的组织机构概括起来可以分为三大部分：项目的实施机构，项目的经营机构和项目的协作机构。,62,1,0,0
2,(多选题)项目的可行性研究和贷款项目评估是相同的，它们的区别包括(),<p>A发起的主体不同</p><p>B发起的时间不同</p><p>C研究的范围和侧重点不同</p><p>D进行项目评估和可行性研究的目的不同</p><p>E涉及领域不同</p>,5,ABCD,项目的可行性研究和贷款项目评估的区别主要表现在以下几个方面：发起的主体不同；发生的时间不同；研究的范围与侧重点不同；进行项目评估和可行性研究的目的不同。但是就涉及领域而言，两者是相同的。,62,1,0,0
2,(多选题)在对拟建项目的投资环境评估中，需先确定评价指标体系和评价标准，然后选择具体的评价方法，如(),<p>A等级尺度法</p><p>B冷热图法</p><p>C道氏评估法</p><p>D抽样评价法</p><p>E相似度法</p>,5,ABCDE,理论上，拟建项目的环境评价需先确定评价指标体系和评价标准，然后选择具体的评价方法，如等级尺度法、冷热图法、道氏评估法、抽样评价法、相似度法等。,62,1,0,0
2,(多选题)银行效益评估包括(),<p>A盈利性效益评估</p><p>B信用风险评估</p><p>C流动性效益评估</p><p>D银行效益动态分析</p><p>E客户目标定位</p>,5,ACD,银行效益评估包括盈利性效益评估、流动性效益评估和银行效益动态分析三个方面。,62,1,0,0
2,(多选题)建厂地区的选择要综合考虑(),<p>A地理条件</p><p>B项目方针</p><p>C当地的基础结构</p><p>D社会经济环境</p><p>E原有的工业基础</p>,5,ABCDE,建厂地区的选择要综合考虑地理条件、项目方针、当地的基础结构和社会经济环境，并充分利用原有的工业基础。,62,1,0,0
2,(多选题)项目总投资由()组成。,<p>A建设投资</p><p>B流动资金</p><p>C投资方向调节税</p><p>D建设期利息</p><p>E购销产生的增值税</p>,5,ABCD,项目总投资由建设投资、流动资金、投资方向调节税和建设期利息四部分组成。,62,1,0,0
2,(多选题)银行对工程设计方案进行分析和评估，就是要分析工程设计方案是否经济合理，是否符合项目的总体发展。对工程设计方案的分析评估可以从()方面进行分析。,<p>A总平面布置方案分析</p><p>B技术分析</p><p>C效益分析</p><p>D风险分析</p><p>E主要工程设计方案分析</p>,5,AE,银行对工程设计方案的分析评估可以从两个方面进行分析：(1)总平面布置方案分析；(2)主要工程设计方案分析，主要是指土建工程设计方案。,62,1,0,0
2,(多选题)项目规模的主要制约因素包括(),<p>A国民经济发展规划、战略布局和有关政策</p><p>B项目所处行业的技术经济特点</p><p>C生产技术和设备、设施状况</p><p>D资金和基本投入物</p><p>E其他生产建设条件</p>,5,ABCDE,项目规模的主要制约因素包括：国民经济发展规划、（本题出自金考必过，网址：www.jinkaobiguo.com，最好的刷题网站。）战略布局和有关政策；项目所处行业的技术经济特点；生产技术和设备、设施状况；资金和基本投入物；其他生产建设条件。,62,1,0,0
2,(多选题)企业信用度是指企业在经济活动中履行诺言、讲求信誉的程度。对企业信用度的分析主要包括对()等的评估。,<p>A企业借贷信用</p><p>B经济合同履约信用</p><p>C产品信誉</p><p>D企业财务状况</p><p>E企业管理水平</p>,5,ABC,信用度是指企业在经济活动中履行诺言、讲求信誉的程度。对企业信用度的分析主要包括对企业借贷信用、经济合同履约信用、产品信誉等的评估。,62,1,0,0
2,(多选题)对工业项目而言，必须要进行环境保护方案分析。在对环境保护方案进行分析时应抓住以下几个环节(),<p>A审查环境影响报告</p><p>B审查治理方案</p><p>C审查建设总投资</p><p>D审查建设总设计</p><p>E分析环境保护的经济性</p>,5,ABCDE,对工业项目而言，必须要进行环境保护方案分析。在对环境保护方案进行分析时应抓住以下几个环节：审查环境影响报告、审查治理方案、审查建设总投资与总设计、分析环境保护的经济性。,62,1,0,0
3,(判断题)当可行性研究报告中提出一个可行性方案时，银行评估人员只需通过审计、计算和分析确认方案的可行性即可。(),<p>A正确</p><p>B错误</p>,2,B,当可行性研究报告中提出一个可行性方案时，银行评估人员应向企业了解是否有其他方案，并根据项目产品的市场需求调查和预测、投入物和生产条件的分析，再经过规模经济的分析，肯定原来的方案或提出更好的方案。,62,1,0,0
3,(判断题)从宏观角度看，对项目的背景分析主要包括项目建设是否符合国民经济平衡发展的需要和是否符合国家的产业政策、技术政策和地区、部门发展规划。(),<p>A正确</p><p>B错误</p>,2,A,从宏观角度看，对项目的背景分析主要包括以下两个方面：项目建设是否符合国民经济平衡发展的需要；项目建设是否符合国家的产业政策、技术政策和地区、部门发展规划。,62,1,0,0
3,(判断题)市场需求预测分析的主要相关因素包括产品特征和消费条件、社会购买力与产品价格水平。(),<p>A正确</p><p>B错误</p>,2,A,市场需求预测分析的主要相关因素包括产品特征和消费条件、社会购买力与产品价格水平。,62,1,0,0
