1,(单选题)搭积木法在计算银行的市场风险时，首先按照特定的准则计算资产组合分别暴露于五种风险下的资本要求，再进行加总，也被称为()。,<p>A组合法</p><p>B标准化方法</p><p>C高级计量法</p><p>D内部模型法</p>,4,B,本题考查标准化方法的相关内容。标准化方法是一种积木式的方法，先分开确定每类项目的资本要求，然后把计算结果简单相加，就得出银行总市场风险所需要的资本额。,0,0
1,(单选题)下列关于金额风险造成的损失的说法，不正确的是()。,<p>A商业银行通常依靠中央银行救助来应对非预期损失</p><p>B金融风险可能造成的损失分为预期损失、非预期损失和灾难性损失</p><p>C商业银行对于规模巨大的灾难性损失，一般需要通过保险手段来转移</p><p>D商业银行通常采取提取损失准备金和冲减利润的方式来应对和吸收预期损失</p>,4,A,商业银行应对非预期损失的首要办法是依靠经济资本，商业银行只有在面临破产威胁时才会得到中央银行救助。,0,0
1,(单选题)一家银行的经营活动和盈利模式越依赖于外部环境，银行潜在的战略风险就()。,<p>A越高</p><p>B越低</p><p>C不一定</p><p>D无关</p>,4,A,银行的经营环境时刻都处在变化中，但不同银行受到的影响是不同的，这取决于银行经营对外部环境的依赖程度以及银行经营模式跟随外部经营环境变化而变化和调整的弹性。战略风险与外部环境依赖性成正比。战略风险越高，则外部环境依赖性越强。,0,0
1,(单选题)某家商业银行的贷款余额和存款余额的比例达到90%，这说明()。,<p>A该银行经营状况良好</p><p>B该银行流动性风险偏高，但仍属正常</p><p>C该银行处置不当可能失去清偿能力</p><p>D该银行资产比率大，发展潜力大，盈利能力强</p>,4,C,存贷款比例=各项贷款余额/各项存款余额×100%。根据《商业银行法》的规定，该指标不得超过75%，一旦指标超过了警戒线，处置不当则可能失去清偿能力，并最终导致商业银行破产。,0,0
1,(单选题)下列关于风险分类的说法，不正确的是()。,<p>A按风险发生的范围可以将风险划分为可量化风险和不可量化风险</p><p>B按风险事故可以将风险划分为经济风险、政治风险、社会风险、自然风险和技术风险</p><p>C按损失结果可以将风险划分为纯粹风险和投机风险</p><p>D按诱发风险的原因，巴塞尔委员会将商业银行面临的风险划分为信用风险、市场风险、操作风险、流动性风险、国家风险、声誉风险、法律风险以及战略风险八大类</p>,4,A,本题是对风险分类的考查。按风险发生的范围可以将风险分为系统风险和非系统风险。,0,0
1,(单选题)在持有期为2天，置信水平为98%的情况下，若所计算的风险价值为2万元，则表明该银行的资产组合()。,<p>A在2天中的收益有98%的可能性不会超过2万元</p><p>B在2天中的收益有98%的可能性会超过2万元</p><p>C在2天中的损失有98%的可能性不会超过2万元</p><p>D在2天中的损失有98%的可能性会超过2万元</p>,4,C,风险价值是潜在的最大损失，在置信水平的概率下，资产组合的损失不会超过风险价值。,0,0
1,(单选题)与单笔贷款业务的信用风险识别不同，商业银行在识别和分析贷款组合信用风险时，应更加关注()可能造成的影响。,<p>A非系统风险</p><p>B管理层风险</p><p>C系统性风险</p><p>D个体风险</p>,4,C,与单笔贷款业务的信用风险识别不同，商业银行在识别和分析贷款组合信用风险时，应更加关注系统性风险可能造成的影响。,0,0
1,(单选题)操作风险损失数据的收集要遵循()的原则。,<p>A客观性、全面性、动态性、标准化</p><p>B客观性、全面性、静态性、标准化</p><p>C主观性、全面性、动态性、标准化</p><p>D主观性、全面性、静态性、标准化</p>,4,A,操作风险损失数据的收集是按照客观性、全面性、动态性、标准化的原则进行的。,0,0
1,(单选题)在商业银行的经营管理过程中，决定其风险承担能力的是()。,<p>A资产规模和商业银行的盈利水平</p><p>B资本金规模和商业银行的盈利水平</p><p>C资产规模和商业银行的风险管理水平</p><p>D资本金规模和商业银行的风险管理水平</p>,4,D,在商业银行的经营管理过程中，有两个至关重要的因素决定其风险承担能力：资本金规模以及商业银行的风险管理水平。,0,0
1,(单选题)商业银行的核心“无形资产”是()。,<p>A风险管理信息系统</p><p>B完善的公司治理机构</p><p>C健全的内部控制机制</p><p>D有效的风险管理策略</p>,4,A,风险管理信息系统作为商业银行的重要“无形资产”，必须设置严格的安全保障，确保系统能够长期、不间断地运行。,0,0
1,(单选题)商业银行面对信息技术基础设施严重受损以影响正常业务运行的风险，不可以通过()来进行风险缓释。,<p>A购买电子保险</p><p>B制定连续营业方法</p><p>CIT系统灾难备援外包</p><p>D提高电子化水平以取代手工操作</p>,4,D,提高电子化水平以取代手工操作可以降低人员因素带来的操作风险，但信息系统的风险是固有的，在商业银行信息技术基础设施严重受损的情况下，此方法不可以进行风险缓释。,0,0
1,(单选题)下列属于战略风险识别中观管理层面内容的是()。,<p>A进入或退出市场的决策是否恰当</p><p>B资产投资组合中是否存在高风险、低收益的金融产品</p><p>C是否忽视对个人理财人员的职业技能和道德操守培训</p><p>D建立企业级风险管理信息系统的决策是否恰当</p>,4,B,A、D两项属于宏观战略层面的风险识别；C选项属于微观层面的战略风险识别。,0,0
1,(单选题)物价稳定是要保持()的大体稳定，避免出现高通货膨胀。,<p>A消费者物价水平</p><p>B生产者物价水平</p><p>C国内生产总值</p><p>D物价总水平</p>,4,D,物价稳定是要保持物价总水平的大体稳定，避免出现高通货膨胀。,0,0
1,(单选题)关联交易是指发生在集团内()之间的有关转移权利或义务的事项安排。,<p>A高级管理层</p><p>B关联方</p><p>C控股股东</p><p>D董事会成员</p>,4,B,关联交易是指发生在集团内关联方之间的有关转移权利或义务的事项安排。,0,0
1,(单选题)()是目前最恰当的声誉风险管理方法。,<p>A采取平等原则对待所有风险</p><p>B采用精确的定量分析方法</p><p>C按照风险大小，采取抓大放小的原则</p><p>D推行全面风险管理理念，确保各类主要风险被正确识别、优先排序，并得到有效管理</p>,4,D,目前，国内外还没有开发出适合于声誉风险管理的量化技术，但普遍认为声誉风险管理的最好办法是：(1)推行全面风险管理理念，改善公司治理，并预先做好防范危机的准备；(2)确保各类主要风险被正确识别、优先排序，并得到有效管理。,0,0
1,(单选题)假设资本要求(K)为2%，违约风险暴露(EAD)为10亿元，则根据《巴塞尔新资本协议》，风险加权资本（RWA）为()亿元。,<p>A1.25</p><p>B2.5</p><p>C10</p><p>D12.5</p>,4,B,考查风险加权资产的计算。RWA=K×12.5×EAD=2%×12.5×10=2.5（亿元）。,0,0
1,(单选题)现代风险分散化思想的重要基石是()。,<p>A风险收益率分析</p><p>B欧式期权定价模型</p><p>C哈瑞马柯威茨提出的投资组合理论</p><p>D威廉夏普提出的资本资产定价模型</p>,4,C,诺贝尔经济学奖得主哈瑞马柯威茨于20世纪50年代提出的不确定条件下的投资组合理论，即如何在风险与收益之间寻求最佳平衡点，已经成为现代风险管理的重要基石。,0,0
1,(单选题)下列指标的计算公式中，正确的是()。,<p>A资本金收益率=税后净收入／资产总额</p><p>B资产收益率=税后净收入／资本金总额</p><p>C净业务收益率=（营业收入总额-营业支出总额）／资产总额</p><p>D非利息收入率=（非利息收入-非利息支出）／（营业收入-营业支出）</p>,4,C,A选项应改为：资本金收益率=税后净收入/资本金总额；B选项应改为：资产收益率=税后净收入/资产总额；D选项应改为：非利息收入率=（非利息收入-非利息支出）/资产总额。,0,0
1,(单选题)银行的流动性风险与()没有关系。,<p>A资产负债币种结构</p><p>B资产负债类别结构</p><p>C资产负债期限结构</p><p>D资产负债分布结构</p>,4,B,A选项，多币种的资产与负债结构进一步增加了流动性风险的复杂性，引起潜在的流动性风险；C选项，商业银行资产负债期限结构的影响十分复杂，“借短贷长"所引起的资产与负债成熟期的不相匹配，导致商业银行资产负债结构具有内在的不稳定性；D选项，商业银行资产分散程度不足，可能会面临较大的潜在风险，甚至产生巨额的损失。,0,0
1,(单选题)利用警兆指标合成的风险指数进行预警的方法是()。,<p>A红色预警法</p><p>B黑色预警法</p><p>C统计预警法</p><p>D指数预警法</p>,4,D,题干所述为指数预警法。,0,0
1,(单选题)战略风险管理流程中，下列()活动是在执行风险管理方案之后执行的。,<p>A制定战略实施方案</p><p>B识别战略风险要素</p><p>C明确战略发展目标</p><p>D定期自我评估风险管理的效果</p>,4,D,战略风险管理流程为：明确战略发展目标，制定战略实施方案，识别、评估、检测战略风险要素，执行风险管理方案，并定期自我评估风险管理的效果活动，确保商业银行的长期战略、短期目标、风险管理措施和可利用资源紧密联系在一起。,0,0
1,(单选题)商业银行对集团法人客户进行信用风险分析时，对()的分析判断至关重要。,<p>A子公司的经营状况</p><p>B集团内关联交易</p><p>C资本来源</p><p>D高层人事安排</p>,4,B,商业银行首先应当参照单一法人客户信用风险识别和分析方法，对集团法人客户的基本信息、经营状况、财务状况、非财务因素及担保状况等进行逐项分析，以识别其潜在的信用风险。其次，集团法人客户通常更为复杂，因此需要更加全面、深入的分析和了解，特别是对集团内各关联方之间的关联交易进行正确的分析和判断至关重要。,0,0
1,(单选题)()是通过有效地授权审批和监督机制来防范法律风险并采取适当的措施来降低重大法律风险的过程。,<p>A法律风险的识别</p><p>B法律风险的监测</p><p>C法律风险的评估</p><p>D法律风险的控制和缓释</p>,4,B,考查法律风险的控制和缓释的相关内容。法律风险的控制和缓释是通过有效地授权审批和监督机制来防范法律风险并采取适当的措施来降低重大法律风险的过程。,0,0
1,(单选题)“未按审批时所附的限制性条款发放贷款”于()业务环节可能出现的违规事项。,<p>A信贷审批</p><p>B贷款发放</p><p>C贷前调查</p><p>D信贷审查</p>,4,B,考查贷款发放的相关内容。贷款发放业务环节可能出现的违规事项有：(1)逆程序发放贷款；(2)未按审批时所附的限制性条款发放贷款；(3)贷款合同要素填写不规范；(4)未按规定办妥抵押品抵押登记手续或手续不完善，造成抵押无效；(5)未按规定办理质押物止付手续或质押权利转移手续，形成无效质押；(6)贷款录入上账错误等。,0,0
1,(单选题)关于关联授信比例中商业银行关联法人或其他组织，表述不正确的是()。,<p>A不包括商业银行</p><p>B与商业银行同受某一企业直接、间接控制的法人或其他组织</p><p>C商业银行的内部人与主要自然人股东及其近亲属直接、间接、共同控制或可施加重大影响的法人或其他组织</p><p>D商业银行的主要非自然人股东是指能够直接、间接、共同持有或控制商业银行10%以上股份或表决权的非自然人股东</p>,4,D,D选项应改为：商业银行的主要非自然人股东是指能够直接、间接、共同持有或控制商业银行5%以上股份或表决权的非自然人股东。,0,0
1,(单选题)违约概率模型能够直接估计客户的违约概率，因此对历史数据的要求更高，需要商业银行建立一致的、明确的违约定义，并且在此基础上积累至少()年的数据。,<p>A1</p><p>B2</p><p>C3</p><p>D5</p>,4,D,相比于传统的专家判断和信用评分法，违约概率模型能够直接估计客户的违约概率，因此对历史数据的要求更高，需要商业银行建立一致的、明确的违约定义，并且在此基础上积累至少5年的数据。,0,0
1,(单选题)()是最具流动性的资产。,<p>A股票</p><p>B贷款</p><p>C现金</p><p>D票据</p>,4,C,巴塞尔委员会将银行资产按流动性高低分为四类：(1)最具有流动性的资产；(2)其他可在市场上交易的证券；(3)商业银行可出售的贷款组合；(4)流动性最差的资产。其中最具有流动性的资产，如现金及在中央银行的市场操作中用于抵押的政府债券，这类资产可用于从中央银行获得流动性支持，或者在市场上出售、回购或抵押融资。,0,0
1,(单选题)下列关于信息披露的频率，表述错误的是()。,<p>A按规定银行披露信息的频率应该每半年进行一次</p><p>B如果有关风险暴露或其他项目的信息变化较快，银行也要按季披露这些信息</p><p>C国际活跃银行和其他大银行（及其主要分支机构）必须按季度披露一级资本充足率、资本充足率及其组成成分</p><p>D对于有关银行风险管理目标及政策、报告系统及各项口径的一般性概述的定性披露，需要每半年进行一次</p>,4,D,对于有关银行风险管理目标及政策、报告系统等定性信息披露，需每年进行一次。,0,0
1,(单选题)超额准备金率计算公式中的各项存款不包括下列哪一项？(),<p>A保证金</p><p>B活期存款</p><p>C应解汇款</p><p>D财政性存款</p>,4,D,根据《商业银行风险监管核心指标》的规定，人民币超额准备金率=（在中国人民银行超额准备金存款+库存现金）/人民币各项存款期末金额×100%。公式中各项存款包括人民币的活期存款、定期存款、应解汇款、保证金，不含财政性存款和委托存款。,0,0
1,(单选题)客户存款金额为5000万元，期限为5年，2年后可提前取款。如果2年后，客户不提高商业银行将面临利率下降的风险；如果客户提前取款，则银行面临流动性风险和利率上升的筹资本上升的风险。此时，利率风险表现为()。,<p>A期权性风险</p><p>B再定价风险</p><p>C收益曲线风险</p><p>D基准利率风险</p>,4,A,考查期权性风险的表现。期权可以是单独的金融工具，例如场内交易期权和场外期权合同，也可以隐含于其他的标准化金融工具之中，例如债券或存款的提前兑付条款、贷款的提前偿还等。,0,0
1,(单选题)电脑“千年虫”属于典型的()风险。,<p>A系统缺陷</p><p>B人员因素</p><p>C外部事件</p><p>D不完善或有问题的内部程序</p>,4,A,系统缺陷引发的操作风险是指由于信息科技部门或服务供应商提供的计算机系统或设备发生故障或其他原因，导致商业银行不能正常提供全部/部分服务或业务中断而造成的损失。在系统方面，最典型的风险是电脑“千年虫”的风险，世界各地的商业银行为此支付了巨额费用。,0,0
1,(单选题)中央银行的窗口指导以()为主要特征。,<p>A限制存款增减额</p><p>B限制贷款增减额</p><p>C限制贷款增加额</p><p>D限制存贷款增减额</p>,4,B,存款对于银行是被动接受的，而贷款是能够主动控制的，因此A、D选项排除；银行贷款的额度可以增加也可以减少，排除C选项。,0,0
1,(单选题)下列关于战略规划的说法，不正确的是()。,<p>A商业银行战略风险管理的有效方法是制定以风险为导向的战略规划</p><p>B战略规划应当从战术层面开始，深入贯彻并落实到宏观和微观操作层面</p><p>C战略规划必须建立在商业银行当前的实际情况和未来的发展潜力基础之上，反映商业银行的经营特色</p><p>D战略规划应当清晰阐述实施方案中所涉及的风险因素、潜在收益以及可以接受的风险水平，并且尽可能地将预期风险损失和财务分析包含在内</p>,4,B,B选项应改为：战略规划始于宏观战略层面，但最终必须深入贯彻并落实到中观管理和微观操作层面。,0,0
1,(单选题)金融资产的市场价值是指()。,<p>A金融资产根据历史成本所反映的账面价值</p><p>B交易双方在公平交易中可接受的资产或债券价值</p><p>C对交易账户头寸按照当前市场行情重估获得的市场价值</p><p>D在评估基准日，自愿买卖双方在知情、谨慎、非强迫的情况下通过公平交易资产所获得的资产的预期价值</p>,4,D,考查金融资产市场价值的定义。金融资产的市场价值是指在评估基准日，自愿买卖双方在知情、谨慎、非强迫的情况下通过公平交易资产所获得的资产的预期价值。,0,0
1,(单选题)在各类操作风险事件中，()给商业银行带来的损失最大。,<p>A洗钱</p><p>B自然灾害</p><p>C内部欺诈</p><p>D外部欺诈</p>,4,D,外部欺诈是指外部人员故意骗取、盗用财产或逃避法律而给商业银行造成损失的行为。该类风险是给商业银行造成损失最大、发生次数最多的操作风险。,0,0
1,(单选题)下列不属于审慎经营类指标的是()。,<p>A资本充足率</p><p>B成本收入比</p><p>C大额风险集中度</p><p>D不良贷款拨备覆盖率</p>,4,B,审慎经营类指标包括资本充足率、大额风险集中度和不良贷款拔备覆盖率。,0,0
1,(单选题)假设美元兑英镑的即期汇率为：GBPI=USD2.0000，美元年利率为3%，英镑年利率为4%，则按照利率平价理论，1年期美元兑英镑远期汇率为()。,<p>AGBPl=USDl.9702</p><p>BGBPl=USDl.9808</p><p>CGBPI=USD2.0000</p><p>DGBPI=USD2.0194</p>,4,D,远期汇率=即期汇率×(1+4%)/(1+3%)=2×1.04/1.03≈2.0194（美元）。,0,0
1,(单选题)按照业务特点和风险特性的不同，商业银行的客户可以分为()。,<p>A公共客户和私人客户</p><p>B法人客户和个人客户</p><p>C单一法人客户和集团法人客户</p><p>D企业类客户和机构类客户</p>,4,B,考查商业银行客户的分类。按照业务特点和风险特性的不同，商业银行的客户可划分为法人客户与个人客户。,0,0
1,(单选题)在信用风险组合管理模型中，违约模型的重要输入参数不包括()。,<p>A贷款金额</p><p>B回收率</p><p>C回收率的波动性</p><p>D贷款违约风险之间的相关性</p>,4,C,违约贷款回收率是商业银行实施内部评级高级法的一个重要因素，在计算预期损失与非预期损失时都需要对回收率进行估计。回收率的波动性不是重要输入参数，只是回收率的一个参数指标。,0,0
1,(单选题)下列可以作为抵押财产的是()。,<p>A医院设备</p><p>B大学教学楼</p><p>C土地所有权</p><p>D正在建造的建筑物、船舶</p>,4,D,考查抵押的相关内容。根据《物权法》规定，债务人或第三人有权处分的一些物品可以抵押。土地的所有权是属于国家的，任何机构或个人无权处置学校和医院属于事业单位，大部分资金来源于政府拨款，其财产不能用作抵押担保。,0,0
1,(单选题)激烈的行业竞争必然形成优胜劣汰，商业银行如果缺乏独特的品牌形象和吸引力，将可能遭遇严重的生存危机。品牌风险会影响到()。,<p>A商业银行的技术水平</p><p>B商业银行的风险管理水平</p><p>C商业银行的业务创新水平</p><p>D商业银行的盈利能力和发展空间</p>,4,D,激烈的行业竞争必然形成优胜劣汰，产品/服务的品牌管理直接影响了商业银行的盈利能力和发展空间，特别是高度依赖公众信息而生存的商业银行，如果缺乏独特的品牌形象和吸引力，将可能遭遇严重的生存危机。,0,0
1,(单选题)()是指金融机构合并资产负债表中资产减去负债后的所有者权益。,<p>A会计资本</p><p>B监管资本</p><p>C经济资本</p><p>D实收资本</p>,4,A,本题考查的是会计资本的定义。会计资本，也就是账面资本，等于金融机构合并资产负债表中资产减去负债后的所有者权益，包括实收资本或普通股、优先股等。,0,0
1,(单选题)下列各项中，不属于内部欺诈事件的是()。,<p>A交易不报告</p><p>B多户头支票欺诈</p><p>C交易品种未经授权（存在资金损失）</p><p>D银行内部发生的性别/种族歧视事件</p>,4,D,考查内部欺诈事件的内容。内部欺诈是指故意骗取、盗用财产或违反监管规则、法律或公司政策导致的损失，此类事件至少涉及内部一方，但不包括歧视及差别待遇事件。D选项属于违反用工法的表现形式之一。,0,0
1,(单选题)下列关于收益计量的说法，正确的是()。,<p>A百分比收益率衡量了绝对收益</p><p>B资产多个时期的对数收益率等于其各时期对数收益率之和</p><p>C资产多个时期的百分比收益率等于其各时期百分比收益率之和</p><p>D相对收益是对投资成果的直接衡量，反映投资行为得到的增值部分的绝对量</p>,4,B,A选项应改为：百分比收益率衡量的是相对收益；C选项应改为：资产多个时期的百分比收益率应按照期初和期末的价格来计算；D选项应改为：绝对收益是对投资成果的直接衡量，反映投资行为得到的增值部分的绝对量。,0,0
1,(单选题)国际市场通常采用()对债券风险进行评估。,<p>A内部评级法</p><p>B外部评级法</p><p>C债券风险评级法</p><p>D债券信用评级法</p>,4,D,国际市场通常采用债券信用评级法对债券风险进行评估。,0,0
1,(单选题)直接体现商业银行的风险管理水平和研究／开发能力的是()。,<p>A不断开发出针对不同风险种类的风险量化方法</p><p>B采取有效措施控制商业银行的整体或重大风险</p><p>C建立功能强大、动态／交互式的风险监测和报告系统</p><p>D采取科学的方法，识别商业银行所面临的各种风险</p>,4,C,建立功能强大、动态/交互式的风险监测和报告系统，对于提高商业银行风险管理效率和质量具有非常重要的作用，也直接体现了商业银行的风险管理水平和研究/开发能力。,0,0
1,(单选题)商业银行可以采取的市场风险计量方法不包括()。,<p>A因果关系分析</p><p>BVaR</p><p>C敏感性分析</p><p>D情景分析</p>,4,A,商业银行可以采取的市场风险计量方法有：(1)缺口分析；(2)久期分析；(3)外汇敞口分析；(4)风险价值(VaR)方法；(5)敏感性分析；(6)情景分析；(7)压力测试；(8)事后检查。,0,0
1,(单选题)假设商业银行信用评级为A的某类贷款企业的违约概率(PD)为5%，贷款违约损失率(LGD)为50%，当期银行对该类型企业的信贷金额为100亿元人民币，违约风险暴露(EAD)为10亿元人民币，则当期银行对该类型企业贷款的预期损失为()亿元人民币。,<p>A0.25</p><p>B0.5</p><p>C3.5</p><p>D5</p>,4,A,考查预期损失的计算。预期损失(EL)=违约概率(PD)×违约风险暴露(EAD)×违约损失率(LGD)=5%×10×50%=0.25（亿元）。,0,0
1,(单选题)在实际应用中，通常用正态分布来描述()的分布。,<p>A每日股票价格</p><p>B每日股票指数</p><p>C股票价格每日变动值</p><p>D股票价格每日收益率</p>,4,C,正态分布是一种重要的概率分布，股票价格（或资产组合）每日收益率的分布可以用正态分布来描述。,0,0
1,(单选题)利率互换发生的前提是()。,<p>A交易双方在金融市场上有不同的信用等级，进而产生了融资时的比较优势</p><p>B必须有在期限和金额上存在相同利益而对贷款需求相反的交易双方</p><p>C存在二级交易市场</p><p>D存在利率差异</p>,4,A,考查利率互换的相关内容。利率互换是指互换双方在约定的时间内根据双方签订的合同，在一笔名义本金数额的基础上互相交换具有不同性质的利息款项的支付。利率互换发生的前提是交易双方在金融市场上有不同的信用等级，进而产生融资时的比较优势。,0,0
1,(单选题)假设某银行当期贷款按五级分类标准进行分类，分别是：正常类800亿元人民币，关注类200亿元人民币，次级类35亿元人民币，可疑类10亿元人民币，损失类5亿元人民币，一般准备、专项准备、特种准备分别为40亿元、15亿元、5亿元人民币，则该银行当期的不良贷款拨备覆盖率为()。,<p>A0.2</p><p>B0.8</p><p>C1</p><p>D1.2</p>,4,D,考查不良贷款拨备覆盖率的计算。不良贷款拔备覆盖率=（一般准备+专项准备+特种准备）/（次级类贷款+可疑类贷款+损失类贷款）=(40+15+5)/(35+10+5)=120%。,0,0
