1,(单选题)关键信息缺乏共享和文档记录属于人员因素中哪一类原因造成的损失？(),<p>A失职违约</p><p>B内部欺诈</p><p>C核心雇员流失</p><p>D知识技能匮乏</p>,4,C,核心雇员流失造成的风险体现为商业银行对关键人员（如交易员、高级客户经理）过度依赖的风险，包括缺乏足够的后备人员、关键信息缺乏共享和文档记录、缺乏岗位轮换机制等。,0,0
1,(单选题)股票S的价格为28元/股。某投资者花6.8元购得股票S的买方期权，规定该投资者可以在12个月后以每股35元的价格购买1股S股票。现知6个月后，股票S的价格上涨为40元，则此时该投资者手中期权的内在价值为()元。,<p>A-1.8</p><p>B0</p><p>C5</p><p>D7</p>,4,C,考查买方期权内在价值的计算。买方期权的内在价值=市场价格-执行价格=40-35=5（元）。,0,0
1,(单选题)()是指控制、管理机构的一种机制或制度安排。,<p>A商业银行内部控制</p><p>B商业银行公司治理</p><p>C商业银行战略管理</p><p>D商业银行风险管理</p>,4,B,题干描述的是商业银行公司治理。,0,0
1,(单选题)风险文化的精神核心是()。,<p>A风险管理策略</p><p>B风险管理理念</p><p>C公司治理结构</p><p>D内部控制系统</p>,4,B,风险文化一般由风险管理理念、知识和制度三个层次组成，其中风险管理理念是风险文化的精神核心，也是风险文化中最为重要和最高层次的因素。,0,0
1,(单选题)下列业务中包含了期权性风险的是()。,<p>A托收业务</p><p>B活期存款业务</p><p>C房地产按揭贷款业务</p><p>D附有提前偿还选择权条款的长期贷款</p>,4,D,考查包含期权性风险的业务。期权性风险源于银行资产、负债和表外业务中所隐含的期权性条款。期权可以是单独的金融工具，如场内（交易所）交易期权和场外期权合同，也可以隐含于其他的标准化金融工具之中，如债券或存款的提前兑付、贷款的提前偿还等。,0,0
1,(单选题)ZETA信用风险分析模型中用于衡量流动性的指标是()。,<p>A流动资产/总资产</p><p>B流动资产/流动负债</p><p>C流动负债/总资产</p><p>D（流动资产-流动负债）/总资产</p>,4,B,流动资产/流动负债，即流动比率是ZETA信用风险分析模型中用于衡量流动性的指标。,0,0
1,(单选题)下列()不属于银监会提出的良好银行监管标准。,<p>A高效、节约地使用一切监管资源</p><p>B对监管者和被监管者都是实施严格、明确的问责制</p><p>C确保银行业金融机构不破产</p><p>D对各类监管设限做到科学合理，有所为有所不为，减少一切不必要的限制</p>,4,C,除A、B、D三项外，银监会提出的良好银行监管标准还包括：(1)促进金融稳定和金融创新共同发展；(2)努力提升我国银行业在国际金融服务中的竞争力；(3)鼓励公平竞争，反对无序竞争。,0,0
1,(单选题)商品价格风险是指商业银行所持有的各类商品的价格发生不利变动而给商业银行带来损失的风险。这里的商品不包括()。,<p>A铜</p><p>B大豆</p><p>C黄金</p><p>D石油</p>,4,C,黄金价格只能作为汇率风险，因此题干所述商品不包括黄金。,0,0
1,(单选题)《商业银行财务报表附注特别规定》对上市银行的()内容的披露做了非常详细的规定。,<p>A中长期贷款、逾期贷款、呆账贷款</p><p>B中长期贷款、逾期贷款、呆滞贷款</p><p>C贷款总额、逾期贷款、呆账贷款</p><p>D贷款总额、逾期贷款、呆滞贷款</p>,4,B,《商业银行财务报表附注特别规定》对上市银行的中长期贷款、逾期贷款、呆滞贷款的内容披露做了非常详细的规定。,0,0
1,(单选题)下列()不属于全面风险管理模式所体现的风险管理理念和方法。,<p>A全面的风险管理范围</p><p>B区域的风险管理体系</p><p>C全程的风险管理过程</p><p>D全员的风险管理文化</p>,4,B,全面风险管理模式体现的先进的风险管理理念和方法主要有：(1)全球的风险管理体系；(2)全面的风险管理范围；(3)全程的风险管理过程；(4)全新的风险管理方法；(5)全员的风险管理文化。,0,0
1,(单选题)下列对于影响期权价值因素的理解，不正确的是()。,<p>A买方期权持有者的最大损失是零</p><p>B随着执行价格的上升，买方期权的价值减小</p><p>C随着标的资产市场价格上升，买方期权的价值增大</p><p>D如果买方期权在某一时间执行，则其收益（不考虑期权费）为标的资产市场价格与期权执行价格的差额</p>,4,A,考查影响期权价值的因素。买方期权持有者的最大损失是期权费、其他佣金费用、手续费等。,0,0
1,(单选题)协议双方同意在约定的未来某个日期按约定的条件买入或卖出一定标准数量的某种金融工具的标准化协议是()。,<p>A期权合约</p><p>B掉期合约</p><p>C期货合约</p><p>D远期合约</p>,4,C,考查期货合约的内容。期货合约是指协议双方同意在约定的未来某个日期按约定的条件买入或卖出一定标准数量的某种金融工具的标准化协议，合约中规定的价格就是期货价格。,0,0
1,(单选题)连续三次投掷一枚硬币的基本事件共有()件。,<p>A8</p><p>B7</p><p>C6</p><p>D3</p>,4,A,连续三次投掷，每一次都可能会出现2种可能，因此是共有2的3次方种可能，即8种基本事件。,0,0
1,(单选题)声誉危机管理的主要内容不包括()。,<p>A危机现场处理</p><p>B模拟训练和演习</p><p>C危机处理过程中的持续沟通</p><p>D明确记载的危机处理／决策流程</p>,4,D,考查声誉危机管理的主要内容。声誉危机管理的主要内容包括(1)预先制定战略性的危机管理规划；(2)提高日常解决问题的能力；(3)危机现场处理；(4)提高发言人的沟通技能；(5)危机处理过程中的持续沟通；(6)管理危机过程中的信息交流；(7)模拟训练和演习。D选项属于有效的声誉风险管理体系的主要内容。,0,0
1,(单选题)最重大的操作风险在于()及公司治理机制的失效。,<p>A内部控制</p><p>B公司策略</p><p>C风险文化</p><p>D风险管理机制</p>,4,A,内部控制的目的在于改善经营管理、提高经济效益。它是因加强经济管理的需要而产生的，是随着经济的发展而发展完善的。内部控制会涉及方方面面的操作风险，B、C、D三项更多的是涉及战略风险。,0,0
1,(单选题)如果一个资产期初投资l00元，期末收入150元，那么该资产的对数收益率为()。,<p>A0.1</p><p>B0.2</p><p>C0.3</p><p>D0.4</p>,4,D,考查对数收益率的计算。对数收益率=In(150/100)=0.4。,0,0
1,(单选题)根据我国监管机构和《巴塞尔新资本协议》的要求，商业银行计算市场风险加权资产，应采用()来进行。,<p>A高级计量法</p><p>B基本指标法</p><p>C内部评级法</p><p>D内部模型法</p>,4,D,根据我国监管机构和《巴塞尔新资本协议》的要求，对于市场风险，商业银行可以采用标准法或内部模型法进行计算。,0,0
1,(单选题)银行风险管理的流程是()。,<p>A风险控制风险识别风险监测风险计量</p><p>B风险识别风险控制风险监测风险计量</p><p>C风险识别风险计量风险监测风险控制</p><p>D风险控制风险识别风险计量风险监测</p>,4,C,本题是对商业银行风险管理流程的考查。按照良好的公司治理结构和内部控制机制，商业银行的风险管理流程可以概括为风险识别、风险计量、风险监测和风险控制四个主要步骤。,0,0
1,(单选题)下列关于现金流分析的说法，不正确的是()。,<p>A现金流分析有助于真实、准确地反映商业银行在未来短期内的流动性状况</p><p>B商业银行的规模越大，业务越复杂，现金流分析的可信赖度越强</p><p>C根据历史数据研究，流动性剩余额与总资产之比小于3%～5%时，对商业银行的流动性风险是一个预警</p><p>D应当将商业银行的流动性“剩余”或“赤字”与融资需求在不同的时间段内进行比较，以合理预估商业银行的流动性需求</p>,4,B,B选项应改为：如果商业银行的规模很大、业务非常复杂、预期期限较长（如180天、360天），则分析人员所能获得完整现金流量信息的可能性和准确性将显著降低，现金流分析结果的可信赖度也随之减弱。在实践操作中，现金流分析法通常和缺口分析等方法一起使用，互为补充。,0,0
1,(单选题)商业银行应当指定()向董事会和高级管理层提供独立的市场风险报告。,<p>A内部审计机构</p><p>B外部审计机构</p><p>C市场风险承担部门</p><p>D市场风险管理部门</p>,4,D,商业银行应当指定专门的部门负责市场风险管理工作。负责市场风险管理的部门应当职责明确，与承担风险的业务经营部门保持相对独立，向董事会和高级管理层提供独立的市场风险报告。,0,0
1,(单选题)资本充足程度监管指标包括()。,<p>A核心资本充足率和附属资本充足率</p><p>B核心资本充足率和资本充足率</p><p>C资本充足率和附属资本充足率</p><p>D资本充足率和风险加权资本率</p>,4,B,资本充足程度监管指标包括核心资本充足率和资本充足率。,0,0
1,(单选题)关于现金债务抵押债券的特定目的公司(SPV)，下列说法正确的是()。,<p>A在合成债务抵押债券中，SPV是投资于不同投资档支付的实际证券</p><p>B在现金债务抵押债券中，SPV是投资于不同投资档支付的实际证券</p><p>C在合成债务抵押债券中，SPV不是投资于不同投资档支付的实际证券，而是投资于无风险债券</p><p>D在现金债务抵押债券中，SPV不是投资于不同投资档支付的实际证券，而是投资于违约互换和无风险债券</p>,4,B,考查现金债务抵押债券的特定公司的相关内容。B选项符合题意。,0,0
1,(单选题)基于()的风险管理策略要求商业银行的信贷业务不应集中于同一业务、同一性质甚至同一个借款人，应是全面的。,<p>A风险分散</p><p>B风险补偿</p><p>C风险对冲</p><p>D风险转移</p>,4,A,根据多样化投资分散风险的原理，商业银行的信贷业务应是全面的，不应集中于同一业务、同一性质甚至同一借款人。,0,0
1,(单选题)《金融违法行为处罚办法》属于()。,<p>A指引</p><p>B法律</p><p>C行政法规</p><p>D部门规章</p>,4,C,《金融违法行为处罚办法》属于行政法规。,0,0
1,(单选题)下列哪一项是由于股票价格的不利变动所带来的风险？(),<p>A折算风险</p><p>B市场风险</p><p>C交易风险</p><p>D股票价格风险</p>,4,D,股票价格风险是指由于商业银行持有的股票价格发生不利变化而给商业银行带来损失的风险。,0,0
1,(单选题)()用于衡量银行实际承担损失超出预计损失的那部分损失。,<p>A核心资本</p><p>B经济资本</p><p>C监管资本</p><p>D会计资本</p>,4,B,用于衡量银行实际承担损失超出预计损失的那部分损失的是经济资本。,0,0
1,(单选题)商业银行公司治理的核心是()。,<p>A在所有权和经营权分离的情况下，为妥善解决委托一代理关系而提出的董事会、高管层组织体系安排和监督制衡机制</p><p>B在所有权和经营权分离的情况下，通过信息披露制度完善股东对公司管理层的监督</p><p>C在所有权和经营权分离的情况下，保证股东利益最大化</p><p>D在股份制结构下保证各类股东的权利分配体系</p>,4,A,考查商业银行公司治理的核心。商业银行公司治理是指控制、管理机构的一种机制或制度安排，其核心是在所有权、经营权分离的情况下，为妥善解决委托代理关系而提出的董事会、高级管理层的组织体系安排和监督制衡机制。,0,0
1,(单选题)在银行为国际贸易提供的支付结算方式中，通常用()。,<p>A本票、汇款、信用证</p><p>B本票、信用证、托收</p><p>C汇款、信用证、托收</p><p>D汇票、信用证、支票</p>,4,C,在银行为国际贸易提供的支付结算方式中，通常用汇款、信用证及托收。,0,0
1,(单选题)风险水平类指标不包括()。,<p>A核心负债比率</p><p>B预期损失率</p><p>C关注类贷款迁徙率.</p><p>D不良贷款拨备覆盖率</p>,4,C,考查风险水平类指标包括的内容。风险水平类指标包括信用风险指标、市场风险指标、操作风险指标和流动性风险指标，A选项是流动性风险指标；B、D两项属于信用风险指标；C选项属于风险迁徙类指标。,0,0
1,(单选题)某银行2008年贷款应提准备为1100亿元，贷款损失准备充足率为80%，则贷款实际计提准备为()亿元。,<p>A880</p><p>B1375</p><p>C1100</p><p>D1000</p>,4,A,由贷款损失准备充足率=贷款实际计提准备/贷款应提准备×100%，可推出，贷款实际计提准备=贷款损失准备充足率×贷款应提准备/100%=80%×1100/100%=880（亿元）。,0,0
1,(单选题)稳健银行公司治理所共同遵循的八项基本原则不包括()。,<p>A董事会成员应称职，清楚理解其在公司治理中的角色，有能力对银行的各项事务作出正确的判断</p><p>B高级管理层应核准银行的战略目标和价值准则，并监督其在全行的传达贯彻</p><p>C董事会和高级管理层有效发挥内部审计都门、外部审计师及各内部指控部门的作用</p><p>D董事会应确保薪酬政策及其做法与银行的公司文化、长期目标和战略、控制环境相一致</p>,4,B,B选项应改为：董事会应核准商业银行的战略目标和价值准则，并监督其在全行的传达贯彻。,0,0
1,(单选题)()是华尔街的第一次数学革命的金融理论。,<p>A罗斯提出套利定价理论</p><p>B夏普提出的CAPM模型</p><p>C马柯威茨提出的现代资产组合理论</p><p>D布莱克、舒尔斯、默顿推导出欧式期权定价的一般模型</p>,4,B,CAPM是诺贝尔经济学奖获得者威廉夏普于1970年在其著作《投资组合理论与资本市场》中提出的，称为华尔街的第一次数学革命的金融理论。,0,0
1,(单选题)下列关于外汇远期合约的表述，不正确的是()。,<p>A外汇远期合约根据外汇未来的利率定价</p><p>B外汇远期合约到期日的结算金额取决于汇率的变化</p><p>C外汇远期合约可以实物交割，也可以现金结算</p><p>D本币升值，如果没有超过远期价格的话，外币的多方仍然盈利</p>,4,A,A选项应改为：外汇远期合约根据外汇即期汇率定价。,0,0
1,(单选题)()是通过调查问卷、系统性的检查或公开讨论的方式，评估银行内部是否符合操作风险管理政策，找出内部操作风险管理的优势和不足。,<p>A关键指标法</p><p>B自我评估法</p><p>C内部评估法</p><p>D系统分析法</p>,4,B,自我评估法是通过调查问卷、系统性的检查或公开讨论的方式，评估是否符合操作风险管理政策，找出内部操作风险的优势和不足。,0,0
1,(单选题)“不要将所有鸡蛋放在一个篮子里”，这一投资格言说明的风险管理策略是()。,<p>A风险对冲</p><p>B风险分散</p><p>C风险补偿</p><p>D风险转移</p>,4,B,风险分散是指通过多样化的投资来分散和降低风险的策略性选择。,0,0
1,"(单选题)已知A项目的投资半年收益率为5%,B项目的年收益率为7%,C项目的季度收益率为3%，那么三个项目的年收益排序为()。",<p>AA＞B＞C</p><p>BA＞C＞B</p><p>CC＞A＞B</p><p>DB＞A＞C</p>,4,C,A项目的年收益率=(1+5%)2-1=0.1025，即10.25%；C项目的年收益率=(1+3%)4-1≈0.1255，即12.55%.12.55%＞10.25%＞7%，即C＞A＞B。,0,0
1,(单选题)银行战略风险管理的主要作用是()。,<p>A提高银行的股东价值和银行知名度，保持银行的行业领先地位</p><p>B最大限度的避免经济损失，提高员工的业务熟练程度，提高银行知名度</p><p>C最大限度的避免经济损失，持久维护商业银行的声誉，提高银行的股东价值</p><p>D持久维护商业银行的声誉，提高员工的业务熟练程度，消除商业银行面临的市场风险</p>,4,C,考查银行战略风险管理的作用。银行战略风险管理的作用主要是最大限度的避免经济损失，持久维护商业银行的声誉，提高银行的股东价值。,0,0
1,(单选题)中国人民银行根据国际外汇市场行情每日公布外汇汇率()。,<p>A买入价</p><p>B卖出价</p><p>C中间价</p><p>D以上都是</p>,4,C,中间价（基准价）是中国人民银行授权外汇交易中心公布的当日外汇牌价。现汇（钞）买入价、现汇（钞）卖出价都是以银行为主体的表示方法。,0,0
1,(单选题)下列关于银行监管基本原则的说法，正确的是()。,<p>A效率原则是指监管活动除法律规定需要保密的以外，应当具有适当的透明度</p><p>B对公正原则应该把握两个方面，一是主体公正，二是客体公正</p><p>C依法原则是指银监会在进行监管活动中要合理配置和利用监管资源，提高监管效率</p><p>D公正原则是指银行业市场的参与者具有平等的法律地位，银监会进行监管活动时应当平等对待所有参与者</p>,4,D,A选项描述的是公开原则；B选项应改为：对公正原则应该把握两个方面，一是实体公正、二是程序公正；C选项描述的是效率原则。,0,0
2,(多选题)信用风险的主要形式包括()。,<p>A结算风险</p><p>B系统性风险</p><p>C非系统风险</p><p>D违约风险</p><p>E战略风险</p>,5,AD,信用风险的主要形式包括：结算风险和违约风险。,0,0
2,(多选题)银监会《商业银行不良资产监测和考核暂行办法》规定的不良贷款分析报告包括()。,<p>A地区和客户结构情况</p><p>B新发放贷款质量情况</p><p>C本期贷款余额等基本情况</p><p>D不良贷款清收转化情况</p><p>E新发生不良贷款的内外部原因分析及典型案例</p>,5,ABCDE,考查不良贷款分析报告包括的内容。除A、B、C、D、E五项外，还包括对不良贷款变化趋势进行预测等。,0,0
2,(多选题)盈利能力比率用来衡量管理层将销售收入转换成实际利润的效率，体现管理层控制费用并获得投资收益的能力，主要有()。,<p>A资产负债率</p><p>B净资产收益率</p><p>C销售毛利率</p><p>D销售净利率</p><p>E总资产周转率</p>,5,BCD,A选项“资产负债率”是杠杆比率，用来衡量企业长期偿债能力；E选项“总资产周转率”是效率比率，衡量管理层控制费用并获得投资收益的能力。,0,0
2,(多选题)风险规避策略的实施成本主要在于()的支出。,<p>A风险分析</p><p>B风险补偿</p><p>C人员工资</p><p>D风险转移</p><p>E经济资本配置</p>,5,AE,风险规避策略的实施成本主要在于风险分析和经济资本配置的支出。,0,0
2,(多选题)商业银行的下列做法中，能够起到降低流动性风险作用的有()。,<p>A制定适当的债务组合</p><p>B制定风险集中限额</p><p>C以零售资金作为银行负债的主要来源</p><p>D适度分散客户种类和资金到期日</p><p>E以批发性质的资金作为银行负债的主要来源</p>,5,ABCD,为降低流动性风险，商业银行应当根据自身情况，采用以下做法：(1)控制各类资金来源的合理比例，并适度分散客户种类和资金到期日；(2)在日常经营中持有足够水平的流动资金，并根据本行的业务特点持有合理的流动资产组合，作为应付紧急融资的储备；(3)制定适当的债务组合以及与主要资金提供者建立稳健持久的关系，以维持资金来源的多样化及稳定性，避免资金来源过度集中于个别对手、产品或市场；(4)制定风险集中限额，并监测日常遵守的情况；(5)以零售资金作为银行负债的主要来源。,0,0
2,(多选题)全面风险管理要素包括()。,<p>A目标设定</p><p>B控制活动</p><p>C事件识别</p><p>D风险对策</p><p>E风险评估</p>,5,ABCDE,除A、B、C、D、E五项外，全面风险管理要素还包括：内部环境、信息和交流、监控等。,0,0
2,(多选题)商业银行贷款担保的主要方式有()。,<p>A保证</p><p>B抵押</p><p>C质押</p><p>D留置</p><p>E定金</p>,5,ABCDE,考查商业银行贷款担保的主要方式。五个选项均符合题意。,0,0
2,(多选题)战略规划在实施方案中应当阐述的内容包括()。,<p>A潜在收益</p><p>B预期风险损失和财务分析</p><p>C所涉及的风险因素</p><p>D可以接受的风险水平</p><p>E银行自身资本状况</p>,5,ABCD,制定以风险为导向的战略规划，并定期进行修正是战略风险管理最有效的方法。战略规划应当清晰阐述实施方案中所涉及的风险因素、潜在收益以及可以接受的风险水平，并且尽可能地将预期风险损失和财务分析包括在内。,0,0
2,(多选题)集团法人客户的信用风险特征包括()。,<p>A系统性风险较高</p><p>B内部关联交易频繁</p><p>C连环担保十分普遍</p><p>D真实财务状况难以掌握</p><p>E风险识别和贷后管理难度大</p>,5,ABCDE,考查集团法人客户的信用风险特征。题中五个选项均符合题意。,0,0
2,(多选题)下列关于风险分散化的论述，正确的有()。,<p>A如果资产之间的相关性为-1，风险分散化效果最好</p><p>B加果资产之间的相关性为+1，分散化策略将不能分散风险</p><p>C如果资产之间的相关性为负，那么风险分散化效果较好</p><p>D如果资产之间的相关性为正，那么风险分散化效果较好</p><p>E如果资产之间的风险不存在相关性，那么分散化策略将不会有风险分散的效果</p>,5,ABCE,考查风险分散化的相关内容。如果资产组合中各资产存在相关性，则风险分散的效果会随着各资产间的相关系数有所不同。假设其他条件不变，当各资产间的相关系数为正时，风险分散效果较差；当相关系数为负时，风险分散效果较好。,0,0
2,(多选题)市场准入是指监管部门采取行政许可手段审查、批准市场主体可以进入某一领域并从事相关活动的机制。广义上讲，银行的市场准入不包括()。,<p>A机构准入</p><p>B业务准入</p><p>C高级管理人员准入</p><p>D资质准入</p><p>E风险控制水平</p>,5,DE,市场准入是指监管部门采取行政许可手段审查、批准市场主体可以进入某一领域并从事相关活动的机制。广义上讲，银行的市场准入包括三个方面：机构准入、业务准入和高级管理人员准入，所以D、E项符合题意。,0,0
2,(多选题)质押合同应包含的基本内容有()。,<p>A债务的期限</p><p>B质押担保的范围</p><p>C质物的质量、状况</p><p>D质物的名称、数量</p><p>E被担保的主债权种类、数额</p>,5,ABCDE,考查质押合同包含的基本内容。质押合同应详细记载的内容包括：(1)被担保的主债权种类、数额；(2)债务的期限；(3)质物的名称、数量、质量、状况；(4)质押担保的范围；(5)质押移交的时间；(6)当事人认为需要约定的其他事项等。,0,0
2,(多选题)国家风险主权评级的实质是对中央政府作为债务人履行偿债责任的意愿与能力的一种判断。其作用主要体现在()。,<p>A能够反映该国的违约损失率水平</p><p>B决定一个国家违约风险暴露的具体情况</p><p>C能够影响一个国家国际资本的流向</p><p>D决定了主权国政府在国际金融市场上进行融资的成本</p><p>E在很大程度上影响了这一个国家非主权实体在国际市场上进行融资的成本</p>,5,CDE,考查国家风险主权评级的作用。国家风险主权评级的作用主要体现在三个方面：(1)决定了主权国政府在国际金融市场上进行融资的成本；(2)在很大程度上影响了这一个国家非主权实体在国际市场上进行融资的成本，信用级别越低，融资的成本越高；(3)能够影响一个国家国际资本的流向（进而影响国家金融安全），特别是在金融危机发生过程中表现得特别明显，如果某国主权评级下调，国际资本会迅速从这个国家撤离。,0,0
2,(多选题)目前，我国银行信贷管理一般实行()与贷款管理责任制相结合的制度，以切实防范、控制和化解贷款业务风险。,<p>A审贷结合、集中审批</p><p>B审贷分离、分级审批</p><p>C审贷结合、分级审批</p><p>D集中授信管理、统一授权管理</p><p>E集中授权管理、统一授信管理</p>,5,BE,目前，我国银行信贷管理一般实行集中授权管理、统一授信管理、审贷分离、分级审批、贷款管理责任制相结合的制度，以切实防范、控制和化解贷款业务风险。,0,0
2,(多选题)下列关于即期外汇买卖的说法，正确的有()。,<p>A可以用于外汇投机</p><p>B属于衍生产品交易</p><p>C在实践中通常简称为即期</p><p>D是外汇交易中最基本的交易</p><p>E可以用于调整持有不同外汇头寸的比例，以避免发生汇率风险</p>,5,ACDE,即期外汇买卖不属于衍生产品，但其是衍生产品交易的基础工具。,0,0
