2,(多选题)目前，我国商业银行流动性风险管理的通常做法主要包括()。,<p>A由计划资金部门负责日常流动性管理</p><p>B成立由行长和各主要业务部门负责人参加的流动性委员会</p><p>C在总行设立资产负债管理委员会，制定全行的流动性管理政策</p><p>D运用货币市场、公开市场等与外部市场平盘，保证在分行分散管理、配置资金</p><p>E通过对贷存比、流动性比率、中长期贷款比例等指标的考核，加强对全行流动性的管理</p>,5,ABCE,D选项应改为：通过计划资金部的交易员，运用货币市场、公开市场等与外部市场平盘，保证在总行层面集中管理和配置资金，动态调整流动性缺口。,0,0
2,(多选题)我国商业银行信息披露中存在的问题有()。,<p>A风险信息披露不充分</p><p>B表外业务信息披露不充分</p><p>C信息披露不及时</p><p>D信息披露内容不全面</p><p>E信息披露监控机制有待完善</p>,5,ABDE,通常情况下，我国银行信息都能及时披露。,0,0
2,(多选题)SOSA评级体制的可借鉴之处在于()。,<p>A将重点放在风险评估、风险跟踪、风险控制上</p><p>B对外资银行的全部业务进行统一监管，体现整体性</p><p>C注重风险管理、内部控制、监管的安全与效益双重目标</p><p>D为全面深入评价一家银行经营管理状况提供规范统一的方法和标准</p><p>E将外资银行分行和办事处作为其跨国机构的有机部分实行监管</p>,5,BCE,A选项是ROCA评级法的特点；D选项是CAMLs评级法的意义。,0,0
2,(多选题)对于表内资产风险权重赋予权重为0的有()。,<p>A政策性银行债券</p><p>B我国中央政府的债券</p><p>C中央政府投资的公用企业的债券</p><p>D商业银行之间原始期限4个月以内的债券</p><p>E国有金融资产管理公司为收购国有银行不良贷款而定向发行的债券</p>,5,ABDE,中央政府投资的公用企业的债券的权重为50%。,0,0
2,(多选题)风险文化又称风险管理文化，是商业银行在经营管理活动中逐步形成的风险管理理念、哲学和价值观，一般由()层次组成。,<p>A风险管理战略</p><p>B风险管理知识</p><p>C风险管理制度</p><p>D风险管理理念</p><p>E风险管理计划</p>,5,BCD,风险文化由风险管理理念、知识和制度三个层次组成。,0,0
2,(多选题)()是各国监督商业银行的主体。,<p>A中央银行</p><p>B财政部门</p><p>C税务部门</p><p>D法律部门</p><p>E证券监督管理部门</p>,5,ABE,由于各国金融监督体制不一样，所以监督商业银行的主体也不同，具体有：中央银行、财政部门、证券监督管理部门。,0,0
2,(多选题)监管机构对实施高级计量法提出的具体标准主要包括()。,<p>A定量标准</p><p>B定性标准</p><p>C资格要求</p><p>D外部数据要求</p><p>E内部数据要求</p>,5,ABCDE,考查高级计量法具体标准。高级计量法是指商业银行在满足监管机构提出的资格要求以及定性和定量标准的前提下，通过内部操作风险计量系统计算监管资本要求。监管机构对实施高级计量法提出了具体标准，包括资格要求、定性标准、定量标准、内部数据和外部数据要求。,0,0
2,(多选题)参照国际风险管理标准，集中型风险管理部门的人员必须具备的主要技能包括()。,<p>A风险监测和分析能力</p><p>B数量分析能力</p><p>C价格核准能力</p><p>D模型创建能力</p><p>E系统开发/集成能力</p>,5,ABCDE,集中型风险管理部门对风险管理人员的专业技能要求最高、最全面。参照国际风险管理标准，集中型风险管理部门的人员必须具备以下五个方面的主要技能：(1)风险监测和分析能力；(2)数量分析能力；(3)价格核准能力；(4)模型创建能力；(5)系统开发/集成能力。,0,0
2,(多选题)商业银行的战略风险主要体现在()等方面。,<p>A商业银行战略目标不能贯彻执行</p><p>B商业银行经营目标不能按时实现</p><p>C为实现战略目标而制定的经营战略存在缺陷</p><p>D为实现目标所需要的资源匮乏</p><p>E整个战略实施过程的质量难以保证</p>,5,CD,考查商业银行战略风险的主要体现。战略风险是指商业银行在追求短期商业目的和长期发展目标的过程中，因不适当的发展规划和战略决策给商业银行造成损失或不利影响的风险。战略风险主要体现在四个方面：(1)商业银行战略目标缺乏整体兼容性；(2)为实现这些目标而制定的经营战略存在缺陷；(3)为实现目标所需要的资源匮乏；(4)整个战略实施过程的质量难以保证。,0,0
2,(多选题)如果出现流动性危机，商业银行采取的下列措施正确的有()。,<p>A减少非核心贷款</p><p>B同业拆入一笔款项</p><p>C维持良好的公共关系</p><p>D加强与长期存款客户的关系</p><p>E寻求央行的紧急支援</p>,5,ABCDE,A、B、D选项可以弥补现金流量的不足；C选项有利于树立积极的公众形象，防止危机恶化；E选项是紧急求救措施。,0,0
2,(多选题)记入交易账户的头寸应当具有明确的头寸管理政策和程序，包括()。,<p>A设置头寸限额并进行监控</p><p>B交易头寸至少应逐日按照公允价值计价</p><p>C根据市场信息来源，对交易头寸予以密切监控</p><p>D按照银行的风险管理程序，交易头寸定期报告给高级管理层</p><p>E交易员可以在批准限额内，按照批准的交易政策和程序管理头寸</p>,5,ACDE,B选项应改为：交易头寸至少应逐日按照市场价值计价。,0,0
2,(多选题)决定商业银行的风险承受能力的因素有()。,<p>A资产管理</p><p>B负债管理</p><p>C资本金规模</p><p>D资产负债管理</p><p>E风险管理水平</p>,5,CE,考查决定商业银行风险承受能力的因素。决定商业银行的风险承受能力的因素有资本金规模和商业银行的风险管理水平。,0,0
2,(多选题)在战略风险评估中，应由专家审核的假设条件主要有()。,<p>A公司治理结构</p><p>B公司的整体战略</p><p>C整体经济指标</p><p>D利率变化/预期</p><p>E信用风险参数</p>,5,CDE,考查战略风险的相关内容。在评估战略风险时，应当首先由商业银行内部具有丰富经验的专家负责审核一些技术性较强的假设条件，例如整体经济指标、利率变化/预期、信用风险参数等。,0,0
2,(多选题)违约责任的承担形式有()。,<p>A定金责任</p><p>B强制履行</p><p>C赔偿损失</p><p>D违约金责任</p><p>E采取补救措施</p>,5,ABCDE,考查违约责任的承担形式。题中五个选项均属于违约责任的承担形式。,0,0
2,(多选题)风险信息系统精确性的要求体现在()。,<p>A风险计量引用在财务管理方面的程度越大，对整个信息系统精确程度的要求就越高</p><p>B准确的计量信用风险、市场风险和操作风险已经成为商业银行信息发布和监管报告中的重要部分</p><p>C风险管理信息系统所提供的分析/计量结果，是各种投资组合不断变化过程中的一个瞬间量化</p><p>D数据的完整性</p><p>E从经过审核的记录系统处收集到的数据信息最为准确</p>,5,ABDE,C选项属于信息系统及时性的要求。,0,0
2,(多选题)下列关于商业银行的风险管理部门设置的说法，正确的有()。,<p>A商业银行风险管理部门必须具有高度独立性</p><p>B商业银行风险管理部门不具有或者只具有非常有限的风险管理策略执行权</p><p>C商业银行风险管理部门和风险管理委员会可以合二为一，以便信息的交流与共享</p><p>D商业银行风险管理部门和风险管理委员会必须相互独立，不能互通信息</p><p>E商业银行风险管理部门通常有集中型和分散型两种类型</p>,5,ABE,建立高效的风险管理部门应当固守两个基本准则：风险管理部门必须具备高度独立性，以提供客观的风险管理策略；风险管理部门不具有或只具有非常有限的风险管理策略执行权。实践操作中，商业银行的“风险管理部门”和“风险管理委员会”既要保持相互独立，又要互为支持，但绝不能混为一谈。风险管理部门的结构通常有集中型和分散型两种类型。,0,0
2,(多选题)总收益互换是将传统的互换进行合成，为投资者提供类似贷款或信用资产的投资产品。下列关于总收益互换的说法不正确的有()。,<p>A银行支付相应的融资成本</p><p>B投资者支付标的资产的所有收益</p><p>C投资者承担标的资产价格变动的所有风险</p><p>D总收益互换的核心主要是复制信用资产的总收益</p><p>E当标的资产的价格上升时，银行就支付给投资者一定的金额</p>,5,AB,考查总收益互换的内容。在总收益互换中，银行支付标的资产的所有收益，投资者反过来要支付相应的融资成本。当标的资产的价格下降时，投资者支付给银行一定的金额；当标的资产的价格上升时，银行就支付给投资者一定的金额。,0,0
2,(多选题)下列各项属于操作风险的有()。,<p>A员工罢工</p><p>B火灾、恐怖袭击</p><p>C黑客攻击、盗取密码</p><p>D内部人员信贷欺诈</p><p>E贿赂、回扣、内部交易</p>,5,ABCDE,考查操作风险的内容。操作风险是指由不完善或有问题的内部程序、员工、信息科技系统以及外部事件所造成损失的风险。题中五个选项均属于操作风险。,0,0
2,(多选题)下列关于缺口分析的理解，正确的有()。,<p>A缺口分析是衡量利率变动对银行当期收益影响的一种方法</p><p>B在正缺口情况下，市场利率上升会导致银行净利息收入下降</p><p>C在负缺口情况下，市场利率上升会导致银行净利息收入上升</p><p>D当某一时间段内的负债大于资产时，就产生了负债敏感型缺口</p><p>E某时间段的缺口乘以假定的利率变动，得出这一利率变动对净利息收</p>,5,ADE,B选项应改为：在正缺口情况下，市场利率与银行净利息收入成正比上升；C选项应改为：在负缺口情况下，市场利率上升会导致银行净利息收入下降。,0,0
2,(多选题)商业银行核心资本包括()。,<p>A普通股</p><p>B优先股</p><p>C一般准备</p><p>D资本公积</p><p>E可转换债券</p>,5,AD,考查商业银行的核心资本的内容。商业银行核心资本包括实收资本或普通股、资本公积、盈余公积、未分配利润和少数股权。B、C、E三项属于附属资本。,0,0
2,(多选题)银行监管方法包括()。,<p>A监督检查</p><p>B外部审计</p><p>C风险评级</p><p>D市场准入</p><p>E资本监管</p>,5,ACDE,考查银行监管的方法。银行监管方法包括资本监管、市场准入、风险评级、监督检查等。,0,0
2,(多选题)下列各项属于政治风险的有()。,<p>A政权风险</p><p>B政策风险</p><p>C政局风险</p><p>D对外关系风险</p><p>E对内关系风险</p>,5,ABCD,考查政治风险的相关内容。政治风险是指商业银行受特定国家的政治动荡等不利因素影响（例如长期以来部分南亚和非洲国家政局不稳），无法正常收回在该国的金融资产而遭受损失的风险。政治风险包括政权风险、政局风险、政策风险和对外关系风险等。,0,0
2,(多选题)良好的银行公司治理普遍具备的特征有()。,<p>A科学的激励约束机制</p><p>B先进的管理信息系统</p><p>C与股东价值相挂钩的有效监督考核机制</p><p>D银行内部有效的制衡关系和清晰的职责边界</p><p>E有健全的内部审计、内部监督和问题整改机制</p>,5,ABCDE,除A、B、C、D四项外，良好的银行公司治理具备的特征还包括完善的内部控制和风险管理体系。,0,0
2,(多选题)利率灵敏度可分为()。,<p>A利差灵敏度</p><p>B利率损失敏感性</p><p>C利率收益敏感性</p><p>D期望利率敏感性</p><p>E资产负债市值的利率灵敏度</p>,5,AE,考查利率灵敏度的分类。利率灵敏度可分为利差灵敏度和资产负债市值的利率灵敏度。,0,0
2,(多选题)关于外部审计和监督检查的关系，下列说法正确的有()。,<p>A外部审计和银行监管统一于非现场检查</p><p>B外部审计和银行监管都将审查银行会计信息、管理信息以及相关记录</p><p>C外部审计侧重于金融机构风险和合规性的分析，银行监管侧重于财务报表审计</p><p>D外部审计意见和监管意见同样作为信息披露的内容，并因此具有相对独立、客观、公正的立场</p><p>E外部审计报告是银行监管的重要资料，银行监管政策、相关标准和准则点也是外部审计所依据和关注的重点，二者的互相配合并形成合力是加强风险监管，防范金融危机的有效保证</p>,5,BDE,A选项应改为：外部审计和银行监管的实施方式统一于现场检查；C选项应改为：银行监管侧重于金融机构风险和合规性的分析，外部审计侧重于财务报表审计。,0,0
3,(判断题)风险与收益是相互影响、相互作用的，一般遵循低风险高收益、高风险低收益的基本规律。(),<p>A正确</p><p>B错误</p>,2,B,考查遵循基本规律的内容。风险与收益是相互影响、相互作用的，一般遵循高风险高收益、低风险低收益的基本规律。,0,0
3,(判断题)商业银行为了获取盈利而在正常范围内建立的“借长贷短”的资产负债期限结构（或持有期缺口），被认为是一种正常的、可控性较强的流动性风险。(),<p>A正确</p><p>B错误</p>,2,B,考查流动性风险的内容。商业银行为了获取盈利而在正常范围内建立的“借短贷长”的资产负债期限结构（或持有期缺口），被认为是一种正常的、可控性较强的流动性风险。,0,0
3,(判断题)资产分类是商业银行实施市场风险管理和计提市场风险资本的前提和基础。(),<p>A正确</p><p>B错误</p>,2,A,资产分类，即银行账户与交易账户的划分是商业银行实施市场风险管理和计提市场风险资本的前提和基础。,0,0
3,(判断题)小型商业银行普遍擅长零售业务，有能力将资源和技术整合起来，和更多的对手竞争。(),<p>A正确</p><p>B错误</p>,2,B,小型商业银行可以在某些专业领域采用先进的信息系统或与第三方合作，在细分业务领域与大型商业银行展开竞争，或利用地域、专业优势，服务于要求相对复杂的企业/零售客户。大型商业银行普遍擅长零售业务，有能力将更多资源和技术持续投入到大规模零售业务系统中（如快速增长的信用卡/借记卡终端商店）。,0,0
3,(判断题)商业银行要靠突击式的培训和教育来培育风险文化。(),<p>A正确</p><p>B错误</p>,2,B,培植风险文化是商业银行的一项“终身事业”。由于商业银行的内外部经营管理环境不断发生变化，风险文化也会被不断修正，因此商业银行无法通过突击式的培训和教育达到培育风险文化的目的，而只能将其贯穿到商业银行的整个生命周期。,0,0
3,(判断题)信用风险管理不应当仅仅停留在单笔贷款的层面上，还应当从贷款组合的层面进行识别、计量、监测和控制。(),<p>A正确</p><p>B错误</p>,2,A,考查信用风险的有关内容。题干表述正确。,0,0
3,(判断题)因为贷款损失准备缺口属于商业银行资本的组成部分，所以计算商业银行的资本充足率时不应扣除贷款损失准备缺口。(),<p>A正确</p><p>B错误</p>,2,B,商业银行资本充足率的计算应建立在充分计提贷款损失准备等各项损失准备的基础之上，以抵御信用风险和市场风险。据此，贷款损失准备缺口也应从资本中扣除。,0,0
3,(判断题)银行内部控制是指商业银行为实现经营目标，通过制定和实施一系列制度、程序和方法，对风险进行事前防范、事中控制、事后监督和纠正的动态过程和机制。(),<p>A正确</p><p>B错误</p>,2,A,考查银行内部控制的含义。题干表述正确。,0,0
3,(判断题)买方期权对期权买方来说是买入一个卖出交易标的物的权利。(),<p>A正确</p><p>B错误</p>,2,B,买方期权的买方和卖方约定在期权的存续期或到期日，期权买方拥有以约定的价格向期权卖方买入约定数量交易标的的权利。因此，买方期权对期权买方来说是买入一个买入交易标的物的权利。,0,0
3,(判断题)商业银行因未能及时根据市场变化和客户需求创新产品和服务，丧失了宝贵的客户资源，从而失去了在传统业务领域的竞争优势。此类风险属于市场风险。(),<p>A正确</p><p>B错误</p>,2,B,题干表述的风险属于战略风险。,0,0
3,(判断题)证券化是将缺乏流动性的资产汇集成资产池，通过结构性重组，将其转化为可以在金融市场上出售和流通的证券。(),<p>A正确</p><p>B错误</p>,2,B,考查证券化的定义。证券化是将缺乏流动性但能够产生可预计的未来现金流的资产（如银行的贷款、企业的应收账款等），通过一定的结构安排，对资产中的风险与收益要素进行分离、重新组合、打包，进而转换成为在金融市场上可以出售并流通的证券的过程。,0,0
3,(判断题)国内外各商业银行均在大力推进运营与前台支持的集中化，在流程方面既加强对前台和后台的控制，又重视对商业银行总体管理的流程重整。（）,<p>A正确</p><p>B错误</p>,2,B,国内外各商业银行均在大力推进运营与后台支持的集中化，在流程方面既加强对前台和中台的控制，又重视对商业银行总体管理的流程重整。,0,0
3,(判断题)申请授信的单一法人客户应向商业银行提交的基本信息包括近3年经审计的资产负债表、利润表等；成立不足3年的客户，提交自成立以来各年度的报表。(）,<p>A正确</p><p>B错误</p>,2,A,题干表述正确。,0,0
3,(判断题)某大型企业受金融危机的影响，效益出现下滑、负债率偏高。为支持该企业渡过难关，商业银行可以对该企业个别经营指标进行微调并继续将其评定为AAA级客户。(),<p>A正确</p><p>B错误</p>,2,B,企业条件改善或恶化时，应重新进行评级，确保内部评级与授信质量一致。,0,0
3,(判断题)矩阵型模式作为银行风险管理组织结构的一种，是对风险管理部集权模式和事业部模式的综合，从而在一定程度上避免了这两种模式的不足。(),<p>A正确</p><p>B错误</p>,2,A,题干表述正确。,0,0
