1,(单选题)某股价指数，按基期加权法编制，并以样本股的流通股数为权数。选取A、B、C三种股票为样本股，样 本股的基期价格分别为5.00元，8.00元，4.00元，流通股数分别为7000万股，9000万股，8000万股。某交 易日，这三种股票的收盘价分别为9.50元，15.00元，8.5元，设基础指数为1000点，则该日的加权股价指 数是( )。 ,<p>A1938.85</p><p>B1939.84</p><p>C1938.86</p><p>D1938.84</p>,4,A,该日的加权股价指数是[（7000*9.5+9000*15+8000*8.5）/（7000*5+9000*8+8000*4)]*1000=1938.849。,0,0
1,(单选题)中国债券指数覆盖了交易所市场和银行间市场所有发行额在( )人民币以上，待偿期限在( )以上的债券，指 数样本债券每月月末调整一次。 ,<p>A100亿，1年</p><p>B50亿，2年</p><p>C50亿，1年</p><p>D100亿，2年</p>,4,C,中国债券指数覆盖了交易所市场和银行间市场所有发行额在50亿人民币以上，待偿期限在1年以上的债 券，指数样本债券每月月末调整一次。,0,0
1,(单选题)股东大会作出修改公司章程的决议，必须经出席会议的股东所持表决权( )以上通过。 ,<p>A三分之一</p><p>B三分之二</p><p>C半数</p><p>D四分之五</p>,4,B,股东大会作出修改公司章程的决议，必须经出席会议的股东所持表决权2／3以上通过。,0,0
1,(单选题)证券公司解聘合规负责人，应当有正当理由，并自解聘之日起( )个工作日内将解聘的事实和理由书面报告 国务院证券监督管理机构。 ,<p>A1</p><p>B3</p><p>C5</p><p>D7</p>,4,B,证券公司解聘合规负责人，应当有正当理由，并自解聘之’日起3个工作日内将解聘的事实和理由书面 报告国务院证券监督管理机构。,0,0
1,(单选题)证券公司及证券营业部应当建立客户投诉书面或者电子档案，档案保存时间不得少于( )年。 ,<p>A1</p><p>B3</p><p>C5</p><p>D10</p>,4,B,证券公司及证券营业部应当建立客户投诉书面或者电子档案，保存时间不少于3年。每年4月底前，证 券公司和证券营业部应当汇总上一年度证券经纪业务投诉及处理情况，分别报证券公司住所地及证券 营业部所在地证监局备案。,0,0
1,(单选题)为证券、期货投资人或者客户提供证券、期货投资分析和预测或者建议等直接或者间接有偿咨询服务的 活动是( )。 ,<p>A证券投资咨询</p><p>B证券投资顾问</p><p>C证券投资服务</p><p>D证券投资经纪</p>,4,A,证券投资咨询是指从事证券、期货投资咨询业务的机构及其投资咨询人员为证券、期货投资人或者客 户提供证券、期货投资分析和预测或者建议等直接或者间接有偿咨询服务的活动。,0,0
1,(单选题)《证券业从业人员执业行为准则》于2009年1月19日由( )正式颁布实施。 ,<p>A证券交易所</p><p>B证券业协会</p><p>C证券登记结算机构</p><p>D证监会</p>,4,B,证券业从业人员执业行为准则》于2009年1月19日由中国证券业协会正式颁布实施。,0,0
1,(单选题)( )是指依法设立的从事证券服务业务的法人机构。 ,<p>A证券服务机构</p><p>B证券中介机构</p><p>C证券自律性组织</p><p>D证券监管机构</p>,4,A,这是证券服务机构的定义。,0,0
1,(单选题)债券与股票的收益率相互影响，表现为( )。 ,<p>A债券的收益率上升，则股票的收益率也必然上升</p><p>B如果市场是有效的，债券的平均收益率和股票的收益率会大体保持相对的关系，其差异反映了二者风 险程度的差别</p><p>C单个股票和债券的收益率不会发生大的差异</p><p>D宏观政策的变化对债券和股票收益率的影响是绝对一致的</p>,4,B,单个股票和债券的收益率会发生差异，而且有时差距还很大。,0,0
1,(单选题)注册资本最低限额为人民币五千万元的证券公司可以从事( )业务。 ,<p>A与证券交易、证券投资活动有关的财务顾问</p><p>B证券资产管理</p><p>C证券自营</p><p>D证券承销与保荐</p>,4,A,证券公司经营证券经纪、证券投资咨询、与证券交易以及投资活动有关的财务顾问业务，注册资本最低限额为5000万元。,0,0
1,(单选题)公司债券利息支出属于公司的( )。 ,<p>A营销经费</p><p>B利润</p><p>C费用范围</p><p>D直接成本</p>,4,C,债券利息是公司的固定支出，属于费用范围。,0,0
1,(单选题)融资融券业务的决策与授权体系原则上按照( )的架构设立和运行。 ,<p>A业务执行部门一董事会一业务决策机构一分支机构</p><p>B董事会一业务执行部门一业务决策机构一分支机构</p><p>C董事会一业务决策机构一业务执行部门一分支机构</p><p>D业务决策机构一业务执行部门一分支机构一董事会</p>,4,C,融资融券业务的决策与授权体系原则上按照“董事会一业务决策机构一业务执行部门一分支机构”的 架构设立和运行。,0,0
1,(单选题)看跌期权的买方具有在约定期限内按( )卖出一定数量基础金融工具的权利。 ,<p>A协定价格</p><p>B未来价格</p><p>C市价</p><p>D公允价格</p>,4,A,此题考查对看跌期权的理解。,0,0
1,(单选题)中国证监会《上市公司并购重组财务顾问业务管理办法》对上市公司并购重组财务顾问业务作出规范， 投资顾问是向( )提供投资建设，辅助投资者做出投资决策。 ,<p>A投资者</p><p>B证券公司</p><p>C证券交易所</p><p>D中国证券业协会</p>,4,A,中国证监会《上市公司并购重组财务顾问业务管理办法》对上市公司并购重组财务顾问业务作出规 范，投资顾问是向投资者提供投资建议，辅助投资者做出投资决策。,0,0
1,(单选题)证券公司和个人应当保证申请文件真实、准确、完整。申请期间，申请文件内容发生重大变化的，应当 自变化之日起( )个工作日内向中国证监会提交更新资料。 ,<p>A1</p><p>B2</p><p>C3</p><p>D4</p>,4,B,证券公司和个人应当保证申请文件真实、准确、完整。申请期间，申请文件内容发生重大变化的，应 当自变化之日起2个工作日内向中国证监会提交更新资料。,0,0
1,(单选题)取得基金销售人员从业考试成绩合格证的人员不可以参加的培训是( )。 ,<p>A所在机构组织的培训</p><p>B协会远程系统的培训</p><p>C所在辖区地方证券业协会组织的培训</p><p>D所在辖区以外的地方证券业协会组织的培训</p>,4,D,取得基金销售人员从业考试成绩合格证的人员可以参加所在机构组织的培训，也可以参加协会远程系 统的培训或所在辖区地方证券业协会组织的培训。,0,0
1,(单选题)以下基金品种中适用我国《证券投资基金法》的是( )。 ,<p>A私募基金</p><p>B创业基金</p><p>C证券投资基金</p><p>D社保基金</p>,4,C,我国《证券投资基金法》的适用范围。,0,0
1,(单选题)中国证券监督管理委员会及其派出机构可以根据( )原则，要求财务顾问提供已按照规定履行尽职调查义务 的证明材料、工作档案和工作底稿。 ,<p>A审慎监管</p><p>B忠实勤勉</p><p>C诚实信用</p><p>D平等自愿</p>,4,A,中国证券监督管理委员会及其派出机构可以根据审慎监管原则，要求财务顾问提供已按照本办法的规 定履行尽职调查义务的证明材料、工作档案和工作底稿，并对财务顾问的公司治理、内部控制、经营 运作、风险状况、从业活动等方面进行非现场检查或者现场检查。,0,0
1,(单选题)以超过票面金额的价格发行股票所得的溢价款项列入发行公司的( )。 ,<p>A任意公积金</p><p>B法定公积金</p><p>C资本公积金</p><p>D盈余公积金</p>,4,C,以超过票面金额的价格发行股票所得的溢价款项列入发行公司的资本公积金。,0,0
1,(单选题)期权交易实际上是一种权利的单方面有偿让渡，期权的买方以支付一定数量的( )为代价而拥有了这种权 利。 ,<p>A期权费</p><p>B利率</p><p>C本金</p><p>D执行价格</p>,4,A,期权交易实际上是一种权利的单方面有偿让渡，期权的买方以支付一定数量的期权费为代价而拥有了 这种权利。,0,0
1,(单选题)看跌期权也称为( )，交易者之所以买入它，是因为预期该看跌期权的标的资产的市场价格将下跌。 ,<p>A欧式期权</p><p>B美式期权</p><p>C认沽权</p><p>D认购权</p>,4,C,常识题，看跌期权又称认沽权。,0,0
1,(单选题)我国《证券法》规定，因不可抗力的突发事件或者为维护证券交易的正常秩序，证券交易所可以决定( )。 ,<p>A临时停市</p><p>B技术性停牌</p><p>C市场禁入</p><p>D以上部可以</p>,4,A,考察证券交易所职能，同时也是法规问题,0,0
1,(单选题)中国证券登记结算公司仅为( )开立结算账户，专用于证券交易成交后的清算交收，具有结算履约担保作 用。 ,<p>A客户</p><p>B证券公司</p><p>C证券交易所</p><p>D证券业协会</p>,4,B,中国证券登记结算公司仅为证券公司开立结算账户，专用于证券交易成交后的清算交收，具有结算履 约担保作用。,0,0
1,(单选题)证券公司净资本的计算公式为( )。 ,<p>A净资本=净资产+金融资产的风险调整一其他资产的风险调整一或有负债的风险调整-／+中国证监会认定或核准的其他调整项目</p><p>B净资本=净资产一金融资产的风险调整一其他资产的风险调整+或有负债的风险调整-／+中国证监会认 定或核准的其他调整项目</p><p>C净资本=净资产一金融资产的风险调整一其他资产的风险调整一或有负债的风险调整-／+中国证监会 认定或核准的其他调整项目</p><p>D净资本=净资产+金融资产的风险调整一其他资产的风险调整+或有负债的风险调整-／+中国证监会认 定或核准的其他调整项目</p>,4,C,察证券公司净资本的计算公式。,0,0
1,(单选题)交易双方在集中的交易所内以公开竞价的形式达成的，在将来某一特定时间交收标准数量特定金融工具 的协议，我们称之为( )。 ,<p>A金融期货合约</p><p>B金融期权台约</p><p>C金融互换交易</p><p>D权证</p>,4,A,金融期货台约指交易双方在集中的交易所内以公开竞价的形式达成的，在将来某一特定时间交收标准 数量特定金融工具的协议。,0,0
1,(单选题)证券公司风险控制指标管理办法》规定，净资本与各项风险资本准备之和的比例不得低于( )。 ,<p>A0.5</p><p>B0.7</p><p>C0.8</p><p>D1</p>,4,D,《证券公司风险控制指标管理办法》规定，净资本与各项风险资本准备之和的比例不得低于100%。,0,0
1,(单选题)以样本股每日收盘价之和除以样本数得到的股价平均数是( )。 ,<p>A简单算术平均数</p><p>B几何算术平均数</p><p>C加权股价平均数</p><p>D修正股价平均数</p>,4,A,简单算术股价平均数是以样本股每日收盘价之和除以样本数。,0,0
1,(单选题)基金管理费是支付给( )的费用。 ,<p>A基金管理人</p><p>B基金托管人</p><p>C基金投资者</p><p>D基金监管部门</p>,4,A,基金管理费是指从基金资产中提取的、支付给为基金提供专业化服务的基金管理人的费用，即管理人 为管理和操作基金而收取的费用。,0,0
1,(单选题)一般意义上的优先股具有的特点之一是在发行时事先确定( )。 ,<p>A红利率</p><p>B股息率</p><p>C现金额</p><p>D票面金额</p>,4,B,优先股的股息率固定。,0,0
1,(单选题)( )于2004年1月31日发布《关于推进资本市场改革开放和稳定发展的若干意见》，对中国资本市场的改革 与发展具有重要的现实意义和深远的历史影响。 ,<p>A国务院</p><p>B证监会</p><p>C发改委</p><p>D商务部</p>,4,A,国务院于2004年1月31日发布《关于推进资本市场改革开放和稳定发展的若干意见》，对中国资本市场 的改革与发展具有重要的现实意义和深远的历史影响。,0,0
1,(单选题)南方积极配置证券投资基金是( )。 ,<p>A公司型基金</p><p>B指数基金</p><p>CETF</p><p>DLOF</p>,4,D,2004年10月14日，南方基金管理公司募集设立了南方积极配置证券投资基金( LOF)，并于2004年12月20日在深圳证券交易所上市交易。,0,0
1,(单选题)按照债券票面载明的利率及支付方式定期分次付息的债券是指( )。 ,<p>A附息债券</p><p>B贴现债券</p><p>C缓息债券</p><p>D零息债券</p>,4,A,考察附息债券的定义。,0,0
1,(单选题)我国证券市场监管部门的主要手段是( )。 ,<p>A法律手段</p><p>B经济手段</p><p>C行政手段</p><p>D财政手段</p>,4,A,我国证券市场监管部门的主要手段是法律手段。,0,0
1,(单选题)创业板上市公司的董事长、经理、( )应当对公司临时报告信息披露的真实性、准确性、完整性、及时性、 公平性承担主要责任。 ,<p>A董事会秘书</p><p>B总经理秘书</p><p>C股东大会</p><p>D财务负责人</p>,4,A,考察上市公司信息披露的监督管理与法律责任。创业板上市公司的董事长、经理、董事会秘书应当对 公司临时报告信息披露的真实性、准确性、完整性、及时性、公平性承担主要责任。,0,0
1,(单选题)可转换公司债券的赎回条件一般是( )。 ,<p>A当公司股票价格在一段时间内连续低于转换价格达一定幅度时</p><p>B当公司股票价格在一段时间内连续高于转换价格达一定幅度时</p><p>C当公司股票价格在一段时间内连续等于转换价格达一定幅度时</p><p>D当公司股票价格持续低迷时</p>,4,B,可转换公司债券的赎回条件一般是当公司股票价格在一段时间内连续高于转换价格达一定幅度时，公 司可按事先约定的赎回价格买回发行在外尚未转股的可转换公司债券。,0,0
1,(单选题)我国《证券法》规定，持有公司( )以上股份的股东为知悉证券交易内幕信息的知情人员。 ,<p>A0.05</p><p>B0.1</p><p>C0.3</p><p>D0.5</p>,4,A,考察内幕交易的行为主体。,0,0
1,(单选题)中央银行的货币政策对股票价格有直接的影响，其手段包括( )。 ,<p>A存款准备金制度</p><p>B发行国债</p><p>C调节税率</p><p>D国家预算</p>,4,A,此题考察货币政策的工具。调节税率、发行国债和国家预算属于财政政策。,0,0
1,(单选题)证券发行与承销管理办法》规定，战略投资者不得参与首次公开发行股票的初步询价和累计投标询价， 并应当承诺获得本次配售的股票持有期限为( )。 ,<p>A不少于3个月</p><p>B不多于3个月</p><p>C不少于12个月</p><p>D不多于12个月</p>,4,C,战略投资者应当承诺获得配售的股票持有期限不少于12个月。,0,0
1,(单选题)发行人和主承销商应当签订承销协议，在承销协议中界定双方的权利义务关系，约定明确的承销基数。 采用( )方式的，应当约定发行失败后的处理措施。 ,<p>A包销</p><p>B代销</p><p>C经销</p><p>D传销</p>,4,B,发行人和主承销商应当签订承销协议，在承销协议中界定双方的权利义务关系，约定明确的承销基 数。采用包销方式的，应当明确包销责任；采用代销方式的，应当约定发行失败后的处理措施。,0,0
1,(单选题)从业人员在执业过程中违反有关证券法律、行政法规以及中国证监会有关规定，受到聘用机构处分的， 该机构应当在处分后( )日内向协会报告。 ,<p>A7</p><p>B10</p><p>C15</p><p>D20</p>,4,B,从业人员在执业过程中违反有关证券法律、行政法规以及中国证监会有关规定，受到聘用机构处分 的，该机构应当在处分后10日内向协会报告。,0,0
1,(单选题)设立限定性集合资产管理计划的净资本限额为( )亿元。 ,<p>A5</p><p>B3</p><p>C2</p><p>D1</p>,4,B,设立限定性集合资产管理计划的净资本限额为3亿元。,0,0
1,(单选题)《中华人民共和国刑法》第一百六十一条规定，提供虚假财务会计报告的公司直接负责的主管人员和其 他直接责任人员。处( )以下有期徒刑或者拘役，并处或者单处( )以上( )以下罚金。 ,<p>A3年，2万元，10万元</p><p>B3年，2万元，20万元</p><p>C5年，2万元，20万元</p><p>D5年，2万元，10万元</p>,4,B,《中华人民共和国刑法》第一百六十一条规定，提供虚假财务会计报告的公司直接负责的主管人员和 其他直接责任人员。处3年以下有期徒刑或者拘役，并处或者单处2万以上20万以下以下罚金。,0,0
1,(单选题)从业人员拒绝协会调查或者检查的，或者所聘用机构拒绝配合调查的，由协会责令改正；拒不改正的， 给予纪律处分；情节严重的，由中国证监会给予从业人员暂停执业( )个月。 ,<p>A3～6</p><p>B6～12</p><p>C3～9</p><p>D3～12 </p>,4,D,从业人员拒绝协会调查或者检查的，或者所聘用机构拒绝配合调查的，由协会责令改正；拒不改正 的，给予纪律处分；情节严重的，由中国证监会给予从业人员暂停执业3个月至12个月，或者吊销其执 业证书的处罚；对机构单处或者并处警告、3万元以下罚款。,0,0
1,(单选题)上市公司在一年内购买、出售重大资产或者担保金额超过公司资产总额30%的，应当由股东大会作出决 议，并经出席会议的股东所持表决权的( )以上通过。 ,<p>A42038</p><p>B42007</p><p>C42006</p><p>D42067</p>,4,A,《中华人民共和国公司法》第一百二十二条规定：“上市公司在一年内购买、出售重大资产或者担保 金额超过公司资产总额30%的，应当由股东大会作出决议，并经出席会议的股东所持表决权的2/3以上 通过。”,0,0
1,(单选题)我国货币市场基金的份额净值固定在( )。 ,<p>A1元人民币</p><p>B2元人民币</p><p>C5元人民币</p><p>D10元人民币</p>,4,A,货币市场基金的份额净值固定在1元人民币。,0,0
1,(单选题)长期国债的偿还期限一般为( )。 ,<p>A1年或1年以内</p><p>B1年以上、10年以下</p><p>C10年或10年以上</p><p>D20年或20年以上</p>,4,C,长期国债的偿还期限一般为10年或10年以上。,0,0
1,(单选题)证券公司开展融资融券业务必须经()批准。 ,<p>A中国证监会</p><p>B证券交易所</p><p>C省级人民政府</p><p>D中国证券业协会</p>,4,A,证券公司开展融资融券业务必须经中国证监会批准。,0,0
1,(单选题)依据证券公司客户信用交易.担保证券账户内的记录，确认证券公司受托持有证券的事实，并以证券公司 为名义持有人，登记于证券持有人名册的证券市场主体是()。 ,<p>A中国证监会</p><p>B证券登记结算机构</p><p>C中国证券业协会</p><p>D证券交易所 </p>,4,B,证券登记结算机构依据证券公司客户信用交易担保证券账户内的记录，确认证券公司受托持有证券的 事实，并以证券公司为名义持有人，登记于证券持有人名册。,0,0
1,(单选题)下列不属于证券经纪业务营业部管理方面法律法规的是()。 ,<p>A《证券业从业人员资格管理办法》</p><p>B《证券公司董事、监事和高级管理人员任职资格监管办法》</p><p>C《证券从业人员行为守则（试行）》</p><p>D《证券公司融资融券业务试点管理办法》 </p>,4,D,证券经纪业务营业部管理方面的法律法规包括《证券业从业人员资格管理办法》《证券公司董事、监 事和高级管理人员任职资格监管办法》和《证券从业人员行为守则（试行）》等。D项属于融资融券 方面的法律法规。,0,0
1,(单选题)合规负责人为证券公司高级管理人员，由()决定聘任，并应当经国务院证券监督管理机构认可。 ,<p>A董事会</p><p>B监事会</p><p>C董事会执行委员会</p><p>D股东大会</p>,4,A,合规负责人为证券公司高级管理人员，由董事会决定聘任，并应当经国务院证券监督管理机构认可。,0,0
1,(单选题)证券公司从事自营业务，应当遵循真实、合法的资金和账户的规定，即（）。 Ⅰ.证券公司从事自营业务必须以自己的名义进行，不得假借他人名义或者以个人名义进行 Ⅱ.证券公司的自营业务必须使用自有资金和依法筹集的资金，不得通过“保本保底”的委托理财、发行 柜台债券等非法方式融资 Ⅲ.不得以他人名义开立多个账户 Ⅳ.证券公司不得将其自营账户转借给他人使用,<p>AⅠ.Ⅱ.Ⅳ</p><p>BⅠ.Ⅱ.Ⅲ.Ⅳ</p><p>CⅠ.Ⅱ.Ⅲ</p><p>DⅡ.Ⅲ.Ⅳ</p>,4,B,真实、合法的资金和账户的规定是指证券公司从事自营业务必须以自己的名义进行，不得假借他人名 义或者以个人名义进行。证券公司的自营业务必须使用自有资金和依法筹集的资金，不得通过“保本 保底”的委托理财、发行柜台债券等非法方式融资，不得以他人名义开立多个账户。证券公司不得将 其自营账户转借给他人使用。,0,0
1,(单选题)自营业务中涉及（）方面的重大决策，应当经过集体决策并采取书面形式，由相关人员签字确认后存 档。 Ⅰ.自营规模 Ⅱ.风险限额 Ⅲ.资产配置 Ⅳ.业务授权,<p>AⅠ.Ⅱ.Ⅳ</p><p>BⅠ.Ⅲ.Ⅳ</p><p>CⅡ.Ⅲ.Ⅳ</p><p>DⅠ.Ⅱ.Ⅲ.Ⅳ</p>,4,D,自营业务中涉及自营规模、风险限额、资产配置、业务授权等方面的重大决策，应当经过集体决策并 采取书面形式，由相关人员签字确认后存档。,0,0
1,(单选题)发行上市信息披露的基本要求包括（）。 Ⅰ.全面性 Ⅱ.真实性 Ⅲ.时效性 Ⅳ.完整性 ,<p>AⅠ.Ⅱ.Ⅲ.Ⅳ</p><p>BⅡ.Ⅲ.Ⅳ</p><p>CⅠ.Ⅲ.</p><p>DⅠ.Ⅱ.Ⅲ</p>,4,D,信息披露的基本要求包括全面性、真实性和时效性。,0,0
1,(单选题)证券公司代销金融产品，应当遵循的原则包括（）。 Ⅰ.平等 Ⅱ.自愿 Ⅲ.专业性 Ⅳ.适当性 ,<p>AⅡ.Ⅳ</p><p>BⅢ.Ⅳ</p><p>CⅠ.Ⅱ.Ⅳ</p><p>DⅠ.Ⅳ.Ⅲ</p>,4,C,证券公司代销金融产品，应当遵守法律、行政法规和中国证监会的规定，遵循平等、自愿、公平、诚 实信用和适当性原则，避免利益冲突，不得损害客户合法权益。,0,0
1,(单选题)使用中国证券登记结算有限责任公司网络投票系统进行投票的具体流程包括（）。 Ⅰ.登录中国证券登记结算有限责任公司网站注册，取得用户名和身份确认码 Ⅱ.向结算公司提交网络申请 Ⅲ.到身份验证机构办理身份验证，激活网上用户名 Ⅳ.使用用户名、密码及附加码登录网站并进行投票 ,<p>AⅡ.Ⅲ</p><p>BⅠ.Ⅲ.Ⅳ</p><p>CⅠ.Ⅱ.Ⅲ.Ⅳ</p><p>DⅠ.Ⅲ</p>,4,B,根据操作流程，投资者办理股东大会网络投票等网络服务业务，需首先登录中国结算公司网站注册， 然后到证券公司营业部(“身份验证机构”)办理身份验证。投资者办理身份验证，须遵循“先注册、 后激活”的程序。投资者办理身份验证并激活网上用户名后，即可参加今后各有关上市公司股东大会 网络投票。流程如下：登录网站www.chinaclear.cn；输入网上用户名、密码及附加码；点击“投票表 决”下的“网上行权”；浏览股东大会列表，选择具体的投票参与方式；进行投票。,0,0
1,(单选题)在证券经纪商与客户的委托代理关系中，客户是（）。 Ⅰ.代理人 Ⅱ.授权人 Ⅲ.委托人 Ⅳ.受托人 ,<p>AⅡ.Ⅲ</p><p>BⅠ.Ⅲ.Ⅳ</p><p>CⅠ.Ⅱ.Ⅳ</p><p>DⅠ.Ⅲ</p>,4,A,在证券经纪商与客户的委托代理关系中，客户是授权人、委托人。,0,0
1,(单选题)以下关于我国证券公司短期融资券的说法，正确的是（）。 Ⅰ.以短期融资为目的 Ⅱ.在银行间债券市场发行 Ⅲ.在证券交易所上市交易 Ⅳ.约定在一定期限内还本付息,<p>AⅠ.Ⅱ.Ⅲ</p><p>BⅠ.Ⅲ.Ⅳ</p><p>CⅠ.Ⅱ.Ⅳ</p><p>DⅡ.Ⅲ.Ⅳ</p>,4,C,证券公司短期融资券是指证券公司以短期融资为目的，在银行间债券市场发行的约定在一定期限内还 本付息的金融债券。,0,0
1,(单选题)证券公司从事上市公司并购重组财务顾问业务应当具备的条件包括（）。 Ⅰ.公司净资本符合中国证监会的规定 Ⅱ.财务顾问主办人不少于3人 Ⅲ.建立健全的尽职调查制度，具备良好的项目风险评估和内核机制 Ⅳ.公司控股股东、实际控制人信誉良好且最近3年无重大违法违规记录,<p>AⅠ．Ⅱ．Ⅲ</p><p>BⅠ．Ⅱ．Ⅳ</p><p>CⅠ．Ⅲ．Ⅳ</p><p>DⅠ．Ⅱ．Ⅲ．Ⅳ</p>,4,C,证券公司从事上市公司并购重组财务顾问业务，应当具备下列条件：(1)公司净资本符合中国证监会的 规定。(2)具有健全且运行良好的内部控制机制和管理制度，严格执行风险控制和内部隔离制度。(3)建 立健全的尽职调查制度，具备良好的项目风险评估和内核机制。(4)公司财务会计信息真实、准确、完 整。(5)公司控股股东、实际控制人信誉良好且最近3年无重大违法违规记录。(6)财务顾问主办人不少于5人。(7)建立健全的尽职调查制度，具备良好的项目风险评估和内核机制。(8)中国证监会规定的其 他条件。,0,0
