1,(单选题)中国证监会对保荐机构资格的申请，自受理之日起( )个工作日内做出核准或者不予核准的书面决定。 ,<p>A15</p><p>B20</p><p>C30</p><p>D45</p>,4,D,中国证监会依法受理、审查申请文件。对保荐机构资格的申请，自受理之日起45个工作日内做出核准 或者不予核准的书面决定。,0,0
1,(单选题)投资主办人与原证券公司解除劳动合同的，原证券公司应当在( )日内向中国证券业协会进行离职备案。 ,<p>A10</p><p>B15</p><p>C20</p><p>D30</p>,4,A,投资主办人与原证券公司解除劳动合同的，原证券公司应当在10日内向中国证券业协会进行离职备 案。,0,0
1,(单选题)证券公司申请设立子公司的，其最近一年净资本应不低于( )亿元。 ,<p>A10</p><p>B12</p><p>C13</p><p>D15</p>,4,B,证券公司申请设立子公司的，其最近一年净资本应不低于12亿元。,0,0
1,(单选题)在违规披露、不披露重要信息的责任中，信息披露义务人的控股股东、实际控制人是法人的，其负责人 应当认定为( )。 ,<p>A直接行为人</p><p>B直接负责的主管人员</p><p>C企业</p><p>D个人</p>,4,B,在违规披露、不披露重要信息的责任中，信息披露义务人的控股股东、实际控制人是法人的，其负责 人应当认定为直接负责的主管人员。,0,0
1,(单选题)诚信信息中的奖励信息、处罚处分信息的效力期限为( )年。 ,<p>A1</p><p>B3</p><p>C5</p><p>D10</p>,4,B,奖励信息、处罚处分信息的效力期限为3年，但因证券期货违法行为被行政处罚、市场禁入的信息，效 力期限为5年。,0,0
1,(单选题)资产证券化的融资方式，发行证券的基础是特定的( )。 ,<p>A证券组合</p><p>B国家证券</p><p>C资产池</p><p>D公司证券</p>,4,C,资产证券化以特定的资产池为基础发行证券。,0,0
1,(单选题)2004年5月，经国务院批准，( )批复同意，深圳证券交易所在主板市场内设立中小企业板市场。 ,<p>A证券交易所</p><p>B证券业协会</p><p>C中国证监会</p><p>D国务院</p>,4,C,2004年5月，经国务院批准，中国证监会批复同意，深圳证券交易所在主板市场内设立中小企业板市场,0,0
1,(单选题)我国《证券法》规定，证券投资者保护基金由( )缴纳的资金及其他依法筹集的资金组成。 ,<p>A证券公司</p><p>B基金公司</p><p>C证券交易所</p><p>D证券业协会</p>,4,A,证券投资者保护基金由证券公司缴纳的资金及其他依法筹集的资金组成。,0,0
1,(单选题)在我国，根据《证券投资基金运作管理办法》的规定，60%以上的基金资产投资于股票的，为( )。 ,<p>A债券基金</p><p>B股票基金</p><p>C货币市场基金</p><p>D衍生证券投资基金</p>,4,B,在我国，根据《证券投资基金运作管理办法》的规定，60%以上的基金资产投资于股票的，为股票基 金。,0,0
1,(单选题)我国《公司法》规定，股份有限公司向发起人、法人发行的股票应当为( ),<p>A原始股</p><p>B法人股</p><p>C记名股票</p><p>D无记名股票</p>,4,C,我国《公司法》规定，股份有限公司向发起人、法人发行的股票应当为记名股票。,0,0
1,(单选题)证券经营机构从事证券自营业务不得从事的操纵市场行为不包括( )。 ,<p>A以明示或默示的方式，约定与其他证券投资者在某一时间内共同买进或卖出某一种或几种证券</p><p>B以自己的不同账户或与其他证券投资者串通在相同时间内进行价格和数量相近、方向相反的交易</p><p>C以自己的不同账户或与其他证券投资者串通在相同时间内进行价格和数量相近、方向相同的交易</p><p>D在一段时间内频繁并且大量地连续买卖某种或某类证券并导致市场价格异常变动</p>,4,C,证券经营机构从事证券自营业务，不得从事下列操纵市场的行为：(1)以明示或默示的方式，约定与其 他证券投资者在某一时间内共同买进或卖出某一种或几种证券。(2)以自己的不同账户或与其他证券投 资者串通在相同时间内进行价格和数量相近、方向相反的交易。(3)在一段时间内频繁并且大量地连续 买卖某种或某类证券并导致市场价格异常变动。,0,0
1,(单选题)普通股票是标准的股票，通过发行普通股票所筹集的资金成为股份公司( )的基础。 ,<p>A虚拟资本</p><p>B注册资本</p><p>C货币资金</p><p>D负债</p>,4,B,普通股票是标准的股票，通过发行普通股票所筹集的资金成为股份公司注册资本的基础。,0,0
1,(单选题)债券作为证明( )关系的凭证，一股是以有一定格式的票面形式来表现的。 ,<p>A物权</p><p>B所有权和转让权</p><p>C债权债务</p><p>D处置权</p>,4,C,债券是证明债权债务关系的凭证。,0,0
1,(单选题)借款人在本国境外市场发行的、不以发行市场所在国货币为面值的国际债券是( )。 ,<p>A外国证券</p><p>B欧洲债券</p><p>C亚洲债券</p><p>D熊猫债券</p>,4,B,欧洲债券借款人在本国境外市场发行的、不以发行市场所在国货币为面值的国际债券。,0,0
1,(单选题)财务顾问不再符合《上市公司并购重组财务顾问业务管理办法》规定条件的，应当在( )个工作日内向中国 证券监督管理委员会报告并依法进行公告，由中国证券监督管理委员会责令改正。 ,<p>A1</p><p>B2</p><p>C3</p><p>D5</p>,4,D,财务顾问不再符合规定条件的，应当在5个工作日内向中国证券监督管理委员会报告并依法进行公告， 由中国证券监督管理委员会责令改正。,0,0
1,(单选题)在债券合约中未规定利息支付的债券是( )。 ,<p>A贴现债券</p><p>B附息债券</p><p>C息票累积债券</p><p>D浮动债券</p>,4,A,这是贴现债券的定义。,0,0
1,(单选题)目前我国常见的股票行业分类的依据主要是公司( )的来源比重。 ,<p>A收入或税收 </p><p>B收入或利润</p><p>C成本或利润</p><p>D收入或成本</p>,4,B,行业分类的主要依据是公司收入或利润的来源比重。,0,0
1,(单选题)根据《证券交易所管理办法》的规定，证券交易所应当就证券上市的条件、申请和批准程序等事项制定 具体的规则。这一职能体现了证券交易所对( )的管理。 ,<p>A上市公司</p><p>B会员</p><p>C交易活动</p><p>D发行活动</p>,4,A,这一职能体现了证券交易所对上市公司的管理。,0,0
1,(单选题)投资适当性的要求就是( )。 ,<p>A全面收集客户的投资信息</p><p>B根据客户投资要求推荐客户满意的产品</p><p>C推荐投资者购买风险适度的产品</p><p>D适合的投资者购买恰当的产品</p>,4,D,投资适当性的要求就是“适合的投资者购买恰当的产品”。,0,0
1,(单选题)通常，在金融期权交易中，( )需要开立保证金账户，并按规定缴纳保证金。 ,<p>A期权卖方</p><p>B期权买方</p><p>C期权买卖双方</p><p>D第三方</p>,4,A,在金融期权交易中，只有期权的卖方需要开立保证金账户，并按规定缴纳保证金，以保证其履约的义 务。,0,0
1,(单选题)在国际债券市场上，不需要官方主管机构批准，也不受货币发行国有关法令管制和约束的债券是( )。 ,<p>A欧洲债券</p><p>B外国债券</p><p>C亚洲债券</p><p>D熊猫债券</p>,4,A,这是欧洲债券的特点。,0,0
1,(单选题)看跌期权的卖方在买方选择行使权利时，必须按期权合约规定的条件( ) 一定数量的基础金融工具。 ,<p>A卖出</p><p>B买入</p><p>C买入或卖出</p><p>D买入和卖出</p>,4,B,看跌期权的卖方在买方选择行使权利时，必须按期权合约规定的条件买人一定数量的基础金融工具。,0,0
1,(单选题)证券公司不得动用客户交易结算资金或者委托资金的情形是( )。 ,<p>A客户进行证券的申购、证券交易的结算或者客户提款</p><p>B客户支付与证券交易有关的佣金、费用或者税款</p><p>C证券公司借用客户资金，30日内还清</p><p>D法律规定的其他情形</p>,4,C,除下列情形外，不得动用客户的交易结算资金或者委托资金：(1)客户进行证券的申购、证券交易的结 算或者客户提款。(2)客户支付与证券交易有关的佣金、费用或者税款。(3)法律规定的其他情形。,0,0
1,(单选题)证券公司的( )或其他风险控制指标不符合规定的，国务院证券监督管理机构应当责其限期改正。 ,<p>A净资产</p><p>B净资本</p><p>C利润率</p><p>D净收益</p>,4,B,证券公司的净资本或其他风险控制指标不符合规定的，国务院证券监督管理机构应当责其限期改正。,0,0
1,(单选题)金融期货的交易对象是( )。,<p>A金融期货实物</p><p>B金融期货合约</p><p>C期权</p><p>D金融现货</p>,4,B,金融期货的交易对象是金融期货合约。,0,0
1,(单选题)股票发行采用代销方式，代销期限届满，向投资者出售的股票数量未达到拟公开发行股票数量( )的，为发 行失败。 ,<p>A0.3</p><p>B0.5</p><p>C0.7</p><p>D0.9</p>,4,C,股票发行采用代销方式，代销期限届满，向投资者出售的股票数量未达到拟公开发行股票数量70%的，为发行失败。,0,0
1,(单选题)下列人员中，可以成为持有公司5%以上股权的股东的是( )。 ,<p>A甲因抢劫罪被判处3年有期徒刑，现刑罚执行完毕已经5年</p><p>B乙公司净资产占实收资本的35%</p><p>C丙因做生意亏本，欠别人5万元已经到期，至今不能清偿</p><p>D丁公司负债达到净资产的75%</p>,4,A,有下列情形之一的单位或者个人，不得成为持有证券公司5%以上股权的股东、实际控制人：(1)因故意 犯罪被判处刑罚，刑罚执行完毕未逾3年。(2)净资产低于实收资本的50%，或者有负债达到净资产的50%。(3)不能清偿到期债务。(4)国务院证券监督管理机构认定的其他情形。,0,0
1,(单选题)证券投资基金托管人是( )权益的代表。 ,<p>A基金发起人</p><p>B基金管理人</p><p>C基金持有人</p><p>D基金监管人</p>,4,C,证券投资基金托管人是基金持有人权益的代表,0,0
1,(单选题)中国证监会和中国证券业协会组织对推介、定价、配售、承销过程的监督检查，发现证券公司存在违反 相关规则规定情形的，中国证券业协会可以采取( )监管措施。 ,<p>A行政</p><p>B法律</p><p>C自律</p><p>D经济</p>,4,C,中国证监会和中国证券业协会组织对推介、定价、配售、承销过程的监督检查，发现证券公司存在违 反相关规则规定情形的，中国证券业协会可以采取自律监管措施。,0,0
1,(单选题)符合条件的资金融入方以所持有的股票或其他证券质押，向符合条件的资金融出方融入资金，并约定在 未来返还资金、解除质押的交易属于( )。 ,<p>A股票抵押回购</p><p>B股票质押回购</p><p>C股票约定回购</p><p>D股票报价回购</p>,4,B,股票质押回购是指符合条件的资金融入方以所持有的股票或其他证券质押，向符合条件的资金融出方 融入资金，并约定在未来返还资金、解除质押的交易。,0,0
1,(单选题)无记名股票与记名股票的差别主要表现在( )。 ,<p>A股东权利</p><p>B股票的记载方式</p><p>C股票名称</p><p>D股票编号</p>,4,B,按是否记在股东姓名，股票可以分为记名股票和无记名股票。,0,0
1,(单选题)作为证券发行制度的一种，注册制实行( )管理原则。 ,<p>A公开</p><p>B公平</p><p>C公正</p><p>D统一</p>,4,A,注册制实行公开管理原则。,0,0
1,(单选题)股票价格指数期货是为适应人们控制股市风险，尤其是( )的需要而产生的。 ,<p>A非系统性风险</p><p>B市场风险</p><p>C系统性风险</p><p>D非市场风险</p>,4,C,股票价格指数期货是为适应人们控制股市风险，尤其是系统性风险的需要而产生的。,0,0
1,(单选题)证券公司董事会应当就风险管理、审计等事项设立专门委员会。审计委员会应当由( )担任召集人。 ,<p>A独立董事</p><p>B董事长</p><p>C监事</p><p>D总经理</p>,4,A,证券公司治理准则（试行）第三十七条董事会应当就风险管理、审计等事项设立专门委员会。审计委 员会应当由独立董事担任召集人。法律法规性问题。,0,0
1,(单选题)中央汇金投资有限责任公司是国家对重点金融机构进行股权投资的金融控股机构，本身并不从事商业活 动。它于2010年在银行间债券市场发行的人民币债券称为( )。 ,<p>A地方政府债券</p><p>B中央政府债券</p><p>C金融债券</p><p>D政府支持机构债券</p>,4,D,政府支持机构债券的有关内容。,0,0
1,(单选题)因国有股行政划转或者变更、在同一实际控制人控制的不同主体之间转让股份、继承取得上市公司股份 超过( )的，收购人可免于聘请财务顾问。 ,<p>A0.1</p><p>B0.2</p><p>C0.3</p><p>D0.5</p>,4,C,因国有股行政划转或者变更、在同一实际控制人控制的不同主体之间转让股份、继承取得上市公司股 份超过30%的，收购人可免于聘请财务顾问。,0,0
1,(单选题)向ADR的持有者派发美元红利或利息，并代理ADR持有者行使投票权等股东权益的机构是( )。 ,<p>A存券银行</p><p>B托管银行</p><p>C中央存托公司</p><p>D证券公司</p>,4,A,存券银行负责向ADR的持有者派发美元红利或利息，并代理ADR持有者行使投票权等股东权益。 ,0,0
1,(单选题)债券持有人可以按照自己的需要和市场的实际状况，灵活地转让债券，以提前收回本金和实现投资收 益，债券的这一特征称之为( )。 ,<p>A偿还性</p><p>B流动性</p><p>C安全性</p><p>D收益性</p>,4,B,考察债券的流动性。,0,0
1,(单选题)资产托管机构有权随时查询集合资产管理计划的经营运作情况，并应当( )核对集合资产管理计划资产的情 况，防止出现挪用或者遗失。 ,<p>A按月</p><p>B按年</p><p>C随时</p><p>D定期</p>,4,D,资产托管机构有权随时查询集合资产管理计划的经营运作情况，并应当定期核对集合资产管理计划资 产的情况，防止出现挪用或者遗失。,0,0
1,(单选题)发行人不得有在最近( )个月内未经法定机关核准，擅自公开或者变相公开发行过证券。 ,<p>A6</p><p>B12</p><p>C18</p><p>D36</p>,4,D,发行人不得有在最近36个月内未经法定机关核准，擅自公开或者变相公开发行过证券。,0,0
1,(单选题)未按照规定对离任的法定代表人或者高级管理人员进行审计，并报送审计报告，没有违法所得的，可处 罚款( )万元。 ,<p>A5</p><p>B50</p><p>C80</p><p>D100</p>,4,A,未按照规定对离任的法定代表人或者高级管理人员进行审计，并报送审计报告，没有违法所得或者违 法所得不足3万元的，处以3万元以上30万元以下的罚款。,0,0
1,(单选题)我国《证券投资基金法》规定，基金管理公司的注册资本不得低于( )人民币，且必须实缴货币资本。 ,<p>A3000万元</p><p>B5000万元</p><p>C1亿元</p><p>D2亿元</p>,4,C,我国《证券投资基金法》规定，基金管理公司的注册资本不得低于1亿元人民币，且必须实缴货币资 本。,0,0
1,(单选题)证券公司应当在代销合同签署后( )个工作日内，向证券公司住所地证监会派出机构报备金融产品说明书、 宣传推介材料和拟向客户提供的其他文件、资料。 ,<p>A3</p><p>B5</p><p>C10</p><p>D15</p>,4,B,证券公司应当在代销合同签署后5个工作日内，向证券公司住所地证监会派出机构报备金融产品说明 书、宣传推介材料和拟向客户提供的其他文件、资料。,0,0
1,(单选题)查询申请符合规定条件、材料齐备的，中国证券业协会应自收到查询申请之日起( )个工作日内出具诚信报 告。 ,<p>A2</p><p>B5</p><p>C10</p><p>D15</p>,4,C,查询申请符合规定条件、材料齐备的，中国证券业协会应自收到查询申请之日起10个工作日内出具诚 信报告。,0,0
1,(单选题)在全国银行间同业拆借中心进行的债券远期交易，期限最短为( )。 ,<p>A1天</p><p>B2天</p><p>C91天</p><p>D365天</p>,4,B,在全国银行间同业拆借中心进行的债券远期交易，期限最短为2天，最长为365天。,0,0
1,(单选题)期货公司接受不符合规定条件的单位或者个人委托的，应当责令改正，给予警告，没收违法所得，并处 违法所得( )的罚款。 ,<p>A1倍以上3倍以下</p><p>B1倍以上5倍以下</p><p>C3倍以上5倍以下</p><p>D3倍以上10倍以下</p>,4,A,期货公司接受不符合规定条件的单位或者个人委托的，应当责令改正，给予警告，没收违法所得，并 处违法所得1倍以上3倍以下的罚款；没有违法所得或者违法所得不满10万元的，并处10万元以上30万 元以下的罚款；情节严重的，责令停业整顿或者吊销期货业务许可证。,0,0
1,(单选题)交易所交易基金的英文简称为( )。 ,<p>A LOF</p><p>B QDII</p><p>C ETF</p><p>D QFII</p>,4,C,交易所交易基金的英文简称为ETF。,0,0
1,(单选题)下列选项中，不属于融资融券业务的账户体系中客户信用账户的是()。 ,<p>A客户信用资金台账</p><p>B融券专用证券账户</p><p>C客户信用证券账户</p><p>D客户信用资金账户</p>,4,B,融资融券业务账户体系中的客户信用账户包括客户信用资金台账、客户信用证券账户和客户信用资金 账户。B项属于证券公司信用账户。,0,0
1,(单选题)下列不属于利用未公开信息交易罪立案追诉标准的是()。 ,<p>A期货交易占用保证金数额累计在30万元以上的</p><p>B证券交易成交额累计在50万元以上的</p><p>C获利或者避免损失数额累计在10万元以上的</p><p>D多次利用内幕信息以外的其他未公开信息进行交易活动的</p>,4,C,根据有关规定，涉嫌下列情形之一的，应确定为利用未公开信息交易罪，并予以立案追诉：(1)证券交 易成交额累计在50万元以上的。(2)期货交易占用保证金数额累计在30万元以上的。(3)获利或者避免损 失数额累计在15万元以上的。(4)多次利用内幕信息以外的其他未公开信息进行交易活动的。(5)其他情 节严重的情形。,0,0
1,(单选题)股份有限公司的股份发行应当遵循的原则不包括()。 ,<p>A公平</p><p>B公正</p><p>C公开</p><p>D同股同价</p>,4,C,股份有限公司的股份发行应当遵循的原则包括公平、公正、同股同价。,0,0
1,(单选题)以下关于地方政府债券的说法正确的是（）。 Ⅰ.地方政府债券是地方政府根据本地区经济发展和资金需求状况，以承担还本付息责任为前提，向社会 筹集资金的所有权凭证 Ⅱ.地方政府债券的发行主体是地方政府 Ⅲ.近几年，国债发行规模中有少量中央政府代地方政府发行的债券 Ⅳ.我国从1995年起实施的《中华人民共和国预算法》规定，地方政府不得发行地方政府债券,<p>AⅡ.Ⅲ.Ⅳ</p><p>BⅠ.Ⅱ.Ⅲ</p><p>CⅠ.Ⅱ.Ⅳ</p><p>DⅢ.Ⅳ</p>,4,A,政府债券属于债务凭证,0,0
1,(单选题)证券经营机构从事证券自营业务不得有的行为包括（）。 Ⅰ.将自营业务与代理业务混合操作 Ⅱ.以自营账户为他人买卖证券 Ⅲ.委托其他证券经营机构代为买卖证券 Ⅳ.以他人名义为自己买卖证券,<p>AⅡ.Ⅲ.Ⅳ</p><p>BⅠ.Ⅲ.Ⅳ</p><p>CⅠ.Ⅱ.Ⅲ.Ⅳ</p><p>DⅡ.Ⅳ</p>,4,C,证券经营机构从事证券自营业务不得有下列行为：(1)将自营业务与代理业务混合操作。(2)以自营账户 为他人或以他人名义为自己买卖证券。(3)委托其他证券经营机构代为买卖证券。(4)中国证监会认定的 其他违反自营业务管理规定的行为。,0,0
1,(单选题)上海证券交易所市场A股和B股送股日程安排不同的日期有（）。 Ⅰ.T日 Ⅱ.T+3日 Ⅲ.T-1日 Ⅳ.T+6日 ,<p>AⅡ.Ⅳ</p><p>BⅠ.Ⅲ.Ⅳ</p><p>CⅠ.Ⅱ.Ⅲ.Ⅳ</p><p>DⅠ.Ⅲ</p>,4,A,上海证券交易所市场A股和B股送股日程安排不同的日期有：T+3日、T+6日。,0,0
1,(单选题)关于申购资金冻结、验资及配号，下列说法正确的有（）。 Ⅰ.每一有效申购单位配一个号 Ⅱ.申购日后的第一个交易日(T+1日)，由中国证券登记结算有限责任公司分公司进行申购资金冻结处理 Ⅲ.当有效申购总量小于或等于该次股票上网发行量时，投资者按其有效申购量认购股票 Ⅳ.当有效申购总量大于该次股票发行量时，则通过摇号抽签，确定有效申购中签号码，每一中签号码认 购一个申购单位新股 ,<p>AⅡ.Ⅲ</p><p>BⅠ.Ⅲ.Ⅳ</p><p>CⅠ.Ⅱ.Ⅲ.Ⅳ</p><p>DⅠ.Ⅲ</p>,4,C,本题考查认购的一般性原则，题中四个选项都正确。,0,0
1,(单选题)下列（）属于证券经纪业务营业部管理方面的法律法规。 Ⅰ.《证券业从业人员资格管理办法》 Ⅱ.《证券公司董事、监事和高级管理人员任职资格监管办法》 Ⅲ.《证券从业人员行为守则（试行）》 Ⅳ.《证券公司融资融券业务试点管理办法》,<p>AⅠ.Ⅱ.Ⅲ</p><p>BⅠ.Ⅱ.Ⅳ</p><p>CⅠ.Ⅲ.Ⅳ</p><p>DⅠ.Ⅱ.Ⅲ.Ⅳ</p>,4,A,证券经纪业务营业部管理方面的法律法规包括《证券业从业人员资格管理办法》《证券公司董事、监 事和高级管理人员任职资格监管办法》和《证券从业人员行为守则（试行）》等。选项IV属于融资融 券方面的法律法规。,0,0
1,(单选题)下列关于经纪业务禁止行为的说法中，正确的是（）。 Ⅰ.不得为多获取佣金而诱导客户进行不必要的证券买卖 Ⅱ.可以在批准的营业场所之外接受客户委托和进行清算、交收 Ⅲ.不得为他人操纵市场、内幕交易、欺诈客户提供方便Ⅳ.不得散布谣言或其他非公开披露的信息,<p>AⅠ.Ⅱ.Ⅳ</p><p>BⅠ.Ⅲ.Ⅳ</p><p>CⅡ.Ⅲ.Ⅳ</p><p>DⅠ.Ⅱ.Ⅲ.Ⅳ</p>,4,B,证券经纪业务的禁止行为之一是不得在批准的营业场所之外接受客户委托和进行清算、交收，故II项 错误。,0,0
1,(单选题)下列选项中，属于基金自律规则的是（）。 Ⅰ.《基金从业人员证券投资管理指引（试行）》 Ⅱ.《公开募集证券投资基金运作管理办法》 Ⅲ.《基金经理注册登记规则》 Ⅳ.《私募投资基金管理人登记和基金备案办法（试行）》 ,<p>AⅡ.Ⅲ.Ⅳ</p><p>BⅠ.Ⅲ.Ⅳ</p><p>CⅠ.Ⅱ.Ⅲ</p><p>DⅠ.Ⅱ.Ⅳ</p>,4,B,选项B．属于部门规章和规范性文件范畴。,0,0
1,(单选题)开放式基金的注册登记体系的模式包括（）。 Ⅰ.“混合”模式 Ⅱ.基金管理人的自建注册登记系统的“外置”模式 Ⅲ.委托中国结算公司作为登记机构的“外置”模式 Ⅳ.基金管理人自建登记系统的“内置”模式,<p>AⅡ.Ⅲ.Ⅳ</p><p>BⅠ.Ⅲ.Ⅳ</p><p>CⅠ.Ⅱ.Ⅲ</p><p>DⅠ.Ⅲ.Ⅳ</p>,4,B,我国开放式基金注册登记体系的模式包括：①基金管理人自建注册登记系统的“内置”模式；②委托 中国证券登记结算有限责任公司作为注册登记机构的“外置”模式；③以上两种情况兼有的“混合” 模式。,0,0
1,(单选题)下列属证券市场中介机构的有（）。 Ⅰ.证券公司 Ⅱ.证券登记结算机构 Ⅲ.会计师事务所 Ⅳ.证券业协会,<p>AⅠ.Ⅱ.Ⅳ</p><p>BⅠ.Ⅲ.Ⅳ</p><p>CⅡ.Ⅲ.Ⅳ</p><p>DⅠ.Ⅱ.Ⅲ</p>,4,D,证券公司、证券服务机构（包括证券投资咨询机构、证券登记结算机构、财务顾问机构、资信评级机 构、资产评估机构、会计师事务所、律师事务所等）属于证券市场中介机构。,0,0
1,(单选题)未经法定机关核准，公司擅自公开发行或者变相公开发行证券的，下列对其实施的处罚中，正确的是 （）。 Ⅰ.责令停止发行，退还所募资金并加算银行同期存款利息 Ⅱ.处以非法所募资金金额5%以上10%以下的罚款 Ⅲ.对擅自公开或者变相公开发行证券设立的公司，由依法履行监督管理职责的机构或者部门会同县级以 上地方人民政府予以取缔 Ⅳ.对直接负责的主管人员和其他直接责任人员给予警告，并处以3万元以上30万元以下的罚款 ,<p>AⅠ.Ⅱ.Ⅲ.Ⅳ</p><p>BⅠ.Ⅲ.Ⅳ</p><p>CⅠ.Ⅲ.Ⅳ</p><p>DⅡ.Ⅲ.Ⅳ</p>,4,B,未经法定机关核准，擅自公开或者变相公开发行证券的，责令停止发行，退还所募资金并加算银行同 期存款利息，处以非法所募资金金额1%以上5%以下的罚款；对擅自公开或者变相公开发行证券设立 的公司，由依法履行监督管理职责的机构或者部门会同县级以上地方人民政府予以取缔。对直接负责 的主管人员和其他直接责任人员给予警告，并处以3万元以上30万元以下的罚款。,0,0
