2,(多选题)当经济处于复苏阶段，下列说法正确的有()。 ,<p>A企业资金周转困难 </p><p>B企业对借贷资金的需求显著扩大 </p><p>C商业银行的资产业务规模明显缩小 </p><p>D商业银行负债规模严重下降 </p><p>E商业银行的资产业务规模明显扩大</p>,5,BE,当经济处于复苏阶段，意味着企业生产规模逐步增加，而由于之前的萧条境况，企业会有扩大投资的需求，即向外借贷资金。相应地，商业银行的资产业务规模也明显扩大。A、C、D三个选项均是经济衰退时的表现。,0,0
2,(多选题)借款人除了应当如实提供贷款人要求的资料，应当向贷款人如实提供所有开户行、账号及存贷款余额情 况，配合贷款人的调查、审查和检查的义务外，还应当包含()。 ,<p>A应当按借款合同约定用途使用贷款 </p><p>B有危及贷款人债权安全情况时，应当及时通知贷款人 </p><p>C应当接受贷款人对其使用信贷资金情况和有关生产经营、财务活动的监督 </p><p>D应当按借款合同约定及时清偿贷款本息 </p><p>E将债务全部或部分转让给第三方的，应当取得贷款人的同意</p>,5,ABCDE,根据《贷款通则》第19条的规定，借款人的义务如下：(1)应当如实提供银行要求的资料（法律规定不能提供者除外）；(2)应当接受贷款人对其使用信贷资金情况和有关生产经营、财务活动的监督；(3)应当按借款合同约定用途使用贷款；(4)应当按借款合同的约定及时清偿贷款本息；(5)将债务全部或部分转让给第三方的，应当取得贷款人的同意；(6)有危及银行债权安全的情况时，应当及时通知银行，同时采取保全措施。,0,0
2,(多选题)某企业在市场中通过利率招标的方式发行某5年期债券，最后确定票面利率为4.3%，这个利率属于()。 ,<p>A远期利率 </p><p>B实际利率 </p><p>C固定利率 </p><p>D长期利率 </p><p>E市场利率</p>,5,CDE,5年期债券的时限在1年以上，属于长期利率；其利率是不变的，属于固定利率；此利率是通过市场招标确定的，属于市场利率。,0,0
2,(多选题)1918年，H.G.莫尔顿提出了资产转换理论，其缺陷包括()。 ,<p>A贷款平均期限的延长会增加银行系统的流动性风险 </p><p>B局限于短期贷款不利于经济的发展 </p><p>C自偿性贷款随经济周期决定信用量，从而会加大经济波动 </p><p>D在经济局势和市场状况出现较大波动时，证券的大量抛售同样会造成银行的巨额损失 </p><p>E由于收入预测与经济周期有密切联系，资产的膨胀和收缩会影响资产质量，因此会增力银行的信贷风险</p>,5,AD,B、C选项是真实票据理论的缺陷；E选项是预期收入理论的缺陷。,0,0
2,(多选题)贷款人处于下列()之一的情况，处以5000元以上1万元以下的罚款。 ,<p>A强令发放贷款 </p><p>B没有公布所经营贷款的种类、期限、利率的 </p><p>C对借款人未提供担保的 </p><p>D没有公开贷款条件和发放贷款时要审查的内容的 </p><p>E没有在规定期限内答复借款人贷款申请的</p>,5,BDE,《贷款通则》第66条规定，贷款人有下列情形之一，由中国人民银行责令改正；逾期不改正的，中国人民银行可以处以5000元以上1万元以下罚款：(1)没有公布所经营贷款的种类、期限、利率的；(2)没有公开贷款条件和发放贷款时要审查的内容的；(3)没有在规定期限内答复借款人贷款申请的。,0,0
2,(多选题)关于托收业务，下列描述正确的有()。 ,<p>A根据是否附有收款单据，托收分为进口托收和跟单托收 </p><p>B托收是指委托人向银行提交凭以收取款项的金融票据或（和）商业票据，要求托收行通过其联行或代 理行向付款人收取款项 </p><p>C托收银行与代收银行对托收的款项能否收到负责 </p><p>D托收属商业信用，托收银行与代收银行对托收的款项能否收到不负责 </p><p>E托收业务是银行的一项最主要业务</p>,5,BD,托收是指委托人（收款人）向其账户所在银行（托收行）提交凭以收取款项的金融票据或（和）商业票据，标示托收行通过其联行或代理行向付款人收取款项。根据所附单据的不同，托收分为光票托收和跟单托收，所以A选项错误。托收属于商业信用，托收银行与代收银行对托收的款项能否收到不承担责任，所以C选项错误。托收只是一种结算方式，不是银行的最主要业务，所以E选项错误。,0,0
2,(多选题)下列属于授信额度的有()。 ,<p>A现金额度 </p><p>B各类保函额度 </p><p>C信用证开证额度 </p><p>D承兑汇票额度 </p><p>E提款额度</p>,5,ABCDE,授信额度是指银行在客户授信限额以内，根据客户的还款能力和银行的客户政策最终决定给予客户的授信总额。它是通过银企双方签署的合约形式加以明确的，包括信用证开证额度、提款额度、各类保函额度、承兑汇票额度、现金额度等。授信额度依照每一笔信用贷款、单个公司借款企业、集团公司等方式进行定义和监管。,0,0
2,(多选题)我国现有的外汇贷款币种包括()。 ,<p>A美元 </p><p>B港元 </p><p>C日元 </p><p>D欧元 </p><p>E澳元</p>,5,ABCD,以外汇作为借贷货币的贷款称为外汇贷款。我国现有的外汇贷款币种有美元、港元、日元、英镑和欧元。,0,0
2,(多选题)财务杠杆加大对公司的可持续增长率影响不显著的原因在于()。 ,<p>A公司现有的销售净利率并不是足够大 </p><p>B公司的大部分利润都用于发放红利，用于再投资的比例过小 </p><p>C利润的增长并没有促进资产增长 </p><p>D资产使用效率比较低，资产增长未能带来销售的显著增长 </p><p>E利润增长的同时促进资产增长</p>,5,ABCD,公司的大部分利润都用于发放红利，用于再投资的比例过小，因此利润的增长并没有促进资产增长，E选项错误。故选ABCD。,0,0
2,(多选题)下列关于还款能力分析的说法，正确的有()。 ,<p>A评估借款人偿还能力的一个重要的方式就是对借款人进行财务分析，借款人偿债能力与其盈利能力、 营运能力、资本结构和现金净流量等密切相关 </p><p>B贷款风险分类最核心的内容就是款项是否充足 </p><p>C现金流量是偿还贷款的主要还款来源，还款能力的主要标志就是借款人的现金流量是否充足 </p><p>D通过财务报表和数据的分析与预测，可以考查借款人过去和现在的收入水平、资产状况及其构成、所 有者权益状况及其构成、偿债能力等 </p><p>E分析借款人现金流量是否充足，其主要目的是分析借款人经营活动产生的现金流量是否足以偿还贷款本 息</p>,5,ACDE,贷款风险分类最核心的内容是贷款偿还的可能性，而决定贷款是否能够偿还，借款人的还款能力是主要因素，银行关心的是借款人的经营状况，现在以及未来的偿付能力。,0,0
2,(多选题)下列属于企业经营风险的有()。 ,<p>A无力偿还债务 </p><p>B增加债务融资导致的风险 </p><p>C购买美国次级债无法收回 </p><p>D机器厂房因地震而提前报废 </p><p>E股票变现损失</p>,5,CDE,企业经营风险是指企业控制和管理的全部资产的不确定性。C选项，企业购买美国次级债无法收回实质上是企业应收账款无法收回；D选项，机器厂房因地震而提前报废属于固定资产比预计年限提前报废；E选项，股票变现损失属于资产贬值。企业无力偿还债务、增加债务融资导致的风险都属于资产负债结构不当造成的风险，不属于经营风险。,0,0
2,(多选题)项目现金流量分析中，不能作为现金流出的项目有()。 ,<p>A折旧费支出 </p><p>B无形资产摊销 </p><p>C递延资产摊销 </p><p>D借款利息支出 </p><p>E还款本金支出</p>,5,ABC,项目现金流量分析中，只计算实际的现金支出，不计算实际的现金收支。而折旧费支出、无形资产与递延资产摊销只是按权责发生制、配比原则将这些资产取得成本，在使用它们的受益期间合理分摊，并不需要付出实际的现金，因而不能作为现金流出项目。,0,0
2,(多选题)质押贷款中，为规避司法风险，银行可采取的措施有()。 ,<p>A将质押资金转为定期存单单独保管 </p><p>B将质押资金转入银行名下保证金账户 </p><p>C将质押资金存放在本行活期存款账户 </p><p>D将质押资金封存 </p><p>E将质押资金存放于借款人处</p>,5,AB,银行如果让质押存款的资金存放在借款人在本行的活期存款账户上，是有司法风险的。如果借款人与其他债权人有经济纠纷，司法部门凭生效的法律文书来银行冻结或扣划存款，发放质押贷款的银行是难以对抗的。为规避这种风险，银行须将质押资金转为定期存单单独保管，或者采取更为妥当的方式，将其转入银行名下的保证金账户。,0,0
2,(多选题)决定质押率的主要因素包括()。 ,<p>A质物适用性、变现能力 </p><p>B质物价值变动趋势 </p><p>C质物新旧 </p><p>D质物市场价格 </p><p>E质物产权范围</p>,5,AB,质押率的确定包括：(1)信贷人员应根据质押财产的价值和质押财产价值的变动因素，科学地确定质押率；(2)确定质押率的依据主要有：质物的适用性、变现能力；质物、质押权利价值的变动趋势。,0,0
2,(多选题)银行公司信贷产品开发的目标不包括()。 ,<p>A提高银行的资产负债率 </p><p>B提高现有市场的份额 </p><p>C吸引现有市场之外的新客户 </p><p>D以更低的成本提供同样或类似的产品 </p><p>E为客户提供更多的产品</p>,5,AE,产品开发的目标主要表现在以下三个方面：一是提高现有市场的份额；二是吸引现有市场之外的新客户；三是以更低的成本提供同样或类似的产品。,0,0
2,(多选题)下列关于资产结构分析的说法，正确的有()。 ,<p>A资产结构是指各项资产占总资产的比重 </p><p>B资产结构分析可用来判断借款人资产分配的合理性 </p><p>C通常制造业的固定资产和存货比重小于零售业的固定资产和存货比重 </p><p>D服务业中，劳动密集型行业的固定资产比重一般高于资本密集型行业 </p><p>E如借款人的资产结构与同行业的比例存在较大差异，应进一步分析差异产生的原因</p>,5,ABE,通常制造业的固定资产和存货比重大于零售业的固定资产和存货比重，因此，C选项错误。服务业中，劳动密集型行业的固定资产比重一般低于资本密集型行业，因此，D选项错误。,0,0
2,(多选题)下列贷款中，不能被认定为呆账的有()。,<p>A借款人触犯刑款，依法受到制裁，其财产不足归还所借债务，又无其他债务承担者，银行经追偿后确 实无法收回债权</p><p>B由于借款人和担保人不能偿还到期债务，银行诉诸法律，借款人和担保人虽有财产，经法院对借款人 和担保人强制执行超过1年以上仍未收回的债权</p><p>C银行对外投资后，由于被投资企业依法宣告破产、关闭、解散或撤销，银行无法收回的股权</p><p>D银行抵债资产的计价价值低于贷款本金的差额</p><p>E银行对债务作诉诸法律后，经法院调解或经债权人会议通过，并与债务人达成和解协议或重整协议，在 债务人履行还款义务后，银行无法追偿的剩余债权</p>,5,BC,B选项中，经法院对借款人和担保人强制执行超过2年以上仍未收回的债权被认定为呆账。C选项中， 按照国家法律法规规定具有投资权的银行的对外投资，由于被投资企业依法宣告破产、关闭、解散或撤销，并终止法人资格的，银行经清算和追偿后仍无法收回的股权被认为呆账。,0,0
2,(多选题)识别客户的产品风险应关注()。 ,<p>A产品定位、分散度与集中度、产品研发 </p><p>B产品实际销售，潜在销售，库存变化 </p><p>C核心产品与非核心产品，对市场变化的应变能力 </p><p>D原材料来源 </p><p>E行业定位识别客户的产品风险应关注()。 </p>,5,ABC,识别客户的产品风险应关注：(1)产品定位、分散度与集中度、产品研发；(2)产品实际销售，潜在销 售，库存变化；(3)核心产品与非核心产品，对市场变化的应变能力。 ,0,0
2,(多选题)一般地，银行指定一个较完整的公司信贷营销计划应包括的内容有()等。 ,<p>A行动方案 </p><p>B计划概要 </p><p>C损益预算表 </p><p>D机会与问题分析 </p><p>E营销战略与策略</p>,5,ABCDE,一般地，一个较完整的公司信贷产品市场营销计划应包括以下内容：计划项目、计划概要、当前营销状况、机会与问题分析、营销目标、营销战略与策略、行动方案、损益预算表、营销控制。,0,0
2,(多选题)下列关于5Cs系统的说法，错误的有()。 ,<p>A品德仅指借款企业负责人的品德 </p><p>B资本是指借款人的财务杠杆状况及资本金状况，财务杠杆越高，意味着债务负担和违约概率较高 </p><p>C还款能力主要从借款人未来现金流量的变动趋势及波动性与借款人的管理水平两个方面进行分析 </p><p>D抵押贷款中，商业银行对抵押品的要求权级别越高，抵押品市场价值越小，贷款风险越低 </p><p>E经营环境主要包括商业周期所处阶段、借款人所在行业状况、利率水平等因素</p>,5,AD,目前所使用的定性分析法有多种，但各种方法都相似，对企业信用分析使用最广泛的5Cs系统具体内容如下：(1)品德(CharaCter)，是对借款人声誉的衡量；(2)资本(Capital)，是指借款人的财务杠杆状况及资本金情况，财务杠杆高就意味着资本金较少，债务负担和违约概率也较高；(3)还款能力（CapaCity）。主要从借款人未来现金流量的变动趋势及波动性与借款人的管理水平两个方面进行分析；(4)抵押(Collateral)。商业银行对抵押品的要求权级别越高，抵押品的市场价值越大，变现能力越强，则贷款的风险越低；(5)经营环境(Condition)。主要包括商业周期所处阶段、借款人所在行业状况、利率水平等因素。,0,0
2,(多选题)非财务分析的方法包括()。 ,<p>A趋势分析法 </p><p>B定量分析法 </p><p>C比率分析法 </p><p>D比较分析法 </p><p>E定性分析法</p>,5,BE,财务分析的方法有：趋势分析法、结构分析法、比率分析法、比较分析法、因素分析法。因此，A、C、D三个选项属于财务分析法。,0,0
2,(多选题)企业的基础、管理水平、财务状况、经营状况和信用度与项目能否顺利实施有密切关系，进而也与项目 的还款能力有很大关系。企业的基础包括()。 ,<p>A分析企业的历史、规模、组织、技术水平 </p><p>B了解企业的劳动力结构和层次 </p><p>C注册资本、固定资产原值与净值以及流动资产情况 </p><p>D了解企业的历史发展过程、经济体制的变化 </p><p>E分析投资者的经营状况</p>,5,ABD,企业的基础包括：分析企业的历史、规模、组织、技术水平等。通过了解企业的历史发展过程、经济体制的变化，以及隶属关系等情况掌握企业的特点。通过了解企业的劳动力结构和层次，看其是否适应项目的技术水平和满足生产力发展的要求。,0,0
2,(多选题)银行自身实力分析包括()。 ,<p>A银行对金融业务的处理能力 </p><p>B银行的市场地位 </p><p>C银行的社会影响 </p><p>D银行的现有资本实力 </p><p>E银行的股东支持力</p>,5,ABCDE,银行自身实力分析包括：(1)银行对金融业务的处理能力、快速应变能力、对资源的获取能力、对技术和产品的开发能力、对形势变化的应变能力等系统实力；(2)银行的品牌、网络、市场地位、客户资源、社会影响等软实力；(3)银行的资本实力，包括现有资本实力、资本补充能力、股东支持力等；(4)政府支持，在一般情况下，政府对各家银行是平等的，但在特殊情况下，政府有时也可能有所倾钭。,0,0
2,(多选题)下列关于税金和利润的审查，正确的有()。 ,<p>A项目所涉及的税种是否都已计算是评估中对税金的审查主要内容 </p><p>B进入项目总投资的有投资方向调节税、设备进口环节所交的增值税和关税 </p><p>C进入产品成本的有土地使用税、房产税、车船牌照使用税、增值税 </p><p>D从销售收入中扣除的有增值税、消费税、营业税、资源税、城市维护建设税、土地增值税、教育费附 加 </p><p>E从利润中扣除的有企业所得税、增值税、消费税、营业税</p>,5,ABD,我国现行的工商税收与项目评估有关的按其归属分类有：进入项目总投资的有投资方向调节税、设备进口环节所交的增值税和关税；进入产品成本的有土地使用税、房产税、车船牌照使用税；从销售收入中扣除的有增值税、消费税、营业税、资源税、城市维护建设税、土地增值税、教育费附加；从利润中扣除的有企业所得税。,0,0
2,(多选题)客户重组包括()。 ,<p>A重整 </p><p>B倒闭 </p><p>C改组 </p><p>D融资 </p><p>E合并</p>,5,ACE,客户重组包括重整、改组和合并三种基本方式。当客户发生重组情形时，常伴随股东更替、股东债权人权利变更和调整、公司章程变更、经理人员更换、经营方向改变、管理方法改变、财产处置及债务清偿安排、资产估价标准确定等情况的发生。,0,0
2,(多选题)成本结构主要由()组成。 ,<p>A固定成本 </p><p>B变动成本 </p><p>C经营杠杆 </p><p>D完整性审查 </p><p>E盈亏平衡点</p>,5,ABCE,成本结构主要由以下几项所组成：(1)固定成本；(2)变动成本；(3)经营杠杆；(4)盈亏平衡点。,0,0
2,(多选题)下列因素中，可能成为进入一个行业壁垒的有()。 ,<p>A专利权和版权 </p><p>B政府政策和管制 </p><p>C较高的投资要求 </p><p>D较高的市场占有率要求 </p><p>E招商引资</p>,5,ABCD,行业壁垒，即行业进入壁垒，是指行业内已有企业对准备进入或正在进入该行业的新企业所拥有的优势，或者说是新企业在进入该行业时所遇到的不利因素和限制。A选项，由于专利权、版权授予企业一种排他使用权利，使企业拥有一种垄断优势，从而可限制其他企业和产品进入行业。B选项，政府政策和管制可能直接阻止企业进入某行业，如石油、电力行业。C选项，较高投资要求使得企业进入行业的投资门槛很高。D选项，较高市场占有率要求使新进入、市场占有率低的企业很容易夭折。招商引资属于鼓励投资者到本地进行实业投资的措施，不会提高行业壁垒，因此，E选项不符合题意。,0,0
2,(多选题)决定银行给予一个企业（集团）授信额度大小的因素包括()。 ,<p>A借款企业的需求和借款原因，借款金额需求 </p><p>B客户的还款能力 </p><p>C银行或借款企业的法律或监督条款的限制 </p><p>D贷款组合管理的限制 </p><p>E银行的客户政策及关系管理因素</p>,5,ABCDE,贷款授信额度是在对以下因素进行评估和考虑的基础上决定的：(1)了解并测算借款企业的需求，通过与借款企业进行讨论，对借款原因进行分析；(2)客户的还款能力；(3)借款企业对借贷金额的需求；(4)银行或借款企业的法律或监督条款的限制，以及借款合同条款对公司借贷活动的限制；(5)贷款组合管理的限制；(6)银行的客户政策，这主要取决于银行的风险偏好和银行对未来市场的判断；(7)关系管理因素，相对于其他银行或债权人，银行愿意提供给借款企业的贷款数额和关系盈利能力。,0,0
3,(判断题)贷款重组是指借款企业由于财务状况恶化或其他原因而出现还款困难，银行在充分评估贷款风险并与借 款企业协商的基础上，修改或重新制定贷款偿还方案，调整贷款合同条款，控制和化解贷款风险的行 为。(),<p>A正确</p><p>B错误</p>,2,A,本题是对贷款重组概念的考查。,0,0
3,(判断题)付款条件只取决于市场供求方面，如果货品供不应求，供货商大多要求预付款或现货交易。(),<p>A正确</p><p>B错误</p>,2,B,付款条件主要取决于市场供求和商业信用两个因素。如果货品供不应求或者买方资信不高，供货商大多要求预付货款或现货交易。,0,0
3,(判断题)如果损失的可能性极大，但存在一些可能有利于或不利于贷款归还的不确定因素，可以直接把贷款归为 次级类或损失类。,<p>A正确</p><p>B错误</p>,2,B,可疑类贷款的特征是肯定要发生一定的损失，只是因为存在借款人重组、兼并、合并等待定因素，损失金额还不能确定。在贷款分类时，对这类贷款的分类，要考虑“有明显缺陷，且有大部分损失”的关键特征。一是被划分为可疑类贷款具有次级类贷款的全部缺陷，并且按照借款人目前的经营情况和净值，贷款的完全清偿是非常值得怀疑或是不可能的。即使以担保作为第二还款来源，贷款本息仍然无法足额偿还。二是虽然损失的可能性极大，但因为存在一些可能有利于或不利于贷款归还的不确定因素，要等到情况更确定时才能把贷款归为次级类或损失类。,0,0
3,(判断题)流动比率高，不仅反映借款人拥有的营运资金高，可用于抵偿短期债务，而且表明借款人可以变现的资 产数额大，债权人遭受损失的风险小，所以该比率越高越好。(),<p>A正确</p><p>B错误</p>,2,B,流动比率越高，反映借款人短期偿债能力越强，债权人的权益越有保证。流动比率高，不仅反映借款人拥有的营运资金高，可用于抵偿短期债务，而且表明借款人可以变现的资产数额大，债权人遭受损失的风险小。但是流动比率也不宜过高，过高不仅表明借款人流动资产占用过多，影响资产的使用效率和盈利能力，也可能表明客户的应收账款过多或是存货过多。,0,0
3,(判断题)担保为银行提供了一个可以影响或控制的潜在还款来源，从而增加了贷款最终偿还的可能性。(),<p>A正确</p><p>B错误</p>,2,A,担保为银行提供了一个可以影响或控制的潜在还款来源，从而增加了贷款最终偿还的可能性。因此，在发放贷款时，银行应要求借款人为贷款人提供相应的担保，这样银行资金更具安全性。,0,0
3,(判断题)当公司实际增长率超过可持续增长率时，公司必然需要贷款。(),<p>A正确</p><p>B错误</p>,2,B,如果实际增长率显著超过可持续增长率时，那么公司确实需要贷款。如果只是轻微超过，尚需要进一步判断。,0,0
3,(判断题)对于借款人造成的不良贷款，银行都能通过催收、行政诉讼等现金清收手段化解损失。(),<p>A正确</p><p>B错误</p>,2,B,对于借款人尚存在一定的偿还能力，或是银行掌握部分第二还款来源时，银行可尝试通过催收、依法诉讼等手段进行现金清收。,0,0
3,(判断题)由于公司信贷产品的同构性越来越强，银行要维持一种产品的竞争优势只能通过市场争夺。(),<p>A正确</p><p>B错误</p>,2,B,在信贷产品同构性较强时，各银行的产品差异不大，此时只能通过增加产品的附加价值来维持一种产品的竞争优势，银行在制作市场定位图时，选择的维度可以是银行实力、服务质量、信誉等因素。,0,0
3,(判断题)贷款意向书与贷款承诺常见于短期贷款中。(),<p>A正确</p><p>B错误</p>,2,B,贷款意向书和贷款承诺在中长期贷款中常见。,0,0
3,(判断题)“固定资产剩余寿命”可用来衡量公司原有固定资产的平均剩余寿命。(),<p>A正确</p><p>B错误</p>,2,B,“固定资产剩余寿命”可以用来衡量公司全部固定资产的平均剩余寿命。,0,0
3,(判断题)在信贷实践中，与营运资金有关的融资需求可能与长期融资需求有关。(),<p>A正确</p><p>B错误</p>,2,A,信贷准则要求：短期资金需求要通过短期融资来实现，长期资金需求要通过长期融资来实现。但实际中，短期融资需求并不意味着就与流动资产和营运资金有关，一些与流动资产和营运资金有关的融资需求也可能与长期融资需求有关。,0,0
3,(判断题)应收账款周转率、应收账款回收期、存货周转率、存货回收期越高，表明资产利用效率越高。(),<p>A正确</p><p>B错误</p>,2,B,应收账款周转率、存货周转率都是越高越好，这两个指标越高，说明企业经营的效率越高；而应收账款回收期、存货回收期都是越低越好，这两个指标越低，说明企业应收账款、存货周转越快，企业经营的效率越高。,0,0
