1,(单选题)主要从项目发起人和项目本身着手的项目分析属于()。,<p>A项目可行性分析</p><p>B项目宏观背景分析</p><p>C项目微观背景分析</p><p>D项目企业分析</p>,4,C,分析项目的微观背景主要从项目发起人和项目本身着手。首先应分析项目发起人单位，然后分析项目提出的理由，并对项目的投资环境进行分析。,0,0
1,(单选题)下列关于贷款种类的说法，错误的是()。,<p>A按照贷款币种可分为人民币贷款和外币贷款</p><p>B按照贷款期限可分为短期贷款和中长期贷款</p><p>C按照贷款对象可分为生产企业贷款和外商投资企业贷款</p><p>D按照贷款利率可分为浮动利率贷款和固定利率贷款</p>,4,C,贷款按照贷款对象可分为生产企业贷款、进出口企业贷款、外商投资企业贷款。,0,0
1,(单选题)根据我国票据贴现相关规定，持票人可向商业银行贴现的票据必须是()商业票据。,<p>A未到期的未承兑</p><p>B已到期的已承兑</p><p>C未到期的已承兑</p><p>D已到期的未承兑</p>,4,C,可用作贴现贷款的票据必须未到期并且已承兑，这样票据才具有价值（未来收益权），已到期或者未承兑的票据不能为银行提供未来现金流保障，因而无法用做贴现贷款。,0,0
1,(单选题)相关项目是指由拟建项目引起的，并与建设、生产、流通、耗费有联系的原材料、燃料、动力运输和环境保护等协作配套项目。相关项目分析最重要的问题就是分析()是否同步。,<p>A项目技术方案</p><p>B项目效益方案</p><p>C项目投资方案</p><p>D项目建设方案</p>,4,D,相关项目分析最重要的问题就是分析项目建设方案是否同步。相关项目的同步建设是我国经济建设中出现的一个大问题。若投资项目与相关项目建设不同步，既影响项目自身效益的发挥，又影响整个国民经济的效益。,0,0
1,(单选题)延伸产品继续延伸和转换的最大可能性为()。,<p>A基础产品</p><p>B期望产品</p><p>C延伸产品</p><p>D潜在产品</p>,4,D,潜在产品是指延伸产品继续延伸和转换的最大可能性，从而塑造出更能符合客户需要的新型产品，使客户从银行提供的产品和服务中得到最大限度的愉悦感，成为银行的忠实客户。,0,0
1,(单选题)下列说法正确的是()。,<p>A借款人需要贷款，直接向中国人民银行申请即可</p><p>B保证贷款应当由保证人与借款人签订借款合同</p><p>C借款人应当按照贷款合同规定按时足额归还贷款本息</p><p>D贷款人对逾期的贷款要求及时发出催收通知单，做好这期贷款本息的催收工作</p>,4,D,A选项，借款人需要贷款，应当向主办银行或者其他银行的经办机构直接申请；B选项，保证贷款应当由保证人与贷款人签订借款合同；C选项，借款人应当按照借款合同规定按时足额归还贷款本息。,0,0
1,(单选题)损益表分析中，计算企业净利润的步骤应为()。,<p>A收入→利润总额→毛利润→净利润</p><p>B毛利润→营业利润→利润总额→净利润</p><p>C营业利润→毛利润→利润总额→净利润</p><p>D营业利润→利润总额→毛利润→净利润</p>,4,B,在损益表分析中，计算企业净利润的步骤如下：第一步，从主营业务收入中减去主营业务成本、营业费用、营业税，得出主营业务利润，即毛利润；第二步，以主营业务利润为基础，加上其他业务利润，减去管理费用、财务费用，得出营业利润；第三步，在营业利润基础上加上投资收益和营业外收入，减去营业外支出，得出利润总额；第四步，从利润总额出发，减去所得税，得出当期净利润。,0,0
1,(单选题)下列不属于速动资产的是()。,<p>A短期投资</p><p>B应收票据</p><p>C应收账款</p><p>D待摊费用</p>,4,D,速动资产包括货币资金、短期投资、应收票据、应收账款、其他应收款项等，存货、预付账款、待摊费用等不计入速动资产。,0,0
1,(单选题)银行贷款发放原则中，主要适用于中长期贷款的是()。,<p>A计划放款原则</p><p>B比例放款原则</p><p>C进度放款原则</p><p>D资本金足额原则</p>,4,C,一般短期贷款不涉及贷款多次发放问题，只有中长期贷款项目期限长，资金需要分期投入，贷款需要分次发放，此时应按照完成工程量的多少付款，即坚持进度放款原则。,0,0
1,(单选题)下列关于普通准备金的计提方法，表述不正确的是()。,<p>A按照全部贷款的余额确定的普通准备金水平最高，但有重复计算风险的可能</p><p>B在全部贷款余额之中扣除专项准备金后确定普通准备金的方法略微复杂，但更为合理</p><p>C在贷款风险分类后，按照正常类贷款余额计提普通准备金的方法相对简便，但计算出的普通准备金水平相对较低</p><p>D按照全部贷款的余额确定的普通准备金水平最低，但有重复计算风险的可能</p>,4,D,按照全部贷款的余额确定的普通准备金水平最高，但有重复计算风险的可能。,0,0
1,(单选题)下列对资产负债率评价正确的是()。,<p>A从债权人角度看，负债比率越高越好</p><p>B从债权人角度看，负债比率越低越好</p><p>C从股东角度看，负债比率越高越好</p><p>D从股东角度看，负债比率越低越好</p>,4,B,资产负债率反映债权人所提供的资本占全部资本的比例，从债权人的角度看，他们最关心的是贷给企业的款项的安全程度，也就是能否按期收回本金和利息。如果股东提供的资本与企业资本总额相比，只占较小的比例，则企业的风险将主要由债权人负担，这对债权人来讲是不利的。因此，他们希望债务比例越低越好，企业偿债有保证，则贷款给企业不会带来太大的风险。从股东的角度看，由于企业通过举债筹措的资金与股东提供的资金经营中发挥同样的作用，所以，股东所关心的是全部资金利润率是否超过借入款项的利率，即借入资金的代价在企业所得的全部资本利润率超过因借款而支付的利息率时，股东所得到的利润就会加大。如果相反，运用全部资本所得的利润率低于借款利息率，则对股东不利，因为借入资本的多余的利息要用股东所得的利润份额来弥补。因此，从股东的立场看，在全部资本利润率高于借款利息率时，负债比例越大越好，否则反之。,0,0
1,(单选题)对于使用直线折旧法的公司而言，固定资产剩余寿命代表着_____中_____所占的比例。(),<p>A总固定资产；折旧资产</p><p>B折旧资产；总固定资产</p><p>C净固定资产；总固定资产</p><p>D净固定资产；折旧资产</p>,4,A,固定资产剩余寿命=净折旧固定资产/折旧支出，对于使用直线折旧法的公司来讲，这个比率代表着在总固定资产中折旧资产所占的比例，该比率的影响因素与固定资产使用比率的因素相同。,0,0
1,(单选题)损益表结构分析是以产品()为100%，计算相关指标占其百分比的。,<p>A净利润</p><p>B销售收入净额</p><p>C销售成本</p><p>D销售利润</p>,4,B,在损益表结构分析中是以产品销售收入净额为100%，计算产品销售成本、产品销售费用、产品销售利润等指标各占销售收入的百分比，计算出各指标所占百分比收入。,0,0
1,(单选题)()是保证抵押物足值的关键。,<p>A对抵押物的价值进行准确评估</p><p>B对抵押物进行严格审查</p><p>C做好抵押物登记工作，确保抵押关系的效力</p><p>D抵押合同期限应覆盖贷款合同期限</p>,4,A,对抵押物的价值进行准确评估是保证抵押物足值的关键。在实际操作中，银行一般要求抵押企业提供商业评估机构出具的评估报告，并根据评估价值打折扣后确定贷款额。,0,0
1,(单选题)在同一张财务报表的不同项目之间、不同类别之间，或在两张不同财务报表（如资产负债表和损益表的有关项目）之间作比较，用比率来反映它们之间的关系，以评价客户财务状况和经营状况好坏的一种方法是()。,<p>A比较分析法</p><p>B比率分析法</p><p>C因素分析法</p><p>D结构分析法</p>,4,B,比率分析法是在同一张财务报表的不同项目之间、不同类别之间，或在两张不同财务报表（如资产负债表和损益表的有关项目）之间作比较，用比率来反映它们之间的关系，以评价客户财务状况和经营状况好坏的一种方法。,0,0
1,(单选题)在经济周期的哪一个阶段，利润的增长幅度最大？(),<p>A繁荣期</p><p>B衰退期</p><p>C谷底期</p><p>D复苏期</p>,4,D,在复苏期早期，生产能力过剩，很小的额外成本就可以使产量大幅增长，这一时期利润的增长幅度最大。,0,0
1,(单选题)金融机构通过第三方识别客户身份，而第三方未采取符合《反洗钱法》要求的客户身份识别措施的，由()承担未履行客户身份识别义务的责任。,<p>A第三方</p><p>B客户</p><p>C该金融机构</p><p>D该金融机构和第三方按比例</p>,4,C,金融机构具有履行客户身份识别的义务，若通过第三方识别客户身份，而第三方未采取符合《反洗钱法》要求的客户身份识别措施，属于该金融机构的失职。,0,0
1,(单选题)债券回购是商业银行短期借款的重要方式，包括()。,<p>A质押式回购与买断式回购</p><p>B质押式回购与卖断式回购</p><p>C抵押式回购与买断式回购</p><p>D抵押式回购与卖断式回购</p>,4,A,债券回购是商业银行短期借款的重要方式，包括质押式回购与买断式回购两种。,0,0
1,(单选题)国际商业银行用来考核商业银行盈利能力和风险水平的最佳办法是()。,<p>A股本收益率</p><p>B资产收益率</p><p>C风险价值方法</p><p>D经风险调整的绩效评估方法</p>,4,D,经风险调整的绩效评估方法(RAPM)与传统绩效度量方法的最大区别就在于将业务的收益与风险直接挂钩，强调了风险衡量在银行这类特殊行业的重要性。国际商业银行用来考核商业银行盈利能力和风险水平的最佳方法是经风险调整的绩效评估方法。,0,0
1,(单选题)关于外部审计制度的表述，下列选项中不正确的是()。,<p>A担负着过滤会计信息风险、确保会计信息质量、降低会计信息识别成本的责任</p><p>B被利益相关者视为重要的利益保障机制</p><p>C外部审计制度的灵魂在于其有效性</p><p>D在直接审计委托模式下，包括企业所有者、注册会计师和经营者三方</p>,4,C,外部审计制度的灵魂在于其独立性。,0,0
1,(单选题)经中国银监会认可，商业银行发行的普通的、无担保的、不以银行资产做抵（质）押的长期次级债务工具可列入附属资本，在距到期日前最后____年，其可计入附属资本的数量每年累计折扣______。(),<p>A3；20%</p><p>B3；1096</p><p>C5；20%</p><p>D5；10%</p>,4,C,经中国银监会认可，商业银行发行的普通的、无担保的、不以银行资产做抵（质）押的长期次级债务工具可列入附属资本，在距到期日前最后5年，其可计入附属资本的数量每年累计折扣20%。,0,0
1,(单选题)中国人民银行提高再贴现率时，市场的反映通常是(）。,<p>A商业银行投资规模降低，货币供应量减少，经济增速放缓</p><p>B商业银行投资规模提高，货币供应量增加，经济快速发展</p><p>C商业银行投资规模降低，货币供应量增加，经济快速发展</p><p>D商业银行投资规模提高，货币供应量减少，经济增速放缓</p>,4,A,中国人民银行调整再贴现率的作用机制是：提高商业银行向中央银行融资的成本，降低商业银行向中央银行的借款意愿，减少向中央银行的借款或贴现。通过准备金不足，商业银行只能收缩对客户的贷款和投资规模，进而也就缩减了市场货币供应量。随着市场货币供应量的减少，市场利率相应上升，社会对货币的需求相应减少，整个社会的投资支出减少，经济增速放缓，最终实现货币政策目标。,0,0
1,(单选题)某企业的货币资金为150，万元，交易性金融资产为30万元，应收票据为50万元，存货为30万元，预付账款为10万元，待摊费用为10万元，持有至到期长期投资为50万元，无形资产为100万元，流动负债为100万元，则速动比率为()。,<p>A2.3</p><p>B2.8</p><p>C1.8</p><p>D4.3</p>,4,C,根据题意，速动资产流动资产存货预付账款待摊费用=150+30+50-30-10-10=180（万元），速动比率=速动资产/流动负债×100%=180/100×100%=1.80,0,0
1,(单选题)如果银行的总资产为1000亿元，总存款为800亿元，核心存款为200亿元，应收存款为10亿元。现金头寸为5亿元，总负债为900亿元，则该银行核心存款比例为(1)。,<p>A0.1</p><p>B0.2</p><p>C0.3</p><p>D0.4</p>,4,B,核心存款比例=核心存款/总资产=200/1000=0.2。,0,0
1,(单选题)市场需求预测分析是对项目投产后()进行分析和判断。,<p>A项目效益</p><p>B项目适用性</p><p>C生产产品的销路</p><p>D生产产品的适用性</p>,4,C,市场需求预测分析是指在市场调查和供求预测的基础上，根据项目产品的竞争能力、市场环境和竞争者等要素，分析和判断项目投产后所生产产品的未来销路问题，具体来说就是考察项目产品在特定时期内是否有市场，以及采取怎样的营销战略来实现销售目标。,0,0
1,(单选题)处于成熟阶段行业中的企业，成功的关键要素是()。,<p>A做好成本控制</p><p>B产品价格促销</p><p>C产品推广</p><p>D加大投入力度</p>,4,A,处于成熟阶段行业中的企业，做好成本控制是成功的关链要素。,0,0
1,(单选题)2007年3月18日中国人民银行调整人民币存款基准利率，其中，3年期整存整取为3.96%，这个利率不属于()。,<p>A官方利率</p><p>B实际利率</p><p>C固定利率</p><p>D长期利率</p>,4,B,实际利率是指剔除通货膨胀后储户或投资者得到利息回报的真实利率。,0,0
1,(单选题)下列主体可作为保证人的是()。,<p>A8岁的小明</p><p>B65岁无经济来源的老张</p><p>C某医院</p><p>D有母公司书面授权可作为保证人的某子公司</p>,4,D,我国《担保法》对保证人的资格作了明确的规定：其一，作为保证人必须是具有民事行为能力的人，只有具有行为能力的人所从事的法律行为才有效。其二，保证人必须具有代为履行主债务的资力。作为保证人不仅要满足上述两个要件，还要受下述各条件的限制：(1)国家机关不得作保证人，但经国务院批准对特定事项作保证人的除外；(2)禁止政府及其所属部门要求银行等金融机构或者企业为他人提供担保；(3)医院、学校等以公共利益为目的的事业单位、社会团体不得作保证人，已提供保证的保证合同无效，并且还要就提供保证的过错承担相应的民事责任；(4)企业法人的分支机构或职能部门不能作保证人，企业法人的分支机构有该法人书面授权的，可以在授权范围内提供保证。,0,0
1,(单选题)竞争性进入威胁的严重程度取决于()。,<p>A替代品的威胁</p><p>B供方的讨价还价能力</p><p>C买方的讨价还价能力</p><p>D进入新领域的障碍大小与预期现有企业对于进入者的反映情况</p>,4,D,竞争性进入威胁的严重程度取决于两方面的因素：一是进入新领域的障碍大小；二是预期现有企业对于进入者的反映情况。,0,0
1,(单选题)下列不属于银行应重点监控的管理状况风险的是()。,<p>A董事会成员变动</p><p>B中层管理层薄弱</p><p>C借款人的关联企业倒闭</p><p>D借款人在银行存款大幅下降</p>,4,D,银行应关注借款人的管理水平、管理架构、人员变化、员工士气变化以及企业内部人员的道德风险对公司经营的影响。企业管理状况风险主要体现在：(1)企业发生重要人事变动，如高级管理人员或董事会成员变动，最主要领导者的行为发生变化，患病或死亡，或陷入诉讼纠纷，无法正常履行职责。(2)最高管理者独裁，领导层不团结，高级管理层之间出现严重的争论和分歧；职能部门矛盾尖锐，互相不配合，管理层素质偏低。(3)管理层对环境和行业中的变化反应迟缓或管理层经营思想变化，表现为极端的冒进或保守。(4)管理层对企业的发展缺乏战略性的计划，缺乏足够的行业经验和管理能力（如有的管理人员只有财务专长而没有技术、操作、战略、营销和财务技能的综合能力），导致经营计划没有实施及无法实施。(5)董事会和高级管理人员以短期利润为中心，不顾长期利益而使财务发生混乱、收益质量受到影响。(6)借款人的主要股东、关联企业或母子公司等发生重大的不利变化。(7)中层管理层薄弱，企业人员更新过快或员工不足。D选项借款人在银行存款状况反映的是企业与银行往来情况。,0,0
1,(单选题)下列关于“法人账户透支”的说法，错误的是()。,<p>A法人账户透支属于短期贷款的一种</p><p>B主要用于满足借款人生产经营过程中的临时性资金需要</p><p>C申请办理法人账户透支业务的借款人需在经办行有一定的结算业务量</p><p>D一般情况下，对法人账户透支业务申请人的还款能力及担保要求要低于普通流动资金贷款</p>,4,D,法人透支业务是指在企业获得银行授信额度后，银行为企业在约定的账户、约定的限额内以透支的形式提供的短期融资和结算便利的业务。一般情况下，对法人账户透支业务申请人的还款能力及担保要求要高于普通流动资金贷款，故D选项错误。,0,0
1,(单选题)统计预警法是()。,<p>A对警素之间的相关关系进行相关分析，确定其先导长度和强度，再根据警素变动确定警级、警度的方法</p><p>B对警兆之间的相关关系进行相关分析，确定其先导长度和强度，再根据警兆变动确定警级、警度的方法</p><p>C对警兆和警素之间相关关系进行相关分析，确定其先导长度和强度，再根据警兆变动确定警级、警度的方法</p><p>D对警兆自变量与警度进行回归分析，再根据警兆变动确定警度的方法</p>,4,C,统计预警法是蓝色预警法的一种，它是对警兆和警素之间的关系进行相关性分析，确定其先导长度和先导强度，再根据警兆变动情况确定各警兆的警级，结合警兆的重要性进行警级综合，最后预报警度的一种方法。,0,0
1,(单选题)未转换的可转换债券的数量少于()时，上市公司就要进行披露。,<p>A3000万元</p><p>B4000万元</p><p>C5000万元</p><p>D6000万元</p>,4,A,未转换的可转换债券的数量少于3000万元时，上市公司就要进行披露。,0,0
1,(单选题)下列指标计算中，错误的是()。,<p>A流动资金=流动资产-流动负债</p><p>B存货=外购原辅材料、燃料+在产品+产成品</p><p>C应收账款=年经营成本/流动资金年周转次数</p><p>D产成品=（年生产成本-年折旧）/流动资金年周转次数</p>,4,D,产成品=（年生产成本-年折旧+年管理费用）/流动资金年周转次数；在产品=（年生产成本-年折旧）/流动资金年周转次数。,0,0
1,(单选题)下列关于经营杠杆表述不正确的是()。,<p>A经营杠杆是营业利润相对于销售量变化敏感度的指示剂</p><p>B通常情况下，高经营杠杆代表着高风险</p><p>C高经营杠杆行业需要获得更高的销售量来维持利润</p><p>D政府会使某些经营杠杆较低的行业成为垄断行业</p>,4,D,政府会使某些经营杠杆较高的行业成为垄断行业。故选D。,0,0
1,(单选题)当公司()时，资产效率下降和商业信用减少可能成为公司贷款的原因。,<p>A现金需求低于现金供给</p><p>B现金需求高于现金供给</p><p>C现金需求增加</p><p>D现金供给减少</p>,4,B,如果公司的现金需求超过了现金供给，那么资产效率下降和商业信用减少可能成为公司贷款的原因。故选B。,0,0
1,(单选题)根据《物权法》的规定，下列关于抵押合同的说法，正确的是()。,<p>A当事人订立抵押合同可以采用书面形式也可以采用口头形式</p><p>B抵押合同成立与抵押权设立相一致，合同成立的同时抵押权即告设立</p><p>C以正在建造的建筑物抵押的，抵押权自登记时设立</p><p>D动产抵押未经登记的，抵押合同无效</p>,4,C,《物权法》明确要求设立抵押权，当事人应当采用书面形式订立抵押合同，因此A选项错误；抵押合同成立与抵押权设立采用分离的机制，即抵押合同先生效，而抵押权设立则需经过一定的法定手续后方能生效，因此B选项错误；对于动产抵押，抵押权自抵押合同生效时设立，未经登记的不得对抗善意第三人，但并不导致抵押合同无效，因此D选项错误。,0,0
1,(单选题)净现值法中，较难确定的是()。,<p>A利率</p><p>B收益率</p><p>C贴现率</p><p>D回报率</p>,4,C,贷款的利率和贴现率是决定贷款净现值的重要因素，但贴现率的确定较为困难。故选C。,0,0
1,(单选题)甲公司向银行贷款，并以所持有的乙上市公司的股份用于质押：根据《担保法》的规定，该职权设立的时间是()。,<p>A借款合同签订之日</p><p>B质押合同签订之日</p><p>C向有关部门申请办理出质登记之日</p><p>D向有关部门办理出质登记之日</p>,4,D,根据《物权法》和《担保法》的规定，以基金份额、证券登记结算机构登记的股权出质的，质权自证券登记结算机构办理出质登记时设立；以其他股权出质的，质权自工商行政管理部门办理出质登记时设立。,0,0
1,(单选题)甲欠乙贷款1000万元，其中500万元以房屋作抵押担保，剩余500万元由丙承担连带保证责任。到期后，甲归还了250万元贷款，乙放弃对抵押物的优先受偿，则丙担保人承担的保证责任金额为()万元。,<p>A500</p><p>B750</p><p>C250</p><p>D1000</p>,4,C,债务人以自己的财产设立抵押，抵押权人放弃该抵押权的，其他担保人在抵押权人丧失优先受偿权益的范围内免除担保责任，但其他担保人承诺仍然提供担保的除外。因此，保证责任金额=1000-250-500=250（万元）。,0,0
1,(单选题)银行股东最关心的财务指标是()。,<p>A资产利润率</p><p>B资本利润率</p><p>C资产利用率</p><p>D收入利润率</p>,4,B,银行股东是资本的提供者，其最关心的财务指标是资本利润率。,0,0
1,(单选题)行业发展的成熟阶段的销售特点是()。,<p>A由于价格较高，销售量很小</p><p>B产品价格下降的同时产品质量取得了明显提高，销售额大幅增长</p><p>C产品价格下跌，销售额增长速度放缓，产品推广成为影响销售的最主要因素</p><p>D一般以较为平稳的速度下降</p>,4,C,在行业发展的启动阶段，销售的特点是：由于价格较高，销售量很小；在行业发展的成长阶段，销售的特点是：产品价格下降的同时产品质量取得了明显提高，销售额大幅增长；在行业发展的成熟阶段，销售的特点是：产品价格下跌，销售额增长速度放缓，产品推广成为影响销售的最主要因素；在行业发展的衰退阶段，销售的特点是：一般以较为平稳的速度下降。,0,0
1,(单选题)与实行新税制前相比，现行基本报表最大的特点不包括()。,<p>A销售收入中不含营业税</p><p>B销售收入中不含增值税的销项税</p><p>C总成本中不含进项税</p><p>D销售税金中不含增值税</p>,4,A,与以往的报表相比，本套评估报表的最大特点是销售收入中不含增值税的销项税，总成本中不合进项税，销售税金中不合增值税，这是根据现行的新税制和企业实际会计核算办法设置的。,0,0
1,(单选题)下列不属于我国估计抵押物价值的一般做法的是()。,<p>A抵押人与银行双方协商确定抵押物的价值</p><p>B银行自行评估</p><p>C依抵押物估价法规估价</p><p>D委托有评估资格的中介机构评估</p>,4,C,由于我国的法律还未就抵押物估价问题作出具体规定，一般的做法由抵押人与银行双方协商确定抵押物的价值，委托具有评估资格的中介机构给予评估或银行自行评估。,0,0
1,(单选题)下列准备金中，具有资本性质的是()。,<p>A普通准备金</p><p>B专项准备金</p><p>C特别准备金</p><p>D银行资本金</p>,4,A,普通准备金又称一般准备金，是按照贷款余额的一定比例提取的贷款损失准备金。我国商业银行现行的按照贷款余额1%提取的贷款呆账准备金相当于普通准备金。由于普通损失准备金在一定程度上具有资本的性质，因此，普通损失准备金可以计入商业银行资本基础的附属资本，但计入的普通准备金不能超过加权风险资产的1.25%，超过部分不再计入。,0,0
