1,(单选题)根据《中华人民共和国担保法》（以下简称《提保法》）的规定，下列财产不可以抵押的是()。 ,<p>A抵押人依法有处分权的原材料、半成品、产品 </p><p>B抵押人所有的机器、交通运输工具和其他财产 </p><p>C抵押人所有的房屋和其他地上定着物 </p><p>D自留地、自留山等集体所有的土地使用权</p>,4,D,根据《担保法》规定，耕地、宅基地（但有特别规定的除外）。自留地、自留山等集体所有的土地使 用权不得抵押。,0,0
1,(单选题)不能作为保证人的是()。 ,<p>A担保公司 </p><p>B经国务院批准对特定事项作保证人的国家机关 </p><p>C自然人 </p><p>D医院、学校等以公共利益为目的的事业单位、社会团体</p>,4,D,《担保法》规定，国家机关不得为保证人，但经国务院批准为使用外国政府或者国际经济组织贷款进 行转贷的除外；学校、幼儿园、医院等以公益为目的的事业单位、社会团体不得为保证人；企业法人 的分支机构、职能部门不得为保证人；企业法人的分支机构有法人书面授权的，可以在授权范围内提 供保证。因此，根据法律规定，除非有特殊情形，否则国家机关、公益性事业单位、社会团体、企业 法人的分支机构、职能部门均不得作为保证人为他人提供担保。,0,0
1,(单选题)公司信贷的借款人主要是经工商行政管理机关（或主管机关）核准登记的()。 ,<p>A企（事）业法人 </p><p>B个人 </p><p>C政府机关 </p><p>D部门</p>,4,A,公司信贷的借款入主要是经工商行政管理机关（或主管机关）核准登记的企（事）业法人。,0,0
1,(单选题)某公司拟以其所有的通勤车、厂房、被法院封存的存货及其租用的机器作抵押向银行申请借款，上述财 产中可以用来作抵押的是()。 ,<p>A厂房、存货 </p><p>B通勤车、厂房 </p><p>C全部财产 </p><p>D通勤车、厂房、存货</p>,4,D,《物权法》第180条规定，债务人或者第三人有权处分的下列财产可以抵押：建筑物和其他土地附着 物；建设用地使用权；以招标、拍卖、公开协商等方式取得的荒地等土地承包经营权；生产设备、原 材料、半成品、产品；正在建造的建筑物、船舶、航空器；交通运输工具；法律、行政法规未禁止抵 押的其他财产；抵押人可以将前款所列财产一并抵押。,0,0
1,(单选题)()是指借款人用资金购买原材料、生产、销售到收回销售款的整个循环过程。 ,<p>A资本转换周期 </p><p>B货币流通周期 </p><p>C生产转换周期 </p><p>D商品流转周期</p>,4,C,生产转换周期是指借款人用资金购买原材料、生产、销售到收回销售款的整个循环过程。,0,0
1,(单选题)商业银行公司信贷产品的定价策略中，被称为“薄利多销定价策略”的是()。 ,<p>A差别定价策略 </p><p>B关系定价策略 </p><p>C高额定价策略 </p><p>D渗透定价策略</p>,4,D,渗透定价策略采用很低的初始价格，打开销路，以便尽早占领较大的市场份额，树立品牌形象后，再 相应地提高产品价格，从而保证一定的利润率。这也被称为“薄利多销定价策略”。,0,0
1,(单选题)B公司2012年利润总额1580万元，销售成本1200万元，销售费用2390万元，管理费用981万元，财务费用 1050万元。B公司的成本费用利润率为()。 ,<p>A0.4401</p><p>B0.281</p><p>C0.3921</p><p>D0.3574</p>,4,B,成本费用利润率是企业一定期间的利润总额与成本、费用总额的比率，即1580/(1200+2390+981+1050) =28.1%。,0,0
1,(单选题)下列各项中，不能单独作为一般准备金的计提基数的是()。 ,<p>A非正常类贷款 </p><p>B正常类贷款 </p><p>C全部贷款余额 </p><p>D全部贷款扣除已提取专项准备金的余额</p>,4,A,一是选择以全部贷款余额作基数；二是为了避免普通准备金与专项准备金的重复计算，选择以全部贷 款扣除已提取专项准备金后的余额作为基数；三是选择以正常类贷款余额或者正常类贷款加上关注类 贷款余额作为基数。,0,0
1,(单选题)如果当期应收账款减少，即收回上一期的应收账款________本期产生的应收账款，销售所得现金就会 _______销售收入。() ,<p>A大于；大于 </p><p>B大于；小于 </p><p>C小于；小于 </p><p>D小于；大于</p>,4,A,无,0,0
1,(单选题)商业银行需审查建设项目的资本金是否已足额到位，这符合银行贷款发放的()的要求。 ,<p>A适宜相容 </p><p>B计划、比例放款 </p><p>C资本金足额 </p><p>D进度放款</p>,4,C,银行需审查建设项目的资本金是否已足额到位。即使因特殊原因不能按时足额到位，贷款支取的比例 也应同步低于借款人资本金到位的比例。这符合银行贷款发放的资本金足额原则。,0,0
1,(单选题)下列关于商业银行对贷款担保状况分析的表述，错误的是()。 ,<p>A要考虑担保的充分性 </p><p>B要考虑担保的有效性 </p><p>C要判断担保能消除或减少贷款风险损失的程度 </p><p>D在没有市场的情况下，可自行确定担保物的市场价值</p>,4,D,根据中国人民银行发布的《贷款风险分类指导原则（试行）》的规定，对于抵押资产的评估，在有市 场的情况下，按市场价格定值；在没有市场的情况下，应参照同类抵押资产的市场价格定值。,0,0
1,(单选题)“应付账款”账户的期初余额为8000元，本期贷方发生额为12000元，期末余额为6000元，则该账户的本 期借方发生额为()元。 ,<p>A2000</p><p>B4000</p><p>C10000</p><p>D14000</p>,4,D,应付账款借方发生额=8000+12000-6000=14000(元)。,0,0
1,(单选题)对行业成熟度四阶段特点的描述，不正确的是()。 ,<p>A衰退阶段：销售量平稳或快速下降，利润由正变负，现金流减小 </p><p>B成长阶段：销售量大幅增长，利润为负值，现金流为正值 </p><p>C成熟阶段：销售量增长放缓，利润为最大化，现金流为正值 </p><p>D启动阶段：销售量很小，利润为负值，现金流为负值</p>,4,B,成长阶段的特点应该是销售量大幅增长，利润为正值，现金流为负。,0,0
1,(单选题)盈亏平衡点是指()，通过此点来分析项目成本与收益平衡的关系。 ,<p>A利润总额最大化的点 </p><p>B边际利润最大化的点 </p><p>C边际成本最小化的点 </p><p>D销售收入总额与产品销售总成本相等的点</p>,4,D,盈亏平衡点(BreakEvenPoint，简称BEP)又称零利润点，通常是指全部销售收入等于全部成本时（销售 收入线与总成本线的交点）的产量。,0,0
1,(单选题)某商业银行的贷款业务发生呆账贷款，经审核批准核销后，应首先()。 ,<p>A冲减税前利润 </p><p>B增加贷款呆账准备金 </p><p>C冲减贷款呆账准备金 </p><p>D冲减税后利润</p>,4,C,某商业银行的贷款业务发生呆账贷款，经审核批准核销后，应首先冲减贷款呆账准备金。,0,0
1,(单选题)毛利润率的计算公式为()。 ,<p>A利润总额/销售收入净额 </p><p>B净利润/销售收入净额 </p><p>C营业利润/销售收入净额 </p><p>D销售利润/销售收入净额</p>,4,D,毛利润率=销售利润/销售收入净额*100%。,0,0
1,(单选题)关于保证合同的形式，下列表述正确的是()。 ,<p>A具有担保性质的信函，传真不属于保证合同 </p><p>B可以单独订立书面合同</p><p>C不可以以主合同担保条款的形式存在 </p><p>D一般以口头形式订立</p>,4,B,根据《担保法》的规定，保证合同要以书面形式订立，以明确双方当事人的权利和义务。书面保证合 同可以单独订立，包括当事人之间的具有担保性质的信函、传真等，也可以是主合同中的担保条款。,0,0
1,(单选题)商业银行对客户的信用评级，主要是对其()的评价，反映客户违约风险的大小。 ,<p>A偿债能力和发展前景 </p><p>B偿债能力和偿债意愿 </p><p>C偿债能力和盈利能力 </p><p>D盈利能力和偿债意愿</p>,4,B,客户信用评级是商业银行对客户偿债能力和偿债意愿的计量和评价，反映客户违约风险的大小。,0,0
1,(单选题)对于动产类抵债资产，商业银行应当自取得之日起()内予以处置。 ,<p>A2年 </p><p>B6个月 </p><p>C5年 </p><p>D1年</p>,4,D,抵债资产收取后应尽快处置变现，其中动产应自取得之日起1年内予以处置。,0,0
1,(单选题)应付账款一般可以看作公司的()融资来源。 ,<p>A中息 </p><p>B高息 </p><p>C无息 </p><p>D低息</p>,4,C,正负债融资和权益融资是企业的两种融资来源，应付账款属于负债项目，构成负债融资的一部分。负 债融资又分为有息和无息两种形式，前者包括长期借款和发行债券，后者指应付项目，因而应付账款 的融资当属于无息负债融资类别。,0,0
1,(单选题)利润表是根据()原理编制的。 ,<p>A负债+所有者权益=资产 </p><p>B收入-费用=利润 </p><p>C负债+所有者权益+收入-费用=资产 </p><p>D资金来源=资金运用</p>,4,B,损益表编制的原理是“收入-费用=利润”的会计平衡公式和收入与费用的配比原则。,0,0
1,(单选题)下列长期投资决策评价指标中，其数值越小越好的指标是()。 ,<p>A内部收益率 </p><p>B投资收益率 </p><p>C投资回收期 </p><p>D净现值率</p>,4,D,这些长期投资决策评价指标中只有投资回收期为越小越好，其余均为越大越好的指标。,0,0
1,(单选题)一个企业有6年的历史，其中前两年主要生产白酒，中间2年从事农副产品加工，后两年从事对外贸易， 且股权完全发生变更，银行分析该客户的品质时，()。 ,<p>A由于该企业敢于创新突破，应给予大力支持 </p><p>B因主营业务和股权变更较大，应给予足够警觉 </p><p>C因主营业务和股权变更较大，应给予大力支持 </p><p>D由于贸易行业利润丰厚，应给予适当支持</p>,4,B,无,0,0
2,(多选题)商业银行在贷款审查审批过程中应审查的内容有()。 ,<p>A保证、抵押、质押等担保方式的合法、足值、有效性 </p><p>B贷款业务资料是否齐全 </p><p>C借款人的银行及商业信用记录 </p><p>D借款人股东的实力及注册资金的到位情况 </p><p>E借款用途的合法合规性</p>,5,ABCDE,商业银行在贷款审查审批过程中应审查的内容有：保证、抵押、质押等担保方式的合法、足值、有效 性；贷款业务资料是否齐全；借款人的银行及商业信用记录；借款人股东的实力及注册资金的到位情 况；借款用途的合法合规性。,0,0
2,(多选题)对借款企业来说，财务状况的变化是企业还款能力变化的直接反映，企业的财务风险主要体现在()。 ,<p>A应收账款异常增加 </p><p>B银行账户混乱，到期票据无力支付 </p><p>C产品积压、存货周转率下降 </p><p>D企业不能按期支付银行贷款本息 </p><p>E经营性净现金流量持续为负值</p>,5,ABCDE,财务状况变化是企业还款能力变化的直接反映。企业的财务风险主要体现在：(1)企业不能按期支付银 行贷款本息；(2)经营性净现金流量持续为负值；(3)产品积压、存货周转率大幅下降；(4)应收账款异常 增加；(5)流动资产占总资产比重大幅下降；(6)短期负债增加失当，长期负债大量增加；(7)银行账户混 乱，到期票据无力支付；(8)企业销售额下降，成本提高，收益减少，经营亏损；(9)不能及时报送会计 报表，或会计报表有造假现象；(10)财务记录和经营控制混乱。,0,0
2,(多选题)商业银行在对客户的经营业绩进行分析评价时，需重点关注的指标有()。 ,<p>A与行业比较的销售增长率 </p><p>B主营业务收入占销售收入总额的比重 </p><p>C固定资产原值 </p><p>D平均工资及福利 </p><p>E产品的市场占有率</p>,5,ABE,与行业比较的销售增长率、产品的市场占有率和主营业务指标可以反映出企业的经营业绩，商业银行 在对客户的经营业绩进行分析评价时需重点关注。,0,0
2,(多选题)项目盈利能力指标主要包括()。 ,<p>A财务净现值 </p><p>B总资产周转率 </p><p>C净现值率 </p><p>D投资回收期 </p><p>E财务内部收益率</p>,5,ACDE,财务净现值、净现值率、投资回收期、财务内部收益率等指标均能反映项目的盈利能力，总资产周转 率反映的是项目的营运能力。,0,0
2,(多选题)项目融资贷前调查报告中财务分析部分包括()。 ,<p>A项目清偿能力评价 </p><p>B项目投资估算与资金筹措评估 </p><p>C敏感性分析 </p><p>D投资回收期 </p><p>E市场占有率评估</p>,5,ABCD,E选项为非财务分析。,0,0
2,(多选题)关于项目现金流量分析，下列说法正确的有()。 ,<p>A全部投资现金流量表中，借款利息和本金的偿还不作为现金流出 </p><p>B净现金流量分析可以判断项目能否按时还款 </p><p>C内部收益率可以作为唯一指标来判断项目能否按时还款 </p><p>D自有资金现金流量表中，借款利息作为现金流入，借款本金的偿还作为现金流出 </p><p>E全部投资现金流量表可用于计算全部投资的内部收益率等评价指标</p>,5,ABE,不能仅仅通过内部收益率指标来判断项目能否按时还款，C选项错误；自有资金现金流量表中，借款 利息、借款本金的偿还均为现金流出，D选项错误。,0,0
2,(多选题)商业银行贷款审批要素包括()。 ,<p>A贷款用途 </p><p>B还款计划安排 </p><p>C担保方式 </p><p>D贷款发放条件与支付方式 </p><p>E贷款利率</p>,5,ABCDE,无,0,0
2,(多选题)我国银行贷款担保的具体形式主要有()。 ,<p>A定金 </p><p>B贷款证券化 </p><p>C保证 </p><p>D质押 </p><p>E抵押</p>,5,CDE,从担保的方式来分，贷款担保主要分为：抵押贷款、质押贷款、保证贷款、信用贷款。,0,0
2,(多选题)商业银行信贷业务经营管理组织架构包括()。 ,<p>A公司业务部门 </p><p>B监事会 </p><p>C稽核部门 </p><p>D高级管理层 </p><p>E董事会及其专门委员会</p>,5,ABCDE,商业银行信贷业务经营管理组织架构包括：董事会及其专门委员会、监事会、高级管理层和信贷业务 前中后台部门。A、C分别属于信贷业务的前、后台部门。,0,0
2,(多选题)从资产负债表看，可能导致流动资产增加的因素有()。 ,<p>A资产效率下降 </p><p>B长期销售增长 </p><p>C季节性销售增长 </p><p>D红利支付 </p><p>E商业信用的减少</p>,5,ABC,从资产负债表看，季节性销售增长、长期销售增长、资产效率下降可能导致流动资产增加。,0,0
2,(多选题)现金流量中的现金包括()。 ,<p>A其他货币资金 </p><p>B活期存款 </p><p>C三个月以内的证券投资 </p><p>D定期存款 </p><p>E库存现金</p>,5,ABCE,现金包括库存现金、活期存款、其他货币资金以及三个月以内的证券投资，但不包括定期存款，因 此，D选项不属于现金。,0,0
2,(多选题)按照《贷款风险分类指引》的规定，不良贷款包括()。 ,<p>A逾期贷款 </p><p>B可疑类贷款 </p><p>C损失类贷款 </p><p>D关注类贷款 </p><p>E次级类贷款</p>,5,BCE,不良贷款包括可疑类贷款、损失类贷款、次级类贷款等。,0,0
2,(多选题)下列财产可以抵押的有()。 ,<p>A以招标、拍卖、公开协商等方式取得的荒地等土地承包经营权 </p><p>B正在建造的建筑物 </p><p>C建筑物和其他土地附着物 </p><p>D交通运输工具 </p><p>E建设用地使用权</p>,5,ABCDE,无,0,0
2,(多选题)针对抵押贷款，商业银行要求借款人提供的材料一般应包括()。 ,<p>A抵押人为外商投资企业或股份制企业的，应出具同意提供抵押的董事会决议和授权书</p><p>B抵押物价值评估报告 </p><p>C借款人同意将抵押物办理保险手续并以银行作为第一受益人的文件材料 </p><p>D抵押物权属证明文件 </p><p>E抵押物清单</p>,5,ABCDE,针对抵押贷款，商业银行要求借款人提供的材料一般应包括抵押人为外商投资企业或股份制企业的， 应出具同意提供抵押的董事会决议和授权书、抵押物价值评估报告、借款人同意将抵押物办理保险手 续并以银行作为第一受益人的文件材料、抵押物权属证明文件、抵押物清单。,0,0
2,(多选题)在市场需求预测分析中，估计潜在的市场需求总量时，与其有关的直接因素包括( ,<p>A单位产品的价格 </p><p>B市场所在区域的面积 </p><p>C购买者的平均购买量 </p><p>D市场所在区域基础设施情况 </p><p>E给定的条件下特定产品或市场中的购买者的数量</p>,5,ACE,潜在的市场需求量是指在一定时期内，在一定行业营销水平和一定的市场环境下，一个行业中所有企 业可能达到的最大营销量之和。总市场潜量可表示为：Q=npq式中：Q市场潜量；n给定的条 件下特定产品或市场中的购买者的数量；p单位产品的价格；q购买者的平均购买量。,0,0
2,(多选题)根据《担保法》规定，担保的法定范围包括()。 ,<p>A损害赔偿金 </p><p>B违约风险溢价 </p><p>C利息 </p><p>D主债权 </p><p>E违约金</p>,5,ACDE,担保的法定范围包括主债权及利息、违约金、损害赔偿金和实现债权的费用等。,0,0
2,(多选题)在商业银行贷后管理中，抵押品检查的主要内容有()。 ,<p>A抵押品是否被变卖出售或部分被变卖出售 </p><p>B抵押品是否被妥善保管 </p><p>C抵押品价值是否变化</p><p>D抵押品是否被转移至不利于银行监控的地方 </p><p>E抵押品保险到期后是否及时续投保险</p>,5,ABCDE,抵押品检查的主要内容有：抵押品是否被变卖出售或部分被变卖出售；抵押品是否被妥善保管；抵押 品价值是否变化；抵押品是否被转移至不利于银行监控的地方；抵押品保险到期后是否及时续投保险 等。,0,0
2,(多选题)下列关于委托贷款的表述，错误的有()。 ,<p>A银行作为受托人收取手续费 </p><p>B委托贷款的风险由银行承担 </p><p>C由银行确定贷款金额、期限、利率 </p><p>D借款人由委托人指定 </p><p>E委托贷款的资金提供方必须是银行</p>,5,BCE,委托贷款是指政府部门、企事业单位及个人等委托人提供资金，由银行（受托人）根据委托人确定的 贷款对象、用途、金额、期限、利率等代为发放、监督使用并协助收回的贷款。委托贷款的风险由委 托人承担，银行（受托人）只收取手续费，不承担贷款风险。,0,0
2,(多选题)贷款档案管理的原则包括()。 ,<p>A档案门类齐全 </p><p>B人员职责明确 </p><p>C管理制度健全 </p><p>D信息利用充分 </p><p>E提供有效服务</p>,5,ABCDE,档案管理的原则和要求是：档案门类齐全、人员职责明确、管理制度健全、信息利用充分、提供有效 服务。,0,0
2,(多选题)商业银行信贷批复文件中可附带的限制性条款包括()。 ,<p>A对外担保的限制 </p><p>B配合贷后管理的要求 </p><p>C资本性支出的限制 </p><p>D股东分红的限制</p><p>E偿债优先权的要求</p>,5,ABCDE,信贷批复中的限制性条款主要包括：(1)办理具体贷款业务品种、额度、期限及保证金比例的要求；(2) 贷款担保方面的要求；(3)对资产负债率等核心偿债能力、流动性、盈利性等财务指标的要求；(4)贷款 支付金额、支付对象的要求；(5)对外担保的限制；(6)资本出售的限制；(7)资本性支出的限制；(8)股 东分红的限制；(9)兼并收购的限制；(10)交叉违约的限制；(11)偿债优先权的要求：(12)配合贷后管理 的要求；(13)确定借款人的交易对手名单、交易商品，必要时限定交易商品价格波动区间和应收账款 账龄；(14)锁定借款人贷款对应的特定还款来源，提出明确还款来源，监督客户物流与现金流的具体 措施，并落实贷款的贷后管理责任人；(15)其他限制性条件。,0,0
2,(多选题)实贷实付的核心要义包括()。 ,<p>A受托支付是实贷实付的重要手段 </p><p>B防范信贷风险是实贷实付的根本目的 </p><p>C按进度发放贷款是实贷实付的基本要求 </p><p>D满足有效信贷需求是实贷实付的根本目的 </p><p>E口头承诺是实贷实付的外部执行依据</p>,5,ACD,受托支付是实贷实付的重要手段，按进度发放贷款是实贷实付的基本要求，满足有效信贷需求是实贷 实付的根本目的，协议承诺是实贷实付的外部执行依据。,0,0
2,(多选题)下列关于信贷资产质量指标的说法，正确的有()。 ,<p>A信贷资产相对不良率大于1时，说明目标区域信贷风险低于银行一般水平 </p><p>B信贷平均损失比率从静态上反映了目标区域信贷资产整体质量 </p><p>C利息实收率用于衡量目标区域信贷资产的收益实现情况 </p><p>D信贷余额扩张系数指标小于0时，目标区域信贷增长相对较慢 </p><p>E加权平均期限用于衡量目标区域信贷资产的期限结构</p>,5,BCDE,信贷资产相对不良率大于1时，说明目标区域信贷风险高于银行一般水平；信贷平均损失率从静态上反 映了目标区域信贷资产整体质量；利息实收率用于衡量目标区域信贷资产的收益实现情况；信贷余额 扩张系数小于0时，目标区域信贷增长相对较慢；加权平均期限用于衡量目标区域信贷资产的期限结 构。,0,0
2,(多选题)根据相关规定，如果借款人发生()情形，均可能导致银行贷款合同无效或效力待定，会对银行保全债权产 生不确定性。 ,<p>A损害国家利益的 </p><p>B恶意串通损害国家、集体或第三人利益的 </p><p>C违反法律、行政法规等强制性规定的 </p><p>D主体资格存在瑕疵的 </p><p>E以合法形式掩盖非法目的的</p>,5,ABCDE,如借款人损害国家利益的，或恶意串通损害国家、集体或第三人利益的，或以合法形式掩盖非法目的 的，或违反法律、行政法规等强制性规定的，或借款人主体资格存在暇疵的，均可能会导致贷款合同 无效或效力待定。,0,0
2,(多选题)抵押合同的内容需包括()。 ,<p>A被担保的主债权种类、数额 </p><p>B债务人履行债务的期限 </p><p>C抵押物的名称、数量、质量、状况，等等 </p><p>D抵押率的确定 </p><p>E抵押担保的范围</p>,5,ABCE,抵押合同要重点审查以下要素：(1)抵押贷款的种类和数额；(2)借款人履行贷款债务的期限；(3)抵押物 的名称、数量、质量、状况、所在地、所有权权属或使用权权属及抵押的范围。,0,0
2,(多选题)下列关于企业“经营杠杆”的表述，正确的有()。 ,<p>A保持较高的销售量和维持市场占有率是经营杠杆较高的行业成功的关键 </p><p>B经营杠杆越高，销售量对营业利润的影响就越大 </p><p>C固定资本占总成本的比例越大，经营杠杆越高 </p><p>D通常情况下，高经营杠杆代表着高风险 </p><p>E在经济增长、销售上升时，低经营杠杆行业的增长速度要比高经营杠杆行业的增长速度缓慢</p>,5,ABCDE,“经营杠杆”是指根据成本性态，在一定产销量范围内，产销量的增减一般不会影响固定成本总额， 但会使单位产品固定成本随着产销量的变化成正比例变化，并使利润变化率大于产销量的变化率，固 定资本占总成本的比例越大，经营杠杆越高，经营风险越大，销售量对营业利润的影响就越大，以上 说法均正确。,0,0
2,(多选题)下列选项中，反映客户短期偿债能力的指标有()。 ,<p>A资产负债率 </p><p>B速动比率 </p><p>C利息保障倍数 </p><p>D流动比率 </p><p>E现金比率</p>,5,BDE,对企业短期偿债能力的指标分析，主要可采用流动负债和流动资产对比的指标，包括营运资金、流动 比率、速动比率、现金比率和企业支付能力系数等，选项B、D、E正确，资产负债率、利息保障倍数 是衡量企业长期偿债能力大小的重要标志，A、C选项错误。,0,0
2,(多选题)授信额度的决定因素有()。 ,<p>A银行或借款企业的法律或监督条款的限制 </p><p>B贷款组合管理的限制 </p><p>C银行的客户政策 </p><p>D借款企业对借贷金额的需求 </p><p>E客户的还款能力</p>,5,ABCDE,授信额度的决定因素主要有：(1)了解并测算借款企业的需求；(2)客户的还款能力；(3)借款企业对借贷 金额的需求；(4)银行或借款企业的法律或监督条款的限制，以及借款合同条款对公司借贷活动的限 制；(5)贷款组合管理的限制，例如地域、行业、借贷类型或者由银行高级管理人员为贷款组合所制定 的贷款授信额度；(6)银行的客户政策，即银行针对客户提出的市场策略；(7)关系管理因素，相对于其 他银行或债权人，银行愿意提供给借款企业的贷款数额和关系盈利能力。,0,0
