1,(单选题)关于客户变更提款计划承担费的收取，说法正确的是()。,<p>A银行可按国际惯例，在借款合同中规定改变提款计划需收取承担费的事宜</p><p>B当借款人变更提款计划时，银行可向全部贷款收取承担费</p><p>C借款人在提款有效期内如全部未提款，银行不能收取承担费</p><p>D客户应提未提的贷款在提款期终了时可累积到下一期提取</p>,4,A,根据国际惯例，在借款合同中规定，变更提款应收取承担费，那么当借款人变更提款计划时，公司业务部门应根据合同办理，可按改变的提款计划部分的贷款金额收取承担费。借款人在提款有效期内如部分或全额未提款，应提未提部分的贷款可根据借款合同的规定收取承担费。在提款期终了时自动注销。公司业务部门在借款人的提款期满之前，将借款人应提未提的贷款额度通知借款人。,0,0
1,(单选题)规模较小银行最适合的定位策略是()。,<p>A主导式定位</p><p>B对抗式定位</p><p>C追随式定位</p><p>D补缺式定位</p>,4,D,处于补缺式地位的商业银行资产规模很小，提供的信贷产品少，集中于一个或数个细分市场进行营销。,0,0
1,(单选题)作为潜在参加银行审贷和提出修改建议的重要依据之一是()。,<p>A银团贷款的基本条件</p><p>B项目的概况及市场分析</p><p>C借款人的法律地位及概况</p><p>D银团贷款信息备忘录</p>,4,D,银团贷款信息备忘录是牵头行在贷前调查基础上协助借款人编制，并由牵头行发给潜在参加银行，作为潜在参加银行审贷和提出修改建议的重要依据之一。,0,0
1,(单选题)对于()，银行确立贷款意向后，除提交一般资料，还应提交国家计划部门关于筹资方式、外债指标的批文。,<p>A票据贴现</p><p>B出口打包贷款</p><p>C转贷款</p><p>D政府贷款项目</p>,4,C,根据《贷款通则》的规定，如为转贷款、国际商业贷款及境外借款担保项目，应提交国家计划部门关于筹资方式、外债指标的批文。,0,0
1,(单选题)信贷文件是()。,<p>A正在执行中的、尚未结清信贷的文件资料</p><p>B已经结清信贷的文件资料</p><p>C贷前审批及贷后管理的有关文件</p><p>D贷前申请的有关文件</p>,4,A,信贷文件是指正在执行中的、尚未结清信贷（贷款）的文件资料。按其重要程度及涵盖内容不同划分为两级，即一级文件（押品）和二级信贷文件。,0,0
1,(单选题)银团贷款的收费原则是()。,<p>A谁借款、谁付费</p><p>B贷款人付费。</p><p>C保证人付费</p><p>D委托人付费</p>,4,A,银团贷款的收费应遵循“谁借款、谁付费”的原则，由借款人支付。,0,0
1,(单选题)办理贷款重组的条件是()。,<p>A借款企业出现财务恶化或其他原因而出现还款困难</p><p>B银行充分评估贷款风险</p><p>C促进现金回收</p><p>D重新制定贷款偿还方案</p>,4,C,总的来说，办理贷款重组的条件是：有利于银行贷款资产风险的控制及促进现金回收，减少经济损失。,0,0
1,(单选题)下列关于基本信贷分析的说法，错误的是()。,<p>A要对贷款使用过程中的周期性分析</p><p>B贷款期限的确定要符合资本循环的转换</p><p>C需分析目前的还款来源，进而分析可用于偿还贷款的还款来源风险</p><p>D不需要关注贷款的目的</p>,4,D,基本信贷分析同样需要关注贷款的目的，防止贷款被挪用。因为贷款一旦被挪用，将导致还款风险加大。,0,0
1,(单选题)预期收入理论是由()提出的。,<p>A亚当斯密</p><p>B莫尔顿</p><p>C赫伯特</p><p>D亚当斯</p>,4,C,1949年，赫伯特.V.普罗克诺在《定期放款与银行流动性理论》一书中提出了预期收入理论。,0,0
1,(单选题)下列属于押品的是()。,<p>A企业本票</p><p>B公司债券</p><p>C贷前审批文件</p><p>D商业承兑汇票</p>,4,B,一级文件（押品）主要是指信贷抵（质）押契证和有价证券及押品契证资料收据和信贷结清通知书。其中押品主要包括：银行开出的本、外币存单、银行本票、银行承兑汇票，上市公司股票、政府和公司债券、保险批单、提货单、产权证或他项权益证书及抵（质）押物的物权凭证、抵债物资的物权凭证等。,0,0
1,(单选题)()是实贷实付的外部执行依据。,<p>A满足有效信贷需求</p><p>B按进度发放贷款</p><p>C受托支付</p><p>D协议承诺</p>,4,D,实贷实付是指银行业金融机构根据贷款项目进度和有效贷款需求，在借款人需要对外支付贷款资金时，根据借款人的提款申请以及支付委托，将贷款资金主要通过贷款人受托支付的方式，支付给符合合同约定的借款人交易对象的过程。满足有效信贷需求是实贷实付的根本目的（满足有效信贷需求是信贷风险管理的最起码要求）。按进度发放贷款是实贷实付的基本要求。受托支付是实贷实付的重要手段。协议承诺是实贷实付的外部执行依据（实贷实付要求贷款人事先与借款人约定明确、合法的贷款用途，约定贷款发放条件、支付方式、接受监督以及违约责任等事项）。,0,0
1,(单选题)基本的信贷准则是()。,<p>A短期融资需求不意味着就与流动资产和营运资金有关</p><p>B与流动资产和营运资金有关的融资需求可能与长期融资需求相关</p><p>C短期资金需求要通过短期融资来实现，长期资金需求要通过长期融资来实现</p><p>D短期资金需求和长期资金需求是同步的</p>,4,C,基本的信贷准则是短期资金需求要通过短期融资来实现，长期资金需求要通过长期融资来实现。,0,0
1,(单选题)对于银行和企业，决定资产价值的主要是()。,<p>A资产账面价值</p><p>B预计的市场价格</p><p>C当前的市场价格</p><p>D资产历史成本</p>,4,C,在市场经济条件下，资产的当前价值往往与账面价值有很大差距。按照历史成本法，只有当资产出售或负债清偿时，市场条件变化对其造成的影响才能得到反映。此外，历史成本法或通过呆账准备金的计提，或通过资产注销反映资产的损失。因此，历史成本法不能及时、准确地反映资产价值的变化。但是对于银行和企业，决定资产价值的主要是当前的市场价格。,0,0
1,(单选题)按照借贷关系持续期内利率水平是否变动，贷款利率可分为()。,<p>A固定利率和浮动利率</p><p>B法定利率和公定利率</p><p>C基准利率和市场利率</p><p>D法定利率和市场利率</p>,4,A,贷款利率主要分为三类：(1)本币贷款利率和外币贷款利率，这是根据贷款币种的不同进行的划分；(2)浮动利率和固定利率，这是按照借贷关系持续期内利率水平是否变动进行的划分；(3)法定利率、行业公定利率和市场利率。,0,0
1,(单选题)2012年9月，某银行发放贷款100万元给某公司，该市经济贸易委员会为该公司担保。后因该公司经营不善，无法维持，经上级主管部门批准，决定解散并同时成立清算委员会。下列说法正确的是()。,<p>A因该公司已解散，故对以前的贷款不负清偿责任</p><p>B该市经济贸易委员会的担保无效</p><p>C该清算委员会负责清偿正常贷款债务及利息，经济贸易委员会承担连带责任</p><p>D因该公司已解散，故应由其上级主管机关负责偿债责任</p>,4,B,《担保法》规定，国家机关、学校、幼儿园、医院等以公益为目的的事业单位、社会团体、企业法人的分支机构、职能部门，不得作为保证人。,0,0
1,(单选题)贷款合同通常存在不合规、不完备等缺陷问题，下列不属于这一问题的是()。,<p>A未明确约定罚息的计算方法</p><p>B担保方式的约定不明确、不具体</p><p>C对借款人未按照约定用途使用贷款资金约束不力</p><p>D合同签署前审查不严</p>,4,D,D选项属于合同签订中容易发生的问题。,0,0
1,(单选题)下列文件中属于担保类文件的是()。,<p>A借款人所属国家主管部门担保文件出具的同意借款人提供该担保的文件</p><p>B海关部门就同意抵押协议项下进口设备抵押出具的批复文件</p><p>C已缴纳印花税的缴付凭证</p><p>D保险权益转让相关协议或文件</p>,4,D,担保类文件包括：(1)已正式签署的抵（质）押协议；(2)已正式签署的保证协议；(3)保险权益转让相关协议或文件；(4)其他必要性文件。A、B、C三个选项均属于与登记、批准、备案、印花税有关的文件。,0,0
1,(单选题)对于提供抵（质）押担保的，下列说法错误的是()。,<p>A可以办理登记或备案手续的，必须先完善有关登记、备案手续</p><p>B如抵（质）押物无明确的登记部门，则必须先将抵（质）押物的有关产权文件及其办理转让所需的有关文件正本交由银行保管，并且将抵（质）押合同在当地的公证部门进行公证</p><p>C对于以金融机构出具的可撤销保函或备用信用证作担保的，应在收妥银行认可的不可撤销保函或备用信用证正本后，才能允许借款人提款</p><p>D对于有权出具不可撤销保函或备用信用证的境外金融机构以外的其他境外法人、组织或个人担保的保证，必须就保证的可行性、保证合同等有关文件征询银行指定律师的法律意见</p>,4,D,对于以金融机构出具的不可撤销保函或备用信用证作担保的，应在收妥银行认可的不可撤销保函或备用信用证正本后，才能允许借款人提款。,0,0
1,(单选题)某项商业银行贷款，借款人无法足额偿还贷款本息，即使执行担保，也肯定造成较大损失的，应属于贷款种类中的()类。,<p>A关注</p><p>B次级</p><p>C可疑</p><p>D损失</p>,4,C,可疑类贷款是指借款人无法足额偿还贷款本息，即使执行担保，也肯定要造成一定的损失。,0,0
1,(单选题)下面哪一项不属于贷前调查的方法？(),<p>A委托调查</p><p>B现场调查</p><p>C突击调查</p><p>D搜寻调查</p>,4,C,贷前调查的方法包括现场调查和非现场调查两种。非现场调查又包括搜寻调查、委托调查和其他方法等。,0,0
1,(单选题)下列选项中，不属于项目总投资组成部分的是()。,<p>A建设投资</p><p>B速动资产</p><p>C投资方向调节税</p><p>D建设期利息</p>,4,B,项目总投资由建设投资、流动资金、投资方向调节税和建设期利息四部分组成。,0,0
1,(单选题)目前，我国银行存款业务中，用复利计算利息的是()。,<p>A定期整存整取</p><p>B定活两便</p><p>C个人活期存款</p><p>D单位定期存款</p>,4,C,除活期存款在每季结息日时将利息计入本金作为下季的本金计算复利外，其他存款不论存期多少，一律不计复利。,0,0
1,(单选题)银行开办银团贷款业务，应当坚持()的原则。,<p>A平等互利、公平办商</p><p>B平等互利、公平办商、风险自担</p><p>C平等互利、风险自担</p><p>D平等互利、公平办商、诚实履约、风险自担</p>,4,D,银行开办银团贷款业务，应当坚持平等互利、公平办商、诚实履约、风险自担的原则。,0,0
1,(单选题)一家银行为牵头行时，分销给其他银团贷款成员的份额原则上不低于()。,<p>A0.1</p><p>B0.3</p><p>C0.4</p><p>D0.5</p>,4,D,单家银行担任牵头行时，分销给其他银团贷款成员的份额原则上不低于50%。,0,0
1,(单选题)某商业银行拥有证券类、信贷类、中间业务类三个产品类别，它们代表了银行产品组合的()。,<p>A宽度</p><p>B深度</p><p>C精度</p><p>D密度</p>,4,A,产品组合宽度，是指产品组合中不同产品线的数量，即产品大类的数量或服务的种类。例如某商业银行有证券类、信贷类和中间业务类等产品类别。,0,0
1,(单选题)人力资源供求预测的主要目的是估计未来某个时期企业对()的需求，这是人力资源规划中较具技术性的关键部分。,<p>A劳动者</p><p>B劳动量</p><p>C人才</p><p>D劳动力</p>,4,D,人力资源供求预测的主要目的是估计未来某个时期企业对劳动力的需求，是人力资源规划中较具技术性的关键部分。同时，人力资源预测必须考虑劳动力的供给情况。,0,0
1,(单选题)以下属于企业的非流动资产的是()。,<p>A预付账款</p><p>B存货</p><p>C无形及递延资产</p><p>D待摊费用</p>,4,C,资产按其流动性可分为流动资产和非流动资产。借款人在一年内不能变现的那部分资产称作非流动资产，包括长期投资、固定资产、无形及递延资产和其他长期资产等。,0,0
1,(单选题)对于一些金额小、数量多的贷款，要采取()的办法来计提贷款损失准备金。,<p>A批量处理</p><p>B逐笔计算</p><p>C固定比率</p><p>D审查比率</p>,4,A,本题是对“非正常类贷款”的同质贷款计提专项准备金的考查。对于一些金额小、数量多的贷款，要采取批量处理的办法计提贷款损失准备金。在对这些贷款中正常类以外的贷款计提专项准备金时，也应采取批量处理的方法。对此类贷款，分类过程主要是参考了贷款的逾期期限。,0,0
1,(单选题)项目的可行性研究属于()工作，是项目业主或发起人为了确定投资方案而进行的工作，一般由设计和咨询机构完成。,<p>A项目报告</p><p>B项目结束</p><p>C项目开始</p><p>D项目论证</p>,4,D,项目的可行性研究属于项目论证工作，是项目业主或发起人为了确定投资方案而进行的工作，一般由设计和咨询机构完成；贷款项目评估是贷款银行为了筛选贷款对象而展开的工作。,0,0
1,(单选题)资本公积金不包括()。,<p>A股本溢价</p><p>B法定财产重估</p><p>C接受捐赠的资产价值</p><p>D法定盈余公积金</p>,4,D,所有权益代表投资者对净资产的所有权。净资产是借款人全部资产减去全部负债的净额。它由投资者投入的资本金和在生产经营过程中形成的资本公积金、盈余公积金、未分配利润组成。资本金是投资者实际投入生产经营活动供长期使用的资金。资本公积金包括股本溢价、法定财产重估和接受捐赠的资产价值等。盈余公积金是按照有关规定从利润中提取的各种公积金，包括法定盈余公积金和任意盈余公积金。,0,0
1,(单选题)银行如果不服地方人民法院第一审判决的，有权在判决书送达之日起()内向上一级人民法院提起上诉。,<p>A15日</p><p>B30日</p><p>C3个月</p><p>D6个月</p>,4,A,人民法院审理案件，一般应在立案之日起6个月内作出判决。银行如果不服地方人民法院第一审判决的，有权在判决书送达之日起15日内向上一级人民法院提起上诉。,0,0
1,(单选题)按照五层次理论，产品的咨询和融资便利属于公司信贷产品中的()。,<p>A核心产品</p><p>B基础产品</p><p>C期望产品</p><p>D延伸产品</p>,4,D,从营销角度可以把公司信贷产品划分为以下五个层次：(1)核心产品，即客户所购买的基本服务和利益；(2)基础产品，即公司信贷产品的基本形式，是核心产品借以实现的形式；(3)期望产品，即购买者购买产品通常希望和默认的一组属性和条件；(4)延伸产品，即某种产品衍生增加的服务和收益；(5)潜在产品，即延伸产品继续延伸和转换的最大可能性，从而塑造出更能符合客户需要的新型产品。由此，产品的咨询和融资便利属于公司信贷产品中的延伸产品。,0,0
1,(单选题)银行贷款经营管理的核心内容是()。,<p>A银行人员管理</p><p>B银行资产管理</p><p>C银行系统管理</p><p>D银行风险管理</p>,4,D,银行贷款业务是一项风险性业务，保证贷款的安全是银行贷款经营管理过程的核心内容。,0,0
1,(单选题)关于成长阶段企业信贷风险分析不正确的是()。,<p>A成长阶段的企业代表中等程度的风险</p><p>B必须进行细致的信贷分析</p><p>C销售增长和产品开发有可能导致偿付风险</p><p>D有能力偿还任何营运资本贷款和固定资产贷款</p>,4,D,成长阶段的企业如果发展过于迅速，对现金的需求较大，而且在增长速度放缓到相对平稳的水平之前并不一定会有能力偿还任何营运资本贷款和固定资产贷款。,0,0
1,(单选题)产品组合的宽度极小，深度不大，但关联性极强。有这种特点的产品组合策略形式是()。,<p>A全线全面型</p><p>B市场专业型</p><p>C产品线专业型</p><p>D特殊产品专业型</p>,4,D,特殊产品专业型，是指商业银行根据自身所具备的特殊资源条件和特殊技术专长，专门提供或经营某些具有优越销路的产品或服务项目。这种策略的特点是：产品组合的宽度极小，深度不大，但关联性极强。,0,0
2,(多选题)波特认为有五种力量决定整个市场或其中任何一个细分市场的长期的内在吸引力。这五个群体是()。 ,<p>A同行业竞争者 </p><p>B潜在的新加入的竞争者 </p><p>C替代产品 </p><p>D购买者和供应商 </p><p>E政府</p>,5,ABCD,波特认为有5种力量决定整个市场或其中任何一个细分市场的长期的内在吸引力，分别是：同行业竞争者、潜在的新加入的竞争者、替代产品、购买者和供应商。细分市场的吸引力分析就是对这5种威胁银行长期盈利的主要因素做出评估。,0,0
2,(多选题)可持续增长率的假设条件有()。 ,<p>A公司的资产使用效率将维持当前水平 </p><p>B公司的销售净利率将维持当前水平，并且可以涵盖负债的利息 </p><p>C公司保持持续不变的红利发放政策 </p><p>D公司的财务杠杆不变 </p><p>E公司未增发股票，增加负债是其唯一的外部融资来源</p>,5,ABCDE,可持续增长率是公司在没有增加财务杠杆情况下可以实现的长期销售增长率，也就是说主要依靠内部融资即可实现的增长率。可持续增长率的假设条件如下：(1)公司的资产使用效率将维持当前水平；(2)会司的销售净利率将维持当前水平，并且可以涵盖负债的利息；(3)公司保持持续不变的红利发放政策；(4)公司的财务杠杆不变；(5)公司未增发股票，增加负债是其唯一的外部融资来源。,0,0
2,(多选题)关于出质人对质物、质押权利占有的合法性，下列说法正确的有()。 ,<p>A用动产出质的，应通过审查动产购置发票、财务账簿，确认其是否为出质人所有 </p><p>B如质押财产为共有财产，出质是否经全体共有人同意 </p><p>C审查质押的设定是否已由出质人有权决议的机关作出决议 </p><p>D认真查验抵押物的权属，确保抵押物的有效性 </p><p>E用权利出质的，应核对权利凭证上的所有人与出质人是否为同一人</p>,5,ABCE,出质人对质物、质押权利占有的合法性：(1)用动产出质的，应通过审查动产购置发票、财务账簿，确认其是否为出质人所有。(2)用权利出质的，应核对权利凭证上的所有人与出质人是否为同一人。如果不是，则要求出示取得权利凭证的合法证明，如判决书或他人同意授权质押的书面证明。(3)审查质押的设定是否已由出质人有权决议的机关作出决议。(4)如质押财产为共有财产，出质是否经全体共有人同意。,0,0
2,(多选题)常规清收包括()。 ,<p>A依法收贷 </p><p>B直接追偿 </p><p>C协商处置抵（质）押物 </p><p>D委托第三方清收 </p><p>E依法追偿</p>,5,BCE,根据是否诉诸法律，清收可划分为常规清收和依法收贷两种。常规清收包括直接追偿、协商处置抵（质）押物、委托第三方清收等方式。,0,0
2,(多选题)下列关于破产重整的说法，正确的有()。 ,<p>A破产重整，是指债务人不能清偿到期债务时，债务人、债务人股东在法院主导下，债权人与债务人进 行协商，调整债务偿还安排，避免债务人破产以后对债权人、股东和雇员等人产生重大不利影响 </p><p>B当债权人内部发生无法调和的争议，或者债权人无法与债务人达成一致意见时，法院会根据自己的判 断作出裁决 </p><p>C根据债权性质（如有无担保），债权人往往被划分成不同的债权人组别 </p><p>D在破产重整程序中，债权人组成债权人会议，与债务人共同协商债务偿还安排 </p><p>E法院裁定债务人进入破产重整程序以后，其他强制执行程序，包括对担保物权的强制执行程序都应继续 进行</p>,5,ABCD,和解是指人民法院受理债权人提出的破产申请后三个月内，债务人的上级主管部门申请整顿，经债务人与债权人会议就和解协议草案达成一致，由人民法院裁定认可而中止破产程序的过程。因此，法院裁定债务人进入破产重整程序以后，其他强制执行程序，包括对担保物权的强制执行程序，都应立即停止。,0,0
2,(多选题)下列属于权利财产担保的有()。 ,<p>A房产担保 </p><p>B企业保证担保 </p><p>C股票担保 </p><p>D债券担保 </p><p>E保险单担保</p>,5,CDE,财产担保又分为不动产、动产和权利财产担保。股票、债券、保险单等担保都属于权利财产担保。,0,0
2,(多选题)从银行角度来讲，资产转换周期包括()。 ,<p>A生产转换周期 </p><p>B资本转换周期 </p><p>C销售转换周期 </p><p>D服务转换周期 </p><p>E供货转换周期</p>,5,AB,从银行角度来讲，资产转换周期是银行信贷资金由金融资本转化为实物资本，再由实物资本转化为金融资本的过程。它包括两个方面的内容：一是生产转换周期；二是资本转换周期。,0,0
2,(多选题)客户的长期资金主要由()构成。 ,<p>A长期负债 </p><p>B流动负债 </p><p>C所有者权益 </p><p>D长期投资 </p><p>E银行存款</p>,5,AC,客户的长期资金是由所有者权益和长期负债构成的。客户在筹资决策中，必须按照《公司法》等法律法规筹集一定的权益资本，但是否要筹集长期债务及筹集多少长期债务，应根据企业需要采用不同的策略，做到负债适度，保持最佳长期债务和权益资本的结构。,0,0
2,(多选题)影响客户的还贷能力的因素有()。 ,<p>A现金流量构成 </p><p>B经济效益 </p><p>C还款资金来源 </p><p>D贷款用途 </p><p>E担保人的经济实力</p>,5,ABCE,影响客户还贷能力的因素有：现金流量构成、经济效益、还款资金来源、担保人的经济实力等。,0,0
2,(多选题)预期收入理论的观点包括()。 ,<p>A贷款能否到期归还，是以未来收入为基础的 </p><p>B稳定的贷款应该建立在现实的归还期限与贷款的证券担保的基础上 </p><p>C中央银行可以作为资金流动性的最后来源 </p><p>D当流动性的需要增大时，可以在金融市场上出售贷款资产 </p><p>E长期投资的资金应来自长期资源</p>,5,ABC,1949年，赫伯特.V.普罗克诺在《定期放款与银行流动性理论》一书中提出了这一理论。预期收入理论认为，贷款能否到期归还，是以未来的收入为基础的，只要未来收入有保障，长期信贷和消费信贷同样能保持流动性和安全性。稳定的贷款应该建立在现实的归还期限与贷款的证券担保的基础上。按照以前的一些理论，这样一种贷款可称为“合格的票据”，如果需要的话，可以拿到中央银行去贴现。这样，中央银行就成为资金流动性的最后来源了。这一理论带来的问题是，由于收入预测与经济周期有密切关系，同时资产的膨胀和收缩也会影响资产质量，因此可能会增加银行的信贷风险。银行危机一旦爆发，其规模和影响范围会越来越大。D选项是资产转换理论的观点；E选项是真实票据理论的观点。,0,0
2,(多选题)下列项目属于递延资产的有()。 ,<p>A土地使用权 </p><p>B开办费 </p><p>C商标权 </p><p>D专利权 </p><p>E以经营租赁租入的固定资产改良支出</p>,5,BE,递延资产是指不能计入当期损益，应当在以后年度内分期摊销的各项费用，包括开办费和以经营租赁租入的固定资产改良支出等。土地使用权、专利权、商标权均属于企业需长期使用但没有实物形态的资产，即无形资产。,0,0
2,(多选题)下列属于真实票据理论的缺陷的有()。 ,<p>A使得缺乏物质保证的贷款大量发放，为信用膨胀创造了条件 </p><p>B由于收入预测与经济周期有密切联系，资产的膨胀和收缩会影响资产质量，因此会增加银行的信贷风 险 </p><p>C局限于短期贷款不利于经济的发展 </p><p>D贷款平均期限的延长会增加银行系统的流动性风险 </p><p>E自偿性贷款随经济周期决定信用量，从而会加大经济波动</p>,5,CE,随着资本主义的发展，真实票据理论的缺陷逐渐显现，银行短期存款的沉淀、长期资金的增加，使银行具备大量发放中长期贷款的能力，局限于短期贷款不利于经济的发展，同时，自偿性贷款随经济周期而决定信用量，会加大经济的波动。,0,0
