1,(单选题)根据《中华人民共和国担保法》（以下简称《提保法》）的规定，下列财产不可以抵押的是()。 ,<p>A抵押人依法有处分权的原材料、半成品、产品 </p><p>B抵押人所有的机器、交通运输工具和其他财产 </p><p>C抵押人所有的房屋和其他地上定着物 </p><p>D自留地、自留山等集体所有的土地使用权</p>,4,D,根据《担保法》规定，耕地、宅基地（但有特别规定的除外）。自留地、自留山等集体所有的土地使 用权不得抵押。,0,0
2,(多选题)根据商业银行审贷分离原则的要求，下列属于商业银行信贷审查岗职责的有()。 ,<p>A审查借款人、借款用途的合规性，审查授信业务是否符合国家和本行信贷政策投向政策 </p><p>B审查授信业务的主要风险点 </p><p>C对客户进行信用等级评价，撰写调查报告 </p><p>D积极拓展信贷业务，搞好市场调查，优选客户，受理借款人申请 </p><p>E对借款人申请信贷业务的合法性、安全性、盈利性进行调查</p>,5,AB,选项C、D、E均为信贷业务岗的岗位职责，非信贷审查岗的岗位职责。,0,0
2,(多选题)企业管理状况风险主要体现在()。 ,<p>A借款人的主要股东、关联企业或母子公司等发生重大的不利变化 </p><p>B高级管理人员同时关注短期和长期利润 </p><p>C企业人员更新过快或员工不足 </p><p>D高级管理层不团结，出现内部矛盾 </p><p>E管理人员只有财务专长而没有综合能力，导致经营计划搁置</p>,5,ACDE,企业管理状况风险主要体现在：(1)企业发生重要人事变动，如高级管理人员或董事会成员变动，最主 要领导者的行为发生变化，患病或死亡，或陷入诉讼纠纷，无法正常履行职责；(2)最高管理者独裁， 领导层不团结，高级管理层之间出现严重的争论和分歧；职能部门矛盾尖锐，互相不配合，管理层素 质偏低；(3)管理层对环境和行业中的变化反应迟缓或管理层经营思想变化，表现为极端的冒进或保守；(4)管理层对企业的发展缺乏战略性的计划，缺乏足够的行业经验和管理能力（如有的管理人员只 有财务专长而没有技术、操作、战略、营销和财务技能的综合能力），导致经营计划没有实施及无法 实施；(5)董事会和高级管理人员以短期利润为中心，不顾长期利益而使财务发生混乱、收益质量受到 影响；(6)借款人的主要股东、关联企业或母子公司等发生重大的不利变化；(7)中层管理层薄弱，企业 人员更新过快或员工不足。,0,0
2,(多选题)商业银行贷款安全性调查的内容包括()。 ,<p>A对借款人生产计划的制订情况进行认定 </p><p>B对借款人对外股本权益性投资情况进行调查 </p><p>C对借款人提供的财务报表的真实性进行审查 </p><p>D对抵押物的价值评估情况进行调查 </p><p>E对借款人在他行借款的利率进行调查</p>,5,BCD,商业银行贷款安全性调查的内容包括：(1)对借款人、保证人、法定代表人的品行、业绩、能力和信誉 精心调查。(2)考察借款人、保证人是否已建立良好的公司治理机制。(3)对借款人、保证人的财务管理 状况进行调查。(4)对原到期贷款及应付利息清偿情况进行调查。(5)对有限责任公司和股份有限公司对 外股本权益性投资情况进行调查。(6)对抵押物的价值评估情况做出调查。(7)对于申请外汇贷款的客 户，业务人员要调查认定借款人、保证人承受汇率、利率风险的能力，尤其要注意汇率变化对抵 （质）押担保额的影响程度。,0,0
2,(多选题)贷款总结评价的内容主要包括()。 ,<p>A贷款基本评价 </p><p>B贷款管理中出现的问题及解决措施 </p><p>C其他有益经验 </p><p>D借款人对银行的评价 </p><p>E贷款对借款人的影响</p>,5,ABC,无,0,0
2,(多选题)借款需求分析对银行的意义在于()。 ,<p>A帮助银行有效地评估风险 </p><p>B帮助银行确定合理的贷款结构与贷款利率 </p><p>C为公司提供融资方面的合理建议 </p><p>D确定贷款总供给量 </p><p>E帮助银行增加盈利</p>,5,ABC,总体来说，银行进行贷款需求分析的意义在于控制贷款风险，具体来说，就是帮助银行有效地评估风 险，帮助银行确定合理的贷款结构与贷款利率，为公司提供融资方面的合理建议。,0,0
2,(多选题)当可行性研究报告中只提出了一个可行性方案时，银行评估人员应()。 ,<p>A向企业了解是否有其他方案 </p><p>B提出一个最优方案 </p><p>C提出备选方案 </p><p>D通过规模经济分析，肯定或否定原来的方案 </p><p>E通过规模经济分析，肯定或提出更好的方案</p>,5,AE,通过项目可研报告评估项目规模时，当可行性研究报告中只提出了一个可行性方案时，银行评估人员 应向企业了解是否有其他方案，并根据项目产品的市场需求调查和预测、对投入物和生产条件分析， 再通过规模经济分析，肯定原来方案或提出更好的方案。,0,0
2,(多选题)项目组织机构分析的内容包括()。,<p>A项目实施机构分析 </p><p>B项目经营机构分析 </p><p>C项目协作机构分析 </p><p>D人力资源分析 </p><p>E项目规模结构分析</p>,5,ABC,人力资源分析不属于项目组织结构分析的内容。,0,0
2,(多选题)财务预测的审查包括()。 ,<p>A项目的总投资、建设投资、流动资金估算的审查 </p><p>B固定资产、无形资产、递延资产原值确定的审查及其折旧和摊销方法的审查 </p><p>C成本的审查 </p><p>D销售收入审查 </p><p>E税金的审查</p>,5,ABCDE,还包括利润的审查。,0,0
2,(多选题)根据竞争与垄断关系的不同，市场通常可分为()等几种类型。 ,<p>A完全竞争 </p><p>B垄断竞争 </p><p>C竞争垄断 </p><p>D寡头垄断 </p><p>E完全垄断</p>,5,ABDE,根据竞争与垄断关系的不同，通常分为完全竞争、垄断竞争、寡头垄断和完全垄断四种不同类型。,0,0
2,(多选题)下列关于资产结构分析的说法，正确的有()。 ,<p>A资产结构是指各项资产占总资产的比重 </p><p>B资产结构分析可用来判断借款人资产分配的合理性 </p><p>C通常制造业的固定资产和存货比重小于零售业的固定资产和存货比重 </p><p>D服务业中，劳动密集型行业的固定资产比重一般高于资本密集型行业 </p><p>E如果借款人的资产结构与同行业的比例存在较大差异，应进一步分析差异产生的原因</p>,5,ABE,C、D刚好弄反了，通常制造业的固定资产和存货比重大于零售业的固定资产和存货比重，服务业中， 劳动密集型行业的固定资产比重一般低于资本密集型行业。,0,0
2,(多选题)贷放分控的操作要点包括()。 ,<p>A要明确放款执行部门的职责 </p><p>B设立独立的放款执行部门 </p><p>C要了解企业的经营性质 </p><p>D注意中央的一些新发文件 </p><p>E完善对放款执行部门的考核和问责机制</p>,5,ABE,贷放分控的操作要点包括：①明确放款执行部门的职责；②设立独立的放款执行部门；③完善对放款 执行部门的考核和问责机制。,0,0
2,(多选题)在建设投资中，工程费用包括()。 ,<p>A安装工程费用 </p><p>B建筑工程费用 </p><p>C基本预备费用 </p><p>D设备购置费用 </p><p>E涨价预备费用</p>,5,ABD,在建设投资中，工程费用包括安装工程费用、建筑工程费用和设备购置费用。基本预备费用和涨价预 备费用属于预备费。,0,0
2,(多选题)客户档案主要包括()。 ,<p>A借款及担保企业的营业执照、法人代码本、本公司章程 </p><p>B借款及担保企业的信用评级资料 </p><p>C借款及担保企业的验资报告 </p><p>D借款及担保企业最近三年主要的财务报表 </p><p>E财务负责人的身份证或护照复印件</p>,5,BCDE,客户档案主要包括的内容有：①借款企业及担保企业的“三证”，即营业执照、法人代码本、税务登记证；②借款企业及担保企业的信用评级资料；③借款企业及担保企业的开户情况；④借款企业及担 保企业的验资报告；⑤借款企业及担保企业近三年的主要财务报表，包括资产负债表、损益表、现金 流量表等，上市公司、“三资”企业需提供经审计的年报；⑥企业法人、财务负责人的身份证或护照 复印件；⑦反映该企业经营、资信（如是“三资”企业，还应提交企业批准证书、公司章程等）及历 次贷款情况的其他资料。,0,0
3,(判断题)评估项目的还款来源时，必须先考虑将项目本身的税后利润全部用于还贷。(),<p>A正确</p><p>B错误</p>,2,B,企业税后利润必须先用于法定盈余公积金和公益金，然后才能用于还贷。评估中在测算项目的还贷资 金来源时不能把所有的税后利润都用于还贷。,0,0
3,(判断题)在计算项目的投资利税率时，不包含增值税。(),<p>A正确</p><p>B错误</p>,2,A,项目投资利税率=年利税总额/项目总投资，其中，年利税总额=年利润总额+年销售税金及附加（不含 增值税）。,0,0
3,(判断题)通常情况下，市场化程度越低，区域风险越低。(),<p>A正确</p><p>B错误</p>,2,B,市场的成熟和完善与否，直接影响到投资环境的优劣和区域发展的快慢。通常情况下，市场化程度越 高，区域风险越低。良好的市场体系能产生正确的市场信号引导投资，引导企业管理经营活动，降低 交易成本，提高投资效益，实现资源的优化配置。,0,0
3,(判断题)项目融资是银行对大型、特大型工程项目建设发放的贷款。(),<p>A正确</p><p>B错误</p>,2,A,项目融资是银行对大型、特大型工程项目建设发放的贷款。该类贷款中，银行直接对项目公司提供贷 款，项目公司对偿还贷款承担直接责任，项目发起人的责任只限于其投入项目公司的股本及其承担的 担保义务。,0,0
3,(判断题)商业银行原则上应根据银行信用评级政策，对不同信用等级的客户，分别授予授权人不同的审批权限。(),<p>A正确</p><p>B错误</p>,2,A,无,0,0
3,(判断题)在计算现金流量时，折旧费支出、无形资产与递延资产摊销不能作为现金流出。(),<p>A正确</p><p>B错误</p>,2,A,无,0,0
3,(判断题)商业银行对逾期或挤占挪用的贷款从发现之日起按照罚息利率计收罚息，直到清偿本息为止。(),<p>A正确</p><p>B错误</p>,2,B,逾期贷款或挤占挪用贷款，从逾期或挤占挪用之日起，按罚息利率计收罚息，直到清偿本息为止，遇 罚息利率调整分段计息，而不是发现之日起。,0,0
3,(判断题)企业法人和事业法人只有经过工商部门的年检并办理年检手续才能够申请办理贷款业务。(),<p>A正确</p><p>B错误</p>,2,B,除不需要经工商部门核准登记的事业法人外，应当经过工商部门办理年检手续。只有经过工商部门的 年检并办理年检手续，才能核实借款人近期的状况，才能保证法人资格的合法性。,0,0
3,(判断题)担保为银行提供了一个可以影响或控制的潜在还款来源，从而增加了贷款最终偿还的可能性。(),<p>A正确</p><p>B错误</p>,2,A,在发放贷款时，银行应要求借款人为贷款提供相应的担保，这样银行资金更具安全性。,0,0
3,(判断题)公司信贷业务人员应仔细核查借款人的法人资格、借款资格、营业执照的有效期、真实性及当年是否办 理了年检手续、贷款卡的有效期及当年是否办理了年审手续以及近期是否发生内容变更、名称变更、注 销、作废等情况。(),<p>A正确</p><p>B错误</p>,2,A,无,0,0
3,(判断题)普通准备金在一定程序上具有资本的性质，可以一定程度上用于弥补银行的未来损失。(),<p>A正确</p><p>B错误</p>,2,A,普通损失准备金所针对的贷款内在损失是不确定的。因此，普通贷款损失准备金在一定程度上具有资 本的性质，可以在一定程度上用于弥补银行的未来损失。,0,0
3,(判断题)隐含价格是指贷款定价中的一些货币性内容。(),<p>A正确</p><p>B错误</p>,2,B,隐含价格是指贷款定价中的一些非货币性内容。,0,0
3,(判断题)贷款原则上可以用于借款人的资本金、股本金和企业其他需自筹资金的融资。(),<p>A正确</p><p>B错误</p>,2,B,无,0,0
3,(判断题)对于上市公司的可流通股票，其公允价值是该股票的市场价格。(),<p>A正确</p><p>B错误</p>,2,A,无,0,0
3,(判断题)贷款逾期后，对不能按借款合同约定期限归还的贷款，应当按照规定加罚利息，加罚的利率应在贷款协 议中明确规定，但是对应收未收的罚息不需要计复利。(),<p>A正确</p><p>B错误</p>,2,B,贷款逾期后，对不能按借款合同约定期限归还的贷款，应当按照规定加罚利息，加罚的利率应在贷款 协议中明确规定。对应收未收的罚息也要计复利。,0,0
3,(判断题)银行在分析借款企业因固定资产扩张导致借款需求时，可将公司销售收入/净固定资产比率与银行相似客 户进行比较，能获得很多有价值的信息。(),<p>A正确</p><p>B错误</p>,2,B,银行在分析借款企业因固定资产扩张导致的借款需求时，可将公司销售收入/净固定资产比率同行业相 关数据进行比较，也能获得很多有价值的信息。,0,0
3,(判断题)银行在对竞争对手和客户需求进行分析前应首先确立市场定位战略。,<p>A正确</p><p>B错误</p>,2,B,银行在确立市场定位战略前，应先对竞争对手与客户需求进行分析。,0,0
3,(判断题)在担保贷款中，担保企业作为第三者要以其财产对借款企业的还贷能力予以担保，但不可以用信誉来担 保。(),<p>A正确</p><p>B错误</p>,2,B,在担保贷款中，担保企业作为第三者要以其信誉或财产对借款企业的还贷能力予以担保，因此，当借 款企业不能按期偿还贷款本息时，担保企业就必须代为清偿。担保企业为了保证自身财产的安全，必 然关心借款企业的经营状况和履约能力的变化。,0,0
3,(判断题)在我国，客户选择银行信贷产品的标准就是产品本身的核心功能。（）,<p>A正确</p><p>B错误</p>,2,B,在我国，客户选择银行信贷产品的标准不仅仅是产品本身的核心功能，还要考虑银行实力、信誉、职 务态度等因素。,0,0
3,(判断题)贷款的风险水平是商业银行经营管理水平的综合反映，同时也受外部环境众多因素的影响。(),<p>A正确</p><p>B错误</p>,2,B,贷款的盈利水平是商业银行经营管理水平的综合反映。,0,0
