1,(单选题)《商业银行法》规定，商业银行贷款余额与存款余额的比例（）。,<p>A不得低于75%</p><p>B不得高于75%</p><p>C不得低于25%</p><p>D不得高于25%</p>,4,B,《商业银行法》规定，商业银行贷款余额与存款余额的比例不得高于75%。,29,1,0,0
1,(单选题)下列（）不能引发商业银行的操作风险。,<p>A有问题的内部控制</p><p>B无法满足客户流动性需求</p><p>C外部事件</p><p>D人员及系统</p>,4,B,此题中，B选项引发流动性风险，考查操作风险的定义,29,1,0,0
1,(单选题)以下关于商业银行依法冻结单位存款的说法正确的是（）。,<p>A被冻结的款项如需解冻，应由被冻结单位提出申请，并说明被冻结原因，银行视情况决定是否解冻</p><p>B冻结期满前，如有特殊原因需要延长冻结的，人民法院、人民检察院、公安机关应当办理继续冻结手续，每次续冻期限最长为1年</p><p>C逾期未办理继续冻结手续的，视为自动撤销冻结</p><p>D如果冻结单位存款发生失误，只能在六个月冻结期后解除冻结</p>,4,C,关于商业银行依法冻结单位存款的说法正确的是逾期未办理继续冻结手续的，视为自动撤销冻结。,29,1,0,0
1,(单选题)商业银行为机构投资者或个人提供全面的资产管理服务是（）。,<p>A企业信息咨询业务</p><p>B财务顾问业务</p><p>C私人银行业务</p><p>D资产管理顾问业务</p>,4,D,此题关键词是“资产管理”，应该在选项中选择相应的答案。（本题来自嗨考网）,29,1,0,0
1,(单选题)健全完善我国商业银行内部控制体系应当包括（）。,<p>A强化内控意识，树立内控优先理念</p><p>B完善激励约束机制</p><p>C提高内控制度的执行力</p><p>D以上都是</p>,4,D,健全完善我国商业银行内部控制体系应当包括强化内控意识，树立内控优先理念、完善激励约束机制、提高内控制度的执行力。,29,1,0,0
1,(单选题)商业银行各地个人征信系统用户应妥善保管自己的用户密码，至少（）个月更改一次密码，并登记密码变更登记簿。,<p>A1</p><p>B2</p><p>C3</p><p>D4</p>,4,B,商业银行各地个人征信系统用户应妥善保管自己的用户密码，至少2个月更改一次密码，并登记密码变更登记簿。,29,1,0,0
2,(多选题)下列能提高商业银行资本充足率的是（）。,<p>A提高风险加权总资产</p><p>B提高市场风险资本</p><p>C发行可转换债券</p><p>D发行普通股</p><p>E降低操作风险资本</p>,5,CDE,能提高商业银行资本充足率的是发行可转换债券、发行普通股、降低操作风险资本。,29,1,0,0
2,(多选题)未经国家有关主管部门批准，擅自设立商业银行的（）会受到处罚。,<p>A个人</p><p>B单位</p><p>C单位直接负责的主管人员</p><p>D单位的所有工作人员</p><p>E监管人员</p>,5,ABC,未经国家有关主管部门批准，擅自设立商业银行属于擅自设立金融机构罪，设立银行的个人、单位都应受到处罚。同时，单位直接负责的主管人员明知这属于非法设立依然在此任职并直接负责担任主管的，也应受到处罚。,29,1,0,0
